company,valuation,date_joined,country/region,city,industry,select_investors,company_cleaned,date_joined_cleaned,years_to_unicorn
ByteDance,180.0,07-04-2017,China,Beijing,Artificial intelligence,Sequoia Capital China,BYTEDANCE,2017-04-07,6
ByteDance,180.0,07-04-2017,China,Beijing,Artificial intelligence,SIG Asia Investments,BYTEDANCE,2017-04-07,6
ByteDance,180.0,07-04-2017,China,Beijing,Artificial intelligence,Sina Weibo,BYTEDANCE,2017-04-07,6
ByteDance,180.0,07-04-2017,China,Beijing,Artificial intelligence,Softbank Group,BYTEDANCE,2017-04-07,6
SpaceX,100.0,01-12-2012,United States,Hawthorne,Other,Founders Fund,SPACEX,2012-12-01,11
SpaceX,100.0,01-12-2012,United States,Hawthorne,Other,Draper Fisher Jurvetson,SPACEX,2012-12-01,11
SpaceX,100.0,01-12-2012,United States,Hawthorne,Other,Rothenberg Ventures,SPACEX,2012-12-01,11
SHEIN,100.0,03-07-2018,China,Shenzhen,E-commerce & direct-to-consumer,Tiger Global Management,SHEIN,2018-07-03,5
SHEIN,100.0,03-07-2018,China,Shenzhen,E-commerce & direct-to-consumer,Sequoia Capital China,SHEIN,2018-07-03,5
SHEIN,100.0,03-07-2018,China,Shenzhen,E-commerce & direct-to-consumer,Shunwei Capital Partners,SHEIN,2018-07-03,5
Stripe,95.0,23-01-2014,United States,San Francisco,Fintech,Khosla Ventures,STRIPE,2014-01-23,9
Stripe,95.0,23-01-2014,United States,San Francisco,Fintech,LowercaseCapital,STRIPE,2014-01-23,9
Stripe,95.0,23-01-2014,United States,San Francisco,Fintech,capitalG,STRIPE,2014-01-23,9
Canva,46.0,08-01-2018,Australia,Surry Hills,Internet software & services,Sequoia Capital China,CANVA,2018-01-08,5
Canva,46.0,08-01-2018,Australia,Surry Hills,Internet software & services,Blackbird Ventures,CANVA,2018-01-08,5
Canva,46.0,08-01-2018,Australia,Surry Hills,Internet software & services,Matrix Partners,CANVA,2018-01-08,5
Revolut,40.0,26-04-2018,United Kingdom,London,Fintech,index Ventures,REVOLUT,2018-04-26,5
Revolut,40.0,26-04-2018,United Kingdom,London,Fintech,DST Global,REVOLUT,2018-04-26,5
Revolut,40.0,26-04-2018,United Kingdom,London,Fintech,Ribbit Capital,REVOLUT,2018-04-26,5
Epic Games,40.0,26-10-2018,United States,Cary,Other,Tencent Holdings,EPIC GAMES,2018-10-26,5
Epic Games,40.0,26-10-2018,United States,Cary,Other,KKR,EPIC GAMES,2018-10-26,5
Epic Games,40.0,26-10-2018,United States,Cary,Other,Smash Ventures,EPIC GAMES,2018-10-26,5
Databricks,39.0,05-02-2019,United States,San Francisco,Data management & analytics,Andreessen Horowitz,DATABRICKS,2019-02-05,4
Databricks,39.0,05-02-2019,United States,San Francisco,Data management & analytics,New Enterprise Associates,DATABRICKS,2019-02-05,4
Databricks,39.0,05-02-2019,United States,San Francisco,Data management & analytics,Battery Ventures,DATABRICKS,2019-02-05,4
Fanatics,38.0,06-06-2012,United States,Jacksonville,E-commerce & direct-to-consumer,SoftBank Group,FANATICS,2012-06-06,11
Fanatics,38.0,06-06-2012,United States,Jacksonville,E-commerce & direct-to-consumer,Andreessen Horowitz,FANATICS,2012-06-06,11
Fanatics,38.0,06-06-2012,United States,Jacksonville,E-commerce & direct-to-consumer,Temasek Holdings,FANATICS,2012-06-06,11
Chime,38.0,05-03-2019,United States,San Francisco,Fintech,Forerunner Ventures,CHIME,2019-03-05,4
Chime,38.0,05-03-2019,United States,San Francisco,Fintech,Crosslink Capital,CHIME,2019-03-05,4
Chime,38.0,05-03-2019,United States,San Francisco,Fintech,Homebrew,CHIME,2019-03-05,4
OpenAI,33.0,22-07-2019,United States,San Francisco,Artificial intelligence,Khosla Ventures,OPENAI,2019-07-22,4
Xiaohongshu,32.0,31-03-2016,China,Shanghai,E-commerce & direct-to-consumer,GGV Capital,XIAOHONGSHU,2016-03-31,7
Xiaohongshu,32.0,31-03-2016,China,Shanghai,E-commerce & direct-to-consumer,ZhenFund,XIAOHONGSHU,2016-03-31,7
Xiaohongshu,32.0,31-03-2016,China,Shanghai,E-commerce & direct-to-consumer,Tencent,XIAOHONGSHU,2016-03-31,7
J&T Express,32.0,07-04-2021,Indonesia,Jakarta,"Supply chain, logistics, & delivery",Hillhouse Capital Management,J&T EXPRESS,2021-04-07,2
J&T Express,32.0,07-04-2021,Indonesia,Jakarta,"Supply chain, logistics, & delivery",Boyu Capital,J&T EXPRESS,2021-04-07,2
J&T Express,32.0,07-04-2021,Indonesia,Jakarta,"Supply chain, logistics, & delivery",Sequoia Capital China,J&T EXPRESS,2021-04-07,2
Miro,27.0,05-01-2022,United States,San Francisco,Internet software & services,Accel,MIRO,2022-01-05,1
Miro,27.0,05-01-2022,United States,San Francisco,Internet software & services,AltaIR Capital,MIRO,2022-01-05,1
Miro,27.0,05-01-2022,United States,San Francisco,Internet software & services,Technology Crossover Ventures,MIRO,2022-01-05,1
Yuanfudao,25.0,31-05-2017,China,Beijing,Edtech,Tencent Holdings,YUANFUDAO,2017-05-31,6
Yuanfudao,25.0,31-05-2017,China,Beijing,Edtech,Warbug Pincus,YUANFUDAO,2017-05-31,6
Yuanfudao,25.0,31-05-2017,China,Beijing,Edtech,IDG Capital,YUANFUDAO,2017-05-31,6
DJI Innovations,22.0,23-01-2015,China,Shenzhen,Hardware,Accel Partners,DJI INNOVATIONS,2015-01-23,8
DJI Innovations,22.0,23-01-2015,China,Shenzhen,Hardware,Sequoia Capital,DJI INNOVATIONS,2015-01-23,8
Discord,20.0,20-04-2018,United States,San Francisco,Internet software & services,Benchmark,DISCORD,2018-04-20,5
Discord,20.0,20-04-2018,United States,San Francisco,Internet software & services,Greylock Partners,DISCORD,2018-04-20,5
Discord,20.0,20-04-2018,United States,San Francisco,Internet software & services,Tencent Holdings,DISCORD,2018-04-20,5
goPuff,20.0,08-10-2020,United States,Philadelphia,"Supply chain, logistics, & delivery",Accel,GOPUFF,2020-10-08,3
goPuff,20.0,08-10-2020,United States,Philadelphia,"Supply chain, logistics, & delivery",Softbank Group,GOPUFF,2020-10-08,3
goPuff,20.0,08-10-2020,United States,Philadelphia,"Supply chain, logistics, & delivery",Anthos Capital,GOPUFF,2020-10-08,3
Yuanqi Senlin,18.0,01-03-2020,China,Beijing,Consumer & retail,Sequoia Capital China,YUANQI SENLIN,2020-03-01,3
Yuanqi Senlin,18.0,01-03-2020,China,Beijing,Consumer & retail,Longfor Capitalm,YUANQI SENLIN,2020-03-01,3
Yuanqi Senlin,18.0,01-03-2020,China,Beijing,Consumer & retail,Gaorong Capital,YUANQI SENLIN,2020-03-01,3
Ripple,17.0,20-12-2019,United States,San Francisco,Fintech,IDG Capital,RIPPLE,2019-12-20,4
Ripple,17.0,20-12-2019,United States,San Francisco,Fintech,Venture51,RIPPLE,2019-12-20,4
Ripple,17.0,20-12-2019,United States,San Francisco,Fintech,Lightspeed Venture Partners,RIPPLE,2019-12-20,4
Blockchain.com,15.0,17-02-2021,United Kingdom,London,Fintech,Lightspeed Venture Partners,BLOCKCHAIN.COM,2021-02-17,2
Blockchain.com,15.0,17-02-2021,United Kingdom,London,Fintech,Google Ventures,BLOCKCHAIN.COM,2021-02-17,2
Blockchain.com,15.0,17-02-2021,United Kingdom,London,Fintech,Lakestar,BLOCKCHAIN.COM,2021-02-17,2
Plaid,15.0,11-12-2018,United States,San Francisco,Fintech,New Enterprise Associates,PLAID,2018-12-11,5
Plaid,15.0,11-12-2018,United States,San Francisco,Fintech,Spar Capital,PLAID,2018-12-11,5
Plaid,15.0,11-12-2018,United States,San Francisco,Fintech,Index Ventures,PLAID,2018-12-11,5
OpenSea,15.0,20-07-2021,United States,New York,Internet software & services,Andreessen Horowitz,OPENSEA,2021-07-20,2
OpenSea,15.0,20-07-2021,United States,New York,Internet software & services,Thirty Five Ventures,OPENSEA,2021-07-20,2
OpenSea,15.0,20-07-2021,United States,New York,Internet software & services,Sound Ventures,OPENSEA,2021-07-20,2
Celonis,15.0,26-06-2018,Germany,Munich,Data management & analytics,Accel,CELONIS,2018-06-26,5
Celonis,15.0,26-06-2018,Germany,Munich,Data management & analytics,83North,CELONIS,2018-06-26,5
Grammarly,14.0,10-10-2019,United States,San Francisco,Internet software & services,General Catalyst,GRAMMARLY,2019-10-10,4
Grammarly,14.0,10-10-2019,United States,San Francisco,Internet software & services,Institutional Venture Partners,GRAMMARLY,2019-10-10,4
Grammarly,14.0,10-10-2019,United States,San Francisco,Internet software & services,Breyer Capital,GRAMMARLY,2019-10-10,4
Devoted Health,13.0,16-10-2018,United States,Waltham,Health,Andreessen Horowitz,DEVOTED HEALTH,2018-10-16,5
Devoted Health,13.0,16-10-2018,United States,Waltham,Health,F-Prime Capital,DEVOTED HEALTH,2018-10-16,5
Devoted Health,13.0,16-10-2018,United States,Waltham,Health,Venrock,DEVOTED HEALTH,2018-10-16,5
Faire,13.0,30-10-2019,United States,San Francisco,Artificial intelligence,Khosla Ventures,FAIRE,2019-10-30,4
Faire,13.0,30-10-2019,United States,San Francisco,Artificial intelligence,Forerunner Ventures,FAIRE,2019-10-30,4
Faire,13.0,30-10-2019,United States,San Francisco,Artificial intelligence,Sequoia Capital,FAIRE,2019-10-30,4
Brex,13.0,05-10-2018,United States,San Francisco,Fintech,DST Global,BREX,2018-10-05,5
Brex,13.0,05-10-2018,United States,San Francisco,Fintech,Ribbit Capital,BREX,2018-10-05,5
Brex,13.0,05-10-2018,United States,San Francisco,Fintech,Greenoaks Capital Management,BREX,2018-10-05,5
Instacart,13.0,30-12-2014,United States,San Francisco,"Supply chain, logistics, & delivery",Khosla Ventures,INSTACART,2014-12-30,9
Instacart,13.0,30-12-2014,United States,San Francisco,"Supply chain, logistics, & delivery",Kleiner Perkins Caufield & Byers,INSTACART,2014-12-30,9
Instacart,13.0,30-12-2014,United States,San Francisco,"Supply chain, logistics, & delivery",Collaborative Fund,INSTACART,2014-12-30,9
JUUL Labs,12.0,20-12-2017,United States,San Francisco,Consumer & retail,Tiger Global Management,JUUL LABS,2017-12-20,6
Bitmain Technologies,12.0,06-07-2018,China,Beijing,Hardware,Coatue Management,BITMAIN TECHNOLOGIES,2018-07-06,5
Bitmain Technologies,12.0,06-07-2018,China,Beijing,Hardware,Sequoia Capital China,BITMAIN TECHNOLOGIES,2018-07-06,5
Bitmain Technologies,12.0,06-07-2018,China,Beijing,Hardware,IDG Capital,BITMAIN TECHNOLOGIES,2018-07-06,5
Biosplice Therapeutics,12.0,06-08-2018,United States,San Diego,Health,Vickers Venture Partners,BIOSPLICE THERAPEUTICS,2018-08-06,5
Biosplice Therapeutics,12.0,06-08-2018,United States,San Diego,Health,IKEA GreenTech,BIOSPLICE THERAPEUTICS,2018-08-06,5
GoodLeap,12.0,13-10-2021,United States,Roseville,Internet software & services,New Enterprise Associates,GOODLEAP,2021-10-13,2
GoodLeap,12.0,13-10-2021,United States,Roseville,Internet software & services,BDT Capital Partners,GOODLEAP,2021-10-13,2
GoodLeap,12.0,13-10-2021,United States,Roseville,Internet software & services,Davidson Kempner Capital Management,GOODLEAP,2021-10-13,2
Xingsheng Selected,12.0,22-07-2020,China,Changsha,E-commerce & direct-to-consumer,KKR,XINGSHENG SELECTED,2020-07-22,3
Xingsheng Selected,12.0,22-07-2020,China,Changsha,E-commerce & direct-to-consumer,Tencent Holdings,XINGSHENG SELECTED,2020-07-22,3
Xingsheng Selected,12.0,22-07-2020,China,Changsha,E-commerce & direct-to-consumer,Sequoia Capital China,XINGSHENG SELECTED,2020-07-22,3
Deel,12.0,21-04-2021,United States,San Francisco,Fintech,Andreessen Horowitz,DEEL,2021-04-21,2
Deel,12.0,21-04-2021,United States,San Francisco,Fintech,Spark Capital,DEEL,2021-04-21,2
Deel,12.0,21-04-2021,United States,San Francisco,Fintech,Y Combinator,DEEL,2021-04-21,2
Airtable,12.0,15-11-2018,United States,San Francisco,Internet software & services,Caffeinated Capital,AIRTABLE,2018-11-15,5
Airtable,12.0,15-11-2018,United States,San Francisco,Internet software & services,CRV,AIRTABLE,2018-11-15,5
Airtable,12.0,15-11-2018,United States,San Francisco,Internet software & services,Founder Collective,AIRTABLE,2018-11-15,5
BYJU's,12.0,25-07-2017,India,Bengaluru,Edtech,Tencent Holdings,BYJU'S,2017-07-25,6
BYJU's,12.0,25-07-2017,India,Bengaluru,Edtech,Lightspeed India Partners,BYJU'S,2017-07-25,6
BYJU's,12.0,25-07-2017,India,Bengaluru,Edtech,Sequoia Capital India,BYJU'S,2017-07-25,6
ZongMu Technology,12.0,03-06-2021,China,Shanghai,Auto & transportation,LTW Capital,ZONGMU TECHNOLOGY,2021-06-03,2
ZongMu Technology,12.0,03-06-2021,China,Shanghai,Auto & transportation,Legend Capital,ZONGMU TECHNOLOGY,2021-06-03,2
ZongMu Technology,12.0,03-06-2021,China,Shanghai,Auto & transportation,Qualcomm Ventures,ZONGMU TECHNOLOGY,2021-06-03,2
Rippling,12.0,04-08-2020,United States,San Francisco,Internet software & services,Initialized Capital,RIPPLING,2020-08-04,3
Rippling,12.0,04-08-2020,United States,San Francisco,Internet software & services,Y Combinator,RIPPLING,2020-08-04,3
Rippling,12.0,04-08-2020,United States,San Francisco,Internet software & services,Kleiner Perkins Caufield & Byers,RIPPLING,2020-08-04,3
Global Switch,11.0,22-12-2016,United Kingdom,London,Hardware,Aviation Industry Corporation of China,GLOBAL SWITCH,2016-12-22,7
Global Switch,11.0,22-12-2016,United Kingdom,London,Hardware,Essence Financial,GLOBAL SWITCH,2016-12-22,7
Global Switch,11.0,22-12-2016,United Kingdom,London,Hardware,Jiangsu Sha Steel Group,GLOBAL SWITCH,2016-12-22,7
Checkout.com,11.0,02-05-2019,United Kingdom,London,Fintech,Tiger Global Management,CHECKOUT.COM,2019-05-02,4
Checkout.com,11.0,02-05-2019,United Kingdom,London,Fintech,Insight Partners,CHECKOUT.COM,2019-05-02,4
Checkout.com,11.0,02-05-2019,United Kingdom,London,Fintech,DST Global,CHECKOUT.COM,2019-05-02,4
Bolt,11.0,08-10-2021,United States,San Francisco,Fintech,Activant Capital,BOLT SAN FRANCISCO,2021-10-08,2
Bolt,11.0,08-10-2021,United States,San Francisco,Fintech,Tribe Capital,BOLT SAN FRANCISCO,2021-10-08,2
Bolt,11.0,08-10-2021,United States,San Francisco,Fintech,General Atlantic,BOLT SAN FRANCISCO,2021-10-08,2
Alchemy,11.0,28-10-2021,United States,San Francisco,Fintech,DFJ Growth Fund,ALCHEMY,2021-10-28,2
Alchemy,11.0,28-10-2021,United States,San Francisco,Fintech,Coatue Management,ALCHEMY,2021-10-28,2
Alchemy,11.0,28-10-2021,United States,San Francisco,Fintech,Addition,ALCHEMY,2021-10-28,2
Lalamove,11.0,21-02-2019,Hong Kong,Cheung Sha Wan,"Supply chain, logistics, & delivery",MindWorks Ventures,LALAMOVE,2019-02-21,4
Lalamove,11.0,21-02-2019,Hong Kong,Cheung Sha Wan,"Supply chain, logistics, & delivery",Shunwei Capital Partners,LALAMOVE,2019-02-21,4
Lalamove,11.0,21-02-2019,Hong Kong,Cheung Sha Wan,"Supply chain, logistics, & delivery",Xiang He Capital,LALAMOVE,2019-02-21,4
Wiz,11.0,17-03-2021,Israel,Tel Aviv,Cybersecurity,Insight Partners,WIZ,2021-03-17,2
Wiz,11.0,17-03-2021,Israel,Tel Aviv,Cybersecurity,Sequoia Capital,WIZ,2021-03-17,2
Wiz,11.0,17-03-2021,Israel,Tel Aviv,Cybersecurity,Index Ventures,WIZ,2021-03-17,2
Gusto,10.0,18-12-2015,United States,San Francisco,Fintech,General Catalyst Partners,GUSTO,2015-12-18,8
Gusto,10.0,18-12-2015,United States,San Francisco,Fintech,Google Ventures,GUSTO,2015-12-18,8
Gusto,10.0,18-12-2015,United States,San Francisco,Fintech,Kleiner Perkins Caufield & Byers,GUSTO,2015-12-18,8
Chehaoduo,10.0,12-03-2016,China,Beijing,E-commerce & direct-to-consumer,Sequoia Capital China,CHEHAODUO,2016-03-12,7
Chehaoduo,10.0,12-03-2016,China,Beijing,E-commerce & direct-to-consumer,GX Capital,CHEHAODUO,2016-03-12,7
reddit,10.0,31-07-2017,United States,San Francisco,Internet software & services,Y Combinator,REDDIT,2017-07-31,6
reddit,10.0,31-07-2017,United States,San Francisco,Internet software & services,Sequoia Capital,REDDIT,2017-07-31,6
reddit,10.0,31-07-2017,United States,San Francisco,Internet software & services,Coatue Management,REDDIT,2017-07-31,6
Talkdesk,10.0,03-10-2018,United States,San Francisco,Internet software & services,DJF,TALKDESK,2018-10-03,5
Talkdesk,10.0,03-10-2018,United States,San Francisco,Internet software & services,Salesforce Ventures,TALKDESK,2018-10-03,5
Talkdesk,10.0,03-10-2018,United States,San Francisco,Internet software & services,Storm Ventures,TALKDESK,2018-10-03,5
Notion Labs,10.0,01-04-2020,United States,San Francisco,Internet software & services,Index Ventures,NOTION LABS,2020-04-01,3
Notion Labs,10.0,01-04-2020,United States,San Francisco,Internet software & services,Draft Ventures,NOTION LABS,2020-04-01,3
Notion Labs,10.0,01-04-2020,United States,San Francisco,Internet software & services,Felicis Ventures,NOTION LABS,2020-04-01,3
Thrasio,10.0,15-07-2020,United States,Walpole,E-commerce & direct-to-consumer,Upper90,THRASIO,2020-07-15,3
Thrasio,10.0,15-07-2020,United States,Walpole,E-commerce & direct-to-consumer,RiverPark Ventures,THRASIO,2020-07-15,3
Thrasio,10.0,15-07-2020,United States,Walpole,E-commerce & direct-to-consumer,Advent International,THRASIO,2020-07-15,3
Digital Currency Group,10.0,01-11-2021,United States,New York,Fintech,Ribbit Capital,DIGITAL CURRENCY GROUP,2021-11-01,2
Digital Currency Group,10.0,01-11-2021,United States,New York,Fintech,capitalG,DIGITAL CURRENCY GROUP,2021-11-01,2
Digital Currency Group,10.0,01-11-2021,United States,New York,Fintech,Softbank Group,DIGITAL CURRENCY GROUP,2021-11-01,2
KuCoin,10.0,10-05-2022,Seychelles,Victoria,Fintech,IDG Capital,KUCOIN,2022-05-10,1
KuCoin,10.0,10-05-2022,Seychelles,Victoria,Fintech,Matrix Partners China,KUCOIN,2022-05-10,1
KuCoin,10.0,10-05-2022,Seychelles,Victoria,Fintech,Jump Crypto,KUCOIN,2022-05-10,1
ServiceTitan,10.0,14-11-2018,United States,Glendale,Internet software & services,Bessemer Venture Partners,SERVICETITAN,2018-11-14,5
ServiceTitan,10.0,14-11-2018,United States,Glendale,Internet software & services,ICONIQ Capital,SERVICETITAN,2018-11-14,5
ServiceTitan,10.0,14-11-2018,United States,Glendale,Internet software & services,Battery Ventures,SERVICETITAN,2018-11-14,5
HEYTEA,10.0,01-07-2019,China,Shenzhen,Other,Sequoia Capital China,HEYTEA,2019-07-01,4
HEYTEA,10.0,01-07-2019,China,Shenzhen,Other,Tencent Investment,HEYTEA,2019-07-01,4
HEYTEA,10.0,01-07-2019,China,Shenzhen,Other,BA Capital,HEYTEA,2019-07-01,4
N26,10.0,10-01-2019,Germany,Berlin,Fintech,Redalpine Venture Partners,N26,2019-01-10,4
N26,10.0,10-01-2019,Germany,Berlin,Fintech,Earlybird Venture Capital,N26,2019-01-10,4
N26,10.0,10-01-2019,Germany,Berlin,Fintech,Valar Ventures,N26,2019-01-10,4
Klaviyo,10.0,17-11-2020,United States,Boston,Internet software & services,Summit Partners,KLAVIYO,2020-11-17,3
Klaviyo,10.0,17-11-2020,United States,Boston,Internet software & services,Accel,KLAVIYO,2020-11-17,3
Klaviyo,10.0,17-11-2020,United States,Boston,Internet software & services,Astral Capital,KLAVIYO,2020-11-17,3
Navan,10.0,08-11-2018,United States,Palo Alto,Travel,Andreessen Horowitz,NAVAN,2018-11-08,5
Navan,10.0,08-11-2018,United States,Palo Alto,Travel,Lightspeed Venture Partners,NAVAN,2018-11-08,5
Navan,10.0,08-11-2018,United States,Palo Alto,Travel,Zeev Ventures,NAVAN,2018-11-08,5
Northvolt,10.0,12-06-2019,Sweden,Stockholm,Other,Vattenfall,NORTHVOLT,2019-06-12,4
Northvolt,10.0,12-06-2019,Sweden,Stockholm,Other,Volkswagen Group,NORTHVOLT,2019-06-12,4
Northvolt,10.0,12-06-2019,Sweden,Stockholm,Other,Goldman Sachs,NORTHVOLT,2019-06-12,4
Tanium,10.0,31-03-2015,United States,Kirkland,Cybersecurity,Andreessen Horowitz,TANIUM,2015-03-31,8
Tanium,10.0,31-03-2015,United States,Kirkland,Cybersecurity,Nor-Cal Invest,TANIUM,2015-03-31,8
Tanium,10.0,31-03-2015,United States,Kirkland,Cybersecurity,TPG Growth,TANIUM,2015-03-31,8
Niantic,9.0,24-11-2017,United States,San Francisco,Mobile & telecommunications,Nintendo,NIANTIC,2017-11-24,6
Niantic,9.0,24-11-2017,United States,San Francisco,Mobile & telecommunications,Google,NIANTIC,2017-11-24,6
Niantic,9.0,24-11-2017,United States,San Francisco,Mobile & telecommunications,Pokemon Company International,NIANTIC,2017-11-24,6
Niantic,9.0,24-11-2017,United States,San Francisco,Mobile & telecommunications,Spark Capital,NIANTIC,2017-11-24,6
OYO Rooms,9.0,25-09-2018,India,Gurugram,Travel,SoftBank Group,OYO ROOMS,2018-09-25,5
OYO Rooms,9.0,25-09-2018,India,Gurugram,Travel,Sequoia Capital India,OYO ROOMS,2018-09-25,5
OYO Rooms,9.0,25-09-2018,India,Gurugram,Travel,Lightspeed India Partners,OYO ROOMS,2018-09-25,5
Getir,9.0,26-03-2021,Turkey,Istanbul,"Supply chain, logistics, & delivery",Tiger Global Management,GETIR,2021-03-26,2
Getir,9.0,26-03-2021,Turkey,Istanbul,"Supply chain, logistics, & delivery",Sequoia Capital,GETIR,2021-03-26,2
Getir,9.0,26-03-2021,Turkey,Istanbul,"Supply chain, logistics, & delivery",Revo Capital,GETIR,2021-03-26,2
Rapyd,9.0,03-12-2019,United Kingdom,London,Fintech,Target Global,RAPYD,2019-12-03,4
Rapyd,9.0,03-12-2019,United Kingdom,London,Fintech,General Catalyst,RAPYD,2019-12-03,4
Rapyd,9.0,03-12-2019,United Kingdom,London,Fintech,Durable Capital Partners,RAPYD,2019-12-03,4
Kavak,9.0,01-10-2020,Mexico,Lerma de Villada,E-commerce & direct-to-consumer,DST Global,KAVAK,2020-10-01,3
Kavak,9.0,01-10-2020,Mexico,Lerma de Villada,E-commerce & direct-to-consumer,SoftBank Group,KAVAK,2020-10-01,3
Kavak,9.0,01-10-2020,Mexico,Lerma de Villada,E-commerce & direct-to-consumer,Mountain Nazca,KAVAK,2020-10-01,3
Nuro,9.0,11-02-2019,United States,Mountain View,Auto & transportation,SoftBank Group,NURO,2019-02-11,4
Nuro,9.0,11-02-2019,United States,Mountain View,Auto & transportation,Greylock Partners,NURO,2019-02-11,4
Nuro,9.0,11-02-2019,United States,Mountain View,Auto & transportation,Gaorong Capital,NURO,2019-02-11,4
Chainalysis,9.0,23-11-2020,United States,New York,Fintech,Addition,CHAINALYSIS,2020-11-23,3
Chainalysis,9.0,23-11-2020,United States,New York,Fintech,Benhcmark,CHAINALYSIS,2020-11-23,3
Chainalysis,9.0,23-11-2020,United States,New York,Fintech,Accel,CHAINALYSIS,2020-11-23,3
Pony.ai,9.0,11-07-2018,United States,Fremont,Artificial intelligence,Sequoia Capital China,PONY.AI,2018-07-11,5
Pony.ai,9.0,11-07-2018,United States,Fremont,Artificial intelligence,IDG Capital,PONY.AI,2018-07-11,5
Pony.ai,9.0,11-07-2018,United States,Fremont,Artificial intelligence,DCM Ventures,PONY.AI,2018-07-11,5
Personio,9.0,19-01-2021,Germany,Munich,Internet software & services,Global Founders Capital,PERSONIO,2021-01-19,2
Personio,9.0,19-01-2021,Germany,Munich,Internet software & services,Nortzone Ventures,PERSONIO,2021-01-19,2
Personio,9.0,19-01-2021,Germany,Munich,Internet software & services,Picus Capital,PERSONIO,2021-01-19,2
Anduril,9.0,11-09-2019,United States,Irvine,Artificial intelligence,Andreessen Horowitz,ANDURIL,2019-09-11,4
Anduril,9.0,11-09-2019,United States,Irvine,Artificial intelligence,Founders Fund,ANDURIL,2019-09-11,4
Anduril,9.0,11-09-2019,United States,Irvine,Artificial intelligence,Revolution Ventures,ANDURIL,2019-09-11,4
SumUp,8.0,16-07-2019,United Kingdom,London,Fintech,American Express Ventures,SUMUP,2019-07-16,4
SumUp,8.0,16-07-2019,United Kingdom,London,Fintech,Goldman Sachs,SUMUP,2019-07-16,4
SumUp,8.0,16-07-2019,United Kingdom,London,Fintech,Bain Capital Credit,SUMUP,2019-07-16,4
Bolt,8.0,29-05-2018,Estonia,Tallinn,Auto & transportation,Didi Chuxing,BOLT TALLINN,2018-05-29,5
Bolt,8.0,29-05-2018,Estonia,Tallinn,Auto & transportation,Diamler,BOLT TALLINN,2018-05-29,5
Bolt,8.0,29-05-2018,Estonia,Tallinn,Auto & transportation,TMT Investments,BOLT TALLINN,2018-05-29,5
Lacework,8.0,07-01-2021,United States,San Jose,Cybersecurity,Sutter Hill Ventures,LACEWORK,2021-01-07,2
Lacework,8.0,07-01-2021,United States,San Jose,Cybersecurity,Liberty Global Ventures,LACEWORK,2021-01-07,2
Lacework,8.0,07-01-2021,United States,San Jose,Cybersecurity,Coatue Management,LACEWORK,2021-01-07,2
Tipalti,8.0,06-10-2020,United States,San Mateo,Fintech,01 Advisors,TIPALTI,2020-10-06,3
Tipalti,8.0,06-10-2020,United States,San Mateo,Fintech,Zeev Ventures,TIPALTI,2020-10-06,3
Tipalti,8.0,06-10-2020,United States,San Mateo,Fintech,Group 11,TIPALTI,2020-10-06,3
Tempus,8.0,21-03-2018,United States,Chicago,Health,New Enterprise Associates,TEMPUS,2018-03-21,5
Tempus,8.0,21-03-2018,United States,Chicago,Health,T. Rowe Associates,TEMPUS,2018-03-21,5
Tempus,8.0,21-03-2018,United States,Chicago,Health,Lightbank,TEMPUS,2018-03-21,5
Ramp,8.0,29-03-2021,United States,New York,Fintech,D1 Capital Partners,RAMP,2021-03-29,2
Ramp,8.0,29-03-2021,United States,New York,Fintech,Stripe,RAMP,2021-03-29,2
Ramp,8.0,29-03-2021,United States,New York,Fintech,Coatue Management,RAMP,2021-03-29,2
Swiggy,8.0,21-06-2018,India,Bengaluru,"Supply chain, logistics, & delivery",Accel India,SWIGGY,2018-06-21,5
Swiggy,8.0,21-06-2018,India,Bengaluru,"Supply chain, logistics, & delivery",SAIF Partners,SWIGGY,2018-06-21,5
Swiggy,8.0,21-06-2018,India,Bengaluru,"Supply chain, logistics, & delivery",Norwest Venture Partners,SWIGGY,2018-06-21,5
Dream11,8.0,09-04-2019,India,Mumbai,Internet software & services,Kaalari Capital,DREAM11,2019-04-09,4
Dream11,8.0,09-04-2019,India,Mumbai,Internet software & services,Tencent Holdings,DREAM11,2019-04-09,4
Dream11,8.0,09-04-2019,India,Mumbai,Internet software & services,Steadview Capital,DREAM11,2019-04-09,4
Fireblocks,8.0,27-07-2021,United States,New York,Fintech,Tenaya Capital,FIREBLOCKS,2021-07-27,2
Fireblocks,8.0,27-07-2021,United States,New York,Fintech,Coatue Management,FIREBLOCKS,2021-07-27,2
Fireblocks,8.0,27-07-2021,United States,New York,Fintech,Stripes Group,FIREBLOCKS,2021-07-27,2
Flexport,8.0,30-04-2018,United States,San Francisco,"Supply chain, logistics, & delivery",Bloomberg Beta,FLEXPORT,2018-04-30,5
Flexport,8.0,30-04-2018,United States,San Francisco,"Supply chain, logistics, & delivery",Founders Fund,FLEXPORT,2018-04-30,5
Flexport,8.0,30-04-2018,United States,San Francisco,"Supply chain, logistics, & delivery",First Round Capital,FLEXPORT,2018-04-30,5
FalconX,8.0,10-08-2021,United States,San Mateo,Fintech,Tiger Global Management,FALCONX,2021-08-10,2
FalconX,8.0,10-08-2021,United States,San Mateo,Fintech,American Express Ventures,FALCONX,2021-08-10,2
FalconX,8.0,10-08-2021,United States,San Mateo,Fintech,B Capital Group,FALCONX,2021-08-10,2
Caris,8.0,12-05-2021,United States,Irving,Health,Sixth Street Partners,CARIS,2021-05-12,2
Caris,8.0,12-05-2021,United States,Irving,Health,OrbiMed Advisors,CARIS,2021-05-12,2
Caris,8.0,12-05-2021,United States,Irving,Health,Highland Capital Management,CARIS,2021-05-12,2
Dapper Labs,8.0,30-03-2021,Canada,Vancouver,Internet software & services,Union Square Ventures,DAPPER LABS,2021-03-30,2
Dapper Labs,8.0,30-03-2021,Canada,Vancouver,Internet software & services,Venrock,DAPPER LABS,2021-03-30,2
Dapper Labs,8.0,30-03-2021,Canada,Vancouver,Internet software & services,Andreessen Horowitz,DAPPER LABS,2021-03-30,2
Hopin,7.0,10-11-2020,United Kingdom,London,Internet software & services,Accel,HOPIN,2020-11-10,3
Hopin,7.0,10-11-2020,United Kingdom,London,Internet software & services,Northzone Ventures,HOPIN,2020-11-10,3
Hopin,7.0,10-11-2020,United Kingdom,London,Internet software & services,Institutional Venture Partners,HOPIN,2020-11-10,3
Netskope,7.0,13-11-2018,United States,Santa Clara,Cybersecurity,Lightspeed Venture Partners,NETSKOPE,2018-11-13,5
Netskope,7.0,13-11-2018,United States,Santa Clara,Cybersecurity,Social Capital,NETSKOPE,2018-11-13,5
Netskope,7.0,13-11-2018,United States,Santa Clara,Cybersecurity,Accel,NETSKOPE,2018-11-13,5
Razorpay,7.0,11-10-2020,India,Bengaluru,Fintech,Sequoia Capital India,RAZORPAY,2020-10-11,3
Razorpay,7.0,11-10-2020,India,Bengaluru,Fintech,Tiger Global Management,RAZORPAY,2020-10-11,3
Razorpay,7.0,11-10-2020,India,Bengaluru,Fintech,Matrix Partners India,RAZORPAY,2020-10-11,3
Automattic,7.0,27-05-2013,United States,San Francisco,Internet software & services,Insight Venture Partners,AUTOMATTIC,2013-05-27,10
Automattic,7.0,27-05-2013,United States,San Francisco,Internet software & services,Lowercase Capital,AUTOMATTIC,2013-05-27,10
Automattic,7.0,27-05-2013,United States,San Francisco,Internet software & services,Polaris Partners,AUTOMATTIC,2013-05-27,10
Carta,7.0,06-05-2019,United States,San Francisco,Fintech,Menlo Ventures,CARTA,2019-05-06,4
Carta,7.0,06-05-2019,United States,San Francisco,Fintech,Spark Capital,CARTA,2019-05-06,4
Carta,7.0,06-05-2019,United States,San Francisco,Fintech,Union Square Ventures,CARTA,2019-05-06,4
Snyk,7.0,21-01-2020,United States,Boston,Cybersecurity,BOLDstart Ventures,SNYK,2020-01-21,3
Snyk,7.0,21-01-2020,United States,Boston,Cybersecurity,Google Ventures,SNYK,2020-01-21,3
Snyk,7.0,21-01-2020,United States,Boston,Cybersecurity,Accel,SNYK,2020-01-21,3
Scale AI,7.0,05-08-2019,United States,San Francisco,Artificial intelligence,Accel,SCALE AI,2019-08-05,4
Scale AI,7.0,05-08-2019,United States,San Francisco,Artificial intelligence,Y Combinator,SCALE AI,2019-08-05,4
Scale AI,7.0,05-08-2019,United States,San Francisco,Artificial intelligence,Index Ventures,SCALE AI,2019-08-05,4
Gong,7.0,12-08-2020,United States,Palo Alto,Artificial intelligence,Norwest Venture Partners,GONG,2020-08-12,3
Gong,7.0,12-08-2020,United States,Palo Alto,Artificial intelligence,Next World Capital,GONG,2020-08-12,3
Gong,7.0,12-08-2020,United States,Palo Alto,Artificial intelligence,Wing Venture Capital,GONG,2020-08-12,3
Gemini,7.0,19-11-2021,United States,New York,Fintech,Morgan Creek Digital,GEMINI,2021-11-19,2
Gemini,7.0,19-11-2021,United States,New York,Fintech,Marcy Venture Partners,GEMINI,2021-11-19,2
Gemini,7.0,19-11-2021,United States,New York,Fintech,10T Fund,GEMINI,2021-11-19,2
Toss,7.0,09-12-2018,South Korea,Seoul,Fintech,Bessemer Venture Partners,TOSS,2018-12-09,5
Toss,7.0,09-12-2018,South Korea,Seoul,Fintech,Qualcomm Ventures,TOSS,2018-12-09,5
Toss,7.0,09-12-2018,South Korea,Seoul,Fintech,Kleiner Perkins Caufield & Byers,TOSS,2018-12-09,5
We Doctor,7.0,22-09-2015,China,Hangzhou,Health,Tencent,WE DOCTOR,2015-09-22,8
We Doctor,7.0,22-09-2015,China,Hangzhou,Health,Morningside Group,WE DOCTOR,2015-09-22,8
Ro,7.0,27-07-2020,United States,New York,Health,Initialized Capital,RO,2020-07-27,3
Ro,7.0,27-07-2020,United States,New York,Health,General Catalyst,RO,2020-07-27,3
Ro,7.0,27-07-2020,United States,New York,Health,SignalFire,RO,2020-07-27,3
ConsenSys,7.0,17-11-2021,United States,New York,Fintech,Third Point,CONSENSYS,2021-11-17,2
ConsenSys,7.0,17-11-2021,United States,New York,Fintech,Electric Capital,CONSENSYS,2021-11-17,2
ConsenSys,7.0,17-11-2021,United States,New York,Fintech,Coinbase Ventures,CONSENSYS,2021-11-17,2
Automation Anywhere,7.0,02-07-2018,United States,San Jose,Artificial intelligence,General Atlantic,AUTOMATION ANYWHERE,2018-07-02,5
Automation Anywhere,7.0,02-07-2018,United States,San Jose,Artificial intelligence,Goldman Sachs,AUTOMATION ANYWHERE,2018-07-02,5
Automation Anywhere,7.0,02-07-2018,United States,San Jose,Artificial intelligence,New Enterprise Associates,AUTOMATION ANYWHERE,2018-07-02,5
1Password,7.0,08-07-2021,Canada,Toronto,Cybersecurity,Slack Fund,1PASSWORD,2021-07-08,2
1Password,7.0,08-07-2021,Canada,Toronto,Cybersecurity,Accel,1PASSWORD,2021-07-08,2
1Password,7.0,08-07-2021,Canada,Toronto,Cybersecurity,Skip Capital,1PASSWORD,2021-07-08,2
Klarna,7.0,12-12-2011,Sweden,Stockholm,Fintech,Institutional Venture Partners,KLARNA,2011-12-12,12
Klarna,7.0,12-12-2011,Sweden,Stockholm,Fintech,Sequoia Capital,KLARNA,2011-12-12,12
Klarna,7.0,12-12-2011,Sweden,Stockholm,Fintech,General Atlantic,KLARNA,2011-12-12,12
Ziroom,7.0,17-01-2018,China,Beijing,E-commerce & direct-to-consumer,Sequoia Capital China,ZIROOM,2018-01-17,5
Ziroom,7.0,17-01-2018,China,Beijing,E-commerce & direct-to-consumer,Warburg Pincus,ZIROOM,2018-01-17,5
Ziroom,7.0,17-01-2018,China,Beijing,E-commerce & direct-to-consumer,General Catalyst,ZIROOM,2018-01-17,5
SVOLT,7.0,08-06-2020,China,Changzhou,Other,IDG Capital,SVOLT,2020-06-08,3
SVOLT,7.0,08-06-2020,China,Changzhou,Other,Bank Of China Group Investment,SVOLT,2020-06-08,3
SVOLT,7.0,08-06-2020,China,Changzhou,Other,,SVOLT,2020-06-08,3
SVOLT,7.0,08-06-2020,China,Changzhou,Other,SDIC CMC Investment Management,SVOLT,2020-06-08,3
National Stock Exchange of India,6.0,01-07-2020,India,Mumbai,Fintech,TA Associates,NATIONAL STOCK EXCHANGE OF INDIA,2020-07-01,3
National Stock Exchange of India,6.0,01-07-2020,India,Mumbai,Fintech,SoftBank Group,NATIONAL STOCK EXCHANGE OF INDIA,2020-07-01,3
National Stock Exchange of India,6.0,01-07-2020,India,Mumbai,Fintech,GS Growth,NATIONAL STOCK EXCHANGE OF INDIA,2020-07-01,3
Mollie,6.0,08-09-2020,Netherlands,Amsterdam,Fintech,Technology Crossover Ventures,MOLLIE,2020-09-08,3
Ola Cabs,6.0,27-10-2014,India,Bengaluru,Auto & transportation,Accel Partners,OLA CABS,2014-10-27,9
Ola Cabs,6.0,27-10-2014,India,Bengaluru,Auto & transportation,SoftBank Group,OLA CABS,2014-10-27,9
Ola Cabs,6.0,27-10-2014,India,Bengaluru,Auto & transportation,Sequoia Capital,OLA CABS,2014-10-27,9
Doctolib,6.0,19-03-2019,France,Paris,Health,BPI France,DOCTOLIB,2019-03-19,4
Doctolib,6.0,19-03-2019,France,Paris,Health,Kerala Ventures,DOCTOLIB,2019-03-19,4
Doctolib,6.0,19-03-2019,France,Paris,Health,Accel,DOCTOLIB,2019-03-19,4
CRED,6.0,06-04-2021,India,Bengaluru,Fintech,Tiger Global Management,CRED,2021-04-06,2
CRED,6.0,06-04-2021,India,Bengaluru,Fintech,DST Global,CRED,2021-04-06,2
CRED,6.0,06-04-2021,India,Bengaluru,Fintech,Sequoia Capital India,CRED,2021-04-06,2
DataRobot,6.0,29-07-2019,United States,Boston,Artificial intelligence,New Enterprise Associates,DATAROBOT,2019-07-29,4
DataRobot,6.0,29-07-2019,United States,Boston,Artificial intelligence,Accomplice,DATAROBOT,2019-07-29,4
DataRobot,6.0,29-07-2019,United States,Boston,Artificial intelligence,IA Ventures,DATAROBOT,2019-07-29,4
Upgrade,6.0,12-02-2018,United States,San Francisco,Fintech,Union Square Ventures,UPGRADE,2018-02-12,5
Upgrade,6.0,12-02-2018,United States,San Francisco,Fintech,Ribbit Capital,UPGRADE,2018-02-12,5
Upgrade,6.0,12-02-2018,United States,San Francisco,Fintech,VY Capital,UPGRADE,2018-02-12,5
Hinge Health,6.0,06-01-2021,United States,San Francisco,Health,Atomico,HINGE HEALTH,2021-01-06,2
Hinge Health,6.0,06-01-2021,United States,San Francisco,Health,Insight Partners,HINGE HEALTH,2021-01-06,2
Hinge Health,6.0,06-01-2021,United States,San Francisco,Health,Coatue Management,HINGE HEALTH,2021-01-06,2
Black Unicorn Factory,6.0,20-05-2021,United States,Los Angeles,Other,Barter Ventures,BLACK UNICORN FACTORY,2021-05-20,2
Benchling,6.0,14-04-2021,United States,San Francisco,Internet software & services,Thrive Capital,BENCHLING,2021-04-14,2
Benchling,6.0,14-04-2021,United States,San Francisco,Internet software & services,Benchmark,BENCHLING,2021-04-14,2
Benchling,6.0,14-04-2021,United States,San Francisco,Internet software & services,MenloVentures,BENCHLING,2021-04-14,2
Royole Corporation,6.0,18-08-2015,China,Shenzhen,Hardware,Warmsun Holding,ROYOLE CORPORATION,2015-08-18,8
Royole Corporation,6.0,18-08-2015,China,Shenzhen,Hardware,IDG Capital Partners,ROYOLE CORPORATION,2015-08-18,8
Better.com,6.0,10-11-2020,United States,New York,Fintech,Pine Brook,BETTER.COM,2020-11-10,3
Better.com,6.0,10-11-2020,United States,New York,Fintech,American Express Ventures,BETTER.COM,2020-11-10,3
Better.com,6.0,10-11-2020,United States,New York,Fintech,Kleiner Perkins Caufield & Byers,BETTER.COM,2020-11-10,3
iCapital Network,6.0,27-07-2021,United States,New York,Fintech,BlackRock,ICAPITAL NETWORK,2021-07-27,2
iCapital Network,6.0,27-07-2021,United States,New York,Fintech,Blackstone,ICAPITAL NETWORK,2021-07-27,2
iCapital Network,6.0,27-07-2021,United States,New York,Fintech,UBS,ICAPITAL NETWORK,2021-07-27,2
6Sense,6.0,30-03-2021,United States,San Francisco,Artificial intelligence,Venrock,6SENSE,2021-03-30,2
6Sense,6.0,30-03-2021,United States,San Francisco,Artificial intelligence,Battery Ventures,6SENSE,2021-03-30,2
6Sense,6.0,30-03-2021,United States,San Francisco,Artificial intelligence,Insight Partners,6SENSE,2021-03-30,2
Attentive,6.0,23-09-2020,United States,Hoboken,Mobile & telecommunications,NextView Ventures,ATTENTIVE,2020-09-23,3
Attentive,6.0,23-09-2020,United States,Hoboken,Mobile & telecommunications,Eniac Ventures,ATTENTIVE,2020-09-23,3
Attentive,6.0,23-09-2020,United States,Hoboken,Mobile & telecommunications,Sequoia Capital,ATTENTIVE,2020-09-23,3
Easyhome,6.0,12-02-2018,China,Beijing,Consumer & retail,Alibaba Group,EASYHOME,2018-02-12,5
Easyhome,6.0,12-02-2018,China,Beijing,Consumer & retail,Boyu Capital,EASYHOME,2018-02-12,5
Easyhome,6.0,12-02-2018,China,Beijing,Consumer & retail,Borui Capital,EASYHOME,2018-02-12,5
Lianjia,6.0,07-04-2016,China,Beijing,E-commerce & direct-to-consumer,Tencent,LIANJIA,2016-04-07,7
Lianjia,6.0,07-04-2016,China,Beijing,E-commerce & direct-to-consumer,Baidu,LIANJIA,2016-04-07,7
Lianjia,6.0,07-04-2016,China,Beijing,E-commerce & direct-to-consumer,Huasheng Capital,LIANJIA,2016-04-07,7
Vice Media,6.0,02-04-2011,United States,Brooklyn,Internet software & services,Technology Crossover Ventures,VICE MEDIA,2011-04-02,12
Vice Media,6.0,02-04-2011,United States,Brooklyn,Internet software & services,A&E Television Networks,VICE MEDIA,2011-04-02,12
Cityblock Health,6.0,10-12-2020,United States,Brooklyn,Health,Thrive Capital,CITYBLOCK HEALTH,2020-12-10,3
Cityblock Health,6.0,10-12-2020,United States,Brooklyn,Health,Maverick Ventures,CITYBLOCK HEALTH,2020-12-10,3
Cityblock Health,6.0,10-12-2020,United States,Brooklyn,Health,Redpoint Ventures,CITYBLOCK HEALTH,2020-12-10,3
Workato,6.0,12-01-2021,United States,Mountain View,Internet software & services,Battery Ventures,WORKATO,2021-01-12,2
Workato,6.0,12-01-2021,United States,Mountain View,Internet software & services,Storm Ventures,WORKATO,2021-01-12,2
Workato,6.0,12-01-2021,United States,Mountain View,Internet software & services,Redpoint Ventures,WORKATO,2021-01-12,2
Back Market,6.0,18-05-2021,France,Paris,E-commerce & direct-to-consumer,Aglae Ventures,BACK MARKET,2021-05-18,2
Back Market,6.0,18-05-2021,France,Paris,E-commerce & direct-to-consumer,Eurazeo,BACK MARKET,2021-05-18,2
Back Market,6.0,18-05-2021,France,Paris,E-commerce & direct-to-consumer,Daphni,BACK MARKET,2021-05-18,2
RELEX,6.0,17-02-2022,Finland,Helsinki,"Supply chain, logistics, & delivery",Blackstone,RELEX,2022-02-17,1
RELEX,6.0,17-02-2022,Finland,Helsinki,"Supply chain, logistics, & delivery",Technology Crossover Ventures,RELEX,2022-02-17,1
RELEX,6.0,17-02-2022,Finland,Helsinki,"Supply chain, logistics, & delivery",Summit Partners,RELEX,2022-02-17,1
The Boring Company,6.0,20-04-2022,United States,Pflugerville,Other,VY Capital,THE BORING COMPANY,2022-04-20,1
The Boring Company,6.0,20-04-2022,United States,Pflugerville,Other,8VC,THE BORING COMPANY,2022-04-20,1
The Boring Company,6.0,20-04-2022,United States,Pflugerville,Other,Craft Ventures,THE BORING COMPANY,2022-04-20,1
Postman,6.0,11-06-2020,United States,San Francisco,Internet software & services,Nexus Venture Partners,POSTMAN,2020-06-11,3
Postman,6.0,11-06-2020,United States,San Francisco,Internet software & services,CRV,POSTMAN,2020-06-11,3
Postman,6.0,11-06-2020,United States,San Francisco,Internet software & services,Insight Partners,POSTMAN,2020-06-11,3
FiveTran,6.0,30-06-2020,United States,Oakland,Data management & analytics,Matrix Partners,FIVETRAN,2020-06-30,3
FiveTran,6.0,30-06-2020,United States,Oakland,Data management & analytics,Andreessen Horowitz,FIVETRAN,2020-06-30,3
FiveTran,6.0,30-06-2020,United States,Oakland,Data management & analytics,General Catalyst,FIVETRAN,2020-06-30,3
ContentSquare,6.0,25-05-2021,France,Paris,Internet software & services,Highland Europe,CONTENTSQUARE,2021-05-25,2
ContentSquare,6.0,25-05-2021,France,Paris,Internet software & services,Eurazeo,CONTENTSQUARE,2021-05-25,2
ContentSquare,6.0,25-05-2021,France,Paris,Internet software & services,Canaan Partners,CONTENTSQUARE,2021-05-25,2
Trade Republic,5.0,20-05-2021,Germany,Berlin,Fintech,Founders Fund. Accel,TRADE REPUBLIC,2021-05-20,2
Trade Republic,5.0,20-05-2021,Germany,Berlin,Fintech,Creandum,TRADE REPUBLIC,2021-05-20,2
Rappi,5.0,31-08-2018,Colombia,Bogota,"Supply chain, logistics, & delivery",DST Global,RAPPI,2018-08-31,5
Rappi,5.0,31-08-2018,Colombia,Bogota,"Supply chain, logistics, & delivery",Andreessen Horowitz,RAPPI,2018-08-31,5
Rappi,5.0,31-08-2018,Colombia,Bogota,"Supply chain, logistics, & delivery",Sequoia Capital,RAPPI,2018-08-31,5
Rappi,5.0,31-08-2018,Colombia,Bogota,"Supply chain, logistics, & delivery",Redpoint e.ventures,RAPPI,2018-08-31,5
Collibra,5.0,29-01-2019,Belgium,Brussels,Data management & analytics,Index Ventures,COLLIBRA,2019-01-29,4
Collibra,5.0,29-01-2019,Belgium,Brussels,Data management & analytics,Battery Ventures,COLLIBRA,2019-01-29,4
Collibra,5.0,29-01-2019,Belgium,Brussels,Data management & analytics,ICONIQ Capital,COLLIBRA,2019-01-29,4
OneTrust,5.0,11-07-2019,United States,Atlanta,Internet software & services,Insight Partners,ONETRUST,2019-07-11,4
QuintoAndar,5.0,09-09-2019,Brazil,Campinas,E-commerce & direct-to-consumer,Kaszek Ventures,QUINTOANDAR,2019-09-09,4
QuintoAndar,5.0,09-09-2019,Brazil,Campinas,E-commerce & direct-to-consumer,General Atlantic,QUINTOANDAR,2019-09-09,4
QuintoAndar,5.0,09-09-2019,Brazil,Campinas,E-commerce & direct-to-consumer,SoftBank Group,QUINTOANDAR,2019-09-09,4
C6 Bank,5.0,02-12-2020,Brazil,Sao Paulo,Fintech,Credit Suisse,C6 BANK,2020-12-02,3
Flink,5.0,01-12-2021,Germany,Berlin,E-commerce & direct-to-consumer,Mubadala Capital,FLINK,2021-12-01,2
Flink,5.0,01-12-2021,Germany,Berlin,E-commerce & direct-to-consumer,Bond,FLINK,2021-12-01,2
Flink,5.0,01-12-2021,Germany,Berlin,E-commerce & direct-to-consumer,Prosus Ventures,FLINK,2021-12-01,2
Hello TransTech,5.0,01-06-2018,China,Shanghai,Auto & transportation,Ant Financial Services Group,HELLO TRANSTECH,2018-06-01,5
Hello TransTech,5.0,01-06-2018,China,Shanghai,Auto & transportation,GGV Capital,HELLO TRANSTECH,2018-06-01,5
Airwallex,5.0,25-03-2019,Australia,Melbourne,Fintech,DST Global,AIRWALLEX,2019-03-25,4
Airwallex,5.0,25-03-2019,Australia,Melbourne,Fintech,Sequoia Capital China,AIRWALLEX,2019-03-25,4
Airwallex,5.0,25-03-2019,Australia,Melbourne,Fintech,Tencent Holdings,AIRWALLEX,2019-03-25,4
Mambu,5.0,06-01-2021,Netherlands,Amsterdam,Fintech,Runa Capital,MAMBU,2021-01-06,2
Mambu,5.0,06-01-2021,Netherlands,Amsterdam,Fintech,Acton Capital Partners,MAMBU,2021-01-06,2
Mambu,5.0,06-01-2021,Netherlands,Amsterdam,Fintech,Point Nine Capital,MAMBU,2021-01-06,2
Horizon Robotics,5.0,27-02-2019,China,Beijing,Artificial intelligence,Hillhouse Capital Management,HORIZON ROBOTICS,2019-02-27,4
Horizon Robotics,5.0,27-02-2019,China,Beijing,Artificial intelligence,Linear Venture,HORIZON ROBOTICS,2019-02-27,4
Horizon Robotics,5.0,27-02-2019,China,Beijing,Artificial intelligence,Morningside Venture Capital,HORIZON ROBOTICS,2019-02-27,4
Howden Group Holdings,5.0,29-09-2020,United Kingdom,London,Other,General Atlantic,HOWDEN GROUP HOLDINGS,2020-09-29,3
Howden Group Holdings,5.0,29-09-2020,United Kingdom,London,Other,3i Group,HOWDEN GROUP HOLDINGS,2020-09-29,3
Howden Group Holdings,5.0,29-09-2020,United Kingdom,London,Other,Huagai Capital,HOWDEN GROUP HOLDINGS,2020-09-29,3
SambaNova Systems,5.0,13-04-2021,United States,Palo Alto,Data management & analytics,Walden International,SAMBANOVA SYSTEMS,2021-04-13,2
SambaNova Systems,5.0,13-04-2021,United States,Palo Alto,Data management & analytics,Google Ventures,SAMBANOVA SYSTEMS,2021-04-13,2
SambaNova Systems,5.0,13-04-2021,United States,Palo Alto,Data management & analytics,Intel Capital,SAMBANOVA SYSTEMS,2021-04-13,2
ZEPZ,5.0,23-08-2021,United Kingdom,London,Fintech,Accel,ZEPZ,2021-08-23,2
ZEPZ,5.0,23-08-2021,United Kingdom,London,Fintech,Technology Crossover Ventures,ZEPZ,2021-08-23,2
ZEPZ,5.0,23-08-2021,United Kingdom,London,Fintech,LeapFrog Investments,ZEPZ,2021-08-23,2
OakNorth Bank,5.0,12-10-2017,United Kingdom,London,Fintech,Clermont Group,OAKNORTH BANK,2017-10-12,6
OakNorth Bank,5.0,12-10-2017,United Kingdom,London,Fintech,Coltrane Asset Management,OAKNORTH BANK,2017-10-12,6
OakNorth Bank,5.0,12-10-2017,United Kingdom,London,Fintech,Toscafund Asset Management,OAKNORTH BANK,2017-10-12,6
Moon Active,5.0,26-01-2020,Israel,Tel Aviv,Mobile & telecommunications,Insight Partners,MOON ACTIVE,2020-01-26,3
Moon Active,5.0,26-01-2020,Israel,Tel Aviv,Mobile & telecommunications,Andalusian Capital Partners,MOON ACTIVE,2020-01-26,3
OfBusiness,5.0,31-07-2021,India,Gurgaon,E-commerce & direct-to-consumer,Matrix Partners India,OFBUSINESS,2021-07-31,2
OfBusiness,5.0,31-07-2021,India,Gurgaon,E-commerce & direct-to-consumer,Falcon Edge Capital,OFBUSINESS,2021-07-31,2
OfBusiness,5.0,31-07-2021,India,Gurgaon,E-commerce & direct-to-consumer,SoftBank Group,OFBUSINESS,2021-07-31,2
Cockroach Labs,5.0,12-01-2021,United States,New York,Data management & analytics,Google Ventures,COCKROACH LABS,2021-01-12,2
Cockroach Labs,5.0,12-01-2021,United States,New York,Data management & analytics,Benchmark,COCKROACH LABS,2021-01-12,2
Cockroach Labs,5.0,12-01-2021,United States,New York,Data management & analytics,FirstMark Capital,COCKROACH LABS,2021-01-12,2
Pine Labs,5.0,24-01-2020,India,Noida,Fintech,Sequoia Capital India,PINE LABS,2020-01-24,3
Pine Labs,5.0,24-01-2020,India,Noida,Fintech,Temasek,PINE LABS,2020-01-24,3
Pine Labs,5.0,24-01-2020,India,Noida,Fintech,PayPal Ventures,PINE LABS,2020-01-24,3
Qonto,5.0,11-01-2022,France,Paris,Fintech,Alven Capital,QONTO,2022-01-11,1
Qonto,5.0,11-01-2022,France,Paris,Fintech,Valar Ventures,QONTO,2022-01-11,1
Qonto,5.0,11-01-2022,France,Paris,Fintech,Tencent Holdings,QONTO,2022-01-11,1
Ola Electric Mobility,5.0,02-07-2019,India,Bengaluru,Auto & transportation,SoftBank Group,OLA ELECTRIC MOBILITY,2019-07-02,4
Ola Electric Mobility,5.0,02-07-2019,India,Bengaluru,Auto & transportation,Tiger Global Management,OLA ELECTRIC MOBILITY,2019-07-02,4
Ola Electric Mobility,5.0,02-07-2019,India,Bengaluru,Auto & transportation,Matrix Partners India,OLA ELECTRIC MOBILITY,2019-07-02,4
Icertis,5.0,17-07-2019,United States,Bellevue,Artificial intelligence,Eight Roads Ventures,ICERTIS,2019-07-17,4
Icertis,5.0,17-07-2019,United States,Bellevue,Artificial intelligence,Greycroft,ICERTIS,2019-07-17,4
Icertis,5.0,17-07-2019,United States,Bellevue,Artificial intelligence,Ignition Partners,ICERTIS,2019-07-17,4
Hopper,5.0,24-03-2021,Canada,Montreal,Travel,Capital One Growth Ventures,HOPPER,2021-03-24,2
Hopper,5.0,24-03-2021,Canada,Montreal,Travel,Citi Ventures,HOPPER,2021-03-24,2
Hopper,5.0,24-03-2021,Canada,Montreal,Travel,OMERS Ventures,HOPPER,2021-03-24,2
VerSe Innovation,5.0,22-12-2020,India,Bengaluru,Internet software & services,Falcon Edge Capital,VERSE INNOVATION,2020-12-22,3
VerSe Innovation,5.0,22-12-2020,India,Bengaluru,Internet software & services,Omidyar Network,VERSE INNOVATION,2020-12-22,3
VerSe Innovation,5.0,22-12-2020,India,Bengaluru,Internet software & services,Sequoia Capital India,VERSE INNOVATION,2020-12-22,3
ShareChat,5.0,08-04-2021,India,Bengaluru,Internet software & services,India Quotient,SHARECHAT,2021-04-08,2
ShareChat,5.0,08-04-2021,India,Bengaluru,Internet software & services,Elevation Capital,SHARECHAT,2021-04-08,2
ShareChat,5.0,08-04-2021,India,Bengaluru,Internet software & services,Lightspeed Venture Partners,SHARECHAT,2021-04-08,2
Coalition,5.0,17-03-2021,United States,San Francisco,Cybersecurity,Two Sigma Ventures,COALITION,2021-03-17,2
Coalition,5.0,17-03-2021,United States,San Francisco,Cybersecurity,Flint Capital,COALITION,2021-03-17,2
Coalition,5.0,17-03-2021,United States,San Francisco,Cybersecurity,Commerce Ventures,COALITION,2021-03-17,2
Grafana Labs,5.0,25-03-2021,United States,New York,Internet software & services,Lightspeed Venture Partners,GRAFANA LABS,2021-03-25,2
Grafana Labs,5.0,25-03-2021,United States,New York,Internet software & services,Lead Edge Capital,GRAFANA LABS,2021-03-25,2
Grafana Labs,5.0,25-03-2021,United States,New York,Internet software & services,Coatue Management,GRAFANA LABS,2021-03-25,2
Meesho,5.0,05-04-2021,India,Bengaluru,Internet software & services,Venture Highway,MEESHO,2021-04-05,2
Meesho,5.0,05-04-2021,India,Bengaluru,Internet software & services,Sequoia Capital India,MEESHO,2021-04-05,2
Meesho,5.0,05-04-2021,India,Bengaluru,Internet software & services,Prosus Ventures,MEESHO,2021-04-05,2
Cerebral,5.0,10-06-2021,United States,San Francisco,Health,Oak HC/FT Partners,CEREBRAL,2021-06-10,2
Cerebral,5.0,10-06-2021,United States,San Francisco,Health,Artis Ventures,CEREBRAL,2021-06-10,2
Cerebral,5.0,10-06-2021,United States,San Francisco,Health,WestCap Group,CEREBRAL,2021-06-10,2
Creditas,5.0,18-12-2020,Brazil,Sao Paulo,Fintech,Kaszek Ventures,CREDITAS,2020-12-18,3
Creditas,5.0,18-12-2020,Brazil,Sao Paulo,Fintech,Amadeus Capital Partners,CREDITAS,2020-12-18,3
Creditas,5.0,18-12-2020,Brazil,Sao Paulo,Fintech,Quona Capital,CREDITAS,2020-12-18,3
Reify Health,5.0,10-08-2021,United States,Boston,Health,Sierra Ventures,REIFY HEALTH,2021-08-10,2
Reify Health,5.0,10-08-2021,United States,Boston,Health,Battery Ventures,REIFY HEALTH,2021-08-10,2
Reify Health,5.0,10-08-2021,United States,Boston,Health,Asset Management Ventures,REIFY HEALTH,2021-08-10,2
Chipone,5.0,16-12-2021,China,Beijing,Hardware,China Grand Prosperity Investment,CHIPONE,2021-12-16,2
Chipone,5.0,16-12-2021,China,Beijing,Hardware,Silk Road Huacheng,CHIPONE,2021-12-16,2
Chipone,5.0,16-12-2021,China,Beijing,Hardware,Oriza Equity Investment,CHIPONE,2021-12-16,2
BetterUp,5.0,25-02-2021,United States,San Francisco,Internet software & services,Threshold Ventures,BETTERUP,2021-02-25,2
BetterUp,5.0,25-02-2021,United States,San Francisco,Internet software & services,Lightspeed Venture Partners,BETTERUP,2021-02-25,2
BetterUp,5.0,25-02-2021,United States,San Francisco,Internet software & services,Crosslink Capital,BETTERUP,2021-02-25,2
Pleo,5.0,06-07-2021,Denmark,Copenhagen,Fintech,Creandum,PLEO,2021-07-06,2
Pleo,5.0,06-07-2021,Denmark,Copenhagen,Fintech,Founders,PLEO,2021-07-06,2
Pleo,5.0,06-07-2021,Denmark,Copenhagen,Fintech,Kinnevik,PLEO,2021-07-06,2
SonarSource,5.0,26-04-2022,Switzerland,Geneva,Internet software & services,Advent International,SONARSOURCE,2022-04-26,1
SonarSource,5.0,26-04-2022,Switzerland,Geneva,Internet software & services,General Catalyst,SONARSOURCE,2022-04-26,1
SonarSource,5.0,26-04-2022,Switzerland,Geneva,Internet software & services,Insight Partners,SONARSOURCE,2022-04-26,1
Lyra Health,5.0,25-08-2020,United States,Burlingame,Health,Greylock Partners,LYRA HEALTH,2020-08-25,3
Lyra Health,5.0,25-08-2020,United States,Burlingame,Health,Venrock,LYRA HEALTH,2020-08-25,3
Lyra Health,5.0,25-08-2020,United States,Burlingame,Health,Providence Ventures,LYRA HEALTH,2020-08-25,3
Checkr,5.0,19-09-2019,United States,San Francisco,Internet software & services,Y Combinator,CHECKR,2019-09-19,4
Checkr,5.0,19-09-2019,United States,San Francisco,Internet software & services,Accel,CHECKR,2019-09-19,4
Checkr,5.0,19-09-2019,United States,San Francisco,Internet software & services,T. Rowe Price,CHECKR,2019-09-19,4
Color,5.0,04-01-2021,United States,Burlingame,Health,General Catalyst,COLOR,2021-01-04,2
Color,5.0,04-01-2021,United States,Burlingame,Health,Viking Global Investors,COLOR,2021-01-04,2
Color,5.0,04-01-2021,United States,Burlingame,Health,T. Rowe Price,COLOR,2021-01-04,2
Lendable,5.0,31-03-2021,United Kingdom,London,Fintech,Ontario Teachers' Pension Plan,LENDABLE,2021-03-31,2
Lendable,5.0,31-03-2021,United Kingdom,London,Fintech,Goldman Sachs,LENDABLE,2021-03-31,2
Vinted,5.0,27-11-2019,Lithuania,Vilnius,E-commerce & direct-to-consumer,Accel,VINTED,2019-11-27,4
Vinted,5.0,27-11-2019,Lithuania,Vilnius,E-commerce & direct-to-consumer,Insight Partners,VINTED,2019-11-27,4
Vinted,5.0,27-11-2019,Lithuania,Vilnius,E-commerce & direct-to-consumer,Burda Principal Investments,VINTED,2019-11-27,4
VIPKid,4.0,04-08-2016,China,Beijing,Edtech,Sequoia Capital China,VIPKID,2016-08-04,7
VIPKid,4.0,04-08-2016,China,Beijing,Edtech,Tencent Holdings,VIPKID,2016-08-04,7
VIPKid,4.0,04-08-2016,China,Beijing,Edtech,Sinovation Ventures,VIPKID,2016-08-04,7
Socure,4.0,16-03-2021,United States,New York,Cybersecurity,Two Sigma Ventures,SOCURE,2021-03-16,2
Socure,4.0,16-03-2021,United States,New York,Cybersecurity,Flint Capital,SOCURE,2021-03-16,2
Socure,4.0,16-03-2021,United States,New York,Cybersecurity,Commerce Ventures,SOCURE,2021-03-16,2
Monzo,4.0,31-10-2018,United Kingdom,London,Fintech,Passion Capital,MONZO,2018-10-31,5
Monzo,4.0,31-10-2018,United Kingdom,London,Fintech,Thrive Capital,MONZO,2018-10-31,5
Monzo,4.0,31-10-2018,United Kingdom,London,Fintech,Orange Digital Ventures,MONZO,2018-10-31,5
UBTECH Robotics,4.0,25-07-2016,China,Shenzhen,Hardware,CDH Investments,UBTECH ROBOTICS,2016-07-25,7
UBTECH Robotics,4.0,25-07-2016,China,Shenzhen,Hardware,Goldstone Investments,UBTECH ROBOTICS,2016-07-25,7
UBTECH Robotics,4.0,25-07-2016,China,Shenzhen,Hardware,Qiming Venture Partners,UBTECH ROBOTICS,2016-07-25,7
wefox,4.0,05-03-2019,Germany,Berlin,Fintech,Salesforce Ventures,WEFOX,2019-03-05,4
wefox,4.0,05-03-2019,Germany,Berlin,Fintech,Seedcamp,WEFOX,2019-03-05,4
wefox,4.0,05-03-2019,Germany,Berlin,Fintech,OMERS Ventures,WEFOX,2019-03-05,4
Lenskart,4.0,20-12-2019,India,Faridabad,E-commerce & direct-to-consumer,Chiratae Ventures,LENSKART,2019-12-20,4
Lenskart,4.0,20-12-2019,India,Faridabad,E-commerce & direct-to-consumer,PremjiInvest,LENSKART,2019-12-20,4
Lenskart,4.0,20-12-2019,India,Faridabad,E-commerce & direct-to-consumer,Softbank,LENSKART,2019-12-20,4
Anthropic,4.0,03-02-2023,United States,San Francisco,Artificial intelligence,Google,ANTHROPIC,2023-02-03,0
Outreach,4.0,16-04-2019,United States,Seattle,Internet software & services,Mayfield Fund,OUTREACH,2019-04-16,4
Outreach,4.0,16-04-2019,United States,Seattle,Internet software & services,M12,OUTREACH,2019-04-16,4
Outreach,4.0,16-04-2019,United States,Seattle,Internet software & services,Trinity Ventures,OUTREACH,2019-04-16,4
WeRide,4.0,23-12-2020,China,Guangzhou,Auto & transportation,Atop Capital,WERIDE,2020-12-23,3
WeRide,4.0,23-12-2020,China,Guangzhou,Auto & transportation,IDInvest Partners,WERIDE,2020-12-23,3
WeRide,4.0,23-12-2020,China,Guangzhou,Auto & transportation,Qiming Venture Partners,WERIDE,2020-12-23,3
Guild Education,4.0,13-11-2019,United States,Denver,Internet software & services,General Atlantic,GUILD EDUCATION,2019-11-13,4
Guild Education,4.0,13-11-2019,United States,Denver,Internet software & services,Blackstone,GUILD EDUCATION,2019-11-13,4
Guild Education,4.0,13-11-2019,United States,Denver,Internet software & services,ICONIQ Growth,GUILD EDUCATION,2019-11-13,4
Arctic Wolf Networks,4.0,22-10-2020,United States,Eden Prairie,Cybersecurity,Lightspeed Venture Partners,ARCTIC WOLF NETWORKS,2020-10-22,3
Arctic Wolf Networks,4.0,22-10-2020,United States,Eden Prairie,Cybersecurity,Redpoint Ventures,ARCTIC WOLF NETWORKS,2020-10-22,3
Arctic Wolf Networks,4.0,22-10-2020,United States,Eden Prairie,Cybersecurity,Viking Global Investors,ARCTIC WOLF NETWORKS,2020-10-22,3
OutSystems,4.0,05-06-2018,United States,Boston,Internet software & services,KKR,OUTSYSTEMS,2018-06-05,5
OutSystems,4.0,05-06-2018,United States,Boston,Internet software & services,ES Ventures,OUTSYSTEMS,2018-06-05,5
OutSystems,4.0,05-06-2018,United States,Boston,Internet software & services,North Bridge Growth Equity,OUTSYSTEMS,2018-06-05,5
Sorare,4.0,21-09-2021,France,Paris,Internet software & services,Benchmark,SORARE,2021-09-21,2
Sorare,4.0,21-09-2021,France,Paris,Internet software & services,Accel,SORARE,2021-09-21,2
Sorare,4.0,21-09-2021,France,Paris,Internet software & services,SoftBank Group,SORARE,2021-09-21,2
Relativity Space,4.0,23-11-2020,United States,Inglewood,Other,Playground Global,RELATIVITY SPACE,2020-11-23,3
Relativity Space,4.0,23-11-2020,United States,Inglewood,Other,Bond,RELATIVITY SPACE,2020-11-23,3
Relativity Space,4.0,23-11-2020,United States,Inglewood,Other,Tribe Capital,RELATIVITY SPACE,2020-11-23,3
Miaoshou Doctor,4.0,27-06-2019,China,Beijing,E-commerce & direct-to-consumer,Sequoia Capital China,MIAOSHOU DOCTOR,2019-06-27,4
Miaoshou Doctor,4.0,27-06-2019,China,Beijing,E-commerce & direct-to-consumer,Qiming Venture Partners,MIAOSHOU DOCTOR,2019-06-27,4
Miaoshou Doctor,4.0,27-06-2019,China,Beijing,E-commerce & direct-to-consumer,Tencent Holdings,MIAOSHOU DOCTOR,2019-06-27,4
ThoughtSpot,4.0,08-05-2018,United States,Sunnyvale,Internet software & services,Lightspeed Venture Partners,THOUGHTSPOT,2018-05-08,5
ThoughtSpot,4.0,08-05-2018,United States,Sunnyvale,Internet software & services,Khosla Ventures,THOUGHTSPOT,2018-05-08,5
ThoughtSpot,4.0,08-05-2018,United States,Sunnyvale,Internet software & services,Geodesic Capital,THOUGHTSPOT,2018-05-08,5
Globalization Partners,4.0,24-01-2022,United States,Boston,Internet software & services,Vista Equity Partners,GLOBALIZATION PARTNERS,2022-01-24,1
Globalization Partners,4.0,24-01-2022,United States,Boston,Internet software & services,Wincove,GLOBALIZATION PARTNERS,2022-01-24,1
Globalization Partners,4.0,24-01-2022,United States,Boston,Internet software & services,TDR Capital,GLOBALIZATION PARTNERS,2022-01-24,1
dbt Labs,4.0,30-06-2021,United States,Philadelphia,Data management & analytics,Andreessen Horowitz,DBT LABS,2021-06-30,2
dbt Labs,4.0,30-06-2021,United States,Philadelphia,Data management & analytics,Amplify Partners,DBT LABS,2021-06-30,2
dbt Labs,4.0,30-06-2021,United States,Philadelphia,Data management & analytics,Sequoia Capital,DBT LABS,2021-06-30,2
SSENSE,4.0,08-06-2021,Canada,Montreal,E-commerce & direct-to-consumer,Sequoia Capital,SSENSE,2021-06-08,2
Dataminr,4.0,04-06-2018,United States,New York,Artificial intelligence,Venrock,DATAMINR,2018-06-04,5
Dataminr,4.0,04-06-2018,United States,New York,Artificial intelligence,Institutional Venture Partners,DATAMINR,2018-06-04,5
Dataminr,4.0,04-06-2018,United States,New York,Artificial intelligence,Goldman Sachs,DATAMINR,2018-06-04,5
BitPanda,4.0,16-03-2021,Austria,Vienna,Fintech,Speedinvest,BITPANDA,2021-03-16,2
BitPanda,4.0,16-03-2021,Austria,Vienna,Fintech,Valar Ventures,BITPANDA,2021-03-16,2
BitPanda,4.0,16-03-2021,Austria,Vienna,Fintech,Uniqa Ventures,BITPANDA,2021-03-16,2
Weee!,4.0,16-03-2021,United States,Fremont,"Supply chain, logistics, & delivery",Goodwater Capital,WEEE!,2021-03-16,2
Weee!,4.0,16-03-2021,United States,Fremont,"Supply chain, logistics, & delivery",iFly,WEEE!,2021-03-16,2
Weee!,4.0,16-03-2021,United States,Fremont,"Supply chain, logistics, & delivery",XVC Venture Capital,WEEE!,2021-03-16,2
Skydance Media,4.0,11-02-2020,United States,Santa Monica,Other,RedBird Capital Partners,SKYDANCE MEDIA,2020-02-11,3
Skydance Media,4.0,11-02-2020,United States,Santa Monica,Other,CJ ENM,SKYDANCE MEDIA,2020-02-11,3
Skydance Media,4.0,11-02-2020,United States,Santa Monica,Other,Tencent Holdings,SKYDANCE MEDIA,2020-02-11,3
Houzz,4.0,30-09-2014,United States,Palo Alto,E-commerce & direct-to-consumer,New Enterprise Associates,HOUZZ,2014-09-30,9
Houzz,4.0,30-09-2014,United States,Palo Alto,E-commerce & direct-to-consumer,Sequoia Capital,HOUZZ,2014-09-30,9
Houzz,4.0,30-09-2014,United States,Palo Alto,E-commerce & direct-to-consumer,Comcast Ventures,HOUZZ,2014-09-30,9
Yello Mobile,4.0,11-11-2014,South Korea,Seoul,Mobile & telecommunications,Formation 8,YELLO MOBILE,2014-11-11,9
MEGVII,4.0,31-10-2017,China,Beijing,Artificial intelligence,Ant Financial Services Group,MEGVII,2017-10-31,6
MEGVII,4.0,31-10-2017,China,Beijing,Artificial intelligence,Russia-China Investment Fund,MEGVII,2017-10-31,6
MEGVII,4.0,31-10-2017,China,Beijing,Artificial intelligence,Foxconn Technology Company,MEGVII,2017-10-31,6
Greensill,4.0,16-07-2018,United Kingdom,London,Fintech,SoftBank Group,GREENSILL,2018-07-16,5
Greensill,4.0,16-07-2018,United Kingdom,London,Fintech,General Atlantic,GREENSILL,2018-07-16,5
Impossible Foods,4.0,13-05-2019,United States,Redwood City,Consumer & retail,Khosla Ventures,IMPOSSIBLE FOODS,2019-05-13,4
Impossible Foods,4.0,13-05-2019,United States,Redwood City,Consumer & retail,Horizons Ventures,IMPOSSIBLE FOODS,2019-05-13,4
Impossible Foods,4.0,13-05-2019,United States,Redwood City,Consumer & retail,Temasek Holdings,IMPOSSIBLE FOODS,2019-05-13,4
Radiology Partners,4.0,26-02-2018,United States,El Segundo,Health,New Enterprise Associates,RADIOLOGY PARTNERS,2018-02-26,5
Radiology Partners,4.0,26-02-2018,United States,El Segundo,Health,Starr Investment Holdings,RADIOLOGY PARTNERS,2018-02-26,5
Next Insurance,4.0,07-10-2019,United States,Palo Alto,Fintech,Zeev Ventures,NEXT INSURANCE,2019-10-07,4
Next Insurance,4.0,07-10-2019,United States,Palo Alto,Fintech,Ribbit Capital,NEXT INSURANCE,2019-10-07,4
Next Insurance,4.0,07-10-2019,United States,Palo Alto,Fintech,TLV Partners,NEXT INSURANCE,2019-10-07,4
PointClickCare,4.0,07-01-2021,Canada,Mississauga,Internet software & services,Dragoneer Investment Group,POINTCLICKCARE,2021-01-07,2
PointClickCare,4.0,07-01-2021,Canada,Mississauga,Internet software & services,Hellman & Friedman,POINTCLICKCARE,2021-01-07,2
PointClickCare,4.0,07-01-2021,Canada,Mississauga,Internet software & services,JMI Equity,POINTCLICKCARE,2021-01-07,2
Zapier,4.0,14-01-2021,United States,Sunnyvale,Internet software & services,Sequoia Capital,ZAPIER,2021-01-14,2
Zapier,4.0,14-01-2021,United States,Sunnyvale,Internet software & services,Bessemer Venture Partners,ZAPIER,2021-01-14,2
Zapier,4.0,14-01-2021,United States,Sunnyvale,Internet software & services,Threshold Ventures,ZAPIER,2021-01-14,2
Clubhouse,4.0,24-01-2021,United States,San Francisco,Mobile & telecommunications,Andreessen Horowitz,CLUBHOUSE,2021-01-24,2
Clubhouse,4.0,24-01-2021,United States,San Francisco,Mobile & telecommunications,TQ Ventures,CLUBHOUSE,2021-01-24,2
BrowserStack,4.0,16-06-2021,Ireland,Dublin,Internet software & services,Accel,BROWSERSTACK,2021-06-16,2
BrowserStack,4.0,16-06-2021,Ireland,Dublin,Internet software & services,Insight Partners,BROWSERSTACK,2021-06-16,2
BrowserStack,4.0,16-06-2021,Ireland,Dublin,Internet software & services,Bond Capital,BROWSERSTACK,2021-06-16,2
Olive,4.0,01-12-2020,United States,Columbus,Health,Drive Capital,OLIVE,2020-12-01,3
Olive,4.0,01-12-2020,United States,Columbus,Health,General Catalyst,OLIVE,2020-12-01,3
Olive,4.0,01-12-2020,United States,Columbus,Health,Ascension Ventures,OLIVE,2020-12-01,3
Rubrik,4.0,28-04-2017,United States,Palo Alto,Data management & analytics,Greylock Partners,RUBRIK,2017-04-28,6
Rubrik,4.0,28-04-2017,United States,Palo Alto,Data management & analytics,Lightspeed Venture Partners,RUBRIK,2017-04-28,6
Rubrik,4.0,28-04-2017,United States,Palo Alto,Data management & analytics,Khosla Ventures,RUBRIK,2017-04-28,6
Melio,4.0,25-01-2021,United States,New York,Fintech,Accel,MELIO,2021-01-25,2
Melio,4.0,25-01-2021,United States,New York,Fintech,Aleph,MELIO,2021-01-25,2
Melio,4.0,25-01-2021,United States,New York,Fintech,American Express Ventures,MELIO,2021-01-25,2
Vuori,4.0,13-10-2021,United States,Carlsbad,E-commerce & direct-to-consumer,SoftBank Group,VUORI,2021-10-13,2
Vuori,4.0,13-10-2021,United States,Carlsbad,E-commerce & direct-to-consumer,Norwest Venture Partners,VUORI,2021-10-13,2
ClickUp,4.0,15-12-2020,United States,San Diego,Internet software & services,Georgian Partners,CLICKUP,2020-12-15,3
ClickUp,4.0,15-12-2020,United States,San Diego,Internet software & services,Craft Ventures,CLICKUP,2020-12-15,3
Cerebras Systems,4.0,14-11-2018,United States,Los Altos,Hardware,Benchmark,CEREBRAS SYSTEMS,2018-11-14,5
Cerebras Systems,4.0,14-11-2018,United States,Los Altos,Hardware,Foundation Capital,CEREBRAS SYSTEMS,2018-11-14,5
Cerebras Systems,4.0,14-11-2018,United States,Los Altos,Hardware,Sequoia Capital,CEREBRAS SYSTEMS,2018-11-14,5
Farmers Business Network,4.0,03-08-2020,United States,San Carlos,Other,Blackrock,FARMERS BUSINESS NETWORK,2020-08-03,3
Farmers Business Network,4.0,03-08-2020,United States,San Carlos,Other,Kleiner Perkins Caulfield & Byers,FARMERS BUSINESS NETWORK,2020-08-03,3
Farmers Business Network,4.0,03-08-2020,United States,San Carlos,Other,Google Ventures,FARMERS BUSINESS NETWORK,2020-08-03,3
Branch,4.0,10-09-2018,United States,Redwood City,Mobile & telecommunications,New Enterprise Associates,BRANCH REDWOOD CITY,2018-09-10,5
Branch,4.0,10-09-2018,United States,Redwood City,Mobile & telecommunications,Pear,BRANCH REDWOOD CITY,2018-09-10,5
Branch,4.0,10-09-2018,United States,Redwood City,Mobile & telecommunications,Cowboy Ventures,BRANCH REDWOOD CITY,2018-09-10,5
Aurora Solar,4.0,24-05-2021,United States,San Francisco,Internet software & services,Fifth Wall Ventures,AURORA SOLAR,2021-05-24,2
Aurora Solar,4.0,24-05-2021,United States,San Francisco,Internet software & services,Energize Ventures,AURORA SOLAR,2021-05-24,2
Aurora Solar,4.0,24-05-2021,United States,San Francisco,Internet software & services,ICONIQ Capital,AURORA SOLAR,2021-05-24,2
Webflow,4.0,13-01-2021,United States,San Francisco,Internet software & services,Accel,WEBFLOW,2021-01-13,2
Webflow,4.0,13-01-2021,United States,San Francisco,Internet software & services,Silversmith Capital Partners,WEBFLOW,2021-01-13,2
Webflow,4.0,13-01-2021,United States,San Francisco,Internet software & services,capitalG,WEBFLOW,2021-01-13,2
Yuga Labs,4.0,22-03-2022,United States,Miami,Internet software & services,Andreessen Horowitz,YUGA LABS,2022-03-22,1
Yuga Labs,4.0,22-03-2022,United States,Miami,Internet software & services,Thrive Capital,YUGA LABS,2022-03-22,1
Yuga Labs,4.0,22-03-2022,United States,Miami,Internet software & services,Sound Ventures,YUGA LABS,2022-03-22,1
Digit Insurance,4.0,15-01-2021,India,Bengaluru,Fintech,Fairfax Financial Holdings,DIGIT INSURANCE,2021-01-15,2
Digit Insurance,4.0,15-01-2021,India,Bengaluru,Fintech,A91 Partners,DIGIT INSURANCE,2021-01-15,2
Digit Insurance,4.0,15-01-2021,India,Bengaluru,Fintech,TVS Capital,DIGIT INSURANCE,2021-01-15,2
Abnormal Security,4.0,10-05-2022,United States,San Francisco,Cybersecurity,Greylock Partners,ABNORMAL SECURITY,2022-05-10,1
Abnormal Security,4.0,10-05-2022,United States,San Francisco,Cybersecurity,Insight Partners,ABNORMAL SECURITY,2022-05-10,1
Abnormal Security,4.0,10-05-2022,United States,San Francisco,Cybersecurity,Menlo Ventures,ABNORMAL SECURITY,2022-05-10,1
Medlinker,4.0,31-07-2018,China,Chengdu,Health,China Health Industry Investment Fund,MEDLINKER,2018-07-31,5
Medlinker,4.0,31-07-2018,China,Chengdu,Health,China Renaissance,MEDLINKER,2018-07-31,5
Medlinker,4.0,31-07-2018,China,Chengdu,Health,and Sequoia Capital China,MEDLINKER,2018-07-31,5
Intarcia Therapeutics,4.0,01-04-2014,United States,Boston,Health,New Enterprise Associates,INTARCIA THERAPEUTICS,2014-04-01,9
Intarcia Therapeutics,4.0,01-04-2014,United States,Boston,Health,New Leaf Venture Partners,INTARCIA THERAPEUTICS,2014-04-01,9
Intarcia Therapeutics,4.0,01-04-2014,United States,Boston,Health,Charter Venture Capital,INTARCIA THERAPEUTICS,2014-04-01,9
StockX,4.0,26-06-2019,United States,Detroit,E-commerce & direct-to-consumer,Google Ventures,STOCKX,2019-06-26,4
StockX,4.0,26-06-2019,United States,Detroit,E-commerce & direct-to-consumer,Battery Ventures,STOCKX,2019-06-26,4
StockX,4.0,26-06-2019,United States,Detroit,E-commerce & direct-to-consumer,DST Global,STOCKX,2019-06-26,4
MessageBird,4.0,08-10-2020,Netherlands,Amsterdam,Mobile & telecommunications,Y Combinator,MESSAGEBIRD,2020-10-08,3
MessageBird,4.0,08-10-2020,Netherlands,Amsterdam,Mobile & telecommunications,Atomico,MESSAGEBIRD,2020-10-08,3
MessageBird,4.0,08-10-2020,Netherlands,Amsterdam,Mobile & telecommunications,Accel,MESSAGEBIRD,2020-10-08,3
Convoy,4.0,21-09-2018,United States,Seattle,"Supply chain, logistics, & delivery",Greylock Partners,CONVOY,2018-09-21,5
Convoy,4.0,21-09-2018,United States,Seattle,"Supply chain, logistics, & delivery",capitalG,CONVOY,2018-09-21,5
Convoy,4.0,21-09-2018,United States,Seattle,"Supply chain, logistics, & delivery",Y Combinator,CONVOY,2018-09-21,5
Articulate,4.0,01-07-2021,United States,New York,Edtech,Blackstone,ARTICULATE,2021-07-01,2
Articulate,4.0,01-07-2021,United States,New York,Edtech,ICONIQ Growth,ARTICULATE,2021-07-01,2
Articulate,4.0,01-07-2021,United States,New York,Edtech,General Atlantic,ARTICULATE,2021-07-01,2
Dutchie,4.0,16-03-2021,United States,Bend,E-commerce & direct-to-consumer,Casa Verde Capital,DUTCHIE,2021-03-16,2
Dutchie,4.0,16-03-2021,United States,Bend,E-commerce & direct-to-consumer,Gron Ventures,DUTCHIE,2021-03-16,2
Dutchie,4.0,16-03-2021,United States,Bend,E-commerce & direct-to-consumer,Thrity Five Ventures,DUTCHIE,2021-03-16,2
Cohesity,4.0,11-06-2018,United States,San Jose,Data management & analytics,SoftBank Group,COHESITY,2018-06-11,5
Cohesity,4.0,11-06-2018,United States,San Jose,Data management & analytics,Sequoia Capital,COHESITY,2018-06-11,5
Cohesity,4.0,11-06-2018,United States,San Jose,Data management & analytics,Wing Venture Capital,COHESITY,2018-06-11,5
Dataiku,4.0,04-12-2019,United States,New York,Artificial intelligence,Alven Capital,DATAIKU,2019-12-04,4
Dataiku,4.0,04-12-2019,United States,New York,Artificial intelligence,FirstMark Capital,DATAIKU,2019-12-04,4
Dataiku,4.0,04-12-2019,United States,New York,Artificial intelligence,capitalG,DATAIKU,2019-12-04,4
VAST Data,4.0,16-04-2020,United States,New York,Data management & analytics,Norwest Venture Partners,VAST DATA,2020-04-16,3
VAST Data,4.0,16-04-2020,United States,New York,Data management & analytics,Goldman Sachs,VAST DATA,2020-04-16,3
VAST Data,4.0,16-04-2020,United States,New York,Data management & analytics,Dell Technologies Capital,VAST DATA,2020-04-16,3
GOAT,4.0,23-09-2020,United States,Culver City,E-commerce & direct-to-consumer,Upfront Ventures,GOAT,2020-09-23,3
GOAT,4.0,23-09-2020,United States,Culver City,E-commerce & direct-to-consumer,Webb Investment Network,GOAT,2020-09-23,3
GOAT,4.0,23-09-2020,United States,Culver City,E-commerce & direct-to-consumer,D1 Capital Partners,GOAT,2020-09-23,3
Noom,4.0,24-05-2021,United States,New York,Health,Qualcomm Ventures,NOOM,2021-05-24,2
Noom,4.0,24-05-2021,United States,New York,Health,Samsung Ventures,NOOM,2021-05-24,2
Noom,4.0,24-05-2021,United States,New York,Health,Silver Lake,NOOM,2021-05-24,2
Redwood Materials,4.0,28-07-2021,United States,Carson City,Other,Breakthrough Energy Ventures,REDWOOD MATERIALS,2021-07-28,2
Redwood Materials,4.0,28-07-2021,United States,Carson City,Other,Capricorn Investment Group,REDWOOD MATERIALS,2021-07-28,2
Redwood Materials,4.0,28-07-2021,United States,Carson City,Other,Valor Equity Partners,REDWOOD MATERIALS,2021-07-28,2
Papaya Global,4.0,04-03-2021,United States,New York,Internet software & services,Bessemer Venture Partners,PAPAYA GLOBAL,2021-03-04,2
Papaya Global,4.0,04-03-2021,United States,New York,Internet software & services,Insight Partners,PAPAYA GLOBAL,2021-03-04,2
Papaya Global,4.0,04-03-2021,United States,New York,Internet software & services,New Era Ventures,PAPAYA GLOBAL,2021-03-04,2
Abogen,4.0,29-11-2021,China,Suzhou,Health,Hillhouse Capital Management,ABOGEN,2021-11-29,2
Abogen,4.0,29-11-2021,China,Suzhou,Health,SoftBank Group,ABOGEN,2021-11-29,2
Abogen,4.0,29-11-2021,China,Suzhou,Health,Qiming Venture Partners,ABOGEN,2021-11-29,2
Harness,4.0,14-01-2021,United States,San Francisco,Artificial intelligence,Menlo Ventures,HARNESS,2021-01-14,2
Harness,4.0,14-01-2021,United States,San Francisco,Artificial intelligence,Alkeon Capital Management,HARNESS,2021-01-14,2
Harness,4.0,14-01-2021,United States,San Francisco,Artificial intelligence,Citi Ventures,HARNESS,2021-01-14,2
Whatnot,4.0,16-09-2021,United States,Marina del Rey,E-commerce & direct-to-consumer,Y Combinator,WHATNOT,2021-09-16,2
Whatnot,4.0,16-09-2021,United States,Marina del Rey,E-commerce & direct-to-consumer,Andreessen Horowitz,WHATNOT,2021-09-16,2
Whatnot,4.0,16-09-2021,United States,Marina del Rey,E-commerce & direct-to-consumer,Wonder Ventures,WHATNOT,2021-09-16,2
Autograph,4.0,20-01-2022,United States,Santa Monica,Internet software & services,01 Advisors. Kleiner Perkins Caufield & Byers. Andreessen Horowitz,AUTOGRAPH,2022-01-20,1
Relativity,4.0,18-03-2021,United States,Chicago,Internet software & services,Silver Lake,RELATIVITY,2021-03-18,2
Relativity,4.0,18-03-2021,United States,Chicago,Internet software & services,ICONIQ Capital,RELATIVITY,2021-03-18,2
Whoop,4.0,28-10-2020,United States,Boston,E-commerce & direct-to-consumer,NextView Ventures,WHOOP,2020-10-28,3
Whoop,4.0,28-10-2020,United States,Boston,E-commerce & direct-to-consumer,Promus Ventures,WHOOP,2020-10-28,3
Whoop,4.0,28-10-2020,United States,Boston,E-commerce & direct-to-consumer,Two Sigma Ventures,WHOOP,2020-10-28,3
Applied Intuition,4.0,22-10-2020,United States,Sunnyvale,Auto & transportation,Andreessen Horowitz,APPLIED INTUITION,2020-10-22,3
Applied Intuition,4.0,22-10-2020,United States,Sunnyvale,Auto & transportation,Lux Capital,APPLIED INTUITION,2020-10-22,3
Applied Intuition,4.0,22-10-2020,United States,Sunnyvale,Auto & transportation,General Catalyst,APPLIED INTUITION,2020-10-22,3
Course Hero,4.0,12-02-2020,United States,Redwood City,Edtech,NewView Capital,COURSE HERO,2020-02-12,3
Course Hero,4.0,12-02-2020,United States,Redwood City,Edtech,Maveron,COURSE HERO,2020-02-12,3
Course Hero,4.0,12-02-2020,United States,Redwood City,Edtech,Ridge Ventures,COURSE HERO,2020-02-12,3
SpotOn,4.0,26-05-2021,United States,San Francisco,Fintech,Dragoneer Investment Group,SPOTON,2021-05-26,2
SpotOn,4.0,26-05-2021,United States,San Francisco,Fintech,DST Global,SPOTON,2021-05-26,2
SpotOn,4.0,26-05-2021,United States,San Francisco,Fintech,Franklin Templeton,SPOTON,2021-05-26,2
Otto Bock HealthCare,4.0,24-06-2017,Germany,Duderstadt,Health,EQT Partners,OTTO BOCK HEALTHCARE,2017-06-24,6
Indigo Ag,3.0,26-09-2017,United States,Boston,Artificial intelligence,Activant Capital Group,INDIGO AG,2017-09-26,6
Indigo Ag,3.0,26-09-2017,United States,Boston,Artificial intelligence,Alaska Permanent Fund,INDIGO AG,2017-09-26,6
Indigo Ag,3.0,26-09-2017,United States,Boston,Artificial intelligence,Baillie Gifford & Co.,INDIGO AG,2017-09-26,6
HyalRoute,3.0,26-05-2020,Singapore,Unknown,Mobile & telecommunications,Kuang-Chi,HYALROUTE,2020-05-26,3
Rec Room,3.0,23-03-2021,United States,Seattle,Internet software & services,First Round Capital,REC ROOM,2021-03-23,2
Rec Room,3.0,23-03-2021,United States,Seattle,Internet software & services,Sequoia Capital,REC ROOM,2021-03-23,2
Rec Room,3.0,23-03-2021,United States,Seattle,Internet software & services,Index Ventures,REC ROOM,2021-03-23,2
Commure,3.0,16-09-2021,United States,San Francisco,Internet software & services,General Catalyst,COMMURE,2021-09-16,2
Commure,3.0,16-09-2021,United States,San Francisco,Internet software & services,HCA Healthcare,COMMURE,2021-09-16,2
Mirakl,3.0,22-09-2020,France,Paris,E-commerce & direct-to-consumer,Elaia Partners,MIRAKL,2020-09-22,3
Mirakl,3.0,22-09-2020,France,Paris,E-commerce & direct-to-consumer,83North,MIRAKL,2020-09-22,3
Mirakl,3.0,22-09-2020,France,Paris,E-commerce & direct-to-consumer,Felix Capital,MIRAKL,2020-09-22,3
Tekion,3.0,21-10-2020,United States,San Ramon,Internet software & services,Airbus Ventures,TEKION,2020-10-21,3
Tekion,3.0,21-10-2020,United States,San Ramon,Internet software & services,Index Ventures,TEKION,2020-10-21,3
Tekion,3.0,21-10-2020,United States,San Ramon,Internet software & services,Advent International,TEKION,2020-10-21,3
Celsius Network,3.0,12-10-2021,United States,Hoboken,Fintech,WestCap Group,CELSIUS NETWORK,2021-10-12,2
Celsius Network,3.0,12-10-2021,United States,Hoboken,Fintech,Caisse de depot et placement du Quebec,CELSIUS NETWORK,2021-10-12,2
GoStudent,3.0,22-06-2021,Austria,Vienna,Edtech,DN Capital,GOSTUDENT,2021-06-22,2
GoStudent,3.0,22-06-2021,Austria,Vienna,Edtech,Left Lane Capital,GOSTUDENT,2021-06-22,2
GoStudent,3.0,22-06-2021,Austria,Vienna,Edtech,Coatue Management,GOSTUDENT,2021-06-22,2
Highspot,3.0,22-02-2021,United States,Seattle,Internet software & services,Madrona Venture Group,HIGHSPOT,2021-02-22,2
Highspot,3.0,22-02-2021,United States,Seattle,Internet software & services,Shasta Ventures,HIGHSPOT,2021-02-22,2
Highspot,3.0,22-02-2021,United States,Seattle,Internet software & services,Salesforce Ventures,HIGHSPOT,2021-02-22,2
Handshake,3.0,12-05-2021,United States,San Francisco,Internet software & services,Kleiner Perkins Caufield & Byers,HANDSHAKE,2021-05-12,2
Handshake,3.0,12-05-2021,United States,San Francisco,Internet software & services,Lightspeed Venture Partners,HANDSHAKE,2021-05-12,2
Handshake,3.0,12-05-2021,United States,San Francisco,Internet software & services,True Ventures,HANDSHAKE,2021-05-12,2
ChargeBee Technologies,3.0,20-04-2021,United States,San Francisco,Fintech,Insight Partners,CHARGEBEE TECHNOLOGIES,2021-04-20,2
ChargeBee Technologies,3.0,20-04-2021,United States,San Francisco,Fintech,Tiger Global Management,CHARGEBEE TECHNOLOGIES,2021-04-20,2
ChargeBee Technologies,3.0,20-04-2021,United States,San Francisco,Fintech,Accel,CHARGEBEE TECHNOLOGIES,2021-04-20,2
Flock Safety,3.0,13-07-2021,United States,Atlanta,Hardware,Matrix Partners,FLOCK SAFETY,2021-07-13,2
Flock Safety,3.0,13-07-2021,United States,Atlanta,Hardware,Initialized Capital,FLOCK SAFETY,2021-07-13,2
Flock Safety,3.0,13-07-2021,United States,Atlanta,Hardware,Tiger Global Management,FLOCK SAFETY,2021-07-13,2
Helion Energy,3.0,05-11-2021,United States,Redmond,Other,Mithril Capital Management,HELION ENERGY,2021-11-05,2
Helion Energy,3.0,05-11-2021,United States,Redmond,Other,Y Combinator,HELION ENERGY,2021-11-05,2
Helion Energy,3.0,05-11-2021,United States,Redmond,Other,Capricorn Investment Group,HELION ENERGY,2021-11-05,2
Acronis,3.0,18-09-2019,Switzerland,Schaffhausen,Cybersecurity,Goldman Sachs,ACRONIS,2019-09-18,4
Acronis,3.0,18-09-2019,Switzerland,Schaffhausen,Cybersecurity,VebVentures,ACRONIS,2019-09-18,4
Acronis,3.0,18-09-2019,Switzerland,Schaffhausen,Cybersecurity,Insight Partners,ACRONIS,2019-09-18,4
Unacademy,3.0,02-09-2020,India,Bengaluru,Edtech,Blume Ventures,UNACADEMY,2020-09-02,3
Unacademy,3.0,02-09-2020,India,Bengaluru,Edtech,Nexus Venture Partners,UNACADEMY,2020-09-02,3
Unacademy,3.0,02-09-2020,India,Bengaluru,Edtech,Sequoia Capital India,UNACADEMY,2020-09-02,3
Odoo,3.0,29-07-2021,Belgium,Louvain-la-Neuve,Internet software & services,Summit Partners,ODOO,2021-07-29,2
Odoo,3.0,29-07-2021,Belgium,Louvain-la-Neuve,Internet software & services,Noshaq,ODOO,2021-07-29,2
Odoo,3.0,29-07-2021,Belgium,Louvain-la-Neuve,Internet software & services,Sofinnova Partners,ODOO,2021-07-29,2
MoonPay,3.0,22-11-2021,United States,Miami,Fintech,New Enterprise Associates,MOONPAY,2021-11-22,2
MoonPay,3.0,22-11-2021,United States,Miami,Fintech,Coatue Management,MOONPAY,2021-11-22,2
MoonPay,3.0,22-11-2021,United States,Miami,Fintech,Tiger Global Management,MOONPAY,2021-11-22,2
Upstox,3.0,29-11-2021,India,Mumbai,Fintech,Tiger Global Management,UPSTOX,2021-11-29,2
Upstox,3.0,29-11-2021,India,Mumbai,Fintech,Kalaari Capital,UPSTOX,2021-11-29,2
Improbable,3.0,11-05-2017,United Kingdom,London,Other,Andreessen Horowitz,IMPROBABLE,2017-05-11,6
Improbable,3.0,11-05-2017,United Kingdom,London,Other,SoftBank Group,IMPROBABLE,2017-05-11,6
Improbable,3.0,11-05-2017,United Kingdom,London,Other,Temasek Holdings,IMPROBABLE,2017-05-11,6
Youxia Motors,3.0,02-04-2018,China,Shanghai,Auto & transportation,China Environmental Protection Industry,YOUXIA MOTORS,2018-04-02,5
Youxia Motors,3.0,02-04-2018,China,Shanghai,Auto & transportation,China Fortune Ocean,YOUXIA MOTORS,2018-04-02,5
OwnBackup,3.0,28-01-2021,United States,Englewood Cliffs,Data management & analytics,Insight Partners,OWNBACKUP,2021-01-28,2
OwnBackup,3.0,28-01-2021,United States,Englewood Cliffs,Data management & analytics,Salesforce Ventures,OWNBACKUP,2021-01-28,2
OwnBackup,3.0,28-01-2021,United States,Englewood Cliffs,Data management & analytics,Vertex Ventures,OWNBACKUP,2021-01-28,2
Starburst,3.0,06-01-2021,United States,Boston,Data management & analytics,Index Ventures,STARBURST,2021-01-06,2
Starburst,3.0,06-01-2021,United States,Boston,Data management & analytics,Coatue Management,STARBURST,2021-01-06,2
Starburst,3.0,06-01-2021,United States,Boston,Data management & analytics,Andreessen Horowitz,STARBURST,2021-01-06,2
Sila Nanotechnologies,3.0,16-04-2019,United States,Alameda,Other,Bessemer Venture Partners,SILA NANOTECHNOLOGIES,2019-04-16,4
Sila Nanotechnologies,3.0,16-04-2019,United States,Alameda,Other,Sutter Hill Ventures,SILA NANOTECHNOLOGIES,2019-04-16,4
Sila Nanotechnologies,3.0,16-04-2019,United States,Alameda,Other,Matrix Partners,SILA NANOTECHNOLOGIES,2019-04-16,4
Scopely,3.0,29-10-2019,United States,Culver City,Mobile & telecommunications,Greycroft,SCOPELY,2019-10-29,4
Scopely,3.0,29-10-2019,United States,Culver City,Mobile & telecommunications,Sands Capital,SCOPELY,2019-10-29,4
Scopely,3.0,29-10-2019,United States,Culver City,Mobile & telecommunications,Revolution Growth,SCOPELY,2019-10-29,4
Komodo Health,3.0,22-05-2020,United States,San Francisco,Health,Andreessen Horowitz,KOMODO HEALTH,2020-05-22,3
Komodo Health,3.0,22-05-2020,United States,San Francisco,Health,IA Ventures,KOMODO HEALTH,2020-05-22,3
Komodo Health,3.0,22-05-2020,United States,San Francisco,Health,Felicis Ventures,KOMODO HEALTH,2020-05-22,3
Kurly,3.0,09-07-2021,South Korea,Seoul,"Supply chain, logistics, & delivery",Sequoia Capital China,KURLY,2021-07-09,2
Kurly,3.0,09-07-2021,South Korea,Seoul,"Supply chain, logistics, & delivery",DST Global,KURLY,2021-07-09,2
Kurly,3.0,09-07-2021,South Korea,Seoul,"Supply chain, logistics, & delivery",DST Global,KURLY,2021-07-09,2
Cars24,3.0,24-11-2020,India,Gurgaon,E-commerce & direct-to-consumer,Moore Strategic Ventures,CARS24,2020-11-24,3
Cars24,3.0,24-11-2020,India,Gurgaon,E-commerce & direct-to-consumer,DST Global,CARS24,2020-11-24,3
Cars24,3.0,24-11-2020,India,Gurgaon,E-commerce & direct-to-consumer,Sequoia Capital India,CARS24,2020-11-24,3
BlockDaemon,3.0,21-09-2021,United States,Los Angeles,Fintech,BOLDstart Ventures,BLOCKDAEMON,2021-09-21,2
BlockDaemon,3.0,21-09-2021,United States,Los Angeles,Fintech,Lerer Hippeau,BLOCKDAEMON,2021-09-21,2
BlockDaemon,3.0,21-09-2021,United States,Los Angeles,Fintech,Kenetic Capital,BLOCKDAEMON,2021-09-21,2
Dadi Cinema,3.0,11-05-2016,China,Shenzhen,Other,Alibaba Pictures Group,DADI CINEMA,2016-05-11,7
Aiven,3.0,18-10-2021,Finland,Helsinki,Internet software & services,Institutional Venture Partners,AIVEN,2021-10-18,2
Aiven,3.0,18-10-2021,Finland,Helsinki,Internet software & services,Atomico,AIVEN,2021-10-18,2
Aiven,3.0,18-10-2021,Finland,Helsinki,Internet software & services,Earlybird Venture Capital,AIVEN,2021-10-18,2
Astera Labs,3.0,17-11-2022,United States,Santa Clara,Hardware,Intel Capital,ASTERA LABS,2022-11-17,1
Astera Labs,3.0,17-11-2022,United States,Santa Clara,Hardware,Sutter Hill Ventures,ASTERA LABS,2022-11-17,1
Astera Labs,3.0,17-11-2022,United States,Santa Clara,Hardware,VentureTech,ASTERA LABS,2022-11-17,1
Thumbtack,3.0,29-09-2015,United States,San Francisco,E-commerce & direct-to-consumer,Tiger Global,THUMBTACK,2015-09-29,8
Thumbtack,3.0,29-09-2015,United States,San Francisco,E-commerce & direct-to-consumer,Sequoia Capital,THUMBTACK,2015-09-29,8
Thumbtack,3.0,29-09-2015,United States,San Francisco,E-commerce & direct-to-consumer,Google Capital,THUMBTACK,2015-09-29,8
Cedar,3.0,09-03-2021,United States,New York,Fintech,Thrive Capital,CEDAR,2021-03-09,2
Cedar,3.0,09-03-2021,United States,New York,Fintech,Founders Fund,CEDAR,2021-03-09,2
Cedar,3.0,09-03-2021,United States,New York,Fintech,Cocnord Health Partners,CEDAR,2021-03-09,2
Eruditus Executive Education,3.0,12-08-2021,India,Mumbai,Edtech,Sequoia Capital India,ERUDITUS EXECUTIVE EDUCATION,2021-08-12,2
Eruditus Executive Education,3.0,12-08-2021,India,Mumbai,Edtech,Softbank,ERUDITUS EXECUTIVE EDUCATION,2021-08-12,2
Eruditus Executive Education,3.0,12-08-2021,India,Mumbai,Edtech,Bertelsmann India Investments,ERUDITUS EXECUTIVE EDUCATION,2021-08-12,2
Blockstream,3.0,24-08-2021,Canada,Vancouver,Fintech,AME Cloud Ventures,BLOCKSTREAM,2021-08-24,2
Blockstream,3.0,24-08-2021,Canada,Vancouver,Fintech,Future Perfect Ventures,BLOCKSTREAM,2021-08-24,2
Blockstream,3.0,24-08-2021,Canada,Vancouver,Fintech,Blockchain Capital,BLOCKSTREAM,2021-08-24,2
Innovaccer,3.0,19-02-2021,United States,San Francisco,Health,M12,INNOVACCER,2021-02-19,2
Innovaccer,3.0,19-02-2021,United States,San Francisco,Health,WestBridge Capital,INNOVACCER,2021-02-19,2
Innovaccer,3.0,19-02-2021,United States,San Francisco,Health,Lightspeed Venture Partners,INNOVACCER,2021-02-19,2
Ironclad,3.0,18-01-2022,United States,Sacramento,Internet software & services,Accel,IRONCLAD,2022-01-18,1
Ironclad,3.0,18-01-2022,United States,Sacramento,Internet software & services,Sequoia Capital,IRONCLAD,2022-01-18,1
Ironclad,3.0,18-01-2022,United States,Sacramento,Internet software & services,Y Combinator,IRONCLAD,2022-01-18,1
Skims,3.0,09-04-2021,United States,Los Angeles,E-commerce & direct-to-consumer,Thrive Capital,SKIMS,2021-04-09,2
Skims,3.0,09-04-2021,United States,Los Angeles,E-commerce & direct-to-consumer,Alliance Consumer Growth,SKIMS,2021-04-09,2
Skims,3.0,09-04-2021,United States,Los Angeles,E-commerce & direct-to-consumer,Imaginary Ventures,SKIMS,2021-04-09,2
Eikon Therapeutics,3.0,06-01-2022,United States,Hayward,Health,The Column Group,EIKON THERAPEUTICS,2022-01-06,1
Eikon Therapeutics,3.0,06-01-2022,United States,Hayward,Health,Foresite Capital,EIKON THERAPEUTICS,2022-01-06,1
Eikon Therapeutics,3.0,06-01-2022,United States,Hayward,Health,Foresite Capital,EIKON THERAPEUTICS,2022-01-06,1
Retool,3.0,22-12-2021,United States,San Francisco,Internet software & services,Sequoia Capital,RETOOL,2021-12-22,2
Verkada,3.0,29-01-2020,United States,San Mateo,Cybersecurity,next47,VERKADA,2020-01-29,3
Verkada,3.0,29-01-2020,United States,San Mateo,Cybersecurity,First Round Capital,VERKADA,2020-01-29,3
Verkada,3.0,29-01-2020,United States,San Mateo,Cybersecurity,Sequoia Capital,VERKADA,2020-01-29,3
PsiQuantum,3.0,27-07-2021,United States,Palo Alto,Hardware,Playground Global,PSIQUANTUM,2021-07-27,2
PsiQuantum,3.0,27-07-2021,United States,Palo Alto,Hardware,M12,PSIQUANTUM,2021-07-27,2
PsiQuantum,3.0,27-07-2021,United States,Palo Alto,Hardware,BlackRock,PSIQUANTUM,2021-07-27,2
Udaan,3.0,04-09-2018,India,Bengaluru,"Supply chain, logistics, & delivery",DST Global,UDAAN,2018-09-04,5
Udaan,3.0,04-09-2018,India,Bengaluru,"Supply chain, logistics, & delivery",Lightspeed Venture Partners,UDAAN,2018-09-04,5
Udaan,3.0,04-09-2018,India,Bengaluru,"Supply chain, logistics, & delivery",Microsoft ScaleUp,UDAAN,2018-09-04,5
HighRadius,3.0,07-01-2020,United States,Houston,Fintech,Susquehanna Growth Equity,HIGHRADIUS,2020-01-07,3
HighRadius,3.0,07-01-2020,United States,Houston,Fintech,Citi Ventures,HIGHRADIUS,2020-01-07,3
HighRadius,3.0,07-01-2020,United States,Houston,Fintech,ICONIQ Capital,HIGHRADIUS,2020-01-07,3
Nuvemshop,3.0,17-08-2021,Brazil,Sao Paulo,E-commerce & direct-to-consumer,Kaszek Ventures,NUVEMSHOP,2021-08-17,2
Nuvemshop,3.0,17-08-2021,Brazil,Sao Paulo,E-commerce & direct-to-consumer,Qualcomm Ventures,NUVEMSHOP,2021-08-17,2
Nuvemshop,3.0,17-08-2021,Brazil,Sao Paulo,E-commerce & direct-to-consumer,Accel,NUVEMSHOP,2021-08-17,2
Yixia,3.0,24-11-2015,China,Beijing,Mobile & telecommunications,Sequoia Capital China,YIXIA,2015-11-24,8
Yixia,3.0,24-11-2015,China,Beijing,Mobile & telecommunications,Sina Weibo,YIXIA,2015-11-24,8
Yixia,3.0,24-11-2015,China,Beijing,Mobile & telecommunications,Kleiner Perkins Caufield & Byers,YIXIA,2015-11-24,8
Yixia,3.0,24-11-2015,China,Beijing,Mobile & telecommunications,Redpoint Ventures,YIXIA,2015-11-24,8
Traveloka,3.0,01-01-2017,Indonesia,Jakarta,Travel,Global Founders Capital,TRAVELOKA,2017-01-01,6
Traveloka,3.0,01-01-2017,Indonesia,Jakarta,Travel,East Ventures,TRAVELOKA,2017-01-01,6
Traveloka,3.0,01-01-2017,Indonesia,Jakarta,Travel,Expedia Inc.,TRAVELOKA,2017-01-01,6
SouChe Holdings,3.0,01-11-2017,China,Hangzhou,E-commerce & direct-to-consumer,Morningside Ventures,SOUCHE HOLDINGS,2017-11-01,6
SouChe Holdings,3.0,01-11-2017,China,Hangzhou,E-commerce & direct-to-consumer,Warburg Pincus,SOUCHE HOLDINGS,2017-11-01,6
SouChe Holdings,3.0,01-11-2017,China,Hangzhou,E-commerce & direct-to-consumer,CreditEase Fintech Investment Fund,SOUCHE HOLDINGS,2017-11-01,6
BGL Group,3.0,24-11-2017,United Kingdom,Peterborough,Fintech,CPP Investment Board,BGL GROUP,2017-11-24,6
Circle,3.0,15-05-2018,United States,Boston,Fintech,General Catalyst,CIRCLE,2018-05-15,5
Circle,3.0,15-05-2018,United States,Boston,Fintech,Digital Currency Group,CIRCLE,2018-05-15,5
Circle,3.0,15-05-2018,United States,Boston,Fintech,Accel,CIRCLE,2018-05-15,5
Zuoyebang,3.0,18-07-2018,China,Beijing,Edtech,Sequoia Capital China,ZUOYEBANG,2018-07-18,5
Zuoyebang,3.0,18-07-2018,China,Beijing,Edtech,Xiang He Capital,ZUOYEBANG,2018-07-18,5
Zuoyebang,3.0,18-07-2018,China,Beijing,Edtech,GGV Capital,ZUOYEBANG,2018-07-18,5
FlixMobility,3.0,18-07-2019,Germany,Munich,Auto & transportation,Holtzbrinck Ventures,FLIXMOBILITY,2019-07-18,4
FlixMobility,3.0,18-07-2019,Germany,Munich,Auto & transportation,Unternehmertum Venture Capital,FLIXMOBILITY,2019-07-18,4
FlixMobility,3.0,18-07-2019,Germany,Munich,Auto & transportation,General Atlantic,FLIXMOBILITY,2019-07-18,4
Wildlife Studios,3.0,05-12-2019,Brazil,Sao Paulo,Other,Benchmark,WILDLIFE STUDIOS,2019-12-05,4
Wildlife Studios,3.0,05-12-2019,Brazil,Sao Paulo,Other,Bessemer Venture Partners,WILDLIFE STUDIOS,2019-12-05,4
ApplyBoard,3.0,05-05-2020,Canada,Kitchener,Edtech,Artiman Ventures,APPLYBOARD,2020-05-05,3
ApplyBoard,3.0,05-05-2020,Canada,Kitchener,Edtech,Plug and Play Ventures,APPLYBOARD,2020-05-05,3
ApplyBoard,3.0,05-05-2020,Canada,Kitchener,Edtech,Anthos Capital,APPLYBOARD,2020-05-05,3
Forter,3.0,19-11-2020,United States,New York,Cybersecurity,Sequoia Capital Israel,FORTER,2020-11-19,3
Forter,3.0,19-11-2020,United States,New York,Cybersecurity,Scale Venture Partners,FORTER,2020-11-19,3
Forter,3.0,19-11-2020,United States,New York,Cybersecurity,Commerce Ventures,FORTER,2020-11-19,3
Calendly,3.0,26-01-2021,United States,Atlanta,Internet software & services,ICONIQ Capital,CALENDLY,2021-01-26,2
Calendly,3.0,26-01-2021,United States,Atlanta,Internet software & services,OpenView Venture Partners,CALENDLY,2021-01-26,2
BlockFi,3.0,11-03-2021,United States,Jersey City,Fintech,ConsenSys Ventures,BLOCKFI,2021-03-11,2
BlockFi,3.0,11-03-2021,United States,Jersey City,Fintech,Valar Ventures,BLOCKFI,2021-03-11,2
BlockFi,3.0,11-03-2021,United States,Jersey City,Fintech,PUC,BLOCKFI,2021-03-11,2
ActiveCampaign,3.0,21-04-2021,United States,Chicago,Internet software & services,Silversmith Capital Partners,ACTIVECAMPAIGN,2021-04-21,2
ActiveCampaign,3.0,21-04-2021,United States,Chicago,Internet software & services,Susquehanna Growth Equity,ACTIVECAMPAIGN,2021-04-21,2
ActiveCampaign,3.0,21-04-2021,United States,Chicago,Internet software & services,Tiger Global Management,ACTIVECAMPAIGN,2021-04-21,2
CMR Surgical,3.0,17-09-2019,United Kingdom,Cambridge,Health,Cambridge Innovation Capital,CMR SURGICAL,2019-09-17,4
CMR Surgical,3.0,17-09-2019,United Kingdom,Cambridge,Health,LGT Capital Partners,CMR SURGICAL,2019-09-17,4
CMR Surgical,3.0,17-09-2019,United Kingdom,Cambridge,Health,Escala Capital,CMR SURGICAL,2019-09-17,4
Lucid Software,3.0,29-06-2021,United States,South Jordan,Internet software & services,Spectrum Equity,LUCID SOFTWARE,2021-06-29,2
Lucid Software,3.0,29-06-2021,United States,South Jordan,Internet software & services,ICONIQ Capital,LUCID SOFTWARE,2021-06-29,2
Lucid Software,3.0,29-06-2021,United States,South Jordan,Internet software & services,Grayhawk Capital,LUCID SOFTWARE,2021-06-29,2
Age of Learning,3.0,03-05-2016,United States,Glendale,Edtech,Iconiq Capital,AGE OF LEARNING,2016-05-03,7
Carbon Health,3.0,21-07-2021,United States,San Francisco,Health,Brookfield Asset Management,CARBON HEALTH,2021-07-21,2
Carbon Health,3.0,21-07-2021,United States,San Francisco,Health,Blackstone,CARBON HEALTH,2021-07-21,2
Carbon Health,3.0,21-07-2021,United States,San Francisco,Health,Data Collective,CARBON HEALTH,2021-07-21,2
Contentful,3.0,28-07-2021,Germany,Berlin,Internet software & services,Balderton Capital,CONTENTFUL,2021-07-28,2
Contentful,3.0,28-07-2021,Germany,Berlin,Internet software & services,General Catalyst,CONTENTFUL,2021-07-28,2
Contentful,3.0,28-07-2021,Germany,Berlin,Internet software & services,Tiger Global Management,CONTENTFUL,2021-07-28,2
LaunchDarkly,3.0,10-08-2021,United States,Oakland,Internet software & services,Uncork Capital,LAUNCHDARKLY,2021-08-10,2
LaunchDarkly,3.0,10-08-2021,United States,Oakland,Internet software & services,Threshold Ventures,LAUNCHDARKLY,2021-08-10,2
LaunchDarkly,3.0,10-08-2021,United States,Oakland,Internet software & services,Bloomberg Beta,LAUNCHDARKLY,2021-08-10,2
Seismic,3.0,18-12-2018,United States,San Diego,Internet software & services,Jackson Square Ventures,SEISMIC,2018-12-18,5
Seismic,3.0,18-12-2018,United States,San Diego,Internet software & services,General Atlantic,SEISMIC,2018-12-18,5
Seismic,3.0,18-12-2018,United States,San Diego,Internet software & services,Lightspeed Venture Partners,SEISMIC,2018-12-18,5
Sky Mavis,3.0,04-10-2021,Vietnam,Ho Chi Minh City,Internet software & services,Fabric Ventures,SKY MAVIS,2021-10-04,2
Sky Mavis,3.0,04-10-2021,Vietnam,Ho Chi Minh City,Internet software & services,500 Global,SKY MAVIS,2021-10-04,2
Sky Mavis,3.0,04-10-2021,Vietnam,Ho Chi Minh City,Internet software & services,Standard Crypto,SKY MAVIS,2021-10-04,2
Outschool,3.0,14-04-2021,United States,San Francisco,Edtech,Uniion Square Ventures,OUTSCHOOL,2021-04-14,2
Outschool,3.0,14-04-2021,United States,San Francisco,Edtech,Tiger Global Management,OUTSCHOOL,2021-04-14,2
Outschool,3.0,14-04-2021,United States,San Francisco,Edtech,Lightspeed Venture Capital,OUTSCHOOL,2021-04-14,2
TradingView,3.0,14-10-2021,United States,Westerville,Fintech,Tiger Global Management,TRADINGVIEW,2021-10-14,2
TradingView,3.0,14-10-2021,United States,Westerville,Fintech,Insight Partners,TRADINGVIEW,2021-10-14,2
TradingView,3.0,14-10-2021,United States,Westerville,Fintech,Jump Capital,TRADINGVIEW,2021-10-14,2
Groww,3.0,07-04-2021,India,Bengaluru,Fintech,Tiger Global Management,GROWW,2021-04-07,2
Groww,3.0,07-04-2021,India,Bengaluru,Fintech,Sequoia Capital India,GROWW,2021-04-07,2
Groww,3.0,07-04-2021,India,Bengaluru,Fintech,Ribbit Capital,GROWW,2021-04-07,2
Podium,3.0,07-04-2020,United States,Lehi,Internet software & services,Accel,PODIUM,2020-04-07,3
Podium,3.0,07-04-2020,United States,Lehi,Internet software & services,Summit Partners,PODIUM,2020-04-07,3
Podium,3.0,07-04-2020,United States,Lehi,Internet software & services,Google Ventures,PODIUM,2020-04-07,3
Via,3.0,30-03-2020,United States,New York,Auto & transportation,83North,VIA,2020-03-30,3
Via,3.0,30-03-2020,United States,New York,Auto & transportation,RiverPark Ventures,VIA,2020-03-30,3
Via,3.0,30-03-2020,United States,New York,Auto & transportation,Pitango Venture Capital,VIA,2020-03-30,3
Anchorage Digital,3.0,15-12-2021,United States,San Francisco,Fintech,Andreessen Horowitz,ANCHORAGE DIGITAL,2021-12-15,2
Anchorage Digital,3.0,15-12-2021,United States,San Francisco,Fintech,Blockchain Capital,ANCHORAGE DIGITAL,2021-12-15,2
Anchorage Digital,3.0,15-12-2021,United States,San Francisco,Fintech,Lux Capital,ANCHORAGE DIGITAL,2021-12-15,2
Inxeption,3.0,13-01-2022,United States,San Francisco,Fintech,Coatue Management,INXEPTION,2022-01-13,1
Inxeption,3.0,13-01-2022,United States,San Francisco,Fintech,BMO Capital,INXEPTION,2022-01-13,1
Inxeption,3.0,13-01-2022,United States,San Francisco,Fintech,Schonfeld Strategic Advisors,INXEPTION,2022-01-13,1
Lattice,3.0,23-03-2021,United States,San Francisco,Internet software & services,Khosla Ventures,LATTICE,2021-03-23,2
Lattice,3.0,23-03-2021,United States,San Francisco,Internet software & services,Thrive Capital,LATTICE,2021-03-23,2
Lattice,3.0,23-03-2021,United States,San Francisco,Internet software & services,Y Combinator,LATTICE,2021-03-23,2
Flutterwave,3.0,09-03-2021,United States,San Francisco,Fintech,Green Visor Capital,FLUTTERWAVE,2021-03-09,2
Flutterwave,3.0,09-03-2021,United States,San Francisco,Fintech,CRE Venture Capital,FLUTTERWAVE,2021-03-09,2
Flutterwave,3.0,09-03-2021,United States,San Francisco,Fintech,Greycroft,FLUTTERWAVE,2021-03-09,2
Amber Group,3.0,21-06-2021,Hong Kong,Unknown,Fintech,Tiger Global Management,AMBER GROUP,2021-06-21,2
Amber Group,3.0,21-06-2021,Hong Kong,Unknown,Fintech,Tiger Brokers,AMBER GROUP,2021-06-21,2
Amber Group,3.0,21-06-2021,Hong Kong,Unknown,Fintech,DCM Ventures,AMBER GROUP,2021-06-21,2
Cross River Bank,3.0,11-02-2022,United States,Fort Lee,Fintech,Battery Ventures,CROSS RIVER BANK,2022-02-11,1
Cross River Bank,3.0,11-02-2022,United States,Fort Lee,Fintech,Andreessen Horowitz,CROSS RIVER BANK,2022-02-11,1
Cross River Bank,3.0,11-02-2022,United States,Fort Lee,Fintech,Ribbit Capital,CROSS RIVER BANK,2022-02-11,1
Remote,3.0,13-07-2021,United States,San Francisco,Fintech,Index Ventures,REMOTE,2021-07-13,2
Remote,3.0,13-07-2021,United States,San Francisco,Fintech,Sequoia Capital,REMOTE,2021-07-13,2
Remote,3.0,13-07-2021,United States,San Francisco,Fintech,General Catalyst,REMOTE,2021-07-13,2
Sentry,3.0,18-02-2021,United States,San Francisco,Other,New Enterprise Associates,SENTRY,2021-02-18,2
Sentry,3.0,18-02-2021,United States,San Francisco,Other,Accel,SENTRY,2021-02-18,2
Sentry,3.0,18-02-2021,United States,San Francisco,Other,Bond,SENTRY,2021-02-18,2
Kraken,3.0,25-06-2019,United States,San Francisco,Fintech,Bnk To The Future,KRAKEN,2019-06-25,4
Kraken,3.0,25-06-2019,United States,San Francisco,Fintech,Trammell Ventures,KRAKEN,2019-06-25,4
Kraken,3.0,25-06-2019,United States,San Francisco,Fintech,SBI Investment,KRAKEN,2019-06-25,4
Workrise,3.0,30-09-2019,United States,Austin,Internet software & services,Founders Fund,WORKRISE,2019-09-30,4
Workrise,3.0,30-09-2019,United States,Austin,Internet software & services,Quantum Energy Partners,WORKRISE,2019-09-30,4
Workrise,3.0,30-09-2019,United States,Austin,Internet software & services,Bedrock Capital,WORKRISE,2019-09-30,4
Loft,3.0,03-01-2020,Brazil,Sao Paulo,E-commerce & direct-to-consumer,Monashees+,LOFT,2020-01-03,3
Loft,3.0,03-01-2020,Brazil,Sao Paulo,E-commerce & direct-to-consumer,Andreessen Horowitz,LOFT,2020-01-03,3
Loft,3.0,03-01-2020,Brazil,Sao Paulo,E-commerce & direct-to-consumer,QED Investors,LOFT,2020-01-03,3
BharatPe,3.0,30-07-2021,India,New Delhi,Fintech,Insight Partners,BHARATPE,2021-07-30,2
BharatPe,3.0,30-07-2021,India,New Delhi,Fintech,Sequoia Capital India,BHARATPE,2021-07-30,2
BharatPe,3.0,30-07-2021,India,New Delhi,Fintech,BEENEXT,BHARATPE,2021-07-30,2
Gokin Solar,3.0,13-04-2022,China,Zhuhai,Other,IDG Capital,GOKIN SOLAR,2022-04-13,1
Gokin Solar,3.0,13-04-2022,China,Zhuhai,Other,Puluo Capital,GOKIN SOLAR,2022-04-13,1
Gokin Solar,3.0,13-04-2022,China,Zhuhai,Other,Midea Capital,GOKIN SOLAR,2022-04-13,1
DriveWealth,3.0,20-08-2021,United States,Chatham,Fintech,Point72 Ventures,DRIVEWEALTH,2021-08-20,2
DriveWealth,3.0,20-08-2021,United States,Chatham,Fintech,Route 66 Ventures,DRIVEWEALTH,2021-08-20,2
DriveWealth,3.0,20-08-2021,United States,Chatham,Fintech,Accel,DRIVEWEALTH,2021-08-20,2
Alan,3.0,19-04-2021,France,Paris,Fintech,Index Ventures,ALAN,2021-04-19,2
Alan,3.0,19-04-2021,France,Paris,Fintech,Temasek,ALAN,2021-04-19,2
Alan,3.0,19-04-2021,France,Paris,Fintech,Portag3 Ventures,ALAN,2021-04-19,2
Meicai,3.0,22-06-2016,China,Beijing,Mobile & telecommunications,Tiger Global Management,MEICAI,2016-06-22,7
Meicai,3.0,22-06-2016,China,Beijing,Mobile & telecommunications,Blue Lake Capital,MEICAI,2016-06-22,7
Meicai,3.0,22-06-2016,China,Beijing,Mobile & telecommunications,ZhenFund,MEICAI,2016-06-22,7
Zipline,3.0,20-05-2019,United States,South San Francisco,"Supply chain, logistics, & delivery",Sequoia Capital,ZIPLINE,2019-05-20,4
Zipline,3.0,20-05-2019,United States,South San Francisco,"Supply chain, logistics, & delivery",Baillie Gifford & Co.,ZIPLINE,2019-05-20,4
Zipline,3.0,20-05-2019,United States,South San Francisco,"Supply chain, logistics, & delivery",Google Ventures,ZIPLINE,2019-05-20,4
Nutrabolt,3.0,08-12-2022,United States,Austin,Consumer & retail,MidOcean Partners,NUTRABOLT,2022-12-08,1
Graphcore,3.0,18-12-2018,United Kingdom,Bristol,Artificial intelligence,Dell Technologies Capital,GRAPHCORE,2018-12-18,5
Graphcore,3.0,18-12-2018,United Kingdom,Bristol,Artificial intelligence,Pitango Venture Capital,GRAPHCORE,2018-12-18,5
Graphcore,3.0,18-12-2018,United Kingdom,Bristol,Artificial intelligence,Amadeus Capital Partners,GRAPHCORE,2018-12-18,5
Illumio,3.0,14-04-2015,United States,Sunnyvale,Cybersecurity,Data Collective,ILLUMIO,2015-04-14,8
Illumio,3.0,14-04-2015,United States,Sunnyvale,Cybersecurity,Formation 8,ILLUMIO,2015-04-14,8
Illumio,3.0,14-04-2015,United States,Sunnyvale,Cybersecurity,General Catalyst Partners,ILLUMIO,2015-04-14,8
MasterClass,3.0,13-05-2021,United States,San Francisco,Edtech,Institutional Venture Partners,MASTERCLASS,2021-05-13,2
MasterClass,3.0,13-05-2021,United States,San Francisco,Edtech,New Enterprise Associates,MASTERCLASS,2021-05-13,2
MasterClass,3.0,13-05-2021,United States,San Francisco,Edtech,Javelin Venture Partners,MASTERCLASS,2021-05-13,2
Dream Games,3.0,30-06-2021,Turkey,Istanbul,Mobile & telecommunications,Makers Fund,DREAM GAMES,2021-06-30,2
Dream Games,3.0,30-06-2021,Turkey,Istanbul,Mobile & telecommunications,Index Ventures,DREAM GAMES,2021-06-30,2
Dream Games,3.0,30-06-2021,Turkey,Istanbul,Mobile & telecommunications,Inova Ventures Participacees,DREAM GAMES,2021-06-30,2
Transmit Security,3.0,22-06-2021,Israel,Tel Aviv,Cybersecurity,General Atlantic,TRANSMIT SECURITY,2021-06-22,2
Transmit Security,3.0,22-06-2021,Israel,Tel Aviv,Cybersecurity,Insight Partners,TRANSMIT SECURITY,2021-06-22,2
Transmit Security,3.0,22-06-2021,Israel,Tel Aviv,Cybersecurity,Vintage Investment Partners,TRANSMIT SECURITY,2021-06-22,2
Hozon Auto,3.0,22-02-2022,China,Shanghai,Auto & transportation,HD Capital,HOZON AUTO,2022-02-22,1
Hozon Auto,3.0,22-02-2022,China,Shanghai,Auto & transportation,Qihoo 360 Technology,HOZON AUTO,2022-02-22,1
Hozon Auto,3.0,22-02-2022,China,Shanghai,Auto & transportation,China Fortune Land Development,HOZON AUTO,2022-02-22,1
Tradeshift,3.0,30-05-2018,United States,San Francisco,Fintech,Notion Capital,TRADESHIFT,2018-05-30,5
Tradeshift,3.0,30-05-2018,United States,San Francisco,Fintech,Scentan Ventures,TRADESHIFT,2018-05-30,5
Tradeshift,3.0,30-05-2018,United States,San Francisco,Fintech,Kite Ventures,TRADESHIFT,2018-05-30,5
Nextiva,3.0,14-09-2021,United States,Scottsdale,Internet software & services,Goldman Sachs Asset Management,NEXTIVA,2021-09-14,2
Tridge,3.0,24-08-2022,South Korea,Seoul,Internet software & services,Forest Partners,TRIDGE,2022-08-24,1
Tridge,3.0,24-08-2022,South Korea,Seoul,Internet software & services,Softbank Ventures Asia,TRIDGE,2022-08-24,1
o9 Solutions,3.0,28-04-2020,United States,Dallas,Artificial intelligence,KKR,O9 SOLUTIONS,2020-04-28,3
Thought Machine,3.0,29-11-2021,United Kingdom,London,Fintech,British Patient Capital,THOUGHT MACHINE,2021-11-29,2
Thought Machine,3.0,29-11-2021,United Kingdom,London,Fintech,SEB Venture Capital,THOUGHT MACHINE,2021-11-29,2
Thought Machine,3.0,29-11-2021,United Kingdom,London,Fintech,IQ Capital,THOUGHT MACHINE,2021-11-29,2
Starling Bank,3.0,08-03-2021,United Kingdom,London,Fintech,JTC Group,STARLING BANK,2021-03-08,2
Starling Bank,3.0,08-03-2021,United Kingdom,London,Fintech,Qatar Investment Authority,STARLING BANK,2021-03-08,2
Starling Bank,3.0,08-03-2021,United Kingdom,London,Fintech,Fidelity Investment,STARLING BANK,2021-03-08,2
BackBase,3.0,09-06-2022,Netherlands,Amsterdam,Fintech,Motive Partners,BACKBASE,2022-06-09,1
ManoMano,3.0,05-07-2021,France,Paris,E-commerce & direct-to-consumer,General Atlantic,MANOMANO,2021-07-05,2
ManoMano,3.0,05-07-2021,France,Paris,E-commerce & direct-to-consumer,Piton Capital,MANOMANO,2021-07-05,2
ManoMano,3.0,05-07-2021,France,Paris,E-commerce & direct-to-consumer,Partech Partners,MANOMANO,2021-07-05,2
Sourcegraph,3.0,13-07-2021,United States,San Francisco,Internet software & services,Redpoint Ventures,SOURCEGRAPH,2021-07-13,2
Sourcegraph,3.0,13-07-2021,United States,San Francisco,Internet software & services,Goldcrest Capital,SOURCEGRAPH,2021-07-13,2
Sourcegraph,3.0,13-07-2021,United States,San Francisco,Internet software & services,Insight Partners,SOURCEGRAPH,2021-07-13,2
Pendo,3.0,17-10-2019,United States,Raleigh,Internet software & services,Contour Venture Partners,PENDO,2019-10-17,4
Pendo,3.0,17-10-2019,United States,Raleigh,Internet software & services,Battery Ventures,PENDO,2019-10-17,4
Pendo,3.0,17-10-2019,United States,Raleigh,Internet software & services,Core Capital Partners,PENDO,2019-10-17,4
Plume,3.0,23-02-2021,United States,Palo Alto,Internet software & services,Insight Partners,PLUME,2021-02-23,2
Plume,3.0,23-02-2021,United States,Palo Alto,Internet software & services,Jackson Square Ventures,PLUME,2021-02-23,2
Plume,3.0,23-02-2021,United States,Palo Alto,Internet software & services,Liberty Gloval Ventures,PLUME,2021-02-23,2
Moglix,3.0,17-05-2021,Singapore,Unknown,E-commerce & direct-to-consumer,Jungle Ventures,MOGLIX,2021-05-17,2
Moglix,3.0,17-05-2021,Singapore,Unknown,E-commerce & direct-to-consumer,Accel,MOGLIX,2021-05-17,2
Moglix,3.0,17-05-2021,Singapore,Unknown,E-commerce & direct-to-consumer,Venture Highway,MOGLIX,2021-05-17,2
Axonius,3.0,01-03-2021,United States,New York,Cybersecurity,Vertex Ventures Israel,AXONIUS,2021-03-01,2
Axonius,3.0,01-03-2021,United States,New York,Cybersecurity,Bessemer Venture Partners,AXONIUS,2021-03-01,2
Axonius,3.0,01-03-2021,United States,New York,Cybersecurity,Emerge,AXONIUS,2021-03-01,2
Xinchao Media,3.0,09-04-2018,China,Chengdu,Internet software & services,JD.com,XINCHAO MEDIA,2018-04-09,5
Xinchao Media,3.0,09-04-2018,China,Chengdu,Internet software & services,Baidu,XINCHAO MEDIA,2018-04-09,5
Xinchao Media,3.0,09-04-2018,China,Chengdu,Internet software & services,Vision Plus Capital,XINCHAO MEDIA,2018-04-09,5
JumpCloud,3.0,13-09-2021,United States,Louisville,Data management & analytics,Foundry Group,JUMPCLOUD,2021-09-13,2
JumpCloud,3.0,13-09-2021,United States,Louisville,Data management & analytics,General Atlantic,JUMPCLOUD,2021-09-13,2
JumpCloud,3.0,13-09-2021,United States,Louisville,Data management & analytics,BlackRock,JUMPCLOUD,2021-09-13,2
Unico,3.0,03-08-2021,Brazil,Sao Paulo,Artificial intelligence,Big Bets,UNICO,2021-08-03,2
Unico,3.0,03-08-2021,Brazil,Sao Paulo,Artificial intelligence,General Atlantic,UNICO,2021-08-03,2
Unico,3.0,03-08-2021,Brazil,Sao Paulo,Artificial intelligence,SOFTBANK Latin America Ventures,UNICO,2021-08-03,2
Oura,3.0,05-04-2022,Finland,Oulu,Health,Forerunner Ventures,OURA,2022-04-05,1
Oura,3.0,05-04-2022,Finland,Oulu,Health,Lifeline Ventures,OURA,2022-04-05,1
Oura,3.0,05-04-2022,Finland,Oulu,Health,MSD Capital,OURA,2022-04-05,1
Eat Just,3.0,30-11-2017,United States,San Francisco,Consumer & retail,Khosla Ventures,EAT JUST,2017-11-30,6
Eat Just,3.0,30-11-2017,United States,San Francisco,Consumer & retail,Horizons Ventures,EAT JUST,2017-11-30,6
Eat Just,3.0,30-11-2017,United States,San Francisco,Consumer & retail,Founders Fund,EAT JUST,2017-11-30,6
Cribl,3.0,25-08-2021,United States,San Francisco,Data management & analytics,Institutional Venture Partners,CRIBL,2021-08-25,2
Cribl,3.0,25-08-2021,United States,San Francisco,Data management & analytics,CRV,CRIBL,2021-08-25,2
Cribl,3.0,25-08-2021,United States,San Francisco,Data management & analytics,Sequoia Capital,CRIBL,2021-08-25,2
Jetti Resources,3.0,24-10-2022,United States,Boulder,Other,BMW i Ventures,JETTI RESOURCES,2022-10-24,1
Jetti Resources,3.0,24-10-2022,United States,Boulder,Other,BHP Ventures,JETTI RESOURCES,2022-10-24,1
Vista Global,2.0,23-08-2017,United Arab Emirates,Dubai,Other,Rhone Capital,VISTA GLOBAL,2017-08-23,6
BYTON,2.0,20-04-2018,China,Nanjing,Auto & transportation,FAW Group,BYTON,2018-04-20,5
BYTON,2.0,20-04-2018,China,Nanjing,Auto & transportation,Tencent Holdings,BYTON,2018-04-20,5
BYTON,2.0,20-04-2018,China,Nanjing,Auto & transportation,Tus Holdings,BYTON,2018-04-20,5
Side,2.0,22-03-2021,United States,San Francisco,Internet software & services,Coatue Managemeny,SIDE,2021-03-22,2
Side,2.0,22-03-2021,United States,San Francisco,Internet software & services,Trinity Ventures,SIDE,2021-03-22,2
Side,2.0,22-03-2021,United States,San Francisco,Internet software & services,Matrix Partners,SIDE,2021-03-22,2
Infra.Market,2.0,25-02-2021,India,Thane,E-commerce & direct-to-consumer,Accel,INFRA.MARKET,2021-02-25,2
Infra.Market,2.0,25-02-2021,India,Thane,E-commerce & direct-to-consumer,Tiger Global Management,INFRA.MARKET,2021-02-25,2
Infra.Market,2.0,25-02-2021,India,Thane,E-commerce & direct-to-consumer,Nexus Venture Partners,INFRA.MARKET,2021-02-25,2
Varo Bank,2.0,09-09-2021,United States,San Francisco,Fintech,Warburg Pincus,VARO BANK,2021-09-09,2
Varo Bank,2.0,09-09-2021,United States,San Francisco,Fintech,The Rise Fund,VARO BANK,2021-09-09,2
Varo Bank,2.0,09-09-2021,United States,San Francisco,Fintech,HarbourVest Partners,VARO BANK,2021-09-09,2
Cato Networks,2.0,17-11-2020,Israel,Tel Aviv,Cybersecurity,Aspect Ventures,CATO NETWORKS,2020-11-17,3
Cato Networks,2.0,17-11-2020,Israel,Tel Aviv,Cybersecurity,SingTel Innov8,CATO NETWORKS,2020-11-17,3
Cato Networks,2.0,17-11-2020,Israel,Tel Aviv,Cybersecurity,Greylock Partners,CATO NETWORKS,2020-11-17,3
Aura,2.0,09-06-2021,United States,Burlington,Cybersecurity,Warburg Pincus,AURA,2021-06-09,2
Aura,2.0,09-06-2021,United States,Burlington,Cybersecurity,General Catalyst,AURA,2021-06-09,2
Vercel,2.0,23-06-2021,United States,San Francisco,Internet software & services,CRV,VERCEL,2021-06-23,2
Vercel,2.0,23-06-2021,United States,San Francisco,Internet software & services,Accel,VERCEL,2021-06-23,2
Vercel,2.0,23-06-2021,United States,San Francisco,Internet software & services,Google Ventures,VERCEL,2021-06-23,2
Sysdig,2.0,28-04-2021,United States,San Francisco,Cybersecurity,Accel,SYSDIG,2021-04-28,2
Sysdig,2.0,28-04-2021,United States,San Francisco,Cybersecurity,Bain Capital Ventures,SYSDIG,2021-04-28,2
Sysdig,2.0,28-04-2021,United States,San Francisco,Cybersecurity,Insight Partners,SYSDIG,2021-04-28,2
Zetwerk,2.0,20-08-2021,India,Bengaluru,Internet software & services,Sequoia Capital India,ZETWERK,2021-08-20,2
Zetwerk,2.0,20-08-2021,India,Bengaluru,Internet software & services,Kae Capital,ZETWERK,2021-08-20,2
Zetwerk,2.0,20-08-2021,India,Bengaluru,Internet software & services,Accel,ZETWERK,2021-08-20,2
Uniphore,2.0,16-02-2022,United States,Palo Alto,Artificial Intelligence,Chiratae Ventures,UNIPHORE,2022-02-16,1
Uniphore,2.0,16-02-2022,United States,Palo Alto,Artificial Intelligence,March Capital Partners,UNIPHORE,2022-02-16,1
Uniphore,2.0,16-02-2022,United States,Palo Alto,Artificial Intelligence,National Grid Partners,UNIPHORE,2022-02-16,1
Somatus,2.0,23-02-2022,United States,McLean,Health,The Blue Venture Fund,SOMATUS,2022-02-23,1
Somatus,2.0,23-02-2022,United States,McLean,Health,Flare Capital Partners,SOMATUS,2022-02-23,1
Somatus,2.0,23-02-2022,United States,McLean,Health,Longitude Capital,SOMATUS,2022-02-23,1
Immutable,2.0,07-03-2022,Australia,Sydney,Fintech,Fabric Ventures,IMMUTABLE,2022-03-07,1
Immutable,2.0,07-03-2022,Australia,Sydney,Fintech,AirTree Ventures,IMMUTABLE,2022-03-07,1
Immutable,2.0,07-03-2022,Australia,Sydney,Fintech,Temasek,IMMUTABLE,2022-03-07,1
A24 Films,2.0,09-03-2022,United States,New York,Other,Stripes Group,A24 FILMS,2022-03-09,1
A24 Films,2.0,09-03-2022,United States,New York,Other,Neuberger Berman,A24 FILMS,2022-03-09,1
SiFive,2.0,16-03-2022,United States,San Mateo,Hardware,Sutter Hill Ventures,SIFIVE,2022-03-16,1
SiFive,2.0,16-03-2022,United States,San Mateo,Hardware,Osage University Partners,SIFIVE,2022-03-16,1
SiFive,2.0,16-03-2022,United States,San Mateo,Hardware,Spark Capital,SIFIVE,2022-03-16,1
Games24x7,2.0,30-03-2022,India,Mumbai,Internet software & services,Tiger Global Management,GAMES24X7,2022-03-30,1
Games24x7,2.0,30-03-2022,India,Mumbai,Internet software & services,The Raine Group,GAMES24X7,2022-03-30,1
Games24x7,2.0,30-03-2022,India,Mumbai,Internet software & services,Malabar Investments,GAMES24X7,2022-03-30,1
Fetch Rewards,2.0,31-03-2021,United States,Madison,E-commerce & direct-to-consumer,Greycroft,FETCH REWARDS,2021-03-31,2
Fetch Rewards,2.0,31-03-2021,United States,Madison,E-commerce & direct-to-consumer,Loeb.NYC,FETCH REWARDS,2021-03-31,2
Fetch Rewards,2.0,31-03-2021,United States,Madison,E-commerce & direct-to-consumer,DST Global,FETCH REWARDS,2021-03-31,2
Coda Payments,2.0,15-04-2022,Singapore,Unknown,Fintech,GIC. Apis Partners,CODA PAYMENTS,2022-04-15,1
Coda Payments,2.0,15-04-2022,Singapore,Unknown,Fintech,Insight Partners,CODA PAYMENTS,2022-04-15,1
DriveNets,2.0,27-01-2021,Israel,Ra'anana,Internet software & services,Bessemer Venture Partners,DRIVENETS,2021-01-27,2
DriveNets,2.0,27-01-2021,Israel,Ra'anana,Internet software & services,Pitango Venture Capital,DRIVENETS,2021-01-27,2
DriveNets,2.0,27-01-2021,Israel,Ra'anana,Internet software & services,D1 Capital Partners,DRIVENETS,2021-01-27,2
Hibob,2.0,12-10-2021,Israel,Tel Aviv,Internet software & services,Bessemer Venture Partners,HIBOB,2021-10-12,2
Hibob,2.0,12-10-2021,Israel,Tel Aviv,Internet software & services,Eight Roads Ventures,HIBOB,2021-10-12,2
Hibob,2.0,12-10-2021,Israel,Tel Aviv,Internet software & services,Battery Ventures,HIBOB,2021-10-12,2
Uala,2.0,13-08-2021,Argentina,Buenos Aires,Fintech,Soros Fund Management,UALA,2021-08-13,2
Uala,2.0,13-08-2021,Argentina,Buenos Aires,Fintech,Ribbit Capital,UALA,2021-08-13,2
Uala,2.0,13-08-2021,Argentina,Buenos Aires,Fintech,Monashees+,UALA,2021-08-13,2
Mobile Premier League,2.0,15-09-2021,India,Bengaluru,Internet software & services,Sequoia Capital India,MOBILE PREMIER LEAGUE,2021-09-15,2
Mobile Premier League,2.0,15-09-2021,India,Bengaluru,Internet software & services,RTP Global,MOBILE PREMIER LEAGUE,2021-09-15,2
Mobile Premier League,2.0,15-09-2021,India,Bengaluru,Internet software & services,Go-Ventures,MOBILE PREMIER LEAGUE,2021-09-15,2
Cybereason,2.0,06-08-2019,United States,Boston,Cybersecurity,SoftBank Group,CYBEREASON,2019-08-06,4
Cybereason,2.0,06-08-2019,United States,Boston,Cybersecurity,CRV,CYBEREASON,2019-08-06,4
Cybereason,2.0,06-08-2019,United States,Boston,Cybersecurity,Spark Capital,CYBEREASON,2019-08-06,4
Cgtz,2.0,21-02-2017,China,Hangzhou,Fintech,Shunwei Capital Partners,CGTZ,2017-02-21,6
Cgtz,2.0,21-02-2017,China,Hangzhou,Fintech,China Media Group,CGTZ,2017-02-21,6
Cgtz,2.0,21-02-2017,China,Hangzhou,Fintech,Guangzhou Huiyin Aofeng Equity Investment Fund,CGTZ,2017-02-21,6
Star Charge,2.0,19-05-2021,China,Changzhou,Auto & transportation,Shunwei Capital Partners,STAR CHARGE,2021-05-19,2
Star Charge,2.0,19-05-2021,China,Changzhou,Auto & transportation,China Media Group,STAR CHARGE,2021-05-19,2
Star Charge,2.0,19-05-2021,China,Changzhou,Auto & transportation,Guangzhou Huiyin Aofeng Equity Investment Fund,STAR CHARGE,2021-05-19,2
EquipmentShare,2.0,01-05-2020,United States,Columbia,Fintech,Romulus Capital,EQUIPMENTSHARE,2020-05-01,3
EquipmentShare,2.0,01-05-2020,United States,Columbia,Fintech,Insight Partners,EQUIPMENTSHARE,2020-05-01,3
EquipmentShare,2.0,01-05-2020,United States,Columbia,Fintech,RedBird Capital Partners,EQUIPMENTSHARE,2020-05-01,3
Carbon,2.0,20-08-2015,United States,Redwood City,Hardware,Google Ventures,CARBON,2015-08-20,8
Carbon,2.0,20-08-2015,United States,Redwood City,Hardware,Sequoia Capital,CARBON,2015-08-20,8
Carbon,2.0,20-08-2015,United States,Redwood City,Hardware,Wakefield Group,CARBON,2015-08-20,8
Rokt,2.0,16-12-2021,United States,New York,Internet software & services,Square Peg Capital,ROKT,2021-12-16,2
Rokt,2.0,16-12-2021,United States,New York,Internet software & services,TDM Growth Partners,ROKT,2021-12-16,2
Rokt,2.0,16-12-2021,United States,New York,Internet software & services,Tiger Global Management,ROKT,2021-12-16,2
PolicyBazaar,2.0,06-05-2019,India,Gurgaon,Fintech,Info Edge,POLICYBAZAAR,2019-05-06,4
PolicyBazaar,2.0,06-05-2019,India,Gurgaon,Fintech,Softbank Capital,POLICYBAZAAR,2019-05-06,4
Paxos,2.0,29-04-2021,United States,New York,Fintech,Liberty City Ventures,PAXOS,2021-04-29,2
Paxos,2.0,29-04-2021,United States,New York,Fintech,RRE Ventures,PAXOS,2021-04-29,2
Paxos,2.0,29-04-2021,United States,New York,Fintech,Mithril Capital Management,PAXOS,2021-04-29,2
Exabeam,2.0,01-06-2021,United States,Foster City,Cybersecurity,Norwest Venture Partners,EXABEAM,2021-06-01,2
Exabeam,2.0,01-06-2021,United States,Foster City,Cybersecurity,Aspect Ventures,EXABEAM,2021-06-01,2
Exabeam,2.0,01-06-2021,United States,Foster City,Cybersecurity,Lightspeed Venture Partners,EXABEAM,2021-06-01,2
BitSight Technologies,2.0,13-09-2021,United States,Boston,Cybersecurity,Menlo Ventures,BITSIGHT TECHNOLOGIES,2021-09-13,2
BitSight Technologies,2.0,13-09-2021,United States,Boston,Cybersecurity,GGV Capital,BITSIGHT TECHNOLOGIES,2021-09-13,2
BitSight Technologies,2.0,13-09-2021,United States,Boston,Cybersecurity,Flybridge Capital Partners,BITSIGHT TECHNOLOGIES,2021-09-13,2
Trumid,2.0,15-07-2020,United States,New York,Fintech,T. Rowe Price,TRUMID,2020-07-15,3
Trumid,2.0,15-07-2020,United States,New York,Fintech,Dragoneer Investment Group,TRUMID,2020-07-15,3
Trumid,2.0,15-07-2020,United States,New York,Fintech,BlackRock,TRUMID,2020-07-15,3
ABL Space Systems,2.0,25-03-2021,United States,El Segundo,Other,T. Rowe Price,ABL SPACE SYSTEMS,2021-03-25,2
ABL Space Systems,2.0,25-03-2021,United States,El Segundo,Other,Lockheed Martin Ventures,ABL SPACE SYSTEMS,2021-03-25,2
ABL Space Systems,2.0,25-03-2021,United States,El Segundo,Other,Fidelity Investment,ABL SPACE SYSTEMS,2021-03-25,2
HoneyBook,2.0,04-05-2021,United States,San Francisco,Internet software & services,Norwest Venture Partners,HONEYBOOK,2021-05-04,2
HoneyBook,2.0,04-05-2021,United States,San Francisco,Internet software & services,Hillsven Capital,HONEYBOOK,2021-05-04,2
HoneyBook,2.0,04-05-2021,United States,San Francisco,Internet software & services,Aleph,HONEYBOOK,2021-05-04,2
Beta Technologies,2.0,19-04-2022,United States,South Burlington,Other,The Rise Fund,BETA TECHNOLOGIES,2022-04-19,1
Beta Technologies,2.0,19-04-2022,United States,South Burlington,Other,Fidelity Investments. RedBird Capital Partners,BETA TECHNOLOGIES,2022-04-19,1
Project44,2.0,01-06-2021,United States,Chicago,"Supply chain, logistics, & delivery",Emergence Capital Partners,PROJECT44,2021-06-01,2
Project44,2.0,01-06-2021,United States,Chicago,"Supply chain, logistics, & delivery",8VC,PROJECT44,2021-06-01,2
Project44,2.0,01-06-2021,United States,Chicago,"Supply chain, logistics, & delivery",Chicago Ventures,PROJECT44,2021-06-01,2
Freenome,2.0,26-08-2020,United States,South San Francisco,Health,Andreessen Horowitz,FREENOME,2020-08-26,3
Freenome,2.0,26-08-2020,United States,South San Francisco,Health,Data Collective,FREENOME,2020-08-26,3
Freenome,2.0,26-08-2020,United States,South San Francisco,Health,Roche Venture Fund,FREENOME,2020-08-26,3
ManyPets,2.0,01-06-2021,United Kingdom,London,Fintech,Octopus Ventures,MANYPETS,2021-06-01,2
ManyPets,2.0,01-06-2021,United Kingdom,London,Fintech,Munich Re Ventures,MANYPETS,2021-06-01,2
ManyPets,2.0,01-06-2021,United Kingdom,London,Fintech,CommerzVentures,MANYPETS,2021-06-01,2
Jobandtalent,2.0,01-12-2021,Spain,Madrid,Internet software & services,Kibo Ventures,JOBANDTALENT,2021-12-01,2
Jobandtalent,2.0,01-12-2021,Spain,Madrid,Internet software & services,SoftBank Group,JOBANDTALENT,2021-12-01,2
Jobandtalent,2.0,01-12-2021,Spain,Madrid,Internet software & services,Atomico,JOBANDTALENT,2021-12-01,2
WEMAKEPRICE,2.0,09-09-2015,South Korea,Seoul,E-commerce & direct-to-consumer,IMM Investment,WEMAKEPRICE,2015-09-09,8
WEMAKEPRICE,2.0,09-09-2015,South Korea,Seoul,E-commerce & direct-to-consumer,NXC,WEMAKEPRICE,2015-09-09,8
Biren Technology,2.0,18-08-2020,China,Shanghai,Hardware,V FUND,BIREN TECHNOLOGY,2020-08-18,3
Biren Technology,2.0,18-08-2020,China,Shanghai,Hardware,IDG Capital,BIREN TECHNOLOGY,2020-08-18,3
Biren Technology,2.0,18-08-2020,China,Shanghai,Hardware,Green Pine Capital Partners,BIREN TECHNOLOGY,2020-08-18,3
Voodoo,2.0,17-08-2020,France,Paris,Other,Tencent Holdings,VOODOO,2020-08-17,3
Voodoo,2.0,17-08-2020,France,Paris,Other,Goldman Sachs,VOODOO,2020-08-17,3
Shield AI,2.0,24-08-2021,United States,San Diego,Artificial intelligence,Andreessen Horowitz,SHIELD AI,2021-08-24,2
Shield AI,2.0,24-08-2021,United States,San Diego,Artificial intelligence,Homebrew,SHIELD AI,2021-08-24,2
Shield AI,2.0,24-08-2021,United States,San Diego,Artificial intelligence,Point72 Ventures,SHIELD AI,2021-08-24,2
Uptake,2.0,27-10-2015,United States,Chicago,Artificial intelligence,Revolution,UPTAKE,2015-10-27,8
Uptake,2.0,27-10-2015,United States,Chicago,Artificial intelligence,New Enterprise Associates,UPTAKE,2015-10-27,8
Uptake,2.0,27-10-2015,United States,Chicago,Artificial intelligence,Caterpillar,UPTAKE,2015-10-27,8
Motive,2.0,23-04-2019,United States,San Francisco,"Supply chain, logistics, & delivery",Google Ventures,MOTIVE,2019-04-23,4
Motive,2.0,23-04-2019,United States,San Francisco,"Supply chain, logistics, & delivery",Index Ventures,MOTIVE,2019-04-23,4
Motive,2.0,23-04-2019,United States,San Francisco,"Supply chain, logistics, & delivery",Scale Venture Partners,MOTIVE,2019-04-23,4
Greenlight,2.0,24-09-2020,United States,Atlanta,Fintech,Relay Ventures,GREENLIGHT,2020-09-24,3
Greenlight,2.0,24-09-2020,United States,Atlanta,Fintech,TTV Capital,GREENLIGHT,2020-09-24,3
Greenlight,2.0,24-09-2020,United States,Atlanta,Fintech,Canapi Ventures,GREENLIGHT,2020-09-24,3
Bowery Farming,2.0,25-05-2021,United States,New York,Other,Temasek,BOWERY FARMING,2021-05-25,2
Bowery Farming,2.0,25-05-2021,United States,New York,Other,Google Ventures,BOWERY FARMING,2021-05-25,2
Bowery Farming,2.0,25-05-2021,United States,New York,Other,General Catalyst,BOWERY FARMING,2021-05-25,2
MoMo,2.0,10-12-2021,Vietnam,Ho Chi Minh City,Fintech,Goodwater Capital,MOMO,2021-12-10,2
MoMo,2.0,10-12-2021,Vietnam,Ho Chi Minh City,Fintech,Warburg Pincus,MOMO,2021-12-10,2
MoMo,2.0,10-12-2021,Vietnam,Ho Chi Minh City,Fintech,GS Growth,MOMO,2021-12-10,2
Zume,2.0,01-11-2018,United States,Mountain View,Consumer & retail,Softbank Group,ZUME,2018-11-01,5
Zume,2.0,01-11-2018,United States,Mountain View,Consumer & retail,AME Cloud Ventures,ZUME,2018-11-01,5
Zume,2.0,01-11-2018,United States,Mountain View,Consumer & retail,SignalFire,ZUME,2018-11-01,5
Algolia,2.0,28-07-2021,United States,San Francisco,Internet software & services,Accel,ALGOLIA,2021-07-28,2
Algolia,2.0,28-07-2021,United States,San Francisco,Internet software & services,Alven Capital,ALGOLIA,2021-07-28,2
Algolia,2.0,28-07-2021,United States,San Francisco,Internet software & services,Storm Ventures,ALGOLIA,2021-07-28,2
Pattern,2.0,06-10-2021,United States,Lehi,Internet software & services,Knox Lane,PATTERN,2021-10-06,2
Pattern,2.0,06-10-2021,United States,Lehi,Internet software & services,Ainge Advisory,PATTERN,2021-10-06,2
Pattern,2.0,06-10-2021,United States,Lehi,Internet software & services,Carlson Private Capital Partners,PATTERN,2021-10-06,2
Newfront Insurance,2.0,12-04-2022,United States,San Francisco,Fintech,Founders Fund,NEWFRONT INSURANCE,2022-04-12,1
Newfront Insurance,2.0,12-04-2022,United States,San Francisco,Fintech,Meritech Capital Partners,NEWFRONT INSURANCE,2022-04-12,1
Newfront Insurance,2.0,12-04-2022,United States,San Francisco,Fintech,GS Growth,NEWFRONT INSURANCE,2022-04-12,1
NuCom Group,2.0,22-02-2018,Germany,Unterfoehring,Other,General Atlantic,NUCOM GROUP,2018-02-22,5
Skydio,2.0,25-02-2021,United States,Redwood City,"Supply chain, logistics, & delivery",Andreessen Horowitz,SKYDIO,2021-02-25,2
Skydio,2.0,25-02-2021,United States,Redwood City,"Supply chain, logistics, & delivery",Andreessen Horowitz,SKYDIO,2021-02-25,2
Skydio,2.0,25-02-2021,United States,Redwood City,"Supply chain, logistics, & delivery",Institutional Venture Partners,SKYDIO,2021-02-25,2
Skydio,2.0,25-02-2021,United States,Redwood City,"Supply chain, logistics, & delivery",Accel,SKYDIO,2021-02-25,2
MUSINSA,2.0,11-11-2019,South Korea,Seoul,E-commerce & direct-to-consumer,Sequoia Capital,MUSINSA,2019-11-11,4
Current,2.0,27-04-2021,United States,New York,Fintech,Expa,CURRENT,2021-04-27,2
Current,2.0,27-04-2021,United States,New York,Fintech,QED Investors,CURRENT,2021-04-27,2
Current,2.0,27-04-2021,United States,New York,Fintech,Foundation Capital,CURRENT,2021-04-27,2
Bitso,2.0,05-05-2021,Mexico,Mexico City,Fintech,Pantera Capital,BITSO,2021-05-05,2
Bitso,2.0,05-05-2021,Mexico,Mexico City,Fintech,QED Investors,BITSO,2021-05-05,2
Bitso,2.0,05-05-2021,Mexico,Mexico City,Fintech,Coinbase Ventures,BITSO,2021-05-05,2
Gympass,2.0,12-06-2019,United States,New York,Internet software & services,General Atlantic,GYMPASS,2019-06-12,4
Gympass,2.0,12-06-2019,United States,New York,Internet software & services,SoftBank Group,GYMPASS,2019-06-12,4
Gympass,2.0,12-06-2019,United States,New York,Internet software & services,Atomico,GYMPASS,2019-06-12,4
Dialpad,2.0,06-10-2020,United States,San Francisco,Internet software & services,Andreessen Horowitz,DIALPAD,2020-10-06,3
Dialpad,2.0,06-10-2020,United States,San Francisco,Internet software & services,Google Ventures,DIALPAD,2020-10-06,3
Dialpad,2.0,06-10-2020,United States,San Francisco,Internet software & services,Section 32,DIALPAD,2020-10-06,3
G7 Networks,2.0,15-02-2022,China,Beijing,"Supply chain, logistics, & delivery",Eastern Bell Capital 32,G7 NETWORKS,2022-02-15,1
G7 Networks,2.0,15-02-2022,China,Beijing,"Supply chain, logistics, & delivery",SDIC CMC Investment Management,G7 NETWORKS,2022-02-15,1
G7 Networks,2.0,15-02-2022,China,Beijing,"Supply chain, logistics, & delivery",Trustbridge Partners,G7 NETWORKS,2022-02-15,1
BloomReach,2.0,23-02-2022,United States,Mountain View,Artificial intelligence,Bain Capital Ventures,BLOOMREACH,2022-02-23,1
BloomReach,2.0,23-02-2022,United States,Mountain View,Artificial intelligence,Sixth Street Growth,BLOOMREACH,2022-02-23,1
BloomReach,2.0,23-02-2022,United States,Mountain View,Artificial intelligence,Lightspeed Venture Partners,BLOOMREACH,2022-02-23,1
Motif FoodWorks,2.0,16-06-2021,United States,Boston,Consumer & retail,General Atlantic,MOTIF FOODWORKS,2021-06-16,2
Motif FoodWorks,2.0,16-06-2021,United States,Boston,Consumer & retail,Breakthrough Energy Ventures,MOTIF FOODWORKS,2021-06-16,2
Motif FoodWorks,2.0,16-06-2021,United States,Boston,Consumer & retail,Viking Global Investors,MOTIF FOODWORKS,2021-06-16,2
Huaqin Telecom Technology,2.0,08-10-2019,China,Shanghai,Mobile & telecommunications,Zhangjiang Haocheng Venture Capital,HUAQIN TELECOM TECHNOLOGY,2019-10-08,4
Huaqin Telecom Technology,2.0,08-10-2019,China,Shanghai,Mobile & telecommunications,Walden International,HUAQIN TELECOM TECHNOLOGY,2019-10-08,4
Huaqin Telecom Technology,2.0,08-10-2019,China,Shanghai,Mobile & telecommunications,Intel Capital,HUAQIN TELECOM TECHNOLOGY,2019-10-08,4
Accelerant,2.0,12-01-2022,United Kingdom,Colchester,Other,Deer Park Road,ACCELERANT,2022-01-12,1
Accelerant,2.0,12-01-2022,United Kingdom,Colchester,Other,Altamont Capital Partners,ACCELERANT,2022-01-12,1
Accelerant,2.0,12-01-2022,United Kingdom,Colchester,Other,Eldridge,ACCELERANT,2022-01-12,1
YITU Technology,2.0,08-03-2018,China,Shanghai,Artificial intelligence,Sequoia Capital China,YITU TECHNOLOGY,2018-03-08,5
YITU Technology,2.0,08-03-2018,China,Shanghai,Artificial intelligence,Banyan Capital,YITU TECHNOLOGY,2018-03-08,5
Addepar,2.0,15-06-2021,United States,Mountain View,Fintech,8VC,ADDEPAR,2021-06-15,2
Addepar,2.0,15-06-2021,United States,Mountain View,Fintech,D1 Capital Partners,ADDEPAR,2021-06-15,2
Addepar,2.0,15-06-2021,United States,Mountain View,Fintech,Sway Ventures,ADDEPAR,2021-06-15,2
Qualia,2.0,21-12-2020,United States,San Francisco,Fintech,8VC,QUALIA,2020-12-21,3
Qualia,2.0,21-12-2020,United States,San Francisco,Fintech,Menlo Ventures,QUALIA,2020-12-21,3
Qualia,2.0,21-12-2020,United States,San Francisco,Fintech,Tiger Global Management,QUALIA,2020-12-21,3
Neo4j,2.0,17-06-2021,United States,San Mateo,Data management & analytics,Eight Roads Ventures,NEO4J,2021-06-17,2
Neo4j,2.0,17-06-2021,United States,San Mateo,Data management & analytics,One Peak Partners,NEO4J,2021-06-17,2
Neo4j,2.0,17-06-2021,United States,San Mateo,Data management & analytics,Creandum,NEO4J,2021-06-17,2
CloudWalk,2.0,08-09-2021,Brazil,Sao Paulo,Fintech,Plug and Play Ventures,CLOUDWALK,2021-09-08,2
CloudWalk,2.0,08-09-2021,Brazil,Sao Paulo,Fintech,Valor Capital Group,CLOUDWALK,2021-09-08,2
CloudWalk,2.0,08-09-2021,Brazil,Sao Paulo,Fintech,DST Global,CLOUDWALK,2021-09-08,2
CoinDCX,2.0,10-08-2021,India,Maharashtra,Fintech,Polychain Capital,COINDCX,2021-08-10,2
CoinDCX,2.0,10-08-2021,India,Maharashtra,Fintech,Coinbase Ventures,COINDCX,2021-08-10,2
CoinDCX,2.0,10-08-2021,India,Maharashtra,Fintech,Jump Capital,COINDCX,2021-08-10,2
FirstCry,2.0,07-02-2020,India,Pune,E-commerce & direct-to-consumer,SoftBank Group,FIRSTCRY,2020-02-07,3
FirstCry,2.0,07-02-2020,India,Pune,E-commerce & direct-to-consumer,SAIF Partners India,FIRSTCRY,2020-02-07,3
FirstCry,2.0,07-02-2020,India,Pune,E-commerce & direct-to-consumer,Valiant Capital Partners,FIRSTCRY,2020-02-07,3
Eightfold.ai,2.0,27-10-2020,United States,Santa Clara,Internet software & services,Foundation Capital,EIGHTFOLD.AI,2020-10-27,3
Eightfold.ai,2.0,27-10-2020,United States,Santa Clara,Internet software & services,Institutional Venture Partners,EIGHTFOLD.AI,2020-10-27,3
Eightfold.ai,2.0,27-10-2020,United States,Santa Clara,Internet software & services,General Catalyst,EIGHTFOLD.AI,2020-10-27,3
Urban Company,2.0,27-04-2021,India,Gurgaon,E-commerce & direct-to-consumer,VY Capital,URBAN COMPANY,2021-04-27,2
Urban Company,2.0,27-04-2021,India,Gurgaon,E-commerce & direct-to-consumer,Accel,URBAN COMPANY,2021-04-27,2
Urban Company,2.0,27-04-2021,India,Gurgaon,E-commerce & direct-to-consumer,Elevation Capital,URBAN COMPANY,2021-04-27,2
ReCharge,2.0,06-05-2021,United States,Los Angeles,Fintech,ICONIQ Growth,RECHARGE,2021-05-06,2
ReCharge,2.0,06-05-2021,United States,Los Angeles,Fintech,Bain Capital Ventures,RECHARGE,2021-05-06,2
ReCharge,2.0,06-05-2021,United States,Los Angeles,Fintech,Summit Partners,RECHARGE,2021-05-06,2
Moveworks,2.0,30-06-2021,United States,Mountain View,Artificial intelligence,Lightspeed Venture Partners,MOVEWORKS,2021-06-30,2
Moveworks,2.0,30-06-2021,United States,Mountain View,Artificial intelligence,Sapphire Ventures,MOVEWORKS,2021-06-30,2
Moveworks,2.0,30-06-2021,United States,Mountain View,Artificial intelligence,Kleiner Perkins Caufield & Byers,MOVEWORKS,2021-06-30,2
Medable,2.0,26-10-2021,United States,Palo Alto,Health,GSR Ventures,MEDABLE,2021-10-26,2
Medable,2.0,26-10-2021,United States,Palo Alto,Health,Sapphire Ventures,MEDABLE,2021-10-26,2
Medable,2.0,26-10-2021,United States,Palo Alto,Health,Streamlined Ventures,MEDABLE,2021-10-26,2
GoCardless,2.0,08-02-2022,United Kingdom,London,Fintech,Accel,GOCARDLESS,2022-02-08,1
GoCardless,2.0,08-02-2022,United Kingdom,London,Fintech,Passion Capital,GOCARDLESS,2022-02-08,1
GoCardless,2.0,08-02-2022,United Kingdom,London,Fintech,Balderton Capital,GOCARDLESS,2022-02-08,1
Aledade,2.0,19-01-2021,United States,Bethesda,Health,Venrock,ALEDADE,2021-01-19,2
Aledade,2.0,19-01-2021,United States,Bethesda,Health,CVF Capital Partners,ALEDADE,2021-01-19,2
Aledade,2.0,19-01-2021,United States,Bethesda,Health,ARCH Venture Partners,ALEDADE,2021-01-19,2
Forto,2.0,21-06-2021,Germany,Berlin,"Supply chain, logistics, & delivery",Cherry Ventures,FORTO,2021-06-21,2
Forto,2.0,21-06-2021,Germany,Berlin,"Supply chain, logistics, & delivery",Northzone Ventures,FORTO,2021-06-21,2
Forto,2.0,21-06-2021,Germany,Berlin,"Supply chain, logistics, & delivery",Global Founders Capital,FORTO,2021-06-21,2
Jeeves,2.0,14-03-2022,United States,Orlando,Fintech,Tencent Holdings,JEEVES,2022-03-14,1
Jeeves,2.0,14-03-2022,United States,Orlando,Fintech,CRV,JEEVES,2022-03-14,1
Jeeves,2.0,14-03-2022,United States,Orlando,Fintech,Clocktower Technology Ventures,JEEVES,2022-03-14,1
Viva Wallet,2.0,17-12-2022,Greece,Athens,Fintech,Breyer Capital,VIVA WALLET,2022-12-17,1
Viva Wallet,2.0,17-12-2022,Greece,Athens,Fintech,Hedosophia,VIVA WALLET,2022-12-17,1
Babel Finance,2.0,25-05-2022,Hong Kong,Hong Kong,Fintech,Dragonfly Capital,BABEL FINANCE,2022-05-25,1
Babel Finance,2.0,25-05-2022,Hong Kong,Hong Kong,Fintech,BAI Capital,BABEL FINANCE,2022-05-25,1
Babel Finance,2.0,25-05-2022,Hong Kong,Hong Kong,Fintech,10T Fund,BABEL FINANCE,2022-05-25,1
Trendy Group International,2.0,13-02-2012,Hong Kong,Kowloon,Consumer & retail,L Capital Partners,TRENDY GROUP INTERNATIONAL,2012-02-13,11
GrubMarket,2.0,14-09-2021,United States,San Francisco,E-commerce & direct-to-consumer,GGV Capital,GRUBMARKET,2021-09-14,2
GrubMarket,2.0,14-09-2021,United States,San Francisco,E-commerce & direct-to-consumer,BlackRock,GRUBMARKET,2021-09-14,2
GrubMarket,2.0,14-09-2021,United States,San Francisco,E-commerce & direct-to-consumer,ACE & Company,GRUBMARKET,2021-09-14,2
GO1,2.0,19-07-2021,Australia,Brisbane,Internet software & services,Y Combinator,GO1,2021-07-19,2
GO1,2.0,19-07-2021,Australia,Brisbane,Internet software & services,M12,GO1,2021-07-19,2
GO1,2.0,19-07-2021,Australia,Brisbane,Internet software & services,SEEK,GO1,2021-07-19,2
Drata,2.0,08-11-2021,United States,San Diego,Cybersecurity,Cowboy Ventures,DRATA,2021-11-08,2
Drata,2.0,08-11-2021,United States,San Diego,Cybersecurity,Leaders Fund,DRATA,2021-11-08,2
Drata,2.0,08-11-2021,United States,San Diego,Cybersecurity,GGV Capital,DRATA,2021-11-08,2
Mysten Labs,2.0,08-09-2022,United States,San Francisco,Internet software & services,Andreessen Horowitz,MYSTEN LABS,2022-09-08,1
Mysten Labs,2.0,08-09-2022,United States,San Francisco,Internet software & services,Coinbase Ventures,MYSTEN LABS,2022-09-08,1
Mysten Labs,2.0,08-09-2022,United States,San Francisco,Internet software & services,Circle Ventures,MYSTEN LABS,2022-09-08,1
Avant,2.0,17-12-2012,United States,Chicago,Artificial intelligence,RRE Ventures,AVANT,2012-12-17,11
Avant,2.0,17-12-2012,United States,Chicago,Artificial intelligence,Tiger Global,AVANT,2012-12-17,11
Avant,2.0,17-12-2012,United States,Chicago,Artificial intelligence,August Capital,AVANT,2012-12-17,11
Tubatu.com,2.0,09-03-2015,China,Shenzhen,E-commerce & direct-to-consumer,Sequoia Capital China,TUBATU.COM,2015-03-09,8
Tubatu.com,2.0,09-03-2015,China,Shenzhen,E-commerce & direct-to-consumer,Matrix Partners China,TUBATU.COM,2015-03-09,8
Tubatu.com,2.0,09-03-2015,China,Shenzhen,E-commerce & direct-to-consumer,58.com,TUBATU.COM,2015-03-09,8
BlaBlaCar,2.0,16-09-2015,France,Paris,Auto & transportation,Accel Partners,BLABLACAR,2015-09-16,8
BlaBlaCar,2.0,16-09-2015,France,Paris,Auto & transportation,Index Ventures,BLABLACAR,2015-09-16,8
BlaBlaCar,2.0,16-09-2015,France,Paris,Auto & transportation,Insight Venture Partners,BLABLACAR,2015-09-16,8
HuiMin,2.0,05-09-2016,China,Beijing,E-commerce & direct-to-consumer,Zheshang Venture Capital,HUIMIN,2016-09-05,7
HuiMin,2.0,05-09-2016,China,Beijing,E-commerce & direct-to-consumer,GP Capital,HUIMIN,2016-09-05,7
HuiMin,2.0,05-09-2016,China,Beijing,E-commerce & direct-to-consumer,Western Capital Management,HUIMIN,2016-09-05,7
Quora,2.0,21-04-2017,United States,Mountain View,Internet software & services,Y Combinator,QUORA,2017-04-21,6
Quora,2.0,21-04-2017,United States,Mountain View,Internet software & services,Matrix Partners,QUORA,2017-04-21,6
Quora,2.0,21-04-2017,United States,Mountain View,Internet software & services,Benchmark,QUORA,2017-04-21,6
Preferred Networks,2.0,17-05-2018,Japan,Tokyo,Artificial intelligence,Toyota Motor Corporation,PREFERRED NETWORKS,2018-05-17,5
Preferred Networks,2.0,17-05-2018,Japan,Tokyo,Artificial intelligence,Mizuho Financial Group,PREFERRED NETWORKS,2018-05-17,5
Preferred Networks,2.0,17-05-2018,Japan,Tokyo,Artificial intelligence,FANUC,PREFERRED NETWORKS,2018-05-17,5
Formlabs,2.0,01-08-2018,United States,Somerville,Hardware,Pitango Venture Capital,FORMLABS,2018-08-01,5
Formlabs,2.0,01-08-2018,United States,Somerville,Hardware,DFJ Growth Fund,FORMLABS,2018-08-01,5
Formlabs,2.0,01-08-2018,United States,Somerville,Hardware,Foundry Group,FORMLABS,2018-08-01,5
4Paradigm,2.0,19-12-2018,China,Beijing,Artificial intelligence,Sequoia Capital China,4PARADIGM,2018-12-19,5
4Paradigm,2.0,19-12-2018,China,Beijing,Artificial intelligence,China Construction Bank,4PARADIGM,2018-12-19,5
4Paradigm,2.0,19-12-2018,China,Beijing,Artificial intelligence,Bank of China,4PARADIGM,2018-12-19,5
Calm,2.0,06-02-2019,United States,San Francisco,Internet software & services,Insight Venture Partners,CALM,2019-02-06,4
Calm,2.0,06-02-2019,United States,San Francisco,Internet software & services,TPG Growth,CALM,2019-02-06,4
Calm,2.0,06-02-2019,United States,San Francisco,Internet software & services,Sound Ventures,CALM,2019-02-06,4
Kaseya,2.0,27-03-2019,United States,Miami,Cybersecurity,Insight Partners,KASEYA,2019-03-27,4
Kaseya,2.0,27-03-2019,United States,Miami,Cybersecurity,TPG Alternative & Renewable Technologies,KASEYA,2019-03-27,4
Kaseya,2.0,27-03-2019,United States,Miami,Cybersecurity,Ireland Strategic Investment Fund,KASEYA,2019-03-27,4
Mafengwo,2.0,23-05-2019,China,Beijing,Travel,Qiming Venture Partners,MAFENGWO,2019-05-23,4
Mafengwo,2.0,23-05-2019,China,Beijing,Travel,Capital Today,MAFENGWO,2019-05-23,4
Mafengwo,2.0,23-05-2019,China,Beijing,Travel,General Atlantic,MAFENGWO,2019-05-23,4
Druva,2.0,20-06-2019,United States,Sunnyvale,Data management & analytics,Nexus Venture Partners,DRUVA,2019-06-20,4
Druva,2.0,20-06-2019,United States,Sunnyvale,Data management & analytics,Tenaya Capital,DRUVA,2019-06-20,4
Druva,2.0,20-06-2019,United States,Sunnyvale,Data management & analytics,Sequoia Capital,DRUVA,2019-06-20,4
Kujiale,2.0,25-10-2019,China,Hangzhou,Internet software & services,GGV Capital,KUJIALE,2019-10-25,4
Kujiale,2.0,25-10-2019,China,Hangzhou,Internet software & services,IDG Capital,KUJIALE,2019-10-25,4
Kujiale,2.0,25-10-2019,China,Hangzhou,Internet software & services,Linear Venture,KUJIALE,2019-10-25,4
AppsFlyer,2.0,21-01-2020,United States,San Francisco,Mobile & telecommunications,Magma Venture Partners,APPSFLYER,2020-01-21,3
AppsFlyer,2.0,21-01-2020,United States,San Francisco,Mobile & telecommunications,Pitango Venture Capital,APPSFLYER,2020-01-21,3
AppsFlyer,2.0,21-01-2020,United States,San Francisco,Mobile & telecommunications,Qumra Capital,APPSFLYER,2020-01-21,3
Keep,2.0,19-05-2020,China,Beijing,Internet software & services,Bertelsmann Asia Investments,KEEP,2020-05-19,3
Keep,2.0,19-05-2020,China,Beijing,Internet software & services,GGV Capital,KEEP,2020-05-19,3
Keep,2.0,19-05-2020,China,Beijing,Internet software & services,Morningside Venture Capital,KEEP,2020-05-19,3
Redis Labs,2.0,25-08-2020,United States,Mountain View,Data management & analytics,Viola Ventures,REDIS LABS,2020-08-25,3
Redis Labs,2.0,25-08-2020,United States,Mountain View,Data management & analytics,Dell Technologies Capital,REDIS LABS,2020-08-25,3
Redis Labs,2.0,25-08-2020,United States,Mountain View,Data management & analytics,Bain Capital Ventures,REDIS LABS,2020-08-25,3
Xingyun Group,2.0,24-09-2020,China,Shenzhen,E-commerce & direct-to-consumer,Matrix Partners China,XINGYUN GROUP,2020-09-24,3
Xingyun Group,2.0,24-09-2020,China,Shenzhen,E-commerce & direct-to-consumer,Eastern Bell Capital,XINGYUN GROUP,2020-09-24,3
Xingyun Group,2.0,24-09-2020,China,Shenzhen,E-commerce & direct-to-consumer,Hongtai Capital Holdings,XINGYUN GROUP,2020-09-24,3
Unqork,2.0,06-10-2020,United States,New York,Fintech,Blackrock,UNQORK,2020-10-06,3
Unqork,2.0,06-10-2020,United States,New York,Fintech,capitalG,UNQORK,2020-10-06,3
Unqork,2.0,06-10-2020,United States,New York,Fintech,World Lab Innovation,UNQORK,2020-10-06,3
Virta Health,2.0,02-12-2020,United States,San Francisco,Health,Caffeinated Capital,VIRTA HEALTH,2020-12-02,3
Virta Health,2.0,02-12-2020,United States,San Francisco,Health,Obvious Ventures,VIRTA HEALTH,2020-12-02,3
Virta Health,2.0,02-12-2020,United States,San Francisco,Health,Venrock,VIRTA HEALTH,2020-12-02,3
ISN,2.0,17-12-2020,United States,Dallas,"Supply chain, logistics, & delivery",Blackstone,ISN,2020-12-17,3
Earnix,2.0,21-02-2021,Israel,Giv'atayim,Fintech,Jerusalem Venture Partners,EARNIX,2021-02-21,2
Earnix,2.0,21-02-2021,Israel,Giv'atayim,Fintech,Israel Growth Partners,EARNIX,2021-02-21,2
Earnix,2.0,21-02-2021,Israel,Giv'atayim,Fintech,Insight Partners,EARNIX,2021-02-21,2
Guoquan Shihui,2.0,17-03-2021,China,Shanghai,Consumer & retail,Tiantu Capital,GUOQUAN SHIHUI,2021-03-17,2
Guoquan Shihui,2.0,17-03-2021,China,Shanghai,Consumer & retail,CMB International Capital,GUOQUAN SHIHUI,2021-03-17,2
Guoquan Shihui,2.0,17-03-2021,China,Shanghai,Consumer & retail,Vision Knight Capital,GUOQUAN SHIHUI,2021-03-17,2
Clearco,2.0,20-04-2021,Canada,Toronto,Fintech,Highland Capital Partners,CLEARCO,2021-04-20,2
Clearco,2.0,20-04-2021,Canada,Toronto,Fintech,Oak HC/FT Partners,CLEARCO,2021-04-20,2
Clearco,2.0,20-04-2021,Canada,Toronto,Fintech,Emergence Capital Partners,CLEARCO,2021-04-20,2
Hive,2.0,21-04-2021,United States,San Francisco,Artificial intelligence,Tomales Bay Capital,HIVE,2021-04-21,2
Hive,2.0,21-04-2021,United States,San Francisco,Artificial intelligence,Bain & Company,HIVE,2021-04-21,2
Hive,2.0,21-04-2021,United States,San Francisco,Artificial intelligence,General Catalyst,HIVE,2021-04-21,2
KRY,2.0,27-04-2021,Sweden,Stockholm,Health,Index Ventures,KRY,2021-04-27,2
KRY,2.0,27-04-2021,Sweden,Stockholm,Health,Creandum,KRY,2021-04-27,2
KRY,2.0,27-04-2021,Sweden,Stockholm,Health,Accel,KRY,2021-04-27,2
Kajabi,2.0,04-05-2021,United States,Irvine,Internet software & services,Meritech Capital Partners,KAJABI,2021-05-04,2
Kajabi,2.0,04-05-2021,United States,Irvine,Internet software & services,Tiger Global Management,KAJABI,2021-05-04,2
Kajabi,2.0,04-05-2021,United States,Irvine,Internet software & services,Spectrum Equity,KAJABI,2021-05-04,2
Ethos,2.0,11-05-2021,United States,San Francisco,Fintech,Sequoia Capital,ETHOS,2021-05-11,2
Ethos,2.0,11-05-2021,United States,San Francisco,Fintech,Google Ventures,ETHOS,2021-05-11,2
Ethos,2.0,11-05-2021,United States,San Francisco,Fintech,Accel,ETHOS,2021-05-11,2
PayFit,2.0,06-01-2022,United Kingdom,London,Fintech,Accel,PAYFIT,2022-01-06,1
PayFit,2.0,06-01-2022,United Kingdom,London,Fintech,frst,PAYFIT,2022-01-06,1
PayFit,2.0,06-01-2022,United Kingdom,London,Fintech,Kima Ventures,PAYFIT,2022-01-06,1
Beisen,2.0,11-05-2021,China,Beijing,Internet software & services,Matrix Partners China,BEISEN,2021-05-11,2
Beisen,2.0,11-05-2021,China,Beijing,Internet software & services,Sequoia Capital China,BEISEN,2021-05-11,2
Beisen,2.0,11-05-2021,China,Beijing,Internet software & services,Genesis Capital,BEISEN,2021-05-11,2
Pipe,2.0,19-05-2021,United States,Miami,Fintech,next47,PIPE,2021-05-19,2
Pipe,2.0,19-05-2021,United States,Miami,Fintech,MaC Venture Capital,PIPE,2021-05-19,2
Pipe,2.0,19-05-2021,United States,Miami,Fintech,FinVC,PIPE,2021-05-19,2
Iterable,2.0,15-06-2021,United States,San Francisco,Internet software & services,CRV,ITERABLE,2021-06-15,2
Iterable,2.0,15-06-2021,United States,San Francisco,Internet software & services,Blue Cloud Ventures,ITERABLE,2021-06-15,2
Iterable,2.0,15-06-2021,United States,San Francisco,Internet software & services,Index Ventures,ITERABLE,2021-06-15,2
Bunq,2.0,18-06-2021,Netherlands,Amsterdam,Fintech,Undisclosed,BUNQ,2021-06-18,2
Clip,2.0,10-06-2021,Mexico,Mexico City,Fintech,Alta Ventures Mexico,CLIP,2021-06-10,2
Clip,2.0,10-06-2021,Mexico,Mexico City,Fintech,General Atlantic,CLIP,2021-06-10,2
Clip,2.0,10-06-2021,Mexico,Mexico City,Fintech,SoftBank Group,CLIP,2021-06-10,2
Loggi,2.0,05-06-2019,Brazil,Sao Paulo,"Supply chain, logistics, & delivery",Qualcomm Ventures,LOGGI,2019-06-05,4
Loggi,2.0,05-06-2019,Brazil,Sao Paulo,"Supply chain, logistics, & delivery",SoftBank Group. Monashees+,LOGGI,2019-06-05,4
MURAL,2.0,20-07-2021,United States,San Francisco,Internet software & services,Insight Partners,MURAL,2021-07-20,2
MURAL,2.0,20-07-2021,United States,San Francisco,Internet software & services,Tiger Global Management,MURAL,2021-07-20,2
MURAL,2.0,20-07-2021,United States,San Francisco,Internet software & services,Gradient Ventures,MURAL,2021-07-20,2
OCSiAl,2.0,04-03-2019,Luxembourg,Leudelange,Other,A&NN,OCSIAL,2019-03-04,4
OCSiAl,2.0,04-03-2019,Luxembourg,Leudelange,Other,Rusnano,OCSIAL,2019-03-04,4
XtalPi,2.0,11-08-2021,China,Shenzhen,Artificial intelligence,Tencent Holdings,XTALPI,2021-08-11,2
XtalPi,2.0,11-08-2021,China,Shenzhen,Artificial intelligence,5Y Capital,XTALPI,2021-08-11,2
XtalPi,2.0,11-08-2021,China,Shenzhen,Artificial intelligence,Sequoia Capital China,XTALPI,2021-08-11,2
Divvy Homes,2.0,13-08-2021,United States,San Francisco,Fintech,Andreessen Horowitz,DIVVY HOMES,2021-08-13,2
Divvy Homes,2.0,13-08-2021,United States,San Francisco,Fintech,Caffeinated Capital,DIVVY HOMES,2021-08-13,2
Divvy Homes,2.0,13-08-2021,United States,San Francisco,Fintech,SciFi VC,DIVVY HOMES,2021-08-13,2
Apeel Sciences,2.0,26-05-2020,United States,Goleta,Other,Upfront Ventures,APEEL SCIENCES,2020-05-26,3
Apeel Sciences,2.0,26-05-2020,United States,Goleta,Other,Tao Capital Partners,APEEL SCIENCES,2020-05-26,3
Apeel Sciences,2.0,26-05-2020,United States,Goleta,Other,Andreessen Horowitz,APEEL SCIENCES,2020-05-26,3
Opay,2.0,23-08-2021,Nigeria,Lagos,Fintech,Sequoia Capital China,OPAY,2021-08-23,2
Opay,2.0,23-08-2021,Nigeria,Lagos,Fintech,Source Code Capital,OPAY,2021-08-23,2
Opay,2.0,23-08-2021,Nigeria,Lagos,Fintech,Redpoint Ventures China,OPAY,2021-08-23,2
Aviatrix,2.0,08-09-2021,United States,Santa Clara,Internet software & services,Ignition Partners,AVIATRIX,2021-09-08,2
Aviatrix,2.0,08-09-2021,United States,Santa Clara,Internet software & services,Formation 8,AVIATRIX,2021-09-08,2
Aviatrix,2.0,08-09-2021,United States,Santa Clara,Internet software & services,CRV,AVIATRIX,2021-09-08,2
SmartNews,2.0,05-08-2019,Japan,Tokyo,Mobile & telecommunications,Japan Post Capital,SMARTNEWS,2019-08-05,4
SmartNews,2.0,05-08-2019,Japan,Tokyo,Mobile & telecommunications,Globis Capital Partners,SMARTNEWS,2019-08-05,4
SmartNews,2.0,05-08-2019,Japan,Tokyo,Mobile & telecommunications,Atomico,SMARTNEWS,2019-08-05,4
Misfits Market,2.0,21-04-2021,United States,Pennsauken,"Supply chain, logistics, & delivery",Accel,MISFITS MARKET,2021-04-21,2
Misfits Market,2.0,21-04-2021,United States,Pennsauken,"Supply chain, logistics, & delivery",D1 Capita Partners,MISFITS MARKET,2021-04-21,2
Misfits Market,2.0,21-04-2021,United States,Pennsauken,"Supply chain, logistics, & delivery",Greenoaks Capital Management,MISFITS MARKET,2021-04-21,2
Spring Health,2.0,16-09-2021,United States,New York,Health,Rethink Impact,SPRING HEALTH,2021-09-16,2
Spring Health,2.0,16-09-2021,United States,New York,Health,Work-Bench,SPRING HEALTH,2021-09-16,2
Spring Health,2.0,16-09-2021,United States,New York,Health,RRE Ventures,SPRING HEALTH,2021-09-16,2
Black Sesame Technologies,2.0,22-09-2021,China,Shanghai,Artificial intelligence,Northern Light Venture Capital,BLACK SESAME TECHNOLOGIES,2021-09-22,2
Black Sesame Technologies,2.0,22-09-2021,China,Shanghai,Artificial intelligence,Xiaomi,BLACK SESAME TECHNOLOGIES,2021-09-22,2
Black Sesame Technologies,2.0,22-09-2021,China,Shanghai,Artificial intelligence,FutureX Capital,BLACK SESAME TECHNOLOGIES,2021-09-22,2
Advance Intelligence Group,2.0,23-09-2021,Singapore,Unknown,Artificial intelligence,Vision Plus Capital,ADVANCE INTELLIGENCE GROUP,2021-09-23,2
Advance Intelligence Group,2.0,23-09-2021,Singapore,Unknown,Artificial intelligence,GSR Ventures,ADVANCE INTELLIGENCE GROUP,2021-09-23,2
Advance Intelligence Group,2.0,23-09-2021,Singapore,Unknown,Artificial intelligence,ZhenFund,ADVANCE INTELLIGENCE GROUP,2021-09-23,2
Modern Treasury,2.0,06-10-2021,United States,San Francisco,Fintech,Benchmark,MODERN TREASURY,2021-10-06,2
Modern Treasury,2.0,06-10-2021,United States,San Francisco,Fintech,Altimeter Capital,MODERN TREASURY,2021-10-06,2
Modern Treasury,2.0,06-10-2021,United States,San Francisco,Fintech,Quiet Capital,MODERN TREASURY,2021-10-06,2
Magic Leap,2.0,21-10-2014,United States,Plantation,Hardware,Obvious Ventures,MAGIC LEAP,2014-10-21,9
Magic Leap,2.0,21-10-2014,United States,Plantation,Hardware,Qualcomm Ventures,MAGIC LEAP,2014-10-21,9
Magic Leap,2.0,21-10-2014,United States,Plantation,Hardware,Andreessen Horowitz,MAGIC LEAP,2014-10-21,9
Tier,2.0,25-10-2021,Germany,Berlin,Travel,Northzone Ventures,TIER,2021-10-25,2
Tier,2.0,25-10-2021,Germany,Berlin,Travel,White Star Capital,TIER,2021-10-25,2
Tier,2.0,25-10-2021,Germany,Berlin,Travel,Novator Partners,TIER,2021-10-25,2
ClickHouse,2.0,28-10-2021,United States,Portola Valley,Data management & analytics,Lightspeed Venture Partners,CLICKHOUSE,2021-10-28,2
ClickHouse,2.0,28-10-2021,United States,Portola Valley,Data management & analytics,Almaz Capital Partners,CLICKHOUSE,2021-10-28,2
ClickHouse,2.0,28-10-2021,United States,Portola Valley,Data management & analytics,Altimeter Capital,CLICKHOUSE,2021-10-28,2
Everlaw,2.0,10-03-2020,United States,Oakland,Internet software & services,K9 Ventures,EVERLAW,2020-03-10,3
Everlaw,2.0,10-03-2020,United States,Oakland,Internet software & services,Menlo Ventures,EVERLAW,2020-03-10,3
Everlaw,2.0,10-03-2020,United States,Oakland,Internet software & services,Andreessen Horowitz,EVERLAW,2020-03-10,3
Zilch,2.0,10-11-2021,United Kingdom,London,Fintech,Gauss Ventures,ZILCH,2021-11-10,2
Zilch,2.0,10-11-2021,United Kingdom,London,Fintech,Ventura Capital,ZILCH,2021-11-10,2
Zilch,2.0,10-11-2021,United Kingdom,London,Fintech,dmg ventures,ZILCH,2021-11-10,2
VerbIT,2.0,08-06-2021,United States,New York,Artificial intelligence,ClalTech,VERBIT,2021-06-08,2
VerbIT,2.0,08-06-2021,United States,New York,Artificial intelligence,Vertex Ventures,VERBIT,2021-06-08,2
VerbIT,2.0,08-06-2021,United States,New York,Artificial intelligence,Oryzn Capital,VERBIT,2021-06-08,2
StarkWare,2.0,17-11-2021,Israel,Netanya,Cybersecurity,Sequoia Capital,STARKWARE,2021-11-17,2
StarkWare,2.0,17-11-2021,Israel,Netanya,Cybersecurity,Paradigm,STARKWARE,2021-11-17,2
StarkWare,2.0,17-11-2021,Israel,Netanya,Cybersecurity,Pantera Capital,STARKWARE,2021-11-17,2
Netlify,2.0,17-11-2021,United States,San Francisco,Internet software & services,Andreessen Horowitz,NETLIFY,2021-11-17,2
Netlify,2.0,17-11-2021,United States,San Francisco,Internet software & services,Kleiner Perkins Caufield & Byers,NETLIFY,2021-11-17,2
Netlify,2.0,17-11-2021,United States,San Francisco,Internet software & services,EQT Ventures,NETLIFY,2021-11-17,2
SWORD Health,2.0,22-11-2021,United States,New York,Health,Khosla Ventures,SWORD HEALTH,2021-11-22,2
SWORD Health,2.0,22-11-2021,United States,New York,Health,Green Innovations,SWORD HEALTH,2021-11-22,2
SWORD Health,2.0,22-11-2021,United States,New York,Health,Founders Fund,SWORD HEALTH,2021-11-22,2
LTK,2.0,22-11-2021,United States,Dallas,Internet software & services,SoftBank Group,LTK,2021-11-22,2
LTK,2.0,22-11-2021,United States,Dallas,Internet software & services,Maverick Capital,LTK,2021-11-22,2
Trax,2.0,22-07-2019,Singapore,Unknown,Artificial intelligence,Hopu Investment Management,TRAX,2019-07-22,4
Trax,2.0,22-07-2019,Singapore,Unknown,Artificial intelligence,Boyu Capital,TRAX,2019-07-22,4
Trax,2.0,22-07-2019,Singapore,Unknown,Artificial intelligence,DC Thomson Ventures,TRAX,2019-07-22,4
Exotec,2.0,17-01-2022,France,Croix,Hardware,Breega Capital,EXOTEC,2022-01-17,1
Exotec,2.0,17-01-2022,France,Croix,Hardware,Iris Capital,EXOTEC,2022-01-17,1
Exotec,2.0,17-01-2022,France,Croix,Hardware,360 Capital Partners,EXOTEC,2022-01-17,1
Dremio,2.0,06-01-2021,United States,Santa Clara,Data management & analytics,Lightspeed Venture Partners,DREMIO,2021-01-06,2
Dremio,2.0,06-01-2021,United States,Santa Clara,Data management & analytics,Redpoint Ventures,DREMIO,2021-01-06,2
Dremio,2.0,06-01-2021,United States,Santa Clara,Data management & analytics,Norwest Venture Partners,DREMIO,2021-01-06,2
Akulaku,2.0,15-02-2022,Indonesia,Jakarta,E-commerce & direct-to-consumer,DCM Ventures,AKULAKU,2022-02-15,1
Akulaku,2.0,15-02-2022,Indonesia,Jakarta,E-commerce & direct-to-consumer,IDG Capital,AKULAKU,2022-02-15,1
Akulaku,2.0,15-02-2022,Indonesia,Jakarta,E-commerce & direct-to-consumer,Siam Commercial Bank,AKULAKU,2022-02-15,1
Cloudinary,2.0,15-02-2022,United States,Santa Clara,Internet software & services,Blackstone,CLOUDINARY,2022-02-15,1
Cloudinary,2.0,15-02-2022,United States,Santa Clara,Internet software & services,Bessemer Venture Partners,CLOUDINARY,2022-02-15,1
Lunar,2.0,12-07-2021,Denmark,Aarhus,Fintech,SEED Capital,LUNAR,2021-07-12,2
Lunar,2.0,12-07-2021,Denmark,Aarhus,Fintech,Greyhound Capital,LUNAR,2021-07-12,2
Lunar,2.0,12-07-2021,Denmark,Aarhus,Fintech,Socii Capital,LUNAR,2021-07-12,2
UpGrad,2.0,09-08-2021,India,Mumbai,Edtech,Qualcomm Ventures,UPGRAD,2021-08-09,2
UpGrad,2.0,09-08-2021,India,Mumbai,Edtech,Accel,UPGRAD,2021-08-09,2
UpGrad,2.0,09-08-2021,India,Mumbai,Edtech,Canaan Partners,UPGRAD,2021-08-09,2
Salsify,2.0,13-04-2022,United States,Boston,Internet software & services,Matrix Partners,SALSIFY,2022-04-13,1
Salsify,2.0,13-04-2022,United States,Boston,Internet software & services,North Bridge Venture Partners,SALSIFY,2022-04-13,1
Salsify,2.0,13-04-2022,United States,Boston,Internet software & services,Venrock,SALSIFY,2022-04-13,1
CertiK,2.0,31-03-2022,United States,New York,Cybersecurity,Tiger Global Management,CERTIK,2022-03-31,1
CertiK,2.0,31-03-2022,United States,New York,Cybersecurity,Lightspeed Venture Partners,CERTIK,2022-03-31,1
CertiK,2.0,31-03-2022,United States,New York,Cybersecurity,Hillhouse Capital Management,CERTIK,2022-03-31,1
ROX Motor,2.0,29-04-2022,China,Shanghai,Auto & transportation,Sequoia Capital China,ROX MOTOR,2022-04-29,1
ROX Motor,2.0,29-04-2022,China,Shanghai,Auto & transportation,IDG Capital,ROX MOTOR,2022-04-29,1
ROX Motor,2.0,29-04-2022,China,Shanghai,Auto & transportation,Qiming Venture Partners,ROX MOTOR,2022-04-29,1
Hugging Face,2.0,09-05-2022,United States,New York,Artificial intelligence,Betaworks Ventures,HUGGING FACE,2022-05-09,1
Hugging Face,2.0,09-05-2022,United States,New York,Artificial intelligence,Addition,HUGGING FACE,2022-05-09,1
Hugging Face,2.0,09-05-2022,United States,New York,Artificial intelligence,Lux Capital,HUGGING FACE,2022-05-09,1
Devo Technology,2.0,26-10-2021,United States,Cambridge,Data management & analytics,Insight Partners,DEVO TECHNOLOGY,2021-10-26,2
Devo Technology,2.0,26-10-2021,United States,Cambridge,Data management & analytics,Kibo Ventures,DEVO TECHNOLOGY,2021-10-26,2
Devo Technology,2.0,26-10-2021,United States,Cambridge,Data management & analytics,Bessemer Venture Partners,DEVO TECHNOLOGY,2021-10-26,2
ShiftKey,2.0,11-01-2023,United States,Dallas,Health,Health Velocity Capital,SHIFTKEY,2023-01-11,0
Rimac Automobili,2.0,01-06-2022,Croatia,Sveta Nedelja,Auto & transportation,Porsche,RIMAC AUTOMOBILI,2022-06-01,1
Rimac Automobili,2.0,01-06-2022,Croatia,Sveta Nedelja,Auto & transportation,InvestIndustrial,RIMAC AUTOMOBILI,2022-06-01,1
Rimac Automobili,2.0,01-06-2022,Croatia,Sveta Nedelja,Auto & transportation,SoftBank Group,RIMAC AUTOMOBILI,2022-06-01,1
Geek+,2.0,21-11-2018,China,Beijing,Hardware,Volcanics Ventures,GEEK+,2018-11-21,5
Geek+,2.0,21-11-2018,China,Beijing,Hardware,Vertex Ventures China,GEEK+,2018-11-21,5
Geek+,2.0,21-11-2018,China,Beijing,Hardware,Warburg Pincus,GEEK+,2018-11-21,5
21.co,2.0,06-09-2022,United States,New York,Fintech,Quiet Ventures,21.CO,2022-09-06,1
21.co,2.0,06-09-2022,United States,New York,Fintech,ETFS Capital,21.CO,2022-09-06,1
21.co,2.0,06-09-2022,United States,New York,Fintech,Collab+Currency,21.CO,2022-09-06,1
Solugen,2.0,10-09-2021,United States,Houston,Other,Fifty Years Fund,SOLUGEN,2021-09-10,2
Solugen,2.0,10-09-2021,United States,Houston,Other,Refactor Capital,SOLUGEN,2021-09-10,2
Solugen,2.0,10-09-2021,United States,Houston,Other,Temasek,SOLUGEN,2021-09-10,2
ZigBang,2.0,07-06-2022,South Korea,Seoul,Mobile & telecommunications,Black Pearl Ventures,ZIGBANG,2022-06-07,1
ZigBang,2.0,07-06-2022,South Korea,Seoul,Mobile & telecommunications,Stonebridge Ventures,ZIGBANG,2022-06-07,1
ZigBang,2.0,07-06-2022,South Korea,Seoul,Mobile & telecommunications,Yuanta Investment Korea,ZIGBANG,2022-06-07,1
Ankorstore,2.0,10-01-2022,France,Paris,E-commerce & direct-to-consumer,Global Founders Capital,ANKORSTORE,2022-01-10,1
Ankorstore,2.0,10-01-2022,France,Paris,E-commerce & direct-to-consumer,Aglae Ventures,ANKORSTORE,2022-01-10,1
Ankorstore,2.0,10-01-2022,France,Paris,E-commerce & direct-to-consumer,Alven Capital,ANKORSTORE,2022-01-10,1
InVision,2.0,01-11-2017,United States,New York,Internet software & services,FirstMark Capital,INVISION,2017-11-01,6
InVision,2.0,01-11-2017,United States,New York,Internet software & services,Tiger Global Management,INVISION,2017-11-01,6
InVision,2.0,01-11-2017,United States,New York,Internet software & services,ICONIQ Capital,INVISION,2017-11-01,6
eDaili,2.0,01-02-2019,China,Shanghai,E-commerce & direct-to-consumer,K2VC,EDAILI,2019-02-01,4
eDaili,2.0,01-02-2019,China,Shanghai,E-commerce & direct-to-consumer,Lightspeed China Partners,EDAILI,2019-02-01,4
eDaili,2.0,01-02-2019,China,Shanghai,E-commerce & direct-to-consumer,Sky9 Capital,EDAILI,2019-02-01,4
MX,2.0,13-01-2021,United States,Lehi,Fintech,Point72 Ventures,MX,2021-01-13,2
MX,2.0,13-01-2021,United States,Lehi,Fintech,Pelion Venture Partners,MX,2021-01-13,2
MX,2.0,13-01-2021,United States,Lehi,Fintech,Commerce Ventures,MX,2021-01-13,2
CoinSwitch Kuber,2.0,06-10-2021,India,Bangalore,Fintech,Tiger Global Management,COINSWITCH KUBER,2021-10-06,2
CoinSwitch Kuber,2.0,06-10-2021,India,Bangalore,Fintech,Sequoia Capital India,COINSWITCH KUBER,2021-10-06,2
CoinSwitch Kuber,2.0,06-10-2021,India,Bangalore,Fintech,Ribbit Capital,COINSWITCH KUBER,2021-10-06,2
Acorns,2.0,09-03-2022,United States,Irvine,Fintech,e.ventures,ACORNS,2022-03-09,1
Acorns,2.0,09-03-2022,United States,Irvine,Fintech,Bain Capital Ventures,ACORNS,2022-03-09,1
Acorns,2.0,09-03-2022,United States,Irvine,Fintech,Greycroft,ACORNS,2022-03-09,1
Fever Labs,2.0,26-01-2022,United States,New York,Internet software & services,Accel,FEVER LABS,2022-01-26,1
Fever Labs,2.0,26-01-2022,United States,New York,Internet software & services,14W,FEVER LABS,2022-01-26,1
Fever Labs,2.0,26-01-2022,United States,New York,Internet software & services,GS Growth,FEVER LABS,2022-01-26,1
Roofstock,2.0,10-03-2022,United States,Oakland,Fintech,Khosla Ventures,ROOFSTOCK,2022-03-10,1
Roofstock,2.0,10-03-2022,United States,Oakland,Fintech,Bain Capital Ventures,ROOFSTOCK,2022-03-10,1
Roofstock,2.0,10-03-2022,United States,Oakland,Fintech,Lightspeed Venture Partners,ROOFSTOCK,2022-03-10,1
thatgamecompany,2.0,03-03-2022,United States,Los Angeles,Internet software & services,Benchmark,THATGAMECOMPANY,2022-03-03,1
thatgamecompany,2.0,03-03-2022,United States,Los Angeles,Internet software & services,Sequoia Capital,THATGAMECOMPANY,2022-03-03,1
thatgamecompany,2.0,03-03-2022,United States,Los Angeles,Internet software & services,TPG Capital,THATGAMECOMPANY,2022-03-03,1
ConcertAI,2.0,29-03-2022,United States,Boston,Artificial Intelligence,Sixth Street Partners,CONCERTAI,2022-03-29,1
ConcertAI,2.0,29-03-2022,United States,Boston,Artificial Intelligence,Declaration Partners,CONCERTAI,2022-03-29,1
ConcertAI,2.0,29-03-2022,United States,Boston,Artificial Intelligence,Maverick Ventures Israel,CONCERTAI,2022-03-29,1
Material Bank,2.0,06-05-2022,United States,Boca Raton,E-commerce & direct-to-consumer,Bain Capital Ventures,MATERIAL BANK,2022-05-06,1
Material Bank,2.0,06-05-2022,United States,Boca Raton,E-commerce & direct-to-consumer,SoftBank Group,MATERIAL BANK,2022-05-06,1
Material Bank,2.0,06-05-2022,United States,Boca Raton,E-commerce & direct-to-consumer,Fifth Wall Ventures,MATERIAL BANK,2022-05-06,1
Volocopter,2.0,04-03-2022,Germany,Bruchsal,Auto & transportation,btov Partners,VOLOCOPTER,2022-03-04,1
Volocopter,2.0,04-03-2022,Germany,Bruchsal,Auto & transportation,Geely,VOLOCOPTER,2022-03-04,1
Volocopter,2.0,04-03-2022,Germany,Bruchsal,Auto & transportation,Intel Capital,VOLOCOPTER,2022-03-04,1
ENOVATE,2.0,15-04-2019,China,Shanghai,Auto & transportation,Automobile Industry Guidance Fund,ENOVATE,2019-04-15,4
MEGAZONE,2.0,16-08-2022,South Korea,Seoul,Internet software & services,Salesforce Ventures,MEGAZONE,2022-08-16,1
MEGAZONE,2.0,16-08-2022,South Korea,Seoul,Internet software & services,ATP Investment,MEGAZONE,2022-08-16,1
MEGAZONE,2.0,16-08-2022,South Korea,Seoul,Internet software & services,kt investment,MEGAZONE,2022-08-16,1
CFGI,2.0,15-09-2021,United States,Boston,Fintech,The Carlyle Group,CFGI,2021-09-15,2
CFGI,2.0,15-09-2021,United States,Boston,Fintech,CVC Capital Partners,CFGI,2021-09-15,2
ZocDoc,2.0,20-08-2015,United States,New York,Health,Founders Fund,ZOCDOC,2015-08-20,8
ZocDoc,2.0,20-08-2015,United States,New York,Health,Khosla Ventures,ZOCDOC,2015-08-20,8
ZocDoc,2.0,20-08-2015,United States,New York,Health,Goldman Sachs,ZOCDOC,2015-08-20,8
Scroll,2.0,14-03-2023,Seychelles,Unknown,Fintech,OKX Ventures,SCROLL,2023-03-14,0
Scroll,2.0,14-03-2023,Seychelles,Unknown,Fintech,Sequoia Capital China,SCROLL,2023-03-14,0
Scroll,2.0,14-03-2023,Seychelles,Unknown,Fintech,IOSG,SCROLL,2023-03-14,0
Diamond Foundry,2.0,29-03-2021,United States,San Francisco,Other,Fashion Tech Lab,DIAMOND FOUNDRY,2021-03-29,2
Diamond Foundry,2.0,29-03-2021,United States,San Francisco,Other,Fidelity Investments,DIAMOND FOUNDRY,2021-03-29,2
Diamond Foundry,2.0,29-03-2021,United States,San Francisco,Other,Vast Ventures,DIAMOND FOUNDRY,2021-03-29,2
FullStory,2.0,04-08-2021,United States,Atlanta,Internet software & services,Google Ventures,FULLSTORY,2021-08-04,2
FullStory,2.0,04-08-2021,United States,Atlanta,Internet software & services,Kleiner Perkins Caufield & Byers,FULLSTORY,2021-08-04,2
FullStory,2.0,04-08-2021,United States,Atlanta,Internet software & services,Stripes Group,FULLSTORY,2021-08-04,2
Lightricks,2.0,31-07-2019,Israel,Jerusalem,Artificial intelligence,Viola Ventures,LIGHTRICKS,2019-07-31,4
Lightricks,2.0,31-07-2019,Israel,Jerusalem,Artificial intelligence,Insight Partners,LIGHTRICKS,2019-07-31,4
Lightricks,2.0,31-07-2019,Israel,Jerusalem,Artificial intelligence,ClalTech,LIGHTRICKS,2019-07-31,4
Lightricks,2.0,31-07-2019,Israel,Jerusalem,Artificial intelligence,Goldman Sachs,LIGHTRICKS,2019-07-31,4
Opentrons,2.0,23-09-2021,United States,New York,Hardware,SOSV,OPENTRONS,2021-09-23,2
Opentrons,2.0,23-09-2021,United States,New York,Hardware,Khosla Ventures,OPENTRONS,2021-09-23,2
Opentrons,2.0,23-09-2021,United States,New York,Hardware,Lerer Hippeau,OPENTRONS,2021-09-23,2
Kindbody,2.0,02-03-2023,United States,Kindbody,Health,RRE Ventures,KINDBODY,2023-03-02,0
Kindbody,2.0,02-03-2023,United States,Kindbody,Health,Google Ventures,KINDBODY,2023-03-02,0
Kindbody,2.0,02-03-2023,United States,Kindbody,Health,Bramalea Partners,KINDBODY,2023-03-02,0
Slice,2.0,28-11-2021,India,Bengaluru,Fintech,Gunosy Capital,SLICE,2021-11-28,2
Slice,2.0,28-11-2021,India,Bengaluru,Fintech,Blume Ventures,SLICE,2021-11-28,2
Slice,2.0,28-11-2021,India,Bengaluru,Fintech,Das Capital,SLICE,2021-11-28,2
Cambrian BioPharma,2.0,26-10-2021,United States,Brooklyn,Health,Future Ventures,CAMBRIAN BIOPHARMA,2021-10-26,2
Cambrian BioPharma,2.0,26-10-2021,United States,Brooklyn,Health,Apeiron Investment Group,CAMBRIAN BIOPHARMA,2021-10-26,2
Cambrian BioPharma,2.0,26-10-2021,United States,Brooklyn,Health,Moore Capital Management,CAMBRIAN BIOPHARMA,2021-10-26,2
AIWAYS,2.0,16-04-2018,China,Shanghai,Auto & transportation,Jiangsu Sha Steel Group,AIWAYS,2018-04-16,5
AIWAYS,2.0,16-04-2018,China,Shanghai,Auto & transportation,Shanghai Puyin Industry,AIWAYS,2018-04-16,5
AIWAYS,2.0,16-04-2018,China,Shanghai,Auto & transportation,Funa Yuanchuang Technology,AIWAYS,2018-04-16,5
Trulioo,2.0,07-06-2021,Canada,Vancouver,Cybersecurity,Blumberg Capital,TRULIOO,2021-06-07,2
Trulioo,2.0,07-06-2021,Canada,Vancouver,Cybersecurity,American Express Ventures,TRULIOO,2021-06-07,2
Trulioo,2.0,07-06-2021,Canada,Vancouver,Cybersecurity,BDC Venture Capital,TRULIOO,2021-06-07,2
Spinny,2.0,24-11-2021,India,Gurugram,E-commerce & direct-to-consumer,General Catalyst,SPINNY,2021-11-24,2
Spinny,2.0,24-11-2021,India,Gurugram,E-commerce & direct-to-consumer,Eleation Capital,SPINNY,2021-11-24,2
Spinny,2.0,24-11-2021,India,Gurugram,E-commerce & direct-to-consumer,Avenir Growth Capital,SPINNY,2021-11-24,2
Crusoe,2.0,21-04-2022,United States,Denver,Internet software & services,Bain Capital Ventures,CRUSOE,2022-04-21,1
Crusoe,2.0,21-04-2022,United States,Denver,Internet software & services,Founders Fund,CRUSOE,2022-04-21,1
Crusoe,2.0,21-04-2022,United States,Denver,Internet software & services,Winklevoss Capital,CRUSOE,2022-04-21,1
Orca Security,2.0,23-03-2021,United States,Portland,Cybersecurity,YL Ventures,ORCA SECURITY,2021-03-23,2
Orca Security,2.0,23-03-2021,United States,Portland,Cybersecurity,Redpoint Ventures,ORCA SECURITY,2021-03-23,2
Orca Security,2.0,23-03-2021,United States,Portland,Cybersecurity,GGV Capital,ORCA SECURITY,2021-03-23,2
Apus Group,2.0,16-01-2015,China,Beijing,Mobile & telecommunications,Redpoint Ventures,APUS GROUP,2015-01-16,8
Apus Group,2.0,16-01-2015,China,Beijing,Mobile & telecommunications,QiMing Venture Partners,APUS GROUP,2015-01-16,8
Apus Group,2.0,16-01-2015,China,Beijing,Mobile & telecommunications,Chengwei Capital,APUS GROUP,2015-01-16,8
AlphaSense,2.0,15-06-2022,United States,New York,Artificial intelligence,Viking Global Investors,ALPHASENSE,2022-06-15,1
AlphaSense,2.0,15-06-2022,United States,New York,Artificial intelligence,GS Growth,ALPHASENSE,2022-06-15,1
AlphaSense,2.0,15-06-2022,United States,New York,Artificial intelligence,BlackRock,ALPHASENSE,2022-06-15,1
Harry's,2.0,16-02-2018,United States,New York,Consumer & retail,Thrive Capital,HARRY'S,2018-02-16,5
Harry's,2.0,16-02-2018,United States,New York,Consumer & retail,Tiger Global Management,HARRY'S,2018-02-16,5
Harry's,2.0,16-02-2018,United States,New York,Consumer & retail,Temasek,HARRY'S,2018-02-16,5
PAX,2.0,22-10-2018,United States,San Francisco,Consumer & retail,Tao Capital Partners,PAX,2018-10-22,5
PAX,2.0,22-10-2018,United States,San Francisco,Consumer & retail,Global Asset Capital,PAX,2018-10-22,5
PAX,2.0,22-10-2018,United States,San Francisco,Consumer & retail,Tiger Global Management,PAX,2018-10-22,5
DispatchHealth,2.0,03-03-2021,United States,Denver,Health,Alta Partners,DISPATCHHEALTH,2021-03-03,2
DispatchHealth,2.0,03-03-2021,United States,Denver,Health,Questa Capital,DISPATCHHEALTH,2021-03-03,2
DispatchHealth,2.0,03-03-2021,United States,Denver,Health,Echo Health Ventures,DISPATCHHEALTH,2021-03-03,2
Pax8,2.0,11-04-2022,United States,Greenwood Village,Internet software & services,Liberty Global Ventures,PAX8,2022-04-11,1
Pax8,2.0,11-04-2022,United States,Greenwood Village,Internet software & services,Sageview Capital,PAX8,2022-04-11,1
Pax8,2.0,11-04-2022,United States,Greenwood Village,Internet software & services,Blue Cloud Ventures,PAX8,2022-04-11,1
Multiverse,2.0,08-06-2022,United Kingdom,London,Edtech,Lightspeed Venture Partners,MULTIVERSE,2022-06-08,1
Multiverse,2.0,08-06-2022,United Kingdom,London,Edtech,Google Ventures,MULTIVERSE,2022-06-08,1
Multiverse,2.0,08-06-2022,United Kingdom,London,Edtech,General Catalyst,MULTIVERSE,2022-06-08,1
Front,2.0,28-06-2022,United States,San Francisco,Internet software & services,Sequoia Capital,FRONT,2022-06-28,1
Front,2.0,28-06-2022,United States,San Francisco,Internet software & services,Uncork Capital,FRONT,2022-06-28,1
Front,2.0,28-06-2022,United States,San Francisco,Internet software & services,Salesforce Ventures,FRONT,2022-06-28,1
Redesign Health,2.0,13-09-2022,United States,New York,Health,General Catalyst,REDESIGN HEALTH,2022-09-13,1
Redesign Health,2.0,13-09-2022,United States,New York,Health,Samsung NEXT,REDESIGN HEALTH,2022-09-13,1
Redesign Health,2.0,13-09-2022,United States,New York,Health,CVS Health Partners,REDESIGN HEALTH,2022-09-13,1
Tessera Therapeutics,2.0,19-04-2022,United States,Cambridge,Health,Altitude Life Science Ventures,TESSERA THERAPEUTICS,2022-04-19,1
Tessera Therapeutics,2.0,19-04-2022,United States,Cambridge,Health,SoftBank Group,TESSERA THERAPEUTICS,2022-04-19,1
Tessera Therapeutics,2.0,19-04-2022,United States,Cambridge,Health,Alaska Permanent Fund,TESSERA THERAPEUTICS,2022-04-19,1
Uniswap,2.0,13-10-2022,United States,New York,Fintech,A16z Crypto,UNISWAP,2022-10-13,1
Uniswap,2.0,13-10-2022,United States,New York,Fintech,Variant Fund,UNISWAP,2022-10-13,1
Uniswap,2.0,13-10-2022,United States,New York,Fintech,Paradigm,UNISWAP,2022-10-13,1
FinAccel,2.0,15-08-2022,Singapore,Unknown,Fintech,Jungle Ventures,FINACCEL,2022-08-15,1
FinAccel,2.0,15-08-2022,Singapore,Unknown,Fintech,Square Peg Capital,FINACCEL,2022-08-15,1
FinAccel,2.0,15-08-2022,Singapore,Unknown,Fintech,OpenSpace Ventures,FINACCEL,2022-08-15,1
Unite Us,2.0,16-03-2021,United States,New York,Health,Insight Partners,UNITE US,2021-03-16,2
Unite Us,2.0,16-03-2021,United States,New York,Health,Sequoia Capital,UNITE US,2021-03-16,2
Unite Us,2.0,16-03-2021,United States,New York,Health,Index Ventures,UNITE US,2021-03-16,2
CircleCI,2.0,11-05-2021,United States,San Francisco,Internet software & services,Threshold Ventures,CIRCLECI,2021-05-11,2
CircleCI,2.0,11-05-2021,United States,San Francisco,Internet software & services,Baseline Ventures,CIRCLECI,2021-05-11,2
CircleCI,2.0,11-05-2021,United States,San Francisco,Internet software & services,Harrison Metal,CIRCLECI,2021-05-11,2
Wave,2.0,07-09-2021,Senegal,Dakar,Fintech,Stripe,WAVE,2021-09-07,2
Wave,2.0,07-09-2021,Senegal,Dakar,Fintech,Founders Fund,WAVE,2021-09-07,2
Wave,2.0,07-09-2021,Senegal,Dakar,Fintech,Partech Partners,WAVE,2021-09-07,2
Vestiaire Collective,2.0,01-03-2021,France,Paris,E-commerce & direct-to-consumer,Eurazeo,VESTIAIRE COLLECTIVE,2021-03-01,2
Vestiaire Collective,2.0,01-03-2021,France,Paris,E-commerce & direct-to-consumer,IDInvest Partners,VESTIAIRE COLLECTIVE,2021-03-01,2
Vestiaire Collective,2.0,01-03-2021,France,Paris,E-commerce & direct-to-consumer,Balderton Capital,VESTIAIRE COLLECTIVE,2021-03-01,2
Dragos,2.0,28-10-2021,United States,Hanover,Cybersecurity,DataTribe,DRAGOS,2021-10-28,2
Dragos,2.0,28-10-2021,United States,Hanover,Cybersecurity,Energy Impact Partners,DRAGOS,2021-10-28,2
Dragos,2.0,28-10-2021,United States,Hanover,Cybersecurity,AllegisCyber Capital,DRAGOS,2021-10-28,2
Reltio,2.0,04-11-2021,United States,Redwood City,Data management & analytics,Crosslink Capital,RELTIO,2021-11-04,2
Reltio,2.0,04-11-2021,United States,Redwood City,Data management & analytics,.406 Ventures,RELTIO,2021-11-04,2
Reltio,2.0,04-11-2021,United States,Redwood City,Data management & analytics,Sapphire Ventures,RELTIO,2021-11-04,2
H2O.ai,2.0,07-11-2021,United States,Mountain View,Artificial intelligence,Nexus Venture Partners,H2O.AI,2021-11-07,2
H2O.ai,2.0,07-11-2021,United States,Mountain View,Artificial intelligence,Transamerica Ventures,H2O.AI,2021-11-07,2
H2O.ai,2.0,07-11-2021,United States,Mountain View,Artificial intelligence,Crane Venture Partners,H2O.AI,2021-11-07,2
ZenBusiness,2.0,09-11-2021,United States,Austin,Fintech,Greycroft,ZENBUSINESS,2021-11-09,2
ZenBusiness,2.0,09-11-2021,United States,Austin,Fintech,Lerer Hippeau,ZENBUSINESS,2021-11-09,2
ZenBusiness,2.0,09-11-2021,United States,Austin,Fintech,Geekdom Fund,ZENBUSINESS,2021-11-09,2
Carsome,2.0,12-07-2021,Malaysia,Selangor,E-commerce & direct-to-consumer,Gobi Partners,CARSOME,2021-07-12,2
Carsome,2.0,12-07-2021,Malaysia,Selangor,E-commerce & direct-to-consumer,500 Startups,CARSOME,2021-07-12,2
Carsome,2.0,12-07-2021,Malaysia,Selangor,E-commerce & direct-to-consumer,Ondine Capital,CARSOME,2021-07-12,2
Productboard,2.0,02-02-2022,United States,San Francisco,Internet software & services,Index Ventures,PRODUCTBOARD,2022-02-02,1
Productboard,2.0,02-02-2022,United States,San Francisco,Internet software & services,Kleiner Perkins Caufield & Byers,PRODUCTBOARD,2022-02-02,1
Productboard,2.0,02-02-2022,United States,San Francisco,Internet software & services,Bessemer Venture Partners,PRODUCTBOARD,2022-02-02,1
Spotter,2.0,16-02-2022,United States,Los Angeles,Fintech,SoftBank Group,SPOTTER,2022-02-16,1
Spotter,2.0,16-02-2022,United States,Los Angeles,Fintech,Access Industries,SPOTTER,2022-02-16,1
Spotter,2.0,16-02-2022,United States,Los Angeles,Fintech,Crossbeam Venture Partners,SPOTTER,2022-02-16,1
Optimism,2.0,17-03-2022,United States,San Francisco,Internet software & services,Paradigm,OPTIMISM,2022-03-17,1
Optimism,2.0,17-03-2022,United States,San Francisco,Internet software & services,Huobi Ventures,OPTIMISM,2022-03-17,1
Optimism,2.0,17-03-2022,United States,San Francisco,Internet software & services,Andreessen Horowitz,OPTIMISM,2022-03-17,1
Incredible Health,2.0,17-08-2022,United States,San Francisco,Health,Obvious Ventures,INCREDIBLE HEALTH,2022-08-17,1
Incredible Health,2.0,17-08-2022,United States,San Francisco,Health,Andreessen Horowitz,INCREDIBLE HEALTH,2022-08-17,1
Incredible Health,2.0,17-08-2022,United States,San Francisco,Health,NFX,INCREDIBLE HEALTH,2022-08-17,1
Jusfoun Big Data,2.0,09-07-2018,China,Beijing,Data management & analytics,Boxin Capital,JUSFOUN BIG DATA,2018-07-09,5
Jusfoun Big Data,2.0,09-07-2018,China,Beijing,Data management & analytics,DT Capital Partners,JUSFOUN BIG DATA,2018-07-09,5
Jusfoun Big Data,2.0,09-07-2018,China,Beijing,Data management & analytics,IDG Capital,JUSFOUN BIG DATA,2018-07-09,5
Transcarent,2.0,11-01-2022,United States,San Francisco,Health,Alta Partners,TRANSCARENT,2022-01-11,1
Transcarent,2.0,11-01-2022,United States,San Francisco,Health,General Catalyst,TRANSCARENT,2022-01-11,1
Transcarent,2.0,11-01-2022,United States,San Francisco,Health,Jove Equity Partners,TRANSCARENT,2022-01-11,1
DealShare,2.0,27-01-2022,India,Bengaluru,E-commerce & direct-to-consumer,Alpha Wave Global,DEALSHARE,2022-01-27,1
DealShare,2.0,27-01-2022,India,Bengaluru,E-commerce & direct-to-consumer,Matrix Partners India,DEALSHARE,2022-01-27,1
DealShare,2.0,27-01-2022,India,Bengaluru,E-commerce & direct-to-consumer,Tiger Global Management,DEALSHARE,2022-01-27,1
Zhubajie,2.0,16-06-2015,China,Chongqing,Internet software & services,Cybernaut Growth Fund,ZHUBAJIE,2015-06-16,8
Zhubajie,2.0,16-06-2015,China,Chongqing,Internet software & services,IDG Capital,ZHUBAJIE,2015-06-16,8
solarisBank,2.0,13-07-2021,Germany,Berlin,Fintech,Yabeo Capital,SOLARISBANK,2021-07-13,2
solarisBank,2.0,13-07-2021,Germany,Berlin,Fintech,SBI Investment,SOLARISBANK,2021-07-13,2
solarisBank,2.0,13-07-2021,Germany,Berlin,Fintech,Vulcan Capital,SOLARISBANK,2021-07-13,2
DataStax,2.0,26-05-2021,United States,Santa Clara,Data management & analytics,Crosslink Capital,DATASTAX,2021-05-26,2
DataStax,2.0,26-05-2021,United States,Santa Clara,Data management & analytics,Meritech Capital Partners,DATASTAX,2021-05-26,2
DataStax,2.0,26-05-2021,United States,Santa Clara,Data management & analytics,Lightspeed Venture Partners,DATASTAX,2021-05-26,2
Infinidat,2.0,29-04-2015,United States,Waltham,Hardware,TPG Growth,INFINIDAT,2015-04-29,8
Infinidat,2.0,29-04-2015,United States,Waltham,Hardware,Goldman Sachs,INFINIDAT,2015-04-29,8
Afiniti,2.0,14-04-2017,Bermuda,Hamilton,Artificial intelligence,GAM Holding,AFINITI,2017-04-14,6
Cao Cao Mobility,2.0,17-01-2018,China,Hangzhou,Auto & transportation,People Electrical Appliance Group China,CAO CAO MOBILITY,2018-01-17,5
Cao Cao Mobility,2.0,17-01-2018,China,Hangzhou,Auto & transportation,Zhongrong International Trust,CAO CAO MOBILITY,2018-01-17,5
Clari,2.0,03-03-2021,United States,Sunnyvale,Internet software & services,Sequoia Capital,CLARI,2021-03-03,2
Clari,2.0,03-03-2021,United States,Sunnyvale,Internet software & services,Bain Capital Ventures,CLARI,2021-03-03,2
Clari,2.0,03-03-2021,United States,Sunnyvale,Internet software & services,enaya Capital,CLARI,2021-03-03,2
Tonal,2.0,31-03-2021,United States,San Francisco,E-commerce & direct-to-consumer,Mayfield Fund,TONAL,2021-03-31,2
Tonal,2.0,31-03-2021,United States,San Francisco,E-commerce & direct-to-consumer,Shasta Ventures,TONAL,2021-03-31,2
Tonal,2.0,31-03-2021,United States,San Francisco,E-commerce & direct-to-consumer,L Catterton,TONAL,2021-03-31,2
Clio,2.0,27-04-2021,Canada,Burnaby,Internet software & services,OMERS Private Equity,CLIO,2021-04-27,2
Clio,2.0,27-04-2021,Canada,Burnaby,Internet software & services,T. Rowe Price,CLIO,2021-04-27,2
Clio,2.0,27-04-2021,Canada,Burnaby,Internet software & services,Technology Crossover Ventures,CLIO,2021-04-27,2
SafetyCulture,2.0,03-05-2021,Australia,Sydney,Internet software & services,Blackbird Ventures,SAFETYCULTURE,2021-05-03,2
SafetyCulture,2.0,03-05-2021,Australia,Sydney,Internet software & services,IndexVentures,SAFETYCULTURE,2021-05-03,2
SafetyCulture,2.0,03-05-2021,Australia,Sydney,Internet software & services,Tiger Global Management,SAFETYCULTURE,2021-05-03,2
Monte Carlo,2.0,24-05-2022,United States,San Francisco,Artificial intelligence,GGV Capital,MONTE CARLO,2022-05-24,1
Monte Carlo,2.0,24-05-2022,United States,San Francisco,Artificial intelligence,Accel,MONTE CARLO,2022-05-24,1
Monte Carlo,2.0,24-05-2022,United States,San Francisco,Artificial intelligence,Redpoint Ventures,MONTE CARLO,2022-05-24,1
Cresta,2.0,17-03-2022,United States,San Francisco,Artificial Intelligence,Andreessen Horowitz,CRESTA,2022-03-17,1
Cresta,2.0,17-03-2022,United States,San Francisco,Artificial Intelligence,Greylock Partners,CRESTA,2022-03-17,1
Cresta,2.0,17-03-2022,United States,San Francisco,Artificial Intelligence,Sequoia Capital,CRESTA,2022-03-17,1
Extend,2.0,18-05-2021,United States,San Francisco,Fintech,GreatPoint Ventures,EXTEND,2021-05-18,2
Extend,2.0,18-05-2021,United States,San Francisco,Fintech,Meritech Capital Partners,EXTEND,2021-05-18,2
Extend,2.0,18-05-2021,United States,San Francisco,Fintech,PayPal Ventures,EXTEND,2021-05-18,2
Generate Biomedicines,2.0,18-11-2021,United States,Cambridge,Health,Altitude Life Science Ventures. T. Rowe Price,GENERATE BIOMEDICINES,2021-11-18,2
Generate Biomedicines,2.0,18-11-2021,United States,Cambridge,Health,Morningside Venture Partners,GENERATE BIOMEDICINES,2021-11-18,2
Cognite,2.0,19-05-2021,Norway,Lysaker,Data management & analytics,Technology Crossover Ventures,COGNITE,2021-05-19,2
Cognite,2.0,19-05-2021,Norway,Lysaker,Data management & analytics,Accel,COGNITE,2021-05-19,2
Cognite,2.0,19-05-2021,Norway,Lysaker,Data management & analytics,Aker,COGNITE,2021-05-19,2
ASAPP,2.0,19-05-2021,United States,New York,Artificial intelligence,March Capital Partners,ASAPP,2021-05-19,2
ASAPP,2.0,19-05-2021,United States,New York,Artificial intelligence,HOF Capital,ASAPP,2021-05-19,2
ASAPP,2.0,19-05-2021,United States,New York,Artificial intelligence,Emergence Capital Partners,ASAPP,2021-05-19,2
SmartHR,2.0,08-06-2021,Japan,Tokyo,Fintech,BEENEXT,SMARTHR,2021-06-08,2
SmartHR,2.0,08-06-2021,Japan,Tokyo,Fintech,World Innovation Lab,SMARTHR,2021-06-08,2
SmartHR,2.0,08-06-2021,Japan,Tokyo,Fintech,Light Street Capital,SMARTHR,2021-06-08,2
Mercury,2.0,03-07-2021,United States,San Francisco,Fintech,Andreessen Horowitz,MERCURY,2021-07-03,2
Mercury,2.0,03-07-2021,United States,San Francisco,Fintech,Coatue Management,MERCURY,2021-07-03,2
Mercury,2.0,03-07-2021,United States,San Francisco,Fintech,Clocktower Technology Ventures,MERCURY,2021-07-03,2
HomeLight,2.0,02-09-2021,United States,San Francisco,Fintech,Zeev Ventures,HOMELIGHT,2021-09-02,2
HomeLight,2.0,02-09-2021,United States,San Francisco,Fintech,Menlo Ventures,HOMELIGHT,2021-09-02,2
HomeLight,2.0,02-09-2021,United States,San Francisco,Fintech,Crosslink Capital,HOMELIGHT,2021-09-02,2
Truepill,2.0,27-10-2021,United States,Hayward,Health,Initialized Capital,TRUEPILL,2021-10-27,2
Truepill,2.0,27-10-2021,United States,Hayward,Health,Sound Ventures,TRUEPILL,2021-10-27,2
Truepill,2.0,27-10-2021,United States,Hayward,Health,TI Platform Management,TRUEPILL,2021-10-27,2
ezCater,2.0,02-04-2019,United States,Boston,"Supply chain, logistics, & delivery",Insight Venture Partners,EZCATER,2019-04-02,4
ezCater,2.0,02-04-2019,United States,Boston,"Supply chain, logistics, & delivery",ICONIQ Capital,EZCATER,2019-04-02,4
ezCater,2.0,02-04-2019,United States,Boston,"Supply chain, logistics, & delivery",Launchpad Venture Group,EZCATER,2019-04-02,4
Wayflyer,2.0,01-02-2022,Ireland,Dublin,Fintech,QED Investors,WAYFLYER,2022-02-01,1
Wayflyer,2.0,01-02-2022,Ireland,Dublin,Fintech,DST Global,WAYFLYER,2022-02-01,1
Wayflyer,2.0,01-02-2022,Ireland,Dublin,Fintech,Left Lane Capital,WAYFLYER,2022-02-01,1
Capitolis,2.0,22-03-2022,United States,New York,Fintech,Sequoia Capital,CAPITOLIS,2022-03-22,1
Capitolis,2.0,22-03-2022,United States,New York,Fintech,Index Ventures,CAPITOLIS,2022-03-22,1
Capitolis,2.0,22-03-2022,United States,New York,Fintech,S Capital,CAPITOLIS,2022-03-22,1
Nord Security,2.0,07-04-2022,Lithuania,Vilnius,Cybersecurity,General Catalyst,NORD SECURITY,2022-04-07,1
Nord Security,2.0,07-04-2022,Lithuania,Vilnius,Cybersecurity,BaltCap,NORD SECURITY,2022-04-07,1
Nord Security,2.0,07-04-2022,Lithuania,Vilnius,Cybersecurity,Novator Partners,NORD SECURITY,2022-04-07,1
Vanta,1.0,07-06-2022,United States,San Francisco,Cybersecurity,Craft Ventures,VANTA,2022-06-07,1
Vanta,1.0,07-06-2022,United States,San Francisco,Cybersecurity,Sequoia Capital,VANTA,2022-06-07,1
Vanta,1.0,07-06-2022,United States,San Francisco,Cybersecurity,Verissimo Ventures,VANTA,2022-06-07,1
Magic Eden,1.0,21-06-2022,United States,San Francisco,Fintech,Sequoia Capital,MAGIC EDEN,2022-06-21,1
Magic Eden,1.0,21-06-2022,United States,San Francisco,Fintech,Lightspeed Venture Partners,MAGIC EDEN,2022-06-21,1
Magic Eden,1.0,21-06-2022,United States,San Francisco,Fintech,Paradigm,MAGIC EDEN,2022-06-21,1
Pave,1.0,28-06-2022,United States,San Francisco,Internet software & services,Y Combinator,PAVE,2022-06-28,1
Pave,1.0,28-06-2022,United States,San Francisco,Internet software & services,Andreessen Horowitz,PAVE,2022-06-28,1
Pave,1.0,28-06-2022,United States,San Francisco,Internet software & services,Bessemer Venture Partners,PAVE,2022-06-28,1
Promasidor Holdings,1.0,08-11-2016,South Africa,Bryanston,Consumer & retail,IFC,PROMASIDOR HOLDINGS,2016-11-08,7
Promasidor Holdings,1.0,08-11-2016,South Africa,Bryanston,Consumer & retail,Ajinomoto,PROMASIDOR HOLDINGS,2016-11-08,7
GalaxySpace,1.0,17-11-2020,China,Beijing,Mobile & telecommunications,Shunwei Capital Partners,GALAXYSPACE,2020-11-17,3
GalaxySpace,1.0,17-11-2020,China,Beijing,Mobile & telecommunications,5Y Capital,GALAXYSPACE,2020-11-17,3
GalaxySpace,1.0,17-11-2020,China,Beijing,Mobile & telecommunications,Legend Capital,GALAXYSPACE,2020-11-17,3
Icon,1.0,18-02-2022,United States,Austin,Hardware,Moderne Ventures,ICON,2022-02-18,1
Icon,1.0,18-02-2022,United States,Austin,Hardware,Oakhouse Partners,ICON,2022-02-18,1
Icon,1.0,18-02-2022,United States,Austin,Hardware,Bjarke Ingels Group,ICON,2022-02-18,1
Fresh Life Style Supply Chain Management,1.0,11-03-2022,China,Chengdu,"Supply chain, logistics, & delivery",Guiyang Venture Capital,FRESH LIFE STYLE SUPPLY CHAIN MANAGEMENT,2022-03-11,1
Fresh Life Style Supply Chain Management,1.0,11-03-2022,China,Chengdu,"Supply chain, logistics, & delivery",Longfor Capital,FRESH LIFE STYLE SUPPLY CHAIN MANAGEMENT,2022-03-11,1
Fresh Life Style Supply Chain Management,1.0,11-03-2022,China,Chengdu,"Supply chain, logistics, & delivery",CAOGENZHIBEN GROUP,FRESH LIFE STYLE SUPPLY CHAIN MANAGEMENT,2022-03-11,1
Alloy,1.0,30-09-2021,United States,New York,Fintech,Bessemer Venture Partners,ALLOY,2021-09-30,2
Alloy,1.0,30-09-2021,United States,New York,Fintech,Eniac Ventures,ALLOY,2021-09-30,2
Alloy,1.0,30-09-2021,United States,New York,Fintech,Canapi Ventures,ALLOY,2021-09-30,2
Baiwang,1.0,25-03-2019,China,Beijing,Fintech,Guozhong Venture Capital Management,BAIWANG,2019-03-25,4
Baiwang,1.0,25-03-2019,China,Beijing,Fintech,Shenzhen Capital Group,BAIWANG,2019-03-25,4
Baiwang,1.0,25-03-2019,China,Beijing,Fintech,Oriental Fortune Capital,BAIWANG,2019-03-25,4
Iluvatar CoreX,1.0,01-03-2021,China,Shanghai,Hardware,Centurium Capital,ILUVATAR COREX,2021-03-01,2
Iluvatar CoreX,1.0,01-03-2021,China,Shanghai,Hardware,Cedarlake Capital,ILUVATAR COREX,2021-03-01,2
Iluvatar CoreX,1.0,01-03-2021,China,Shanghai,Hardware,Unicom Innovation Venture Capital,ILUVATAR COREX,2021-03-01,2
Wenheyou,1.0,17-04-2021,China,Hunan,Other,Sequoia Capital China,WENHEYOU,2021-04-17,2
Wenheyou,1.0,17-04-2021,China,Hunan,Other,Warburg Pincus,WENHEYOU,2021-04-17,2
Wenheyou,1.0,17-04-2021,China,Hunan,Other,IDG Capital,WENHEYOU,2021-04-17,2
Kitopi,1.0,01-07-2021,United Arab Emirates,Dubai,"Supply chain, logistics, & delivery",CE-Ventures,KITOPI,2021-07-01,2
Kitopi,1.0,01-07-2021,United Arab Emirates,Dubai,"Supply chain, logistics, & delivery",BECO Capital,KITOPI,2021-07-01,2
Kitopi,1.0,01-07-2021,United Arab Emirates,Dubai,"Supply chain, logistics, & delivery",Nordstar,KITOPI,2021-07-01,2
Loom,1.0,20-05-2021,United States,San Francisco,Internet software & services,Kleiner Perkins Caufield & Byers,LOOM,2021-05-20,2
Loom,1.0,20-05-2021,United States,San Francisco,Internet software & services,Sequoia Capital,LOOM,2021-05-20,2
Loom,1.0,20-05-2021,United States,San Francisco,Internet software & services,General Catalyst,LOOM,2021-05-20,2
Ximalaya FM,1.0,22-09-2017,China,Shanghai,Mobile & telecommunications,China Creation Ventures,XIMALAYA FM,2017-09-22,6
Ximalaya FM,1.0,22-09-2017,China,Shanghai,Mobile & telecommunications,Sierra Ventures,XIMALAYA FM,2017-09-22,6
Ximalaya FM,1.0,22-09-2017,China,Shanghai,Mobile & telecommunications,Xingwang Investment Management,XIMALAYA FM,2017-09-22,6
Carzone,1.0,01-03-2019,China,Jiangsu,E-commerce & direct-to-consumer,Alibaba Group,CARZONE,2019-03-01,4
Carzone,1.0,01-03-2019,China,Jiangsu,E-commerce & direct-to-consumer,Co-Stone Venture Capital,CARZONE,2019-03-01,4
Carzone,1.0,01-03-2019,China,Jiangsu,E-commerce & direct-to-consumer,Buhuo Venture Capital,CARZONE,2019-03-01,4
OpenWeb,1.0,09-11-2021,United States,New York,Internet software & services,Insight Partners,OPENWEB,2021-11-09,2
OpenWeb,1.0,09-11-2021,United States,New York,Internet software & services,AltaIR Capital,OPENWEB,2021-11-09,2
OpenWeb,1.0,09-11-2021,United States,New York,Internet software & services,Norma Investments,OPENWEB,2021-11-09,2
bolttech,1.0,01-07-2021,Singapore,Unknown,Fintech,Mundi Ventures,BOLTTECH,2021-07-01,2
bolttech,1.0,01-07-2021,Singapore,Unknown,Fintech,Doqling Capital Partners,BOLTTECH,2021-07-01,2
bolttech,1.0,01-07-2021,Singapore,Unknown,Fintech,Activant Capital,BOLTTECH,2021-07-01,2
First Mode,1.0,07-12-2022,United States,Seattle,Other,Anglo American,FIRST MODE,2022-12-07,1
Bilt Rewards,1.0,25-10-2022,United States,New York,Fintech,Camber Creek,BILT REWARDS,2022-10-25,1
Bilt Rewards,1.0,25-10-2022,United States,New York,Fintech,Kairos HQ,BILT REWARDS,2022-10-25,1
Bilt Rewards,1.0,25-10-2022,United States,New York,Fintech,Fifth Wall Ventures,BILT REWARDS,2022-10-25,1
Mu Sigma,1.0,07-02-2013,United States,Northbrook,Data management & analytics,Sequoia Capital,MU SIGMA,2013-02-07,10
Mu Sigma,1.0,07-02-2013,United States,Northbrook,Data management & analytics,General Atlantic,MU SIGMA,2013-02-07,10
Kushki,1.0,07-06-2022,Ecuador,Quito,Fintech,Clocktower Technology Ventures,KUSHKI,2022-06-07,1
Kushki,1.0,07-06-2022,Ecuador,Quito,Fintech,DILA Capital,KUSHKI,2022-06-07,1
Kushki,1.0,07-06-2022,Ecuador,Quito,Fintech,Kaszek Ventures,KUSHKI,2022-06-07,1
Jasper,1.0,17-10-2022,United States,Austin,Artificial intelligence,Foundation Capital,JASPER,2022-10-17,1
Jasper,1.0,17-10-2022,United States,Austin,Artificial intelligence,Institutional Venture Partners,JASPER,2022-10-17,1
Jasper,1.0,17-10-2022,United States,Austin,Artificial intelligence,Founders Capital,JASPER,2022-10-17,1
Orna Therapeutics,1.0,16-08-2022,United States,Cambridge,Health,MPM Capital,ORNA THERAPEUTICS,2022-08-16,1
Orna Therapeutics,1.0,16-08-2022,United States,Cambridge,Health,Astellas Venture Management,ORNA THERAPEUTICS,2022-08-16,1
Orna Therapeutics,1.0,16-08-2022,United States,Cambridge,Health,F2 Ventures,ORNA THERAPEUTICS,2022-08-16,1
TuJia,1.0,17-06-2015,China,Beijing,Travel,GGV Capital,TUJIA,2015-06-17,8
TuJia,1.0,17-06-2015,China,Beijing,Travel,QiMing Venture Partnersl,TUJIA,2015-06-17,8
Mofang Living,1.0,13-04-2016,China,Shanghai,E-commerce & direct-to-consumer,Warburg Pincus,MOFANG LIVING,2016-04-13,7
Mofang Living,1.0,13-04-2016,China,Shanghai,E-commerce & direct-to-consumer,Aviation Industry Corporation of China,MOFANG LIVING,2016-04-13,7
Gett,1.0,24-05-2016,United Kingdom,London,Auto & transportation,Volkswagen,GETT,2016-05-24,7
Gett,1.0,24-05-2016,United Kingdom,London,Auto & transportation,Access Industries,GETT,2016-05-24,7
Gett,1.0,24-05-2016,United Kingdom,London,Auto & transportation,Vostok New Ventures,GETT,2016-05-24,7
DT Dream,1.0,08-06-2017,China,Hangzhou,Data management & analytics,Alibaba Group,DT DREAM,2017-06-08,6
DT Dream,1.0,08-06-2017,China,Hangzhou,Data management & analytics,China Everbright Investment Management,DT DREAM,2017-06-08,6
DT Dream,1.0,08-06-2017,China,Hangzhou,Data management & analytics,Yinxinggu Capital,DT DREAM,2017-06-08,6
Changingedu,1.0,30-10-2017,China,Shanghai,Edtech,Trustbridge Partners,CHANGINGEDU,2017-10-30,6
Changingedu,1.0,30-10-2017,China,Shanghai,Edtech,IDG Capital,CHANGINGEDU,2017-10-30,6
Changingedu,1.0,30-10-2017,China,Shanghai,Edtech,Sequoia Capital China,CHANGINGEDU,2017-10-30,6
XiaoZhu,1.0,01-11-2017,China,Beijing,Travel,Morningside Ventures,XIAOZHU,2017-11-01,6
XiaoZhu,1.0,01-11-2017,China,Beijing,Travel,Capital Today,XIAOZHU,2017-11-01,6
XiaoZhu,1.0,01-11-2017,China,Beijing,Travel,JOY Capital,XIAOZHU,2017-11-01,6
JOLLY Information Technology,1.0,29-05-2018,China,Hangzhou,E-commerce & direct-to-consumer,Legend Capital,JOLLY INFORMATION TECHNOLOGY,2018-05-29,5
JOLLY Information Technology,1.0,29-05-2018,China,Hangzhou,E-commerce & direct-to-consumer,CDH Investments,JOLLY INFORMATION TECHNOLOGY,2018-05-29,5
JOLLY Information Technology,1.0,29-05-2018,China,Hangzhou,E-commerce & direct-to-consumer,Sequoia Capital China,JOLLY INFORMATION TECHNOLOGY,2018-05-29,5
Yijiupi,1.0,20-09-2018,China,Beijing,Consumer & retail,Source Code Capital,YIJIUPI,2018-09-20,5
Yijiupi,1.0,20-09-2018,China,Beijing,Consumer & retail,Meituan Dianping,YIJIUPI,2018-09-20,5
Yijiupi,1.0,20-09-2018,China,Beijing,Consumer & retail,Tencent Holdings,YIJIUPI,2018-09-20,5
Cambridge Mobile Telematics,1.0,19-12-2018,United States,Cambridge,Auto & transportation,SoftBank Group,CAMBRIDGE MOBILE TELEMATICS,2018-12-19,5
Collective Health,1.0,17-06-2019,United States,San Francisco,Fintech,New Enterprise Associates,COLLECTIVE HEALTH,2019-06-17,4
Collective Health,1.0,17-06-2019,United States,San Francisco,Fintech,Founders Fund,COLLECTIVE HEALTH,2019-06-17,4
Collective Health,1.0,17-06-2019,United States,San Francisco,Fintech,Google Ventures,COLLECTIVE HEALTH,2019-06-17,4
Strava,1.0,16-11-2020,United States,San Francisco,Internet software & services,Jackson Square Ventures,STRAVA,2020-11-16,3
Strava,1.0,16-11-2020,United States,San Francisco,Internet software & services,Madrone Capital Partners,STRAVA,2020-11-16,3
Strava,1.0,16-11-2020,United States,San Francisco,Internet software & services,Sequoia Capital,STRAVA,2020-11-16,3
Zenoti,1.0,15-12-2020,United States,Bellevue,Internet software & services,Norwest Venture Partners,ZENOTI,2020-12-15,3
Zenoti,1.0,15-12-2020,United States,Bellevue,Internet software & services,Accel,ZENOTI,2020-12-15,3
Zenoti,1.0,15-12-2020,United States,Bellevue,Internet software & services,Tiger Global Management,ZENOTI,2020-12-15,3
K Health,1.0,19-01-2021,United States,New York,Health,Max Ventures,K HEALTH,2021-01-19,2
K Health,1.0,19-01-2021,United States,New York,Health,Mangrove Capital Partners,K HEALTH,2021-01-19,2
K Health,1.0,19-01-2021,United States,New York,Health,14W,K HEALTH,2021-01-19,2
Uplight,1.0,03-03-2021,United States,Boulder,Other,Rubicon Technology Partners,UPLIGHT,2021-03-03,2
Uplight,1.0,03-03-2021,United States,Boulder,Other,Max Ventures,UPLIGHT,2021-03-03,2
Uplight,1.0,03-03-2021,United States,Boulder,Other,Inclusive Capital Partners,UPLIGHT,2021-03-03,2
ID.me,1.0,19-03-2021,United States,McLean,Cybersecurity,Moonshots Capital,ID.ME,2021-03-19,2
ID.me,1.0,19-03-2021,United States,McLean,Cybersecurity,BoxGroup,ID.ME,2021-03-19,2
ID.me,1.0,19-03-2021,United States,McLean,Cybersecurity,Blu Venture Investors,ID.ME,2021-03-19,2
Snapdocs,1.0,25-05-2021,United States,San Francisco,Fintech,Sequoia Capital,SNAPDOCS,2021-05-25,2
Snapdocs,1.0,25-05-2021,United States,San Francisco,Fintech,Y Combinator,SNAPDOCS,2021-05-25,2
Snapdocs,1.0,25-05-2021,United States,San Francisco,Fintech,F-Prime Capital,SNAPDOCS,2021-05-25,2
Chipper Cash,1.0,31-05-2021,United States,San Francisco,Fintech,Deciens Capital,CHIPPER CASH,2021-05-31,2
Chipper Cash,1.0,31-05-2021,United States,San Francisco,Fintech,Bezos Expeditions,CHIPPER CASH,2021-05-31,2
Chipper Cash,1.0,31-05-2021,United States,San Francisco,Fintech,500 Startups,CHIPPER CASH,2021-05-31,2
Ledger,1.0,10-06-2021,France,Paris,Hardware,Digital Currency Group,LEDGER,2021-06-10,2
Ledger,1.0,10-06-2021,France,Paris,Hardware,Draper Esprit,LEDGER,2021-06-10,2
Ledger,1.0,10-06-2021,France,Paris,Hardware,Korelya Capital,LEDGER,2021-06-10,2
Next Silicon,1.0,14-06-2021,Israel,Tel Aviv,Hardware,Amiti Ventures,NEXT SILICON,2021-06-14,2
Next Silicon,1.0,14-06-2021,Israel,Tel Aviv,Hardware,Playground Global,NEXT SILICON,2021-06-14,2
Next Silicon,1.0,14-06-2021,Israel,Tel Aviv,Hardware,Aleph,NEXT SILICON,2021-06-14,2
YunQuNa,1.0,29-06-2021,China,Shanghai,"Supply chain, logistics, & delivery",Source Code Capital,YUNQUNA,2021-06-29,2
YunQuNa,1.0,29-06-2021,China,Shanghai,"Supply chain, logistics, & delivery",Coatue Management,YUNQUNA,2021-06-29,2
YunQuNa,1.0,29-06-2021,China,Shanghai,"Supply chain, logistics, & delivery",DCM Ventures,YUNQUNA,2021-06-29,2
impact.com,1.0,13-07-2021,United States,Santa Barbara,Internet software & services,Redpoint Ventures,IMPACT.COM,2021-07-13,2
impact.com,1.0,13-07-2021,United States,Santa Barbara,Internet software & services,Providence Equity Partners,IMPACT.COM,2021-07-13,2
impact.com,1.0,13-07-2021,United States,Santa Barbara,Internet software & services,Silversmith Capital Partners,IMPACT.COM,2021-07-13,2
SmartRecruiters,1.0,20-07-2021,United States,San Francisco,Internet software & services,Mayfield Fund,SMARTRECRUITERS,2021-07-20,2
SmartRecruiters,1.0,20-07-2021,United States,San Francisco,Internet software & services,Insight Partners,SMARTRECRUITERS,2021-07-20,2
SmartRecruiters,1.0,20-07-2021,United States,San Francisco,Internet software & services,Rembrandt Venture Partners,SMARTRECRUITERS,2021-07-20,2
NotCo,1.0,26-07-2021,Chile,Santiago,Consumer & retail,Kaszek Ventures,NOTCO,2021-07-26,2
NotCo,1.0,26-07-2021,Chile,Santiago,Consumer & retail,SOSV,NOTCO,2021-07-26,2
NotCo,1.0,26-07-2021,Chile,Santiago,Consumer & retail,Tiger Global Management,NOTCO,2021-07-26,2
Culture Amp,1.0,29-07-2021,Australia,Richmond,Internet software & services,Felicis Ventures,CULTURE AMP,2021-07-29,2
Culture Amp,1.0,29-07-2021,Australia,Richmond,Internet software & services,Index Ventures,CULTURE AMP,2021-07-29,2
Culture Amp,1.0,29-07-2021,Australia,Richmond,Internet software & services,Blackbird Ventures,CULTURE AMP,2021-07-29,2
TaxBit,1.0,04-08-2021,United States,Draper,Fintech,Insight Partners,TAXBIT,2021-08-04,2
TaxBit,1.0,04-08-2021,United States,Draper,Fintech,Coinbase Ventures,TAXBIT,2021-08-04,2
TaxBit,1.0,04-08-2021,United States,Draper,Fintech,PayPal Ventures,TAXBIT,2021-08-04,2
Pacaso,1.0,24-03-2021,United States,Cincinnati,Fintech,Global Founders Capital,PACASO,2021-03-24,2
Pacaso,1.0,24-03-2021,United States,Cincinnati,Fintech,Shea Ventures,PACASO,2021-03-24,2
Pacaso,1.0,24-03-2021,United States,Cincinnati,Fintech,Greycroft,PACASO,2021-03-24,2
1047 Games,1.0,14-09-2021,United States,Zephyr Cove,Internet software & services,VGames,1047 GAMES,2021-09-14,2
1047 Games,1.0,14-09-2021,United States,Zephyr Cove,Internet software & services,Lakestar,1047 GAMES,2021-09-14,2
1047 Games,1.0,14-09-2021,United States,Zephyr Cove,Internet software & services,Galaxy Interactive,1047 GAMES,2021-09-14,2
Matillion,1.0,15-09-2021,United Kingdom,Altrincham,Data management & analytics,Scale Venture Partners,MATILLION,2021-09-15,2
Matillion,1.0,15-09-2021,United Kingdom,Altrincham,Data management & analytics,Sapphire Ventures,MATILLION,2021-09-15,2
Matillion,1.0,15-09-2021,United Kingdom,Altrincham,Data management & analytics,Battery Ventures,MATILLION,2021-09-15,2
Persona,1.0,15-09-2021,United States,San Francisco,Cybersecurity,Coatue Management,PERSONA,2021-09-15,2
Persona,1.0,15-09-2021,United States,San Francisco,Cybersecurity,Index Ventures,PERSONA,2021-09-15,2
Persona,1.0,15-09-2021,United States,San Francisco,Cybersecurity,Founders Fund,PERSONA,2021-09-15,2
Ascend Money,1.0,27-09-2021,Thailand,Bangkok,Fintech,Ant Group,ASCEND MONEY,2021-09-27,2
Ascend Money,1.0,27-09-2021,Thailand,Bangkok,Fintech,Charoen Pokphand Group,ASCEND MONEY,2021-09-27,2
Ascend Money,1.0,27-09-2021,Thailand,Bangkok,Fintech,Bow Wave Capital,ASCEND MONEY,2021-09-27,2
Andela,1.0,29-09-2021,United States,New York,Internet software & services,Spark Capital,ANDELA,2021-09-29,2
Andela,1.0,29-09-2021,United States,New York,Internet software & services,Google Ventures,ANDELA,2021-09-29,2
Andela,1.0,29-09-2021,United States,New York,Internet software & services,CRE Venture Capital,ANDELA,2021-09-29,2
Built,1.0,30-09-2021,United States,Nashville,Internet software & services,Nyca Partners,BUILT,2021-09-30,2
Built,1.0,30-09-2021,United States,Nashville,Internet software & services,Index Ventures,BUILT,2021-09-30,2
Built,1.0,30-09-2021,United States,Nashville,Internet software & services,Technology Crossover Ventures,BUILT,2021-09-30,2
CoinList,1.0,15-10-2021,United States,San Francisco,Fintech,Accomplice,COINLIST,2021-10-15,2
CoinList,1.0,15-10-2021,United States,San Francisco,Fintech,Polychain Capital,COINLIST,2021-10-15,2
CoinList,1.0,15-10-2021,United States,San Francisco,Fintech,GoldenTree Asset Management,COINLIST,2021-10-15,2
Lusha,1.0,10-11-2021,United States,New York,Internet software & services,PSG,LUSHA,2021-11-10,2
Lusha,1.0,10-11-2021,United States,New York,Internet software & services,ION Crossover Partners,LUSHA,2021-11-10,2
CureFit,1.0,10-11-2021,India,Bengaluru,Health,Chiratae Ventures,CUREFIT,2021-11-10,2
CureFit,1.0,10-11-2021,India,Bengaluru,Health,Accel,CUREFIT,2021-11-10,2
CureFit,1.0,10-11-2021,India,Bengaluru,Health,Kalaari Capital,CUREFIT,2021-11-10,2
Olist,1.0,15-12-2021,Brazil,Curitiba,E-commerce & direct-to-consumer,Redpoint e.ventures,OLIST,2021-12-15,2
Olist,1.0,15-12-2021,Brazil,Curitiba,E-commerce & direct-to-consumer,Valor Capital Group,OLIST,2021-12-15,2
Olist,1.0,15-12-2021,Brazil,Curitiba,E-commerce & direct-to-consumer,SoftBank Latin America Fund,OLIST,2021-12-15,2
Paradox,1.0,27-12-2021,United States,Scottsdale,Internet software & services,Brighton Park Capital,PARADOX,2021-12-27,2
Paradox,1.0,27-12-2021,United States,Scottsdale,Internet software & services,Blue Cloud Ventures,PARADOX,2021-12-27,2
Paradox,1.0,27-12-2021,United States,Scottsdale,Internet software & services,Workday Ventures,PARADOX,2021-12-27,2
Airbyte,1.0,17-12-2021,United States,San Francisco,Internet software & services,Accel,AIRBYTE,2021-12-17,2
Airbyte,1.0,17-12-2021,United States,San Francisco,Internet software & services,Benchmark,AIRBYTE,2021-12-17,2
Airbyte,1.0,17-12-2021,United States,San Francisco,Internet software & services,SV Angel,AIRBYTE,2021-12-17,2
StoreDot,1.0,04-01-2022,Israel,Herzliya,Other,Samsung Ventures,STOREDOT,2022-01-04,1
StoreDot,1.0,04-01-2022,Israel,Herzliya,Other,SingulariTeam,STOREDOT,2022-01-04,1
StoreDot,1.0,04-01-2022,Israel,Herzliya,Other,BP Ventures,STOREDOT,2022-01-04,1
Il Makiage,1.0,10-01-2022,United States,New York,E-commerce & direct-to-consumer,L Catterton,IL MAKIAGE,2022-01-10,1
Il Makiage,1.0,10-01-2022,United States,New York,E-commerce & direct-to-consumer,Franklin Templeton,IL MAKIAGE,2022-01-10,1
Il Makiage,1.0,10-01-2022,United States,New York,E-commerce & direct-to-consumer,First Light Capital Group,IL MAKIAGE,2022-01-10,1
Spendesk,1.0,18-01-2022,France,Paris,Fintech,Index Ventures,SPENDESK,2022-01-18,1
Spendesk,1.0,18-01-2022,France,Paris,Fintech,Eight Roads Ventures,SPENDESK,2022-01-18,1
Spendesk,1.0,18-01-2022,France,Paris,Fintech,General Atlantic,SPENDESK,2022-01-18,1
Veriff,1.0,26-01-2022,Estonia,Tallinn,Artificial intelligence,Accel,VERIFF,2022-01-26,1
Veriff,1.0,26-01-2022,Estonia,Tallinn,Artificial intelligence,Institutional Venture Partners,VERIFF,2022-01-26,1
Veriff,1.0,26-01-2022,Estonia,Tallinn,Artificial intelligence,Tiger Global Management,VERIFF,2022-01-26,1
Athelas,1.0,31-01-2022,United States,Mountain View,Health,Sequoia Capital,ATHELAS,2022-01-31,1
Athelas,1.0,31-01-2022,United States,Mountain View,Health,General Catalyst,ATHELAS,2022-01-31,1
Athelas,1.0,31-01-2022,United States,Mountain View,Health,Human Capital,ATHELAS,2022-01-31,1
ElasticRun,1.0,07-02-2022,India,Pune,"Supply chain, logistics, & delivery",Kalaari Capital,ELASTICRUN,2022-02-07,1
ElasticRun,1.0,07-02-2022,India,Pune,"Supply chain, logistics, & delivery",Norwest Venture Partners,ELASTICRUN,2022-02-07,1
ElasticRun,1.0,07-02-2022,India,Pune,"Supply chain, logistics, & delivery",Prosus Ventures,ELASTICRUN,2022-02-07,1
Veho,1.0,21-12-2021,United States,Boulder,"Supply chain, logistics, & delivery",General Catalyst,VEHO,2021-12-21,2
Veho,1.0,21-12-2021,United States,Boulder,"Supply chain, logistics, & delivery",Origin Ventures,VEHO,2021-12-21,2
Veho,1.0,21-12-2021,United States,Boulder,"Supply chain, logistics, & delivery",Fontinalis Partners,VEHO,2021-12-21,2
Temporales,1.0,16-02-2022,United States,Bellevue,Internet software & services,Amplify Partners,TEMPORALES,2022-02-16,1
Temporales,1.0,16-02-2022,United States,Bellevue,Internet software & services,Addition,TEMPORALES,2022-02-16,1
Temporales,1.0,16-02-2022,United States,Bellevue,Internet software & services,Madrona Venture Group,TEMPORALES,2022-02-16,1
Fabric,1.0,24-02-2022,United States,Bellevue,E-commerce & direct-to-consumer,Redpoint Ventures,FABRIC BELLEVUE,2022-02-24,1
Fabric,1.0,24-02-2022,United States,Bellevue,E-commerce & direct-to-consumer,Norwest Venture Partners,FABRIC BELLEVUE,2022-02-24,1
Fabric,1.0,24-02-2022,United States,Bellevue,E-commerce & direct-to-consumer,Sierra Ventures,FABRIC BELLEVUE,2022-02-24,1
Zeta,1.0,24-05-2021,United States,San Francisco,Fintech,Sodexo Ventures,ZETA,2021-05-24,2
Zeta,1.0,24-05-2021,United States,San Francisco,Fintech,SoftBank Group,ZETA,2021-05-24,2
Boba,1.0,05-04-2022,United States,San Francisco,Fintech,DeFi Technologies,BOBA,2022-04-05,1
Boba,1.0,05-04-2022,United States,San Francisco,Fintech,Hypersphere Ventures,BOBA,2022-04-05,1
Boba,1.0,05-04-2022,United States,San Francisco,Fintech,M13,BOBA,2022-04-05,1
Upside,1.0,26-04-2022,United States,DC,Mobile & telecommunications,Bessemer Venture Partners,UPSIDE,2022-04-26,1
Upside,1.0,26-04-2022,United States,DC,Mobile & telecommunications,Builders VC,UPSIDE,2022-04-26,1
Upside,1.0,26-04-2022,United States,DC,Mobile & telecommunications,General Catalyst,UPSIDE,2022-04-26,1
Mashgin,1.0,09-05-2022,United States,Palo Alto,Artificial intelligence,New Enterprise Associates,MASHGIN,2022-05-09,1
Mashgin,1.0,09-05-2022,United States,Palo Alto,Artificial intelligence,Matrix Partmers,MASHGIN,2022-05-09,1
Mashgin,1.0,09-05-2022,United States,Palo Alto,Artificial intelligence,Susa Ventures,MASHGIN,2022-05-09,1
Dock,1.0,12-05-2022,Brazil,Sao Paulo,Fintech,Viking Global Investors,DOCK,2022-05-12,1
Dock,1.0,12-05-2022,Brazil,Sao Paulo,Fintech,Riverwood Capital,DOCK,2022-05-12,1
Dock,1.0,12-05-2022,Brazil,Sao Paulo,Fintech,Lightrock,DOCK,2022-05-12,1
Prometheus,1.0,23-09-2021,United States,Santa Cruz,Other,BMW i Ventures,PROMETHEUS,2021-09-23,2
Prometheus,1.0,23-09-2021,United States,Santa Cruz,Other,Metaplanet,PROMETHEUS,2021-09-23,2
Prometheus,1.0,23-09-2021,United States,Santa Cruz,Other,Maersk Growth,PROMETHEUS,2021-09-23,2
5ire,1.0,15-07-2022,United Kingdom,London,Internet software & services,Global Emerging Markets,5IRE,2022-07-15,1
5ire,1.0,15-07-2022,United Kingdom,London,Internet software & services,Sram & Mram Group,5IRE,2022-07-15,1
5ire,1.0,15-07-2022,United Kingdom,London,Internet software & services,Marshland Capital,5IRE,2022-07-15,1
Yipin Shengxian,1.0,11-03-2019,China,Hefei,E-commerce & direct-to-consumer,Eastern Bell Capital,YIPIN SHENGXIAN,2019-03-11,4
Yipin Shengxian,1.0,11-03-2019,China,Hefei,E-commerce & direct-to-consumer,Capital Today,YIPIN SHENGXIAN,2019-03-11,4
Yipin Shengxian,1.0,11-03-2019,China,Hefei,E-commerce & direct-to-consumer,Longzhu Capital,YIPIN SHENGXIAN,2019-03-11,4
Bordrin Motors,1.0,03-06-2019,China,Shanghai,Auto & transportation,China Grand Prosperity Investment,BORDRIN MOTORS,2019-06-03,4
Bordrin Motors,1.0,03-06-2019,China,Shanghai,Auto & transportation,CSC Group,BORDRIN MOTORS,2019-06-03,4
Arcadia,1.0,10-05-2022,United States,DC,Other,BoxGroup,ARCADIA,2022-05-10,1
Arcadia,1.0,10-05-2022,United States,DC,Other,Energy Impact Partners,ARCADIA,2022-05-10,1
Arcadia,1.0,10-05-2022,United States,DC,Other,Camber Creek,ARCADIA,2022-05-10,1
VTS,1.0,07-05-2019,United States,New York,Internet software & services,Trinity Ventures,VTS,2019-05-07,4
VTS,1.0,07-05-2019,United States,New York,Internet software & services,Fifth Wall Ventures,VTS,2019-05-07,4
VTS,1.0,07-05-2019,United States,New York,Internet software & services,OpenView Venture Partners,VTS,2019-05-07,4
Shukun Technology,1.0,16-08-2021,China,Beijing,Artificial Intelligence,Marathon Venture Partners,SHUKUN TECHNOLOGY,2021-08-16,2
Shukun Technology,1.0,16-08-2021,China,Beijing,Artificial Intelligence,Huagai Capital,SHUKUN TECHNOLOGY,2021-08-16,2
Shukun Technology,1.0,16-08-2021,China,Beijing,Artificial Intelligence,China Creation Ventures,SHUKUN TECHNOLOGY,2021-08-16,2
Huasun,1.0,19-01-2023,China,Xuancheng,Other,Hongtai Capital Holdings,HUASUN,2023-01-19,0
Huasun,1.0,19-01-2023,China,Xuancheng,Other,Jintou Zhiyuan,HUASUN,2023-01-19,0
Coocaa,1.0,16-03-2018,China,Shenzhen,Hardware,Baidu,COOCAA,2018-03-16,5
Coocaa,1.0,16-03-2018,China,Shenzhen,Hardware,Tencent Holdings,COOCAA,2018-03-16,5
Juma Peisong,1.0,26-11-2018,China,Chengdu,"Supply chain, logistics, & delivery",Ding Xiang Capital,JUMA PEISONG,2018-11-26,5
Juma Peisong,1.0,26-11-2018,China,Chengdu,"Supply chain, logistics, & delivery",New Hope Fund,JUMA PEISONG,2018-11-26,5
Juma Peisong,1.0,26-11-2018,China,Chengdu,"Supply chain, logistics, & delivery",Sino-Ocean Capital,JUMA PEISONG,2018-11-26,5
Ouyeel,1.0,27-06-2019,China,Shanghai,Internet software & services,Taigang Venture Capital,OUYEEL,2019-06-27,4
Gymshark,1.0,14-08-2020,United Kingdom,Solihull,E-commerce & direct-to-consumer,General Atlantic,GYMSHARK,2020-08-14,3
M1,1.0,14-07-2021,United States,Chicago,Fintech,Left Lane Capital,M1,2021-07-14,2
M1,1.0,14-07-2021,United States,Chicago,Fintech,Clocktower Technology Ventures,M1,2021-07-14,2
M1,1.0,14-07-2021,United States,Chicago,Fintech,Jump Capital,M1,2021-07-14,2
Aleo,1.0,07-02-2022,United States,San Francisco,Cybersecurity,Slow Ventures,ALEO,2022-02-07,1
Aleo,1.0,07-02-2022,United States,San Francisco,Cybersecurity,Andreessen Horowitz,ALEO,2022-02-07,1
Aleo,1.0,07-02-2022,United States,San Francisco,Cybersecurity,SoftBank Group,ALEO,2022-02-07,1
Einride,1.0,31-12-2021,Sweden,Stockholm,Auto & transportation,Temasek,EINRIDE,2021-12-31,2
Einride,1.0,31-12-2021,Sweden,Stockholm,Auto & transportation,BUILD Capital Partners,EINRIDE,2021-12-31,2
Einride,1.0,31-12-2021,Sweden,Stockholm,Auto & transportation,Northzone Ventures,EINRIDE,2021-12-31,2
Justworks,1.0,28-01-2020,United States,New York,Internet software & services,Index Ventures,JUSTWORKS,2020-01-28,3
Justworks,1.0,28-01-2020,United States,New York,Internet software & services,Thrive Capital,JUSTWORKS,2020-01-28,3
Justworks,1.0,28-01-2020,United States,New York,Internet software & services,Bain Capital Ventures,JUSTWORKS,2020-01-28,3
Valgen Medtech,1.0,06-05-2021,China,Hangzhou,Health,Sequoia Capital China,VALGEN MEDTECH,2021-05-06,2
Valgen Medtech,1.0,06-05-2021,China,Hangzhou,Health,China Life Investment Holding Company,VALGEN MEDTECH,2021-05-06,2
Valgen Medtech,1.0,06-05-2021,China,Hangzhou,Health,Qiming Venture Partners,VALGEN MEDTECH,2021-05-06,2
SonderMind,1.0,28-07-2021,United States,Denver,Health,Kickstart Fund,SONDERMIND,2021-07-28,2
SonderMind,1.0,28-07-2021,United States,Denver,Health,General Catalyst,SONDERMIND,2021-07-28,2
SonderMind,1.0,28-07-2021,United States,Denver,Health,Drive Capital,SONDERMIND,2021-07-28,2
Amagi,1.0,16-03-2022,India,Bengaluru,Internet software & services,Mayfield,AMAGI,2022-03-16,1
Amagi,1.0,16-03-2022,India,Bengaluru,Internet software & services,Accel,AMAGI,2022-03-16,1
Amagi,1.0,16-03-2022,India,Bengaluru,Internet software & services,Norwest Venture Partners,AMAGI,2022-03-16,1
Papa,1.0,04-11-2021,United States,Miami,Health,Initialized Capital,PAPA,2021-11-04,2
Papa,1.0,04-11-2021,United States,Miami,Health,Canaan Partners,PAPA,2021-11-04,2
Papa,1.0,04-11-2021,United States,Miami,Health,Sound Ventures,PAPA,2021-11-04,2
Figment,1.0,20-12-2021,Canada,Toronto,Internet software & services,Bonfire Ventures,FIGMENT,2021-12-20,2
Figment,1.0,20-12-2021,Canada,Toronto,Internet software & services,Two Sigma Ventures,FIGMENT,2021-12-20,2
Figment,1.0,20-12-2021,Canada,Toronto,Internet software & services,FJ Labs,FIGMENT,2021-12-20,2
Envoy,1.0,11-01-2022,United States,San Francisco,Internet software & services,Andreessen Horowitz,ENVOY,2022-01-11,1
Envoy,1.0,11-01-2022,United States,San Francisco,Internet software & services,Initialized Capital,ENVOY,2022-01-11,1
Envoy,1.0,11-01-2022,United States,San Francisco,Internet software & services,TriplePoint Capital,ENVOY,2022-01-11,1
Deliverect,1.0,24-01-2022,Belgium,Ghent,Fintech,Newion Partners,DELIVERECT,2022-01-24,1
Deliverect,1.0,24-01-2022,Belgium,Ghent,Fintech,SmartFin Capital,DELIVERECT,2022-01-24,1
Deliverect,1.0,24-01-2022,Belgium,Ghent,Fintech,OMERS Ventures,DELIVERECT,2022-01-24,1
SparkCognition,1.0,25-01-2022,United States,Austin,Artificial intelligence,March Capital Partners,SPARKCOGNITION,2022-01-25,1
SparkCognition,1.0,25-01-2022,United States,Austin,Artificial intelligence,Temasek,SPARKCOGNITION,2022-01-25,1
SparkCognition,1.0,25-01-2022,United States,Austin,Artificial intelligence,Doha Venture Capital,SPARKCOGNITION,2022-01-25,1
Liquidity,1.0,20-02-2023,Israel,Tel Aviv,Fintech,MUFG Innovation Partners,LIQUIDITY,2023-02-20,0
Liquidity,1.0,20-02-2023,Israel,Tel Aviv,Fintech,Spark Capital,LIQUIDITY,2023-02-20,0
Firebolt,1.0,26-01-2022,Israel,Tel Aviv,Data management & analytics,TLV Partners,FIREBOLT,2022-01-26,1
Firebolt,1.0,26-01-2022,Israel,Tel Aviv,Data management & analytics,Zeev Ventures,FIREBOLT,2022-01-26,1
Firebolt,1.0,26-01-2022,Israel,Tel Aviv,Data management & analytics,Bessemer Venture Partners,FIREBOLT,2022-01-26,1
Koudai,1.0,23-10-2014,China,Beijing,E-commerce & direct-to-consumer,New Enterprise Associates,KOUDAI,2014-10-23,9
Koudai,1.0,23-10-2014,China,Beijing,E-commerce & direct-to-consumer,Tiger Global Management,KOUDAI,2014-10-23,9
Koudai,1.0,23-10-2014,China,Beijing,E-commerce & direct-to-consumer,Tencent,KOUDAI,2014-10-23,9
Symphony,1.0,16-05-2017,United States,New York,Fintech,BNP Paribas,SYMPHONY,2017-05-16,6
Symphony,1.0,16-05-2017,United States,New York,Fintech,Goldman Sachs,SYMPHONY,2017-05-16,6
Symphony,1.0,16-05-2017,United States,New York,Fintech,Google,SYMPHONY,2017-05-16,6
Yidian Zixun,1.0,17-10-2017,China,Beijing,Mobile & telecommunications,Phoenix New Media,YIDIAN ZIXUN,2017-10-17,6
Yidian Zixun,1.0,17-10-2017,China,Beijing,Mobile & telecommunications,Tianjin Haihe Industry Fund,YIDIAN ZIXUN,2017-10-17,6
Cabify,1.0,22-01-2018,Spain,Madrid,Auto & transportation,Seaya Ventures,CABIFY,2018-01-22,5
Cabify,1.0,22-01-2018,Spain,Madrid,Auto & transportation,Otter Rock Capital,CABIFY,2018-01-22,5
Cabify,1.0,22-01-2018,Spain,Madrid,Auto & transportation,Rakuten,CABIFY,2018-01-22,5
Hive Box,1.0,23-01-2018,China,Shenzhen,"Supply chain, logistics, & delivery",Eastern Bell Capital,HIVE BOX,2018-01-23,5
Hive Box,1.0,23-01-2018,China,Shenzhen,"Supply chain, logistics, & delivery",SF Holding Co,HIVE BOX,2018-01-23,5
Hive Box,1.0,23-01-2018,China,Shenzhen,"Supply chain, logistics, & delivery",STO Express,HIVE BOX,2018-01-23,5
Away,1.0,15-05-2019,United States,New York,E-commerce & direct-to-consumer,Global Founders Capital,AWAY,2019-05-15,4
Away,1.0,15-05-2019,United States,New York,E-commerce & direct-to-consumer,Comcast Ventures,AWAY,2019-05-15,4
Away,1.0,15-05-2019,United States,New York,E-commerce & direct-to-consumer,Forerunner Ventures,AWAY,2019-05-15,4
Kong,1.0,31-12-2020,United States,San Francisco,Internet software & services,New Enterprise Associates,KONG,2020-12-31,3
Kong,1.0,31-12-2020,United States,San Francisco,Internet software & services,CRV,KONG,2020-12-31,3
Kong,1.0,31-12-2020,United States,San Francisco,Internet software & services,Index Ventures,KONG,2020-12-31,3
Epidemic Sound,1.0,11-03-2021,Sweden,Stockholm,Internet software & services,EQT Partners,EPIDEMIC SOUND,2021-03-11,2
Epidemic Sound,1.0,11-03-2021,Sweden,Stockholm,Internet software & services,Blackstone,EPIDEMIC SOUND,2021-03-11,2
Yotpo,1.0,18-03-2021,United States,New York,Internet software & services,Bessemer Venture Partners,YOTPO,2021-03-18,2
Yotpo,1.0,18-03-2021,United States,New York,Internet software & services,Vintage Investment Partners,YOTPO,2021-03-18,2
Yotpo,1.0,18-03-2021,United States,New York,Internet software & services,Blumberg Capital,YOTPO,2021-03-18,2
Rebel Foods,1.0,07-10-2021,India,Pune,E-commerce & direct-to-consumer,Sequoia Capital India,REBEL FOODS,2021-10-07,2
Rebel Foods,1.0,07-10-2021,India,Pune,E-commerce & direct-to-consumer,Lightbox Ventures,REBEL FOODS,2021-10-07,2
Rebel Foods,1.0,07-10-2021,India,Pune,E-commerce & direct-to-consumer,Coatue Management,REBEL FOODS,2021-10-07,2
Coda,1.0,08-07-2021,United States,Mountain View,Internet software & services,Greylock Partners,CODA,2021-07-08,2
Coda,1.0,08-07-2021,United States,Mountain View,Internet software & services,General Catalyst,CODA,2021-07-08,2
Coda,1.0,08-07-2021,United States,Mountain View,Internet software & services,Khosla Ventures,CODA,2021-07-08,2
Stash,1.0,03-02-2021,United States,New York,Fintech,Goodwater Capital,STASH,2021-02-03,2
Stash,1.0,03-02-2021,United States,New York,Fintech,Entree Capital,STASH,2021-02-03,2
Stash,1.0,03-02-2021,United States,New York,Fintech,Valar Ventures,STASH,2021-02-03,2
Rad Power Bikes,1.0,28-10-2021,United States,Seattle,Auto & transportation,Durable Capital Partners,RAD POWER BIKES,2021-10-28,2
Rad Power Bikes,1.0,28-10-2021,United States,Seattle,Auto & transportation,Cercano Management,RAD POWER BIKES,2021-10-28,2
Rad Power Bikes,1.0,28-10-2021,United States,Seattle,Auto & transportation,T. Rowe Price,RAD POWER BIKES,2021-10-28,2
Clarify Health,1.0,05-04-2022,United States,San Francisco,Health,KKR,CLARIFY HEALTH,2022-04-05,1
Clarify Health,1.0,05-04-2022,United States,San Francisco,Health,Aspenwood Ventures,CLARIFY HEALTH,2022-04-05,1
Clarify Health,1.0,05-04-2022,United States,San Francisco,Health,Spark Capital,CLARIFY HEALTH,2022-04-05,1
Bucketplace,1.0,09-05-2022,South Korea,Seoul,E-commerce & direct-to-consumer,IMM Investment,BUCKETPLACE,2022-05-09,1
Bucketplace,1.0,09-05-2022,South Korea,Seoul,E-commerce & direct-to-consumer,Mirae Asset Capital,BUCKETPLACE,2022-05-09,1
Bucketplace,1.0,09-05-2022,South Korea,Seoul,E-commerce & direct-to-consumer,BOND,BUCKETPLACE,2022-05-09,1
Paddle,1.0,09-05-2022,United Kingdom,London,Fintech,Notion Capital,PADDLE,2022-05-09,1
Paddle,1.0,09-05-2022,United Kingdom,London,Fintech,Kindred Capital,PADDLE,2022-05-09,1
Paddle,1.0,09-05-2022,United Kingdom,London,Fintech,BGF Ventures,PADDLE,2022-05-09,1
OneCard,1.0,13-07-2022,India,Pune,Fintech,Sequoia Capital India,ONECARD,2022-07-13,1
OneCard,1.0,13-07-2022,India,Pune,Fintech,Hummingbird Ventures,ONECARD,2022-07-13,1
OneCard,1.0,13-07-2022,India,Pune,Fintech,Matrix Partners India,ONECARD,2022-07-13,1
boAT,1.0,28-10-2022,India,Mumbai,Consumer & retail,Qualcomm Ventures,BOAT,2022-10-28,1
boAT,1.0,28-10-2022,India,Mumbai,Consumer & retail,Fireside Ventures,BOAT,2022-10-28,1
Phenom People,1.0,07-04-2021,United States,Ambler,Internet software & services,Sierra Ventures,PHENOM PEOPLE,2021-04-07,2
Phenom People,1.0,07-04-2021,United States,Ambler,Internet software & services,AXA Venture Partners,PHENOM PEOPLE,2021-04-07,2
Phenom People,1.0,07-04-2021,United States,Ambler,Internet software & services,Sigma Prime Ventures,PHENOM PEOPLE,2021-04-07,2
GupShup,1.0,08-04-2021,United States,San Francisco,Internet software & services,Helion Venture Partners,GUPSHUP,2021-04-08,2
GupShup,1.0,08-04-2021,United States,San Francisco,Internet software & services,Tiger Global management,GUPSHUP,2021-04-08,2
GupShup,1.0,08-04-2021,United States,San Francisco,Internet software & services,CRV,GUPSHUP,2021-04-08,2
Degreed,1.0,13-04-2021,United States,Pleasanton,Edtech,Signal Peak Ventures,DEGREED,2021-04-13,2
Degreed,1.0,13-04-2021,United States,Pleasanton,Edtech,Owl Ventures,DEGREED,2021-04-13,2
Degreed,1.0,13-04-2021,United States,Pleasanton,Edtech,Jump Capital,DEGREED,2021-04-13,2
Astranis Space Technologies,1.0,14-04-2021,United States,San Francisco,Mobile & telecommunications,Refactor Capital,ASTRANIS SPACE TECHNOLOGIES,2021-04-14,2
Astranis Space Technologies,1.0,14-04-2021,United States,San Francisco,Mobile & telecommunications,Andreessen Horowitz,ASTRANIS SPACE TECHNOLOGIES,2021-04-14,2
Astranis Space Technologies,1.0,14-04-2021,United States,San Francisco,Mobile & telecommunications,Fifty Years Fund,ASTRANIS SPACE TECHNOLOGIES,2021-04-14,2
Scalable Capital,1.0,08-06-2021,Germany,Munich,Fintech,BlackRock,SCALABLE CAPITAL,2021-06-08,2
Scalable Capital,1.0,08-06-2021,Germany,Munich,Fintech,Tengelmann Ventures,SCALABLE CAPITAL,2021-06-08,2
Scalable Capital,1.0,08-06-2021,Germany,Munich,Fintech,Holtzbrinck Ventures,SCALABLE CAPITAL,2021-06-08,2
VideoAmp,1.0,21-10-2021,United States,Los Angeles,Internet software & services,Simon Equity Partners,VIDEOAMP,2021-10-21,2
VideoAmp,1.0,21-10-2021,United States,Los Angeles,Internet software & services,Wavemaker Partners,VIDEOAMP,2021-10-21,2
VideoAmp,1.0,21-10-2021,United States,Los Angeles,Internet software & services,Anthem Venture Partners,VIDEOAMP,2021-10-21,2
Panther Labs,1.0,02-12-2021,United States,San Francisco,Cybersecurity,Innovation Endeavors,PANTHER LABS,2021-12-02,2
Panther Labs,1.0,02-12-2021,United States,San Francisco,Cybersecurity,s28 Capital,PANTHER LABS,2021-12-02,2
Panther Labs,1.0,02-12-2021,United States,San Francisco,Cybersecurity,Lightspeed Venture Partners,PANTHER LABS,2021-12-02,2
Salt Security,1.0,10-02-2022,United States,Palo Alto,Cybersecurity,Y Combinator,SALT SECURITY,2022-02-10,1
Salt Security,1.0,10-02-2022,United States,Palo Alto,Cybersecurity,S Capital,SALT SECURITY,2022-02-10,1
Salt Security,1.0,10-02-2022,United States,Palo Alto,Cybersecurity,Tenaya Capital,SALT SECURITY,2022-02-10,1
Tripledot,1.0,14-02-2022,United Kingdom,London,Mobile & telecommunications,Lightspeed Venture Partners,TRIPLEDOT,2022-02-14,1
Tripledot,1.0,14-02-2022,United Kingdom,London,Mobile & telecommunications,Access Industries,TRIPLEDOT,2022-02-14,1
Tripledot,1.0,14-02-2022,United Kingdom,London,Mobile & telecommunications,Eldridge,TRIPLEDOT,2022-02-14,1
Nimble Rx,1.0,14-06-2022,United States,Redwood City,Health,Sequoia Capital,NIMBLE RX,2022-06-14,1
Nimble Rx,1.0,14-06-2022,United States,Redwood City,Health,Four Rivers Group,NIMBLE RX,2022-06-14,1
Nimble Rx,1.0,14-06-2022,United States,Redwood City,Health,DAG Ventures,NIMBLE RX,2022-06-14,1
Veepee,1.0,02-07-2007,France,La Plaine Saint-Denis,E-commerce & direct-to-consumer,Summit Partners,VEEPEE,2007-07-02,16
Veepee,1.0,02-07-2007,France,La Plaine Saint-Denis,E-commerce & direct-to-consumer,Qatar Holding,VEEPEE,2007-07-02,16
Neon,1.0,14-02-2022,Brazil,Sao Paulo,Fintech,Propel Venture Partners,NEON,2022-02-14,1
Neon,1.0,14-02-2022,Brazil,Sao Paulo,Fintech,Monashees+,NEON,2022-02-14,1
Neon,1.0,14-02-2022,Brazil,Sao Paulo,Fintech,BBVA,NEON,2022-02-14,1
Movable Ink,1.0,28-04-2022,United States,New York,Internet software & services,Contour Venture Partners,MOVABLE INK,2022-04-28,1
Movable Ink,1.0,28-04-2022,United States,New York,Internet software & services,Intel Capital,MOVABLE INK,2022-04-28,1
Movable Ink,1.0,28-04-2022,United States,New York,Internet software & services,Silver Lake,MOVABLE INK,2022-04-28,1
Patreon,1.0,02-09-2020,United States,San Francisco,Internet software & services,Index Ventures,PATREON,2020-09-02,3
Patreon,1.0,02-09-2020,United States,San Francisco,Internet software & services,Thrive Capital,PATREON,2020-09-02,3
Patreon,1.0,02-09-2020,United States,San Francisco,Internet software & services,CRV,PATREON,2020-09-02,3
DeepBlue Technology,1.0,16-04-2018,China,Shanghai,Artificial intelligence,DESUN Capital,DEEPBLUE TECHNOLOGY,2018-04-16,5
DeepBlue Technology,1.0,16-04-2018,China,Shanghai,Artificial intelligence,Yunfeng Capital,DEEPBLUE TECHNOLOGY,2018-04-16,5
DeepBlue Technology,1.0,16-04-2018,China,Shanghai,Artificial intelligence,Meridian Capital,DEEPBLUE TECHNOLOGY,2018-04-16,5
Klook,1.0,07-08-2018,Hong Kong,Central,Travel,Sequoia Capital China,KLOOK,2018-08-07,5
Klook,1.0,07-08-2018,Hong Kong,Central,Travel,Goldman Sachs,KLOOK,2018-08-07,5
Klook,1.0,07-08-2018,Hong Kong,Central,Travel,Matrix Partners China,KLOOK,2018-08-07,5
Yaoshibang,1.0,15-06-2021,China,Guangzhou,Health,Green Pine Capital Partners,YAOSHIBANG,2021-06-15,2
Yaoshibang,1.0,15-06-2021,China,Guangzhou,Health,Ivy Capital,YAOSHIBANG,2021-06-15,2
Yaoshibang,1.0,15-06-2021,China,Guangzhou,Health,DCM Ventures,YAOSHIBANG,2021-06-15,2
Epirus,1.0,14-02-2022,United States,Hawthorne,Other,8VC,EPIRUS,2022-02-14,1
Epirus,1.0,14-02-2022,United States,Hawthorne,Other,Bedrock Capital,EPIRUS,2022-02-14,1
Epirus,1.0,14-02-2022,United States,Hawthorne,Other,Broom Ventures,EPIRUS,2022-02-14,1
Signifyd,1.0,15-04-2021,United States,San Jose,Fintech,Menlo Ventures,SIGNIFYD,2021-04-15,2
Signifyd,1.0,15-04-2021,United States,San Jose,Fintech,Resolute Ventures,SIGNIFYD,2021-04-15,2
Signifyd,1.0,15-04-2021,United States,San Jose,Fintech,IA Ventures,SIGNIFYD,2021-04-15,2
Jaguar Microsystems,1.0,23-06-2022,China,Shenzhen,Hardware,Tencent Holdings,JAGUAR MICROSYSTEMS,2022-06-23,1
Jaguar Microsystems,1.0,23-06-2022,China,Shenzhen,Hardware,Glory Ventures,JAGUAR MICROSYSTEMS,2022-06-23,1
Jaguar Microsystems,1.0,23-06-2022,China,Shenzhen,Hardware,Shenzhen Capital Group,JAGUAR MICROSYSTEMS,2022-06-23,1
Motorway,1.0,29-11-2021,United Kingdom,London,E-commerce & direct-to-consumer,Marchmont Ventures,MOTORWAY,2021-11-29,2
Motorway,1.0,29-11-2021,United Kingdom,London,E-commerce & direct-to-consumer,BMW i Ventures,MOTORWAY,2021-11-29,2
Motorway,1.0,29-11-2021,United Kingdom,London,E-commerce & direct-to-consumer,Index Ventures,MOTORWAY,2021-11-29,2
RIDI,1.0,24-01-2022,South Korea,Seoul,E-commerce & direct-to-consumer,Atinum Investment,RIDI,2022-01-24,1
RIDI,1.0,24-01-2022,South Korea,Seoul,E-commerce & direct-to-consumer,Company K Partners,RIDI,2022-01-24,1
RIDI,1.0,24-01-2022,South Korea,Seoul,E-commerce & direct-to-consumer,GIC,RIDI,2022-01-24,1
Flipboard,1.0,22-07-2015,United States,Palo Alto,Internet software & services,Kleiner Perkins Caufield & Byers,FLIPBOARD,2015-07-22,8
Flipboard,1.0,22-07-2015,United States,Palo Alto,Internet software & services,Comcast Ventures,FLIPBOARD,2015-07-22,8
Flipboard,1.0,22-07-2015,United States,Palo Alto,Internet software & services,Insight Partners,FLIPBOARD,2015-07-22,8
GPclub,1.0,22-10-2018,South Korea,Seoul,Other,Goldman Sachs,GPCLUB,2018-10-22,5
Tongdun Technology,1.0,25-04-2019,China,Hangzhou,Cybersecurity,Advantech Capital,TONGDUN TECHNOLOGY,2019-04-25,4
Tongdun Technology,1.0,25-04-2019,China,Hangzhou,Cybersecurity,Temasek Holdings Ltd.,TONGDUN TECHNOLOGY,2019-04-25,4
Tongdun Technology,1.0,25-04-2019,China,Hangzhou,Cybersecurity,Tiantu Capital Co.,TONGDUN TECHNOLOGY,2019-04-25,4
Athletic Greens,1.0,25-01-2022,United States,New York,Health,SC.Holdings,ATHLETIC GREENS,2022-01-25,1
Athletic Greens,1.0,25-01-2022,United States,New York,Health,Not Boring Capital,ATHLETIC GREENS,2022-01-25,1
Athletic Greens,1.0,25-01-2022,United States,New York,Health,Bolt Ventures,ATHLETIC GREENS,2022-01-25,1
Unisound,1.0,19-07-2018,China,Beijing,Artificial intelligence,Qiming Venture Partners,UNISOUND,2018-07-19,5
Unisound,1.0,19-07-2018,China,Beijing,Artificial intelligence,China Internet Investment Fund,UNISOUND,2018-07-19,5
Unisound,1.0,19-07-2018,China,Beijing,Artificial intelligence,Qualcomm Ventures,UNISOUND,2018-07-19,5
Alzheon,1.0,30-09-2020,United States,Framingham,Health,ARCH Venture Partners,ALZHEON,2020-09-30,3
Alzheon,1.0,30-09-2020,United States,Framingham,Health,Ally Bridge Group,ALZHEON,2020-09-30,3
MasterControl,1.0,15-12-2022,United States,Salt Lake City,Health,InnoVentures Capital Partners,MASTERCONTROL,2022-12-15,1
HeartFlow,1.0,04-12-2017,United States,Redwood City,Health,BlueCross BlueShield Venture Partners,HEARTFLOW,2017-12-04,6
HeartFlow,1.0,04-12-2017,United States,Redwood City,Health,US Venture Partners,HEARTFLOW,2017-12-04,6
Shiprocket,1.0,16-08-2022,India,New Delhi,"Supply chain, logistics, & delivery",Bertelsmann India Investments,SHIPROCKET,2022-08-16,1
Shiprocket,1.0,16-08-2022,India,New Delhi,"Supply chain, logistics, & delivery",March Capital Partners,SHIPROCKET,2022-08-16,1
Shiprocket,1.0,16-08-2022,India,New Delhi,"Supply chain, logistics, & delivery",Tribe Capital,SHIPROCKET,2022-08-16,1
Shiprocket,1.0,16-08-2022,India,New Delhi,"Supply chain, logistics, & delivery",Nirvana Venture Advisors,SHIPROCKET,2022-08-16,1
The Brandtech Group,1.0,19-11-2019,United States,New York,Other,Undisclosed,THE BRANDTECH GROUP,2019-11-19,4
InSightec,1.0,06-03-2020,Israel,Tirat Carmel,Health,York Capital Management,INSIGHTEC,2020-03-06,3
InSightec,1.0,06-03-2020,Israel,Tirat Carmel,Health,GE Healthcare,INSIGHTEC,2020-03-06,3
InSightec,1.0,06-03-2020,Israel,Tirat Carmel,Health,Koch Disruptive Technologies,INSIGHTEC,2020-03-06,3
Everly Health,1.0,03-12-2020,United States,Austin,Health,Highland Capital Partners,EVERLY HEALTH,2020-12-03,3
Everly Health,1.0,03-12-2020,United States,Austin,Health,Next Coast Ventures,EVERLY HEALTH,2020-12-03,3
Everly Health,1.0,03-12-2020,United States,Austin,Health,SoGal Ventures,EVERLY HEALTH,2020-12-03,3
Manner,1.0,24-12-2020,China,Shanghai,Other,Coatue Management,MANNER,2020-12-24,3
Manner,1.0,24-12-2020,China,Shanghai,Other,H Capital,MANNER,2020-12-24,3
Manner,1.0,24-12-2020,China,Shanghai,Other,Capital Today,MANNER,2020-12-24,3
TalkingData,1.0,06-01-2021,China,Beijing,Mobile & telecommunications,N5 Capital,TALKINGDATA,2021-01-06,2
TalkingData,1.0,06-01-2021,China,Beijing,Mobile & telecommunications,CR Capital Mgmt,TALKINGDATA,2021-01-06,2
TalkingData,1.0,06-01-2021,China,Beijing,Mobile & telecommunications,JD Digits,TALKINGDATA,2021-01-06,2
DistroKid,1.0,16-08-2021,United States,New York,Internet software & services,Insight Partners,DISTROKID,2021-08-16,2
DistroKid,1.0,16-08-2021,United States,New York,Internet software & services,Silversmith Capital Partners,DISTROKID,2021-08-16,2
DistroKid,1.0,16-08-2021,United States,New York,Internet software & services,Spotify,DISTROKID,2021-08-16,2
Konfio,1.0,29-09-2021,Mexico,Mexico City,Fintech,Kaszek Ventures,KONFIO,2021-09-29,2
Konfio,1.0,29-09-2021,Mexico,Mexico City,Fintech,QED Investors,KONFIO,2021-09-29,2
Konfio,1.0,29-09-2021,Mexico,Mexico City,Fintech,International Finance Corporation,KONFIO,2021-09-29,2
Betterment,1.0,29-09-2021,United States,New York,Fintech,Bessemer Venture Partners,BETTERMENT,2021-09-29,2
Betterment,1.0,29-09-2021,United States,New York,Fintech,Menlo Ventures,BETTERMENT,2021-09-29,2
Betterment,1.0,29-09-2021,United States,New York,Fintech,Anthermis,BETTERMENT,2021-09-29,2
Flock Freight,1.0,20-10-2021,United States,Encinitas,"Supply chain, logistics, & delivery",SignalFire,FLOCK FREIGHT,2021-10-20,2
Flock Freight,1.0,20-10-2021,United States,Encinitas,"Supply chain, logistics, & delivery",GLP Capital Partners,FLOCK FREIGHT,2021-10-20,2
Flock Freight,1.0,20-10-2021,United States,Encinitas,"Supply chain, logistics, & delivery",Google Ventures,FLOCK FREIGHT,2021-10-20,2
YugaByte,1.0,28-10-2021,United States,Sunnyvale,Data management & analytics,Lightspeed Venture Partners,YUGABYTE,2021-10-28,2
YugaByte,1.0,28-10-2021,United States,Sunnyvale,Data management & analytics,Dell Technologies Capital,YUGABYTE,2021-10-28,2
YugaByte,1.0,28-10-2021,United States,Sunnyvale,Data management & analytics,Wipro Ventures,YUGABYTE,2021-10-28,2
Lukka,1.0,14-01-2022,United States,New York,Fintech,Liberty City Ventures,LUKKA,2022-01-14,1
Lukka,1.0,14-01-2022,United States,New York,Fintech,Soros Fund Management,LUKKA,2022-01-14,1
Lukka,1.0,14-01-2022,United States,New York,Fintech,Summer Capital,LUKKA,2022-01-14,1
TravelPerk,1.0,12-01-2022,Spain,Barcelona,Travel,LocalGlobe,TRAVELPERK,2022-01-12,1
TravelPerk,1.0,12-01-2022,Spain,Barcelona,Travel,Kinnevik,TRAVELPERK,2022-01-12,1
TravelPerk,1.0,12-01-2022,Spain,Barcelona,Travel,Felix Capital,TRAVELPERK,2022-01-12,1
iTrustCapital,1.0,11-01-2022,United States,Long Beach,Fintech,Left Lane Capital,ITRUSTCAPITAL,2022-01-11,1
iTrustCapital,1.0,11-01-2022,United States,Long Beach,Fintech,Walden Venture Capital,ITRUSTCAPITAL,2022-01-11,1
Domestika,1.0,27-01-2022,United States,Berkeley,Internet software & services,Zeev Ventures,DOMESTIKA,2022-01-27,1
Domestika,1.0,27-01-2022,United States,Berkeley,Internet software & services,GSV Ventures,DOMESTIKA,2022-01-27,1
CoinTracker,1.0,27-01-2022,United States,San Francisco,Fintech,Initialized Capital,COINTRACKER,2022-01-27,1
CoinTracker,1.0,27-01-2022,United States,San Francisco,Fintech,General Catalyst,COINTRACKER,2022-01-27,1
CoinTracker,1.0,27-01-2022,United States,San Francisco,Fintech,Kraken Ventures,COINTRACKER,2022-01-27,1
Loadsmart,1.0,01-02-2022,United States,New York,"Supply chain, logistics, & delivery",Chromo Invest,LOADSMART,2022-02-01,1
Loadsmart,1.0,01-02-2022,United States,New York,"Supply chain, logistics, & delivery",Maersk Growth,LOADSMART,2022-02-01,1
Loadsmart,1.0,01-02-2022,United States,New York,"Supply chain, logistics, & delivery",BlackRock,LOADSMART,2022-02-01,1
TUNGEE,1.0,15-12-2021,China,Guangzhou,Artificial Intelligence,UNITY VENTURES,TUNGEE,2021-12-15,2
TUNGEE,1.0,15-12-2021,China,Guangzhou,Artificial Intelligence,Qiming Venture Partners,TUNGEE,2021-12-15,2
TUNGEE,1.0,15-12-2021,China,Guangzhou,Artificial Intelligence,GGV Capital,TUNGEE,2021-12-15,2
Yubi,1.0,07-03-2022,India,Chennai,Fintech,Insight Partners,YUBI,2022-03-07,1
Yubi,1.0,07-03-2022,India,Chennai,Fintech,B Capital Group,YUBI,2022-03-07,1
Yubi,1.0,07-03-2022,India,Chennai,Fintech,Lightspeed Venture Partners,YUBI,2022-03-07,1
LinkTree,1.0,16-03-2022,Australia,Melbourne,Internet software & services,AirTree Ventures,LINKTREE,2022-03-16,1
LinkTree,1.0,16-03-2022,Australia,Melbourne,Internet software & services,Insight Partners,LINKTREE,2022-03-16,1
LinkTree,1.0,16-03-2022,Australia,Melbourne,Internet software & services,Index Ventures,LINKTREE,2022-03-16,1
Island,1.0,23-03-2022,United States,Dallas,Internet software & services,Insight Partners,ISLAND,2022-03-23,1
Island,1.0,23-03-2022,United States,Dallas,Internet software & services,Sequoia Capital,ISLAND,2022-03-23,1
Island,1.0,23-03-2022,United States,Dallas,Internet software & services,Stripes Group,ISLAND,2022-03-23,1
Clipboard Health,1.0,01-02-2022,United States,San Francisco,Internet software & services,Caffeinated Capital,CLIPBOARD HEALTH,2022-02-01,1
Clipboard Health,1.0,01-02-2022,United States,San Francisco,Internet software & services,Initialized Capital,CLIPBOARD HEALTH,2022-02-01,1
Clipboard Health,1.0,01-02-2022,United States,San Francisco,Internet software & services,Y Combinator,CLIPBOARD HEALTH,2022-02-01,1
Biofourmis,1.0,26-04-2022,United States,Boston,Health,General Atlantic,BIOFOURMIS,2022-04-26,1
Biofourmis,1.0,26-04-2022,United States,Boston,Health,CVS Health,BIOFOURMIS,2022-04-26,1
Biofourmis,1.0,26-04-2022,United States,Boston,Health,MassMutual Ventures,BIOFOURMIS,2022-04-26,1
STORD,1.0,13-09-2021,United States,Atlanta,"Supply chain, logistics, & delivery",Dynamo VC,STORD,2021-09-13,2
STORD,1.0,13-09-2021,United States,Atlanta,"Supply chain, logistics, & delivery",Susa Ventures,STORD,2021-09-13,2
STORD,1.0,13-09-2021,United States,Atlanta,"Supply chain, logistics, & delivery",Founders Fund,STORD,2021-09-13,2
Optibus,1.0,16-05-2022,Israel,Tel Aviv,"Supply chain, logistics, & delivery",Bessemer Venture Partners,OPTIBUS,2022-05-16,1
Optibus,1.0,16-05-2022,Israel,Tel Aviv,"Supply chain, logistics, & delivery",Insight Partners,OPTIBUS,2022-05-16,1
Optibus,1.0,16-05-2022,Israel,Tel Aviv,"Supply chain, logistics, & delivery",Pitango Venture Capital,OPTIBUS,2022-05-16,1
Equashield,1.0,06-10-2022,United States,Port Washington,Health,Nordic Capital,EQUASHIELD,2022-10-06,1
Intercom,1.0,27-03-2018,United States,San Francisco,Internet software & services,FirstMark Capital,INTERCOM,2018-03-27,5
Intercom,1.0,27-03-2018,United States,San Francisco,Internet software & services,Tiger Global Management,INTERCOM,2018-03-27,5
OVO Energy,1.0,14-02-2019,United Kingdom,Bristol,Other,Mitsubishi Corporation,OVO ENERGY,2019-02-14,4
OVO Energy,1.0,14-02-2019,United Kingdom,Bristol,Other,Mayfair Equity Partners,OVO ENERGY,2019-02-14,4
Huisuanzhang,1.0,24-05-2021,China,Beijing,Fintech,IDG Capital,HUISUANZHANG,2021-05-24,2
Huisuanzhang,1.0,24-05-2021,China,Beijing,Fintech,Gaocheng Capital,HUISUANZHANG,2021-05-24,2
Huisuanzhang,1.0,24-05-2021,China,Beijing,Fintech,Chuanrong Capital,HUISUANZHANG,2021-05-24,2
WTOIP,1.0,08-04-2018,China,Guangzhou,Internet software & services,Dark Horse Technology Group,WTOIP,2018-04-08,5
WTOIP,1.0,08-04-2018,China,Guangzhou,Internet software & services,Hopu Investment Management,WTOIP,2018-04-08,5
WTOIP,1.0,08-04-2018,China,Guangzhou,Internet software & services,Kefa Capital,WTOIP,2018-04-08,5
PeopleCert,1.0,23-06-2021,Greece,Athens,Internet software & services,FTV Capital,PEOPLECERT,2021-06-23,2
Greater Bay Technology,1.0,02-04-2022,China,Guangzhou,Hardware,Tencent Holdings,GREATER BAY TECHNOLOGY,2022-04-02,1
Greater Bay Technology,1.0,02-04-2022,China,Guangzhou,Hardware,Utrust Venture Capital,GREATER BAY TECHNOLOGY,2022-04-02,1
Greater Bay Technology,1.0,02-04-2022,China,Guangzhou,Hardware,GF Xinde Investment Management Co.,GREATER BAY TECHNOLOGY,2022-04-02,1
JMGO,1.0,15-03-2022,China,Shenzhen,Hardware,IDG Capital,JMGO,2022-03-15,1
JMGO,1.0,15-03-2022,China,Shenzhen,Hardware,Yuanda Venture Investment,JMGO,2022-03-15,1
JMGO,1.0,15-03-2022,China,Shenzhen,Hardware,Primitive Forest Holdings Group,JMGO,2022-03-15,1
BigID,1.0,16-12-2020,United States,New York,Cybersecurity,BOLDstart Ventures,BIGID,2020-12-16,3
BigID,1.0,16-12-2020,United States,New York,Cybersecurity,SAP.iO Fund,BIGID,2020-12-16,3
BigID,1.0,16-12-2020,United States,New York,Cybersecurity,Scale Venture Partners,BIGID,2020-12-16,3
Kuaikan Manhua,1.0,01-12-2017,China,Beijing,Internet software & services,Sequoia Capital China,KUAIKAN MANHUA,2017-12-01,6
Kuaikan Manhua,1.0,01-12-2017,China,Beijing,Internet software & services,CMC Capital Partners,KUAIKAN MANHUA,2017-12-01,6
Kuaikan Manhua,1.0,01-12-2017,China,Beijing,Internet software & services,Tencent Holdings,KUAIKAN MANHUA,2017-12-01,6
Marshmallow,1.0,08-09-2021,United Kingdom,London,Fintech,Passion Capital,MARSHMALLOW,2021-09-08,2
Marshmallow,1.0,08-09-2021,United Kingdom,London,Fintech,Hedosophia,MARSHMALLOW,2021-09-08,2
Marshmallow,1.0,08-09-2021,United Kingdom,London,Fintech,Outrun Ventures,MARSHMALLOW,2021-09-08,2
Honor Technology,1.0,05-10-2021,United States,San Francisco,Internet software & services,Andreessen Horowitz,HONOR TECHNOLOGY,2021-10-05,2
Honor Technology,1.0,05-10-2021,United States,San Francisco,Internet software & services,Prosus Ventures,HONOR TECHNOLOGY,2021-10-05,2
Honor Technology,1.0,05-10-2021,United States,San Francisco,Internet software & services,Thrive Capital,HONOR TECHNOLOGY,2021-10-05,2
Mythical Games,1.0,04-11-2021,United States,Sherman Oaks,Internet software & services,Javelin Venture Partners,MYTHICAL GAMES,2021-11-04,2
Mythical Games,1.0,04-11-2021,United States,Sherman Oaks,Internet software & services,Struck Capital,MYTHICAL GAMES,2021-11-04,2
Mythical Games,1.0,04-11-2021,United States,Sherman Oaks,Internet software & services,Alumni Ventures Group,MYTHICAL GAMES,2021-11-04,2
Incode Technologies,1.0,07-12-2021,United States,San Francisco,Cybersecurity,Dila Capital,INCODE TECHNOLOGIES,2021-12-07,2
Incode Technologies,1.0,07-12-2021,United States,San Francisco,Cybersecurity,Framework Ventures,INCODE TECHNOLOGIES,2021-12-07,2
Incode Technologies,1.0,07-12-2021,United States,San Francisco,Cybersecurity,3L,INCODE TECHNOLOGIES,2021-12-07,2
Tackle.io,1.0,21-12-2021,United States,Boise,Internet software & services,Andreessen Horowitz,TACKLE.IO,2021-12-21,2
Tackle.io,1.0,21-12-2021,United States,Boise,Internet software & services,Bessemer Venture Partners,TACKLE.IO,2021-12-21,2
Tackle.io,1.0,21-12-2021,United States,Boise,Internet software & services,Coatue Management,TACKLE.IO,2021-12-21,2
Flipdish,1.0,13-01-2022,Ireland,Dublin,Internet software & services,Tencent Holdings,FLIPDISH,2022-01-13,1
Flipdish,1.0,13-01-2022,Ireland,Dublin,Internet software & services,Tiger Global Management,FLIPDISH,2022-01-13,1
Flipdish,1.0,13-01-2022,Ireland,Dublin,Internet software & services,Global Founders Capital,FLIPDISH,2022-01-13,1
Route,1.0,21-01-2022,United States,Lehi,"Supply chain, logistics, & delivery",Madrona Venture Group,ROUTE,2022-01-21,1
Route,1.0,21-01-2022,United States,Lehi,"Supply chain, logistics, & delivery",Banner Ventures,ROUTE,2022-01-21,1
Route,1.0,21-01-2022,United States,Lehi,"Supply chain, logistics, & delivery",FJ Labs,ROUTE,2022-01-21,1
CaptivateIQ,1.0,26-01-2022,United States,San Francisco,Fintech,Sequoia Capital,CAPTIVATEIQ,2022-01-26,1
CaptivateIQ,1.0,26-01-2022,United States,San Francisco,Fintech,Y Combinator,CAPTIVATEIQ,2022-01-26,1
CaptivateIQ,1.0,26-01-2022,United States,San Francisco,Fintech,Accel,CAPTIVATEIQ,2022-01-26,1
Talos,1.0,10-05-2022,United States,New York,Fintech,Castle Island Ventures,TALOS,2022-05-10,1
Talos,1.0,10-05-2022,United States,New York,Fintech,PayPal Ventures,TALOS,2022-05-10,1
Talos,1.0,10-05-2022,United States,New York,Fintech,Andreessen Horowitz,TALOS,2022-05-10,1
airSlate,1.0,16-06-2022,United States,Brookline,Internet software & services,G Squared,AIRSLATE,2022-06-16,1
airSlate,1.0,16-06-2022,United States,Brookline,Internet software & services,UiPath Ventures,AIRSLATE,2022-06-16,1
airSlate,1.0,16-06-2022,United States,Brookline,Internet software & services,General Catalyst,AIRSLATE,2022-06-16,1
ClassDojo,1.0,21-07-2022,United States,San Francisco,Edtech,General Catalyst,CLASSDOJO,2022-07-21,1
ClassDojo,1.0,21-07-2022,United States,San Francisco,Edtech,Unkork Capital,CLASSDOJO,2022-07-21,1
ClassDojo,1.0,21-07-2022,United States,San Francisco,Edtech,Tencent Holdings,CLASSDOJO,2022-07-21,1
BrewDog,1.0,10-04-2017,United Kingdom,Aberdeen,Consumer & retail,TSG Consumer Partners,BREWDOG,2017-04-10,6
BrewDog,1.0,10-04-2017,United Kingdom,Aberdeen,Consumer & retail,Crowdcube,BREWDOG,2017-04-10,6
Enflame,1.0,05-01-2021,China,Shanghai,Hardware,Tencent Holdings,ENFLAME,2021-01-05,2
Enflame,1.0,05-01-2021,China,Shanghai,Hardware,Delta Capital,ENFLAME,2021-01-05,2
Enflame,1.0,05-01-2021,China,Shanghai,Hardware,Redpoint Ventures China,ENFLAME,2021-01-05,2
Shulan Health,1.0,01-03-2021,China,Hangzhou,Health,Qiming Venture Partners,SHULAN HEALTH,2021-03-01,2
SeatGeek,1.0,31-08-2022,United States,New York,E-commerce & direct-to-consumer,Accel,SEATGEEK,2022-08-31,1
SeatGeek,1.0,31-08-2022,United States,New York,E-commerce & direct-to-consumer,Founder Collective,SEATGEEK,2022-08-31,1
SeatGeek,1.0,31-08-2022,United States,New York,E-commerce & direct-to-consumer,Brainchild Holdings,SEATGEEK,2022-08-31,1
EQRx,1.0,11-01-2021,United States,Cambridge,Health,Nextech Invest,EQRX,2021-01-11,2
EQRx,1.0,11-01-2021,United States,Cambridge,Health,Casdin Capital,EQRX,2021-01-11,2
EQRx,1.0,11-01-2021,United States,Cambridge,Health,Google Ventures,EQRX,2021-01-11,2
Nexii,1.0,08-09-2021,Canada,Vancouver,Other,Trane Technologies,NEXII,2021-09-08,2
Nexii,1.0,08-09-2021,Canada,Vancouver,Other,Honeywell,NEXII,2021-09-08,2
inDriver,1.0,01-02-2021,United States,Mountain View,Auto & transportation,Leta Capital,INDRIVER,2021-02-01,2
inDriver,1.0,01-02-2021,United States,Mountain View,Auto & transportation,Insight Partners,INDRIVER,2021-02-01,2
inDriver,1.0,01-02-2021,United States,Mountain View,Auto & transportation,General Catalyst,INDRIVER,2021-02-01,2
Spiber,1.0,08-09-2021,Japan,Tsuruoka,Other,Cool Japan Fund,SPIBER,2021-09-08,2
Spiber,1.0,08-09-2021,Japan,Tsuruoka,Other,JAFCO,SPIBER,2021-09-08,2
Spiber,1.0,08-09-2021,Japan,Tsuruoka,Other,The Carlyle Group,SPIBER,2021-09-08,2
Insider,1.0,28-02-2022,Turkey,Istanbul,Internet software & services,Wamda Capital,INSIDER,2022-02-28,1
Insider,1.0,28-02-2022,Turkey,Istanbul,Internet software & services,Endeavor,INSIDER,2022-02-28,1
Insider,1.0,28-02-2022,Turkey,Istanbul,Internet software & services,Riverwood Capital,INSIDER,2022-02-28,1
Kallyope,1.0,15-02-2022,United States,New York,Health,The Column Group,KALLYOPE,2022-02-15,1
Kallyope,1.0,15-02-2022,United States,New York,Health,Alexandria Venture Investments,KALLYOPE,2022-02-15,1
Kallyope,1.0,15-02-2022,United States,New York,Health,Lux Capital,KALLYOPE,2022-02-15,1
Zip,1.0,25-05-2022,United States,San Francisco,Fintech,CRV,ZIP,2022-05-25,1
Zip,1.0,25-05-2022,United States,San Francisco,Fintech,Tiger Global Management,ZIP,2022-05-25,1
Zip,1.0,25-05-2022,United States,San Francisco,Fintech,Y Combinator,ZIP,2022-05-25,1
Our Next Energy,1.0,01-02-2023,United States,Novi,Other,BMW i Ventures,OUR NEXT ENERGY,2023-02-01,0
Our Next Energy,1.0,01-02-2023,United States,Novi,Other,Breakthrough Energy Ventures,OUR NEXT ENERGY,2023-02-01,0
Our Next Energy,1.0,01-02-2023,United States,Novi,Other,Volta Energy Technologies,OUR NEXT ENERGY,2023-02-01,0
Yiguo,1.0,09-11-2016,China,Shanghai,"Supply chain, logistics, & delivery",Alibaba Group,YIGUO,2016-11-09,7
Yiguo,1.0,09-11-2016,China,Shanghai,"Supply chain, logistics, & delivery",KKR,YIGUO,2016-11-09,7
Yiguo,1.0,09-11-2016,China,Shanghai,"Supply chain, logistics, & delivery",Goldman Sachs,YIGUO,2016-11-09,7
Fair,1.0,20-12-2018,United States,Santa Monica,Auto & transportation,CreditEase Fintech Investment Fund,FAIR,2018-12-20,5
Fair,1.0,20-12-2018,United States,Santa Monica,Auto & transportation,BMW i Ventures,FAIR,2018-12-20,5
Fair,1.0,20-12-2018,United States,Santa Monica,Auto & transportation,SoftBank Group,FAIR,2018-12-20,5
Glossier,1.0,19-03-2019,United States,New York,Consumer & retail,Forerunner Ventures,GLOSSIER,2019-03-19,4
Glossier,1.0,19-03-2019,United States,New York,Consumer & retail,Institutional Venture Partners,GLOSSIER,2019-03-19,4
Glossier,1.0,19-03-2019,United States,New York,Consumer & retail,Thrive Capital,GLOSSIER,2019-03-19,4
Workhuman,1.0,23-06-2020,Ireland,Dublin,Internet software & services,ICG,WORKHUMAN,2020-06-23,3
Qumulo,1.0,16-07-2020,United States,Seattle,Data management & analytics,Madrona Venture Group,QUMULO,2020-07-16,3
Qumulo,1.0,16-07-2020,United States,Seattle,Data management & analytics,Kleiner Perkins Caufield & Byers,QUMULO,2020-07-16,3
Qumulo,1.0,16-07-2020,United States,Seattle,Data management & analytics,Highland Capital Partners,QUMULO,2020-07-16,3
Tealium,1.0,03-02-2021,United States,San Diego,Internet software & services,Georgian Partners,TEALIUM,2021-02-03,2
Tealium,1.0,03-02-2021,United States,San Diego,Internet software & services,Silver Lake,TEALIUM,2021-02-03,2
Tealium,1.0,03-02-2021,United States,San Diego,Internet software & services,Presidio Ventures,TEALIUM,2021-02-03,2
Public,1.0,17-02-2021,United States,New York,Fintech,Accel,PUBLIC,2021-02-17,2
Public,1.0,17-02-2021,United States,New York,Fintech,Greycroft,PUBLIC,2021-02-17,2
Public,1.0,17-02-2021,United States,New York,Fintech,Advancit Capital,PUBLIC,2021-02-17,2
Pipa Coding,1.0,25-03-2021,China,Beijing,Edtech,Source Code Capital,PIPA CODING,2021-03-25,2
Pipa Coding,1.0,25-03-2021,China,Beijing,Edtech,XVC Venture Capital,PIPA CODING,2021-03-25,2
Pipa Coding,1.0,25-03-2021,China,Beijing,Edtech,Hillhouse Capital Management,PIPA CODING,2021-03-25,2
Pilot.com,1.0,26-03-2021,United States,San Francisco,Fintech,Index Ventures,PILOT.COM,2021-03-26,2
Pilot.com,1.0,26-03-2021,United States,San Francisco,Fintech,Sequoia Capital,PILOT.COM,2021-03-26,2
Pilot.com,1.0,26-03-2021,United States,San Francisco,Fintech,Bezos Expeditions,PILOT.COM,2021-03-26,2
Aibee,1.0,13-04-2021,China,Beijing,Artificial intelligence,Sequoia Capital China,AIBEE,2021-04-13,2
Aibee,1.0,13-04-2021,China,Beijing,Artificial intelligence,Lenovo Capital and Incubator,AIBEE,2021-04-13,2
Aibee,1.0,13-04-2021,China,Beijing,Artificial intelligence,Group GSR Ventures,AIBEE,2021-04-13,2
Jokr,1.0,02-12-2021,United States,New York,"Supply chain, logistics, & delivery",GGV Capital,JOKR,2021-12-02,2
Jokr,1.0,02-12-2021,United States,New York,"Supply chain, logistics, & delivery",Tiger Global Management,JOKR,2021-12-02,2
Jokr,1.0,02-12-2021,United States,New York,"Supply chain, logistics, & delivery",Greycroft,JOKR,2021-12-02,2
Cava Group,1.0,27-04-2021,United States,Washington,Other,SWaN & Legend Ventures,CAVA GROUP,2021-04-27,2
Cava Group,1.0,27-04-2021,United States,Washington,Other,Revolution Growth,CAVA GROUP,2021-04-27,2
Cava Group,1.0,27-04-2021,United States,Washington,Other,Invus Group,CAVA GROUP,2021-04-27,2
Vectra Networks,1.0,29-04-2021,United States,San Jose,Artificial intelligence,IA Ventures,VECTRA NETWORKS,2021-04-29,2
Vectra Networks,1.0,29-04-2021,United States,San Jose,Artificial intelligence,Khosla Ventures,VECTRA NETWORKS,2021-04-29,2
Vectra Networks,1.0,29-04-2021,United States,San Jose,Artificial intelligence,AME Cloud Ventures,VECTRA NETWORKS,2021-04-29,2
Ada Support,1.0,07-05-2021,Canada,Toronto,Artificial intelligence,Version One Ventures,ADA SUPPORT,2021-05-07,2
Ada Support,1.0,07-05-2021,Canada,Toronto,Artificial intelligence,Bessemer Venture Partners,ADA SUPPORT,2021-05-07,2
Ada Support,1.0,07-05-2021,Canada,Toronto,Artificial intelligence,FirstMark Capital,ADA SUPPORT,2021-05-07,2
SmartMore,1.0,24-06-2021,China,Shenzhen,Artificial Intelligence,IDG Capital,SMARTMORE,2021-06-24,2
SmartMore,1.0,24-06-2021,China,Shenzhen,Artificial Intelligence,ZhenFund,SMARTMORE,2021-06-24,2
SmartMore,1.0,24-06-2021,China,Shenzhen,Artificial Intelligence,Sequoia Capital China,SMARTMORE,2021-06-24,2
Rohlik Group,1.0,01-07-2021,Czech Republic,Prague,"Supply chain, logistics, & delivery",Partech Partners,ROHLIK GROUP,2021-07-01,2
Rohlik Group,1.0,01-07-2021,Czech Republic,Prague,"Supply chain, logistics, & delivery",Index Ventures,ROHLIK GROUP,2021-07-01,2
Rohlik Group,1.0,01-07-2021,Czech Republic,Prague,"Supply chain, logistics, & delivery",Quadrille Capital,ROHLIK GROUP,2021-07-01,2
FloQast,1.0,21-07-2021,United States,Los Angeles,Fintech,Polaris Partners,FLOQAST,2021-07-21,2
FloQast,1.0,21-07-2021,United States,Los Angeles,Fintech,Insight Partners,FLOQAST,2021-07-21,2
FloQast,1.0,21-07-2021,United States,Los Angeles,Fintech,Norwest Venture Partners,FLOQAST,2021-07-21,2
MindTickle,1.0,03-08-2021,United States,San Francisco,Internet software & services,Qualcomm Ventures,MINDTICKLE,2021-08-03,2
MindTickle,1.0,03-08-2021,United States,San Francisco,Internet software & services,Accel,MINDTICKLE,2021-08-03,2
MindTickle,1.0,03-08-2021,United States,San Francisco,Internet software & services,Canaan Partners,MINDTICKLE,2021-08-03,2
DailyPay,1.0,18-05-2021,United States,New York,Fintech,RPM Ventures,DAILYPAY,2021-05-18,2
DailyPay,1.0,18-05-2021,United States,New York,Fintech,Inspiration Ventures,DAILYPAY,2021-05-18,2
DailyPay,1.0,18-05-2021,United States,New York,Fintech,Carrick Capital Partners,DAILYPAY,2021-05-18,2
Offchain Labs,1.0,31-08-2021,United States,Princeton,Internet software & services,Pantera Capital,OFFCHAIN LABS,2021-08-31,2
Offchain Labs,1.0,31-08-2021,United States,Princeton,Internet software & services,Polychain Capital,OFFCHAIN LABS,2021-08-31,2
Offchain Labs,1.0,31-08-2021,United States,Princeton,Internet software & services,Lightspeed Venture Partners,OFFCHAIN LABS,2021-08-31,2
Copado,1.0,13-09-2021,United States,Chicago,Data management & analytics,Insight Partners,COPADO,2021-09-13,2
Copado,1.0,13-09-2021,United States,Chicago,Data management & analytics,Salesforce Ventures,COPADO,2021-09-13,2
Copado,1.0,13-09-2021,United States,Chicago,Data management & analytics,Perpetual Investors,COPADO,2021-09-13,2
Gem,1.0,28-09-2021,United States,San Francisco,Internet software & services,Accel,GEM,2021-09-28,2
Gem,1.0,28-09-2021,United States,San Francisco,Internet software & services,Greylock Partners,GEM,2021-09-28,2
Gem,1.0,28-09-2021,United States,San Francisco,Internet software & services,Meritech Capital Partners,GEM,2021-09-28,2
CarDekho,1.0,13-10-2021,India,Jaipur,E-commerce & direct-to-consumer,Sequoia Capital India,CARDEKHO,2021-10-13,2
CarDekho,1.0,13-10-2021,India,Jaipur,E-commerce & direct-to-consumer,Hillhouse Capital Management,CARDEKHO,2021-10-13,2
CarDekho,1.0,13-10-2021,India,Jaipur,E-commerce & direct-to-consumer,Sunley House Capital Management,CARDEKHO,2021-10-13,2
MyGlamm,1.0,10-11-2021,India,Mumbai,E-commerce & direct-to-consumer,L'Occitane,MYGLAMM,2021-11-10,2
MyGlamm,1.0,10-11-2021,India,Mumbai,E-commerce & direct-to-consumer,Trifecta Capital,MYGLAMM,2021-11-10,2
MyGlamm,1.0,10-11-2021,India,Mumbai,E-commerce & direct-to-consumer,Bessemer Venture Partners,MYGLAMM,2021-11-10,2
AgentSync,1.0,07-12-2021,United States,Denver,Fintech,Craft Ventures,AGENTSYNC,2021-12-07,2
AgentSync,1.0,07-12-2021,United States,Denver,Fintech,Caffeinated Capital,AGENTSYNC,2021-12-07,2
AgentSync,1.0,07-12-2021,United States,Denver,Fintech,Operator Collective,AGENTSYNC,2021-12-07,2
Pristyn Care,1.0,07-12-2021,India,Gurugram,Health,Sequoia Capital India,PRISTYN CARE,2021-12-07,2
Pristyn Care,1.0,07-12-2021,India,Gurugram,Health,Hummingbird Ventures,PRISTYN CARE,2021-12-07,2
Pristyn Care,1.0,07-12-2021,India,Gurugram,Health,Epiq Capital,PRISTYN CARE,2021-12-07,2
Merama,1.0,09-12-2021,Mexico,Mexico City,E-commerce & direct-to-consumer,SoftBank Latin America Fund,MERAMA,2021-12-09,2
Merama,1.0,09-12-2021,Mexico,Mexico City,E-commerce & direct-to-consumer,Advent International,MERAMA,2021-12-09,2
Merama,1.0,09-12-2021,Mexico,Mexico City,E-commerce & direct-to-consumer,Balderton Capital,MERAMA,2021-12-09,2
SeekOut,1.0,12-01-2022,United States,Bellevue,Internet software & services,Mayfield,SEEKOUT,2022-01-12,1
SeekOut,1.0,12-01-2022,United States,Bellevue,Internet software & services,Madrona Venture Group,SEEKOUT,2022-01-12,1
SeekOut,1.0,12-01-2022,United States,Bellevue,Internet software & services,Tiger Global Management,SEEKOUT,2022-01-12,1
BigPanda,1.0,12-01-2022,United States,Mountain View,Artificial intelligence,Advent International,BIGPANDA,2022-01-12,1
BigPanda,1.0,12-01-2022,United States,Mountain View,Artificial intelligence,Battery Ventures,BIGPANDA,2022-01-12,1
BigPanda,1.0,12-01-2022,United States,Mountain View,Artificial intelligence,Sequoia Capital Israel,BIGPANDA,2022-01-12,1
Phantom,1.0,31-01-2022,United States,San Francisco,Fintech,Paradigm,PHANTOM,2022-01-31,1
Phantom,1.0,31-01-2022,United States,San Francisco,Fintech,Andreessen Horowitz,PHANTOM,2022-01-31,1
Phantom,1.0,31-01-2022,United States,San Francisco,Fintech,Jump Capital,PHANTOM,2022-01-31,1
LivSpace,1.0,08-02-2022,India,Bengaluru,E-commerce & direct-to-consumer,Jungle Ventures,LIVSPACE,2022-02-08,1
LivSpace,1.0,08-02-2022,India,Bengaluru,E-commerce & direct-to-consumer,Helion Venture Partners,LIVSPACE,2022-02-08,1
LivSpace,1.0,08-02-2022,India,Bengaluru,E-commerce & direct-to-consumer,INGKA Investments,LIVSPACE,2022-02-08,1
Xpressbees,1.0,09-02-2022,India,Pune,"Supply chain, logistics, & delivery",Norwest Venture Partners,XPRESSBEES,2022-02-09,1
Xpressbees,1.0,09-02-2022,India,Pune,"Supply chain, logistics, & delivery",Investcorp,XPRESSBEES,2022-02-09,1
Xpressbees,1.0,09-02-2022,India,Pune,"Supply chain, logistics, & delivery",Blackstone,XPRESSBEES,2022-02-09,1
Nova Labs,1.0,22-02-2022,United States,San Francisco,Internet software & services,FirstMark Capital,NOVA LABS,2022-02-22,1
Nova Labs,1.0,22-02-2022,United States,San Francisco,Internet software & services,Tiger Global Management,NOVA LABS,2022-02-22,1
Nova Labs,1.0,22-02-2022,United States,San Francisco,Internet software & services,FTX Venture,NOVA LABS,2022-02-22,1
Choco,1.0,12-04-2022,Germany,Berlin,E-commerce & direct-to-consumer,Bessemer Venture Partners,CHOCO,2022-04-12,1
Choco,1.0,12-04-2022,Germany,Berlin,E-commerce & direct-to-consumer,G Squared,CHOCO,2022-04-12,1
Choco,1.0,12-04-2022,Germany,Berlin,E-commerce & direct-to-consumer,Insight Partners,CHOCO,2022-04-12,1
Viz.ai,1.0,07-04-2022,United States,San Francisco,Artificial Intelligence,Kleiner Perkins Caufield & Byers,VIZ.AI,2022-04-07,1
Viz.ai,1.0,07-04-2022,United States,San Francisco,Artificial Intelligence,CRV,VIZ.AI,2022-04-07,1
Viz.ai,1.0,07-04-2022,United States,San Francisco,Artificial Intelligence,Threshold Ventures,VIZ.AI,2022-04-07,1
Unit,1.0,17-05-2022,United States,New York,Fintech,Accel,UNIT,2022-05-17,1
Unit,1.0,17-05-2022,United States,New York,Fintech,Better Tomorrow Ventures,UNIT,2022-05-17,1
Unit,1.0,17-05-2022,United States,New York,Fintech,Flourish Ventures,UNIT,2022-05-17,1
stori,1.0,15-07-2022,Mexico,Juarez,Fintech,Vision Plus Capital,STORI,2022-07-15,1
stori,1.0,15-07-2022,Mexico,Juarez,Fintech,Source Code Capital,STORI,2022-07-15,1
stori,1.0,15-07-2022,Mexico,Juarez,Fintech,Lightspeed Venture Partners,STORI,2022-07-15,1
Spectrum Medical,1.0,18-07-2022,United Kingdom,Gloucester,Health,CVC Capital Partners,SPECTRUM MEDICAL,2022-07-18,1
Swiftly,1.0,19-09-2022,United States,Seattle,Mobile & telecommunications,Mendacre,SWIFTLY,2022-09-19,1
Swiftly,1.0,19-09-2022,United States,Seattle,Mobile & telecommunications,BRV Capital Management,SWIFTLY,2022-09-19,1
Swiftly,1.0,19-09-2022,United States,Seattle,Mobile & telecommunications,Liquid 2 Ventures,SWIFTLY,2022-09-19,1
CloudBees,1.0,09-12-2021,United States,San Jose,Data management & analytics,Matrix Partners,CLOUDBEES,2021-12-09,2
CloudBees,1.0,09-12-2021,United States,San Jose,Data management & analytics,Lightspeed Venture Partners,CLOUDBEES,2021-12-09,2
CloudBees,1.0,09-12-2021,United States,San Jose,Data management & analytics,Verizon Ventures,CLOUDBEES,2021-12-09,2
Colossal,1.0,31-01-2023,United States,Austin,Health,Animal Capital,COLOSSAL,2023-01-31,0
Colossal,1.0,31-01-2023,United States,Austin,Health,Breyer Capital,COLOSSAL,2023-01-31,0
Colossal,1.0,31-01-2023,United States,Austin,Health,In-Q-Tel,COLOSSAL,2023-01-31,0
L&P Cosmetic,1.0,01-01-2016,South Korea,Seoul,Consumer & retail,CDIB Capital,L&P COSMETIC,2016-01-01,7
Mininglamp Technology,1.0,27-03-2019,China,Beijing,Artificial intelligence,Russia-China Investment Fund,MININGLAMP TECHNOLOGY,2019-03-27,4
Mininglamp Technology,1.0,27-03-2019,China,Beijing,Artificial intelligence,Tencent Holdings,MININGLAMP TECHNOLOGY,2019-03-27,4
Mininglamp Technology,1.0,27-03-2019,China,Beijing,Artificial intelligence,Sequoia Capital China,MININGLAMP TECHNOLOGY,2019-03-27,4
Luoji Siwei,1.0,20-07-2017,China,Beijing,Edtech,Sequoia Capital China,LUOJI SIWEI,2017-07-20,6
Luoji Siwei,1.0,20-07-2017,China,Beijing,Edtech,Qiming Venture Partners,LUOJI SIWEI,2017-07-20,6
Luoji Siwei,1.0,20-07-2017,China,Beijing,Edtech,Tencent Holdings,LUOJI SIWEI,2017-07-20,6
Yimidida,1.0,14-01-2019,China,Shanghai,"Supply chain, logistics, & delivery",Source Code Capital,YIMIDIDA,2019-01-14,4
Yimidida,1.0,14-01-2019,China,Shanghai,"Supply chain, logistics, & delivery",Global Logistic Properties,YIMIDIDA,2019-01-14,4
Yimidida,1.0,14-01-2019,China,Shanghai,"Supply chain, logistics, & delivery",K2VC,YIMIDIDA,2019-01-14,4
Modern Health,1.0,11-02-2021,United States,San Francisco,Health,Kleiner Perkins Caufield & Byers,MODERN HEALTH,2021-02-11,2
Modern Health,1.0,11-02-2021,United States,San Francisco,Health,Afore Capital,MODERN HEALTH,2021-02-11,2
Modern Health,1.0,11-02-2021,United States,San Francisco,Health,Founders Fund,MODERN HEALTH,2021-02-11,2
IRL,1.0,15-06-2021,United States,San Francisco,Internet software & services,Goodwater Capital,IRL,2021-06-15,2
IRL,1.0,15-06-2021,United States,San Francisco,Internet software & services,Floodgate,IRL,2021-06-15,2
IRL,1.0,15-06-2021,United States,San Francisco,Internet software & services,Founders Fund,IRL,2021-06-15,2
Tuhu,1.0,15-09-2018,China,Shanghai,Auto & transportation,Qiming Venture Partners,TUHU,2018-09-15,5
Tuhu,1.0,15-09-2018,China,Shanghai,Auto & transportation,Yaxia Automobile,TUHU,2018-09-15,5
Tuhu,1.0,15-09-2018,China,Shanghai,Auto & transportation,Far East Horizon,TUHU,2018-09-15,5
Younited,1.0,08-12-2022,France,Paris,Fintech,Weber Investissements,YOUNITED,2022-12-08,1
Younited,1.0,08-12-2022,France,Paris,Fintech,Schibsted Growth,YOUNITED,2022-12-08,1
SOURCE Global,1.0,29-04-2022,United States,Scottsdale,Other,Breakthrough Energy Ventures,SOURCE GLOBAL,2022-04-29,1
SOURCE Global,1.0,29-04-2022,United States,Scottsdale,Other,Material Impact,SOURCE GLOBAL,2022-04-29,1
SOURCE Global,1.0,29-04-2022,United States,Scottsdale,Other,3x5 Special Opportunity Partners,SOURCE GLOBAL,2022-04-29,1
LifeMiles,1.0,13-07-2015,Colombia,Bogota,Other,Advent International,LIFEMILES,2015-07-13,8
Venafi,1.0,10-12-2020,United States,Salt Lake City,Cybersecurity,Pelion Venture Partners,VENAFI,2020-12-10,3
Venafi,1.0,10-12-2020,United States,Salt Lake City,Cybersecurity,Foundation Capital,VENAFI,2020-12-10,3
Venafi,1.0,10-12-2020,United States,Salt Lake City,Cybersecurity,Thoma Bravo,VENAFI,2020-12-10,3
Guideline,1.0,16-06-2021,United States,San Mateo,Fintech,Pelion Venture Partners,GUIDELINE,2021-06-16,2
Guideline,1.0,16-06-2021,United States,San Mateo,Fintech,Foundation Capital,GUIDELINE,2021-06-16,2
Guideline,1.0,16-06-2021,United States,San Mateo,Fintech,Thoma Bravo,GUIDELINE,2021-06-16,2
Rebellion Defense,1.0,16-09-2021,United States,Washington DC,Artificial intelligence,Venrock,REBELLION DEFENSE,2021-09-16,2
Rebellion Defense,1.0,16-09-2021,United States,Washington DC,Artificial intelligence,Innovation Endeavors,REBELLION DEFENSE,2021-09-16,2
Rebellion Defense,1.0,16-09-2021,United States,Washington DC,Artificial intelligence,Insights Partners,REBELLION DEFENSE,2021-09-16,2
Elemy,1.0,06-10-2021,United States,San Francisco,Health,General Catalyst,ELEMY,2021-10-06,2
Elemy,1.0,06-10-2021,United States,San Francisco,Health,Bling Capital,ELEMY,2021-10-06,2
Elemy,1.0,06-10-2021,United States,San Francisco,Health,Felicis Ventures,ELEMY,2021-10-06,2
Happy Money,1.0,08-02-2022,United States,Tustin,Fintech,FirstMark Capital,HAPPY MONEY,2022-02-08,1
Happy Money,1.0,08-02-2022,United States,Tustin,Fintech,Anthemis,HAPPY MONEY,2022-02-08,1
Happy Money,1.0,08-02-2022,United States,Tustin,Fintech,CMFG Ventures,HAPPY MONEY,2022-02-08,1
TELD,1.0,16-12-2019,China,Qingdao,Fintech,China Reform Fund,TELD,2019-12-16,4
TELD,1.0,16-12-2019,China,Qingdao,Fintech,Gaopeng Capital,TELD,2019-12-16,4
TELD,1.0,16-12-2019,China,Qingdao,Fintech,Jinhui Xingye,TELD,2019-12-16,4
DANA,1.0,10-08-2022,Indonesia,Jakarta,Fintech,Ant Group,DANA,2022-08-10,1
DANA,1.0,10-08-2022,Indonesia,Jakarta,Fintech,Lazada,DANA,2022-08-10,1
DANA,1.0,10-08-2022,Indonesia,Jakarta,Fintech,Sinar Mas Indonesia,DANA,2022-08-10,1
At-Bay,1.0,27-07-2021,United States,Mountain View,Fintech,Lightspeed Venture Partners,AT-BAY,2021-07-27,2
At-Bay,1.0,27-07-2021,United States,Mountain View,Fintech,Khosla Ventures,AT-BAY,2021-07-27,2
At-Bay,1.0,27-07-2021,United States,Mountain View,Fintech,Munich Re Ventures,AT-BAY,2021-07-27,2
Visby Medical,1.0,01-03-2022,United States,San Jose,Health,Artiman Ventures,VISBY MEDICAL,2022-03-01,1
Visby Medical,1.0,01-03-2022,United States,San Jose,Health,Pitango Venture Capital,VISBY MEDICAL,2022-03-01,1
Visby Medical,1.0,01-03-2022,United States,San Jose,Health,Valo Ventures,VISBY MEDICAL,2022-03-01,1
Invoca,1.0,14-06-2022,United States,Santa Barbara,Artificial intelligence,Upfront Ventures,INVOCA,2022-06-14,1
Invoca,1.0,14-06-2022,United States,Santa Barbara,Artificial intelligence,Accel,INVOCA,2022-06-14,1
Invoca,1.0,14-06-2022,United States,Santa Barbara,Artificial intelligence,Industry Ventures,INVOCA,2022-06-14,1
Wasabi,1.0,27-09-2022,United States,Boston,Internet software & services,Forestay Capital,WASABI,2022-09-27,1
Wasabi,1.0,27-09-2022,United States,Boston,Internet software & services,Alumni Ventures,WASABI,2022-09-27,1
Wasabi,1.0,27-09-2022,United States,Boston,Internet software & services,NTT DoCoMo Ventures,WASABI,2022-09-27,1
Flexe,1.0,21-04-2022,United States,Seattle,"Supply chain, logistics, & delivery",Redpoint Ventures,FLEXE,2022-04-21,1
Flexe,1.0,21-04-2022,United States,Seattle,"Supply chain, logistics, & delivery",Prologis Ventures,FLEXE,2022-04-21,1
Flexe,1.0,21-04-2022,United States,Seattle,"Supply chain, logistics, & delivery",Madrona Venture Group,FLEXE,2022-04-21,1
TangoMe,1.0,20-03-2014,United States,Mountain View,Mobile & telecommunications,Draper Fisher Jurtson,TANGOME,2014-03-20,9
TangoMe,1.0,20-03-2014,United States,Mountain View,Mobile & telecommunications,Qualcomm Ventures,TANGOME,2014-03-20,9
TangoMe,1.0,20-03-2014,United States,Mountain View,Mobile & telecommunications,Alibaba Group,TANGOME,2014-03-20,9
AppDirect,1.0,07-10-2015,United States,San Francisco,E-commerce & direct-to-consumer,Mithril,APPDIRECT,2015-10-07,8
AppDirect,1.0,07-10-2015,United States,San Francisco,E-commerce & direct-to-consumer,iNovia Capital,APPDIRECT,2015-10-07,8
AppDirect,1.0,07-10-2015,United States,San Francisco,E-commerce & direct-to-consumer,Foundry Group,APPDIRECT,2015-10-07,8
Juanpi,1.0,14-04-2016,China,Wuhan,E-commerce & direct-to-consumer,Tiantu Capital,JUANPI,2016-04-14,7
Juanpi,1.0,14-04-2016,China,Wuhan,E-commerce & direct-to-consumer,SAIF Partners China,JUANPI,2016-04-14,7
Juanpi,1.0,14-04-2016,China,Wuhan,E-commerce & direct-to-consumer,Newsion Venture Capital,JUANPI,2016-04-14,7
OVH,1.0,15-08-2016,France,Roubaix,Other,KKR,OVH,2016-08-15,7
OVH,1.0,15-08-2016,France,Roubaix,Other,TowerBrook Capital Partners,OVH,2016-08-15,7
GetYourGuide,1.0,16-05-2019,Germany,Berlin,Travel,Spark Capital,GETYOURGUIDE,2019-05-16,4
GetYourGuide,1.0,16-05-2019,Germany,Berlin,Travel,Highland Europe,GETYOURGUIDE,2019-05-16,4
GetYourGuide,1.0,16-05-2019,Germany,Berlin,Travel,Sunstone Capital,GETYOURGUIDE,2019-05-16,4
Ivalua,1.0,21-05-2019,United States,Redwood City,Fintech,Ardian,IVALUA,2019-05-21,4
Ivalua,1.0,21-05-2019,United States,Redwood City,Fintech,Tiger Global Management,IVALUA,2019-05-21,4
Ivalua,1.0,21-05-2019,United States,Redwood City,Fintech,KKR,IVALUA,2019-05-21,4
Sisense,1.0,09-01-2020,United States,New York,Data management & analytics,Opus Capital,SISENSE,2020-01-09,3
Sisense,1.0,09-01-2020,United States,New York,Data management & analytics,Genesis Partners,SISENSE,2020-01-09,3
Sisense,1.0,09-01-2020,United States,New York,Data management & analytics,Battery Ventures,SISENSE,2020-01-09,3
Pharmapacks,1.0,12-11-2020,United States,Islandia,E-commerce & direct-to-consumer,The Carlyle Group,PHARMAPACKS,2020-11-12,3
Sennder,1.0,14-01-2021,Germany,Berlin,"Supply chain, logistics, & delivery",Accelm Scania Growth Capital,SENNDER,2021-01-14,2
Sennder,1.0,14-01-2021,Germany,Berlin,"Supply chain, logistics, & delivery",Lakestar,SENNDER,2021-01-14,2
Nexthink,1.0,08-02-2021,Switzerland,Prilly,Data management & analytics,Auriga,NEXTHINK,2021-02-08,2
Nexthink,1.0,08-02-2021,Switzerland,Prilly,Data management & analytics,Galeo Ventures,NEXTHINK,2021-02-08,2
Nexthink,1.0,08-02-2021,Switzerland,Prilly,Data management & analytics,Highland Europe,NEXTHINK,2021-02-08,2
Zego,1.0,09-03-2021,United Kingdom,London,Fintech,LocalGlobe,ZEGO,2021-03-09,2
Zego,1.0,09-03-2021,United Kingdom,London,Fintech,Balderton Capital,ZEGO,2021-03-09,2
Zego,1.0,09-03-2021,United Kingdom,London,Fintech,Target Global,ZEGO,2021-03-09,2
Rightway,1.0,30-03-2021,United States,New York,Health,Thrive Capital,RIGHTWAY,2021-03-30,2
Rightway,1.0,30-03-2021,United States,New York,Health,Khosla Ventures,RIGHTWAY,2021-03-30,2
Rightway,1.0,30-03-2021,United States,New York,Health,Tiger Global Management,RIGHTWAY,2021-03-30,2
Sunbit,1.0,20-05-2021,United States,Los Angeles,Fintech,Zeev Ventures,SUNBIT,2021-05-20,2
Sunbit,1.0,20-05-2021,United States,Los Angeles,Fintech,Group11,SUNBIT,2021-05-20,2
Sunbit,1.0,20-05-2021,United States,Los Angeles,Fintech,Chicago Ventures,SUNBIT,2021-05-20,2
Qingting FM,1.0,02-06-2021,China,Shanghai,Internet software & services,China Culture Industrial Investment Fund,QINGTING FM,2021-06-02,2
Qingting FM,1.0,02-06-2021,China,Shanghai,Internet software & services,We Capital,QINGTING FM,2021-06-02,2
Qingting FM,1.0,02-06-2021,China,Shanghai,Internet software & services,China Minsheng Investment Group,QINGTING FM,2021-06-02,2
G2,1.0,22-06-2021,United States,Chicago,Internet software & services,Pritzker Group Venture Capital,G2,2021-06-22,2
G2,1.0,22-06-2021,United States,Chicago,Internet software & services,Accel,G2,2021-06-22,2
G2,1.0,22-06-2021,United States,Chicago,Internet software & services,Hyde Park Venture Partners,G2,2021-06-22,2
Hailo,1.0,12-10-2021,Israel,Tel Aviv,Artificial intelligence,Glory Ventures,HAILO,2021-10-12,2
Hailo,1.0,12-10-2021,Israel,Tel Aviv,Artificial intelligence,Maniv Mobility,HAILO,2021-10-12,2
Caribou,1.0,23-05-2022,United States,Denver,Fintech,CMFG Ventures,CARIBOU,2022-05-23,1
Caribou,1.0,23-05-2022,United States,Denver,Fintech,Accomplice,CARIBOU,2022-05-23,1
Caribou,1.0,23-05-2022,United States,Denver,Fintech,Moderne Ventures,CARIBOU,2022-05-23,1
Nowports,1.0,24-05-2022,Mexico,Monterrey,"Supply chain, logistics, & delivery",Monashees+,NOWPORTS,2022-05-24,1
Nowports,1.0,24-05-2022,Mexico,Monterrey,"Supply chain, logistics, & delivery",Foundation Capital,NOWPORTS,2022-05-24,1
Nowports,1.0,24-05-2022,Mexico,Monterrey,"Supply chain, logistics, & delivery",Base10 Partners,NOWPORTS,2022-05-24,1
People.ai,1.0,11-08-2021,United States,San Francisco,Internet software & services,GGV Capital,PEOPLE.AI,2021-08-11,2
People.ai,1.0,11-08-2021,United States,San Francisco,Internet software & services,Lightspeed Venture Partners,PEOPLE.AI,2021-08-11,2
People.ai,1.0,11-08-2021,United States,San Francisco,Internet software & services,ICONIQ Capital,PEOPLE.AI,2021-08-11,2
Carousell,1.0,15-09-2021,Singapore,Unknown,E-commerce & direct-to-consumer,500 Global,CAROUSELL,2021-09-15,2
Carousell,1.0,15-09-2021,Singapore,Unknown,E-commerce & direct-to-consumer,Rakuten Ventures,CAROUSELL,2021-09-15,2
Carousell,1.0,15-09-2021,Singapore,Unknown,E-commerce & direct-to-consumer,Golden Gate Ventures,CAROUSELL,2021-09-15,2
apna,1.0,15-09-2021,India,Bengaluru,Internet software & services,Sequoia Capital India,APNA,2021-09-15,2
apna,1.0,15-09-2021,India,Bengaluru,Internet software & services,Rocketship.vc,APNA,2021-09-15,2
apna,1.0,15-09-2021,India,Bengaluru,Internet software & services,Lightspeed India Partners,APNA,2021-09-15,2
Karat,1.0,13-10-2021,United States,Seattle,Internet software & services,8VC,KARAT,2021-10-13,2
Karat,1.0,13-10-2021,United States,Seattle,Internet software & services,Norwest Venture Partners,KARAT,2021-10-13,2
Karat,1.0,13-10-2021,United States,Seattle,Internet software & services,Tiger Global Management,KARAT,2021-10-13,2
Enpal,1.0,18-10-2021,Germany,Berlin,Internet software & services,HV Capital,ENPAL,2021-10-18,2
Enpal,1.0,18-10-2021,Germany,Berlin,Internet software & services,Softbank Group,ENPAL,2021-10-18,2
Enpal,1.0,18-10-2021,Germany,Berlin,Internet software & services,BlackRock,ENPAL,2021-10-18,2
Acko General Insurance,1.0,28-10-2021,India,Bengaluru,Fintech,Intact Ventures,ACKO GENERAL INSURANCE,2021-10-28,2
Acko General Insurance,1.0,28-10-2021,India,Bengaluru,Fintech,Munich Re Ventures,ACKO GENERAL INSURANCE,2021-10-28,2
Acko General Insurance,1.0,28-10-2021,India,Bengaluru,Fintech,General Atlantic,ACKO GENERAL INSURANCE,2021-10-28,2
Daily Harvest,1.0,16-11-2021,United States,New York,E-commerce & direct-to-consumer,M13,DAILY HARVEST,2021-11-16,2
Daily Harvest,1.0,16-11-2021,United States,New York,E-commerce & direct-to-consumer,Lightspeed Venture Partners,DAILY HARVEST,2021-11-16,2
Daily Harvest,1.0,16-11-2021,United States,New York,E-commerce & direct-to-consumer,Lone Pine Capital,DAILY HARVEST,2021-11-16,2
The Bank of London,1.0,30-11-2021,United Kingdom,London,Fintech,Mangrove Capital Partners,THE BANK OF LONDON,2021-11-30,2
The Bank of London,1.0,30-11-2021,United Kingdom,London,Fintech,14W. ForgeLight,THE BANK OF LONDON,2021-11-30,2
Fundbox,1.0,30-11-2021,United States,San Francisco,Fintech,Khosla Ventures,FUNDBOX,2021-11-30,2
Fundbox,1.0,30-11-2021,United States,San Francisco,Fintech,General Catalyst,FUNDBOX,2021-11-30,2
Fundbox,1.0,30-11-2021,United States,San Francisco,Fintech,Blumberg Capital,FUNDBOX,2021-11-30,2
Turing,1.0,20-12-2021,United States,Palo Alto,Internet software & services,Foundation Capital,TURING,2021-12-20,2
Turing,1.0,20-12-2021,United States,Palo Alto,Internet software & services,Frontier Ventures,TURING,2021-12-20,2
Turing,1.0,20-12-2021,United States,Palo Alto,Internet software & services,AltaIR Capital,TURING,2021-12-20,2
GlobalBees,1.0,28-12-2021,India,New Delhi,E-commerce & direct-to-consumer,Chiratae Ventures,GLOBALBEES,2021-12-28,2
GlobalBees,1.0,28-12-2021,India,New Delhi,E-commerce & direct-to-consumer,SoftBank Group,GLOBALBEES,2021-12-28,2
GlobalBees,1.0,28-12-2021,India,New Delhi,E-commerce & direct-to-consumer,Trifecta Capital,GLOBALBEES,2021-12-28,2
LEAD,1.0,13-01-2022,India,Andheri,Edtech,WestBridge Capital,LEAD,2022-01-13,1
LEAD,1.0,13-01-2022,India,Andheri,Edtech,GSV Ventures,LEAD,2022-01-13,1
LEAD,1.0,13-01-2022,India,Andheri,Edtech,Elevar Equity,LEAD,2022-01-13,1
eSentire,1.0,22-02-2022,Canada,Waterloo,Cybersecurity,Edison Partners,ESENTIRE,2022-02-22,1
eSentire,1.0,22-02-2022,Canada,Waterloo,Cybersecurity,Georgian Partners,ESENTIRE,2022-02-22,1
eSentire,1.0,22-02-2022,Canada,Waterloo,Cybersecurity,VentureLink,ESENTIRE,2022-02-22,1
Beyond Identity,1.0,22-02-2022,United States,New York,Cybersecurity,New Enterprise Associates,BEYOND IDENTITY,2022-02-22,1
Beyond Identity,1.0,22-02-2022,United States,New York,Cybersecurity,Koch Disruptive Technologies,BEYOND IDENTITY,2022-02-22,1
Beyond Identity,1.0,22-02-2022,United States,New York,Cybersecurity,Evolution Equity Partners,BEYOND IDENTITY,2022-02-22,1
Staffbase,1.0,15-03-2022,Germany,Chemnitz,Internet software & services,Insight Partners,STAFFBASE,2022-03-15,1
Staffbase,1.0,15-03-2022,Germany,Chemnitz,Internet software & services,e.ventures,STAFFBASE,2022-03-15,1
Staffbase,1.0,15-03-2022,Germany,Chemnitz,Internet software & services,General Atlantic,STAFFBASE,2022-03-15,1
Chief,1.0,31-03-2022,United States,New York,Other,General Catalyst,CHIEF,2022-03-31,1
Chief,1.0,31-03-2022,United States,New York,Other,Inspired Capital,CHIEF,2022-03-31,1
Chief,1.0,31-03-2022,United States,New York,Other,Flybridge Capital Partners,CHIEF,2022-03-31,1
IntelyCare,1.0,06-04-2022,United States,Quincy,Health,Kaiser Permanente Ventures,INTELYCARE,2022-04-06,1
IntelyCare,1.0,06-04-2022,United States,Quincy,Health,Endeavour Vision,INTELYCARE,2022-04-06,1
IntelyCare,1.0,06-04-2022,United States,Quincy,Health,LRVHealth,INTELYCARE,2022-04-06,1
Teleport,1.0,03-05-2022,United States,Oakland,Cybersecurity,Kleiner Perkins Caufield & Byers,TELEPORT,2022-05-03,1
Teleport,1.0,03-05-2022,United States,Oakland,Cybersecurity,s28 Capital,TELEPORT,2022-05-03,1
Teleport,1.0,03-05-2022,United States,Oakland,Cybersecurity,Insight Partners,TELEPORT,2022-05-03,1
Imply Data,1.0,17-05-2022,United States,Burlingame,Data management & analytics,Andreessen Horowitz,IMPLY DATA,2022-05-17,1
Imply Data,1.0,17-05-2022,United States,Burlingame,Data management & analytics,Bessemer Venture Partners,IMPLY DATA,2022-05-17,1
Imply Data,1.0,17-05-2022,United States,Burlingame,Data management & analytics,Khosla Ventures,IMPLY DATA,2022-05-17,1
Imply Data,1.0,17-05-2022,United States,Burlingame,Data management & analytics,,IMPLY DATA,2022-05-17,1
Material Security,1.0,11-05-2022,United States,Redwood City,Cybersecurity,Andreessen Horowitz,MATERIAL SECURITY,2022-05-11,1
Material Security,1.0,11-05-2022,United States,Redwood City,Cybersecurity,Founders Fund,MATERIAL SECURITY,2022-05-11,1
PhysicsWallah,1.0,07-06-2022,India,Uttar Pradesh,Edtech,GSV Ventures,PHYSICSWALLAH,2022-06-07,1
PhysicsWallah,1.0,07-06-2022,India,Uttar Pradesh,Edtech,WestBridge Capital,PHYSICSWALLAH,2022-06-07,1
Recover,1.0,09-06-2022,Spain,Banyeres de Mariola,Other,Goldman Sachs Asset Management,RECOVER,2022-06-09,1
Recover,1.0,09-06-2022,Spain,Banyeres de Mariola,Other,STORY3 Capital Partners,RECOVER,2022-06-09,1
Purplle,1.0,09-06-2022,India,Mumbai,E-commerce & direct-to-consumer,Blume Ventures,PURPLLE,2022-06-09,1
Purplle,1.0,09-06-2022,India,Mumbai,E-commerce & direct-to-consumer,JSW Ventures,PURPLLE,2022-06-09,1
Purplle,1.0,09-06-2022,India,Mumbai,E-commerce & direct-to-consumer,IvyCap Ventures,PURPLLE,2022-06-09,1
CAIS,1.0,11-01-2022,United States,New York,Fintech,Franklin Templeton,CAIS,2022-01-11,1
CAIS,1.0,11-01-2022,United States,New York,Fintech,Motive Partners. Apollo Global Management,CAIS,2022-01-11,1
Nxin,1.0,18-09-2018,China,Beijing,Internet software & services,Beijing Juneng Hesheng Industry Investment Fund,NXIN,2018-09-18,5
Nxin,1.0,18-09-2018,China,Beijing,Internet software & services,Beijing Shuju Xinrong Fund,NXIN,2018-09-18,5
UISEE Technology,1.0,25-01-2021,China,Beijing,"Supply chain, logistics, & delivery",Shenzhen Capital Group,UISEE TECHNOLOGY,2021-01-25,2
UISEE Technology,1.0,25-01-2021,China,Beijing,"Supply chain, logistics, & delivery",Robert Bosch Venture Capital,UISEE TECHNOLOGY,2021-01-25,2
UISEE Technology,1.0,25-01-2021,China,Beijing,"Supply chain, logistics, & delivery",SeptWolves Ventures,UISEE TECHNOLOGY,2021-01-25,2
56PINGTAI,1.0,25-01-2021,China,Shanghai,"Supply chain, logistics, & delivery",QF Capital,56PINGTAI,2021-01-25,2
56PINGTAI,1.0,25-01-2021,China,Shanghai,"Supply chain, logistics, & delivery",QC Capital,56PINGTAI,2021-01-25,2
56PINGTAI,1.0,25-01-2021,China,Shanghai,"Supply chain, logistics, & delivery",Unicom Innovation Venture Capital,56PINGTAI,2021-01-25,2
Cirkul,1.0,13-06-2022,United States,Sarasota,Consumer & retail,AF Ventures,CIRKUL,2022-06-13,1
Cirkul,1.0,13-06-2022,United States,Sarasota,Consumer & retail,Siddhi Capital,CIRKUL,2022-06-13,1
Cirkul,1.0,13-06-2022,United States,Sarasota,Consumer & retail,SC.Holdings,CIRKUL,2022-06-13,1
Radius Payment Solutions,1.0,27-11-2017,United Kingdom,Crewe,Fintech,Inflexion Private Equity,RADIUS PAYMENT SOLUTIONS,2017-11-27,6
Rivigo,1.0,11-07-2019,India,Gurgaon,"Supply chain, logistics, & delivery",SAIF Partners India,RIVIGO,2019-07-11,4
Rivigo,1.0,11-07-2019,India,Gurgaon,"Supply chain, logistics, & delivery",Warburg Pincus,RIVIGO,2019-07-11,4
Rivigo,1.0,11-07-2019,India,Gurgaon,"Supply chain, logistics, & delivery",Trifecta Capital Advisors,RIVIGO,2019-07-11,4
Mamaearth,1.0,28-12-2021,India,Gurgaon,E-commerce & direct-to-consumer,Fireside Ventures,MAMAEARTH,2021-12-28,2
Mamaearth,1.0,28-12-2021,India,Gurgaon,E-commerce & direct-to-consumer,Sequoia Capital India,MAMAEARTH,2021-12-28,2
Mamaearth,1.0,28-12-2021,India,Gurgaon,E-commerce & direct-to-consumer,Stellaris Venture Partners,MAMAEARTH,2021-12-28,2
0x,1.0,26-04-2022,United States,San Francisco,Fintech,Jump Capital,0X,2022-04-26,1
0x,1.0,26-04-2022,United States,San Francisco,Fintech,Pantera Capital,0X,2022-04-26,1
0x,1.0,26-04-2022,United States,San Francisco,Fintech,Greylock Partners,0X,2022-04-26,1
Jiuxian,1.0,30-07-2015,China,Beijing,E-commerce & direct-to-consumer,Sequoia Capital China,JIUXIAN,2015-07-30,8
Jiuxian,1.0,30-07-2015,China,Beijing,E-commerce & direct-to-consumer,Rich Land Capital,JIUXIAN,2015-07-30,8
Jiuxian,1.0,30-07-2015,China,Beijing,E-commerce & direct-to-consumer,Merrysunny Wealth,JIUXIAN,2015-07-30,8
Instabase,1.0,21-10-2019,United States,San Francisco,Data management & analytics,New Enterprise Associates,INSTABASE,2019-10-21,4
Instabase,1.0,21-10-2019,United States,San Francisco,Data management & analytics,Greylock Partners,INSTABASE,2019-10-21,4
Instabase,1.0,21-10-2019,United States,San Francisco,Data management & analytics,Andreessen Horowitz,INSTABASE,2019-10-21,4
Sendbird,1.0,06-04-2021,United States,San Mateo,Mobile & telecommunications,FundersClub,SENDBIRD,2021-04-06,2
Sendbird,1.0,06-04-2021,United States,San Mateo,Mobile & telecommunications,Y Combinator,SENDBIRD,2021-04-06,2
Sendbird,1.0,06-04-2021,United States,San Mateo,Mobile & telecommunications,Tiger Global Management,SENDBIRD,2021-04-06,2
Density,1.0,10-11-2021,United States,San Francisco,Hardware,Founders Fund,DENSITY,2021-11-10,2
Density,1.0,10-11-2021,United States,San Francisco,Hardware,Upfront Ventures,DENSITY,2021-11-10,2
Density,1.0,10-11-2021,United States,San Francisco,Hardware,01 Advisors,DENSITY,2021-11-10,2
Mixpanel,1.0,15-11-2021,United States,San Francisco,Internet software & services,Bain Capital Tech Opportunities,MIXPANEL,2021-11-15,2
Mixpanel,1.0,15-11-2021,United States,San Francisco,Internet software & services,Andreessen Horowitz,MIXPANEL,2021-11-15,2
Mixpanel,1.0,15-11-2021,United States,San Francisco,Internet software & services,Sequoia Capital,MIXPANEL,2021-11-15,2
Branch,1.0,01-03-2022,United States,Columbus,Fintech,American Family Ventures,BRANCH COLUMBUS,2022-03-01,1
Branch,1.0,01-03-2022,United States,Columbus,Fintech,Greycroft,BRANCH COLUMBUS,2022-03-01,1
Branch,1.0,01-03-2022,United States,Columbus,Fintech,SignalFire,BRANCH COLUMBUS,2022-03-01,1
OrCam Technologies,1.0,20-02-2018,Israel,Jerusalem,Artificial intelligence,Intel Capital,ORCAM TECHNOLOGIES,2018-02-20,5
OrCam Technologies,1.0,20-02-2018,Israel,Jerusalem,Artificial intelligence,Aviv Venture Capital,ORCAM TECHNOLOGIES,2018-02-20,5
Ample,1.0,11-11-2021,United States,San Francisco,Hardware,Shell Ventures,AMPLE,2021-11-11,2
Ample,1.0,11-11-2021,United States,San Francisco,Hardware,Blackstone,AMPLE,2021-11-11,2
Ample,1.0,11-11-2021,United States,San Francisco,Hardware,Moore Strategic Ventures,AMPLE,2021-11-11,2
BlackBuck,1.0,22-07-2021,India,Bengaluru,"Supply chain, logistics, & delivery",Accel,BLACKBUCK,2021-07-22,2
BlackBuck,1.0,22-07-2021,India,Bengaluru,"Supply chain, logistics, & delivery",Sands Capital,BLACKBUCK,2021-07-22,2
BlackBuck,1.0,22-07-2021,India,Bengaluru,"Supply chain, logistics, & delivery",International Finance Corporation,BLACKBUCK,2021-07-22,2
Leap Motor,1.0,20-11-2018,China,Hangzhou,Auto & transportation,Sequoia Capital China,LEAP MOTOR,2018-11-20,5
Leap Motor,1.0,20-11-2018,China,Hangzhou,Auto & transportation,Gopher Asset Management,LEAP MOTOR,2018-11-20,5
Leap Motor,1.0,20-11-2018,China,Hangzhou,Auto & transportation,Shanghai Electric Group,LEAP MOTOR,2018-11-20,5
Wheel,1.0,19-01-2022,United States,Austin,Health,Silverton Partners,WHEEL,2022-01-19,1
Wheel,1.0,19-01-2022,United States,Austin,Health,Tusk Ventures,WHEEL,2022-01-19,1
Wheel,1.0,19-01-2022,United States,Austin,Health,CRV,WHEEL,2022-01-19,1
DeepL,1.0,11-01-2023,Germany,Cologne,Internet software & services,Benchmark,DEEPL,2023-01-11,0
DeepL,1.0,11-01-2023,Germany,Cologne,Internet software & services,btov Partners,DEEPL,2023-01-11,0
DeepL,1.0,11-01-2023,Germany,Cologne,Internet software & services,Bessemer Venture Partners,DEEPL,2023-01-11,0
MNT-Halan,1.0,03-02-2023,Egypt,Cairo,Fintech,Middle East Venture Partners,MNT-HALAN,2023-02-03,0
MNT-Halan,1.0,03-02-2023,Egypt,Cairo,Fintech,Endeavor,MNT-HALAN,2023-02-03,0
MNT-Halan,1.0,03-02-2023,Egypt,Cairo,Fintech,Algebra Ventures,MNT-HALAN,2023-02-03,0
Character.AI,1.0,03-03-2023,United States,Menlo Park,Artificial intelligence,Andreessen Horowitz,CHARACTER.AI,2023-03-03,0
Atmosphere,1.0,07-02-2023,United States,Austin,Other,S3 Ventures,ATMOSPHERE,2023-02-07,0
Adept,1.0,14-03-2023,United States,San Francisco,Artificial intelligence,Greylock Partners,ADEPT,2023-03-14,0
Adept,1.0,14-03-2023,United States,San Francisco,Artificial intelligence,Addition,ADEPT,2023-03-14,0
Adept,1.0,14-03-2023,United States,San Francisco,Artificial intelligence,M12,ADEPT,2023-03-14,0
Beamery,1.0,13-12-2022,United Kingdom,London,Artificial intelligence,Index Ventures,BEAMERY,2022-12-13,1
Beamery,1.0,13-12-2022,United Kingdom,London,Artificial intelligence,EQT Ventures,BEAMERY,2022-12-13,1
Beamery,1.0,13-12-2022,United Kingdom,London,Artificial intelligence,Workday Ventures,BEAMERY,2022-12-13,1
Flow,1.0,15-08-2022,United States,New York,Fintech,Andreessen Horowitz,FLOW,2022-08-15,1
Xanadu,1.0,09-11-2022,Canada,Toronto,Hardware,BDC Capital,XANADU,2022-11-09,1
Xanadu,1.0,09-11-2022,Canada,Toronto,Hardware,Georgian,XANADU,2022-11-09,1
Xanadu,1.0,09-11-2022,Canada,Toronto,Hardware,Bessemer Venture Partners,XANADU,2022-11-09,1
LINE MAN Wongnai,1.0,26-09-2022,Thailand,Bangkok,E-commerce & direct-to-consumer,BRV Capital Management,LINE MAN WONGNAI,2022-09-26,1
LINE MAN Wongnai,1.0,26-09-2022,Thailand,Bangkok,E-commerce & direct-to-consumer,Bualuang Ventures,LINE MAN WONGNAI,2022-09-26,1
Celestia,1.0,19-10-2022,Liechtenstein,Vaduz,Internet software & services,Placeholder Capital,CELESTIA,2022-10-19,1
Celestia,1.0,19-10-2022,Liechtenstein,Vaduz,Internet software & services,Coinbase Ventures,CELESTIA,2022-10-19,1
Celestia,1.0,19-10-2022,Liechtenstein,Vaduz,Internet software & services,Binance Ventures,CELESTIA,2022-10-19,1
Stability AI,1.0,05-10-2022,United Kingdom,London,Artificial intelligence,Lightspeed Venture Partners,STABILITY AI,2022-10-05,1
Stability AI,1.0,05-10-2022,United Kingdom,London,Artificial intelligence,Coatue Management,STABILITY AI,2022-10-05,1
Vesttoo,1.0,25-10-2022,Israel,Tel Aviv-Yafo,Fintech,Mouro Capital,VESTTOO,2022-10-25,1
Vesttoo,1.0,25-10-2022,Israel,Tel Aviv-Yafo,Fintech,Hanaco Venture Capital,VESTTOO,2022-10-25,1
Vesttoo,1.0,25-10-2022,Israel,Tel Aviv-Yafo,Fintech,Gramercy Ventures,VESTTOO,2022-10-25,1
Satispay,1.0,28-09-2022,Italy,Milan,Fintech,Lightrock,SATISPAY,2022-09-28,1
Satispay,1.0,28-09-2022,Italy,Milan,Fintech,Greyhound Capital,SATISPAY,2022-09-28,1
Satispay,1.0,28-09-2022,Italy,Milan,Fintech,Endeavor,SATISPAY,2022-09-28,1
Paystand,1.0,02-08-2022,United States,Scotts Valley,Fintech,BlueRun Ventures,PAYSTAND,2022-08-02,1
Paystand,1.0,02-08-2022,United States,Scotts Valley,Fintech,LEAP Global Partners,PAYSTAND,2022-08-02,1
Paystand,1.0,02-08-2022,United States,Scotts Valley,Fintech,Cervin Ventures,PAYSTAND,2022-08-02,1
Turntide Technologies,1.0,15-06-2022,United States,Sunnyvale,Auto & transportation,Meson Capital Partners,TURNTIDE TECHNOLOGIES,2022-06-15,1
Turntide Technologies,1.0,15-06-2022,United States,Sunnyvale,Auto & transportation,Fifth Wall Ventures,TURNTIDE TECHNOLOGIES,2022-06-15,1
Turntide Technologies,1.0,15-06-2022,United States,Sunnyvale,Auto & transportation,OGCI Climate Investments,TURNTIDE TECHNOLOGIES,2022-06-15,1
EcoVadis,1.0,14-06-2022,France,Paris,"Supply chain, logistics, & delivery",Astorg Partners,ECOVADIS,2022-06-14,1
EcoVadis,1.0,14-06-2022,France,Paris,"Supply chain, logistics, & delivery",Princeville Global,ECOVADIS,2022-06-14,1
EcoVadis,1.0,14-06-2022,France,Paris,"Supply chain, logistics, & delivery",Beyond Net Zero,ECOVADIS,2022-06-14,1
TransferMate,1.0,22-05-2022,Ireland,Kilkenny,Fintech,Railway Pension Trustee Co. Ltd.,TRANSFERMATE,2022-05-22,1
Lookout,1.0,10-10-2013,United States,San Francisco,Cybersecurity,Accel Partners,LOOKOUT,2013-10-10,10
Lookout,1.0,10-10-2013,United States,San Francisco,Cybersecurity,Greylock Partners,LOOKOUT,2013-10-10,10
Lookout,1.0,10-10-2013,United States,San Francisco,Cybersecurity,Lowercase Capital,LOOKOUT,2013-10-10,10
Perimeter 81,1.0,06-06-2022,Israel,Tel Aviv,Cybersecurity,Insight Partners,PERIMETER 81,2022-06-06,1
Perimeter 81,1.0,06-06-2022,Israel,Tel Aviv,Cybersecurity,Toba Capital,PERIMETER 81,2022-06-06,1
Perimeter 81,1.0,06-06-2022,Israel,Tel Aviv,Cybersecurity,Spring Ventures,PERIMETER 81,2022-06-06,1
Snapdeal,1.0,21-05-2014,India,New Delhi,E-commerce & direct-to-consumer,SoftBankGroup,SNAPDEAL,2014-05-21,9
Snapdeal,1.0,21-05-2014,India,New Delhi,E-commerce & direct-to-consumer,Blackrock,SNAPDEAL,2014-05-21,9
Snapdeal,1.0,21-05-2014,India,New Delhi,E-commerce & direct-to-consumer,Alibaba Group,SNAPDEAL,2014-05-21,9
TechStyle Fashion Group,1.0,29-08-2014,United States,El Segundo,E-commerce & direct-to-consumer,Matrix Partners,TECHSTYLE FASHION GROUP,2014-08-29,9
TechStyle Fashion Group,1.0,29-08-2014,United States,El Segundo,E-commerce & direct-to-consumer,Passport Capital,TECHSTYLE FASHION GROUP,2014-08-29,9
TechStyle Fashion Group,1.0,29-08-2014,United States,El Segundo,E-commerce & direct-to-consumer,Rho Ventures,TECHSTYLE FASHION GROUP,2014-08-29,9
Zebec,1.0,29-08-2022,United States,San Francisco,Fintech,Resolute Ventures,ZEBEC,2022-08-29,1
Zebec,1.0,29-08-2022,United States,San Francisco,Fintech,Shima Capital,ZEBEC,2022-08-29,1
Zebec,1.0,29-08-2022,United States,San Francisco,Fintech,Circle Ventures,ZEBEC,2022-08-29,1
InMobi,1.0,02-12-2014,India,Bengaluru,Mobile & telecommunications,Kleiner Perkins Caufield & Byers,INMOBI,2014-12-02,9
InMobi,1.0,02-12-2014,India,Bengaluru,Mobile & telecommunications,Softbank Corp.,INMOBI,2014-12-02,9
InMobi,1.0,02-12-2014,India,Bengaluru,Mobile & telecommunications,Sherpalo Ventures,INMOBI,2014-12-02,9
LinkSure Network,1.0,01-01-2015,China,Shanghai,Mobile & telecommunications,Unknown,LINKSURE NETWORK,2015-01-01,8
Red Ventures,1.0,07-01-2015,United States,Fort Mill,Other,Silver Lake Partners,RED VENTURES,2015-01-07,8
Red Ventures,1.0,07-01-2015,United States,Fort Mill,Other,General Atlantic,RED VENTURES,2015-01-07,8
BeiBei,1.0,22-01-2015,China,Hangzhou,E-commerce & direct-to-consumer,Banyan Capital,BEIBEI,2015-01-22,8
BeiBei,1.0,22-01-2015,China,Hangzhou,E-commerce & direct-to-consumer,New Horizon Capital,BEIBEI,2015-01-22,8
BeiBei,1.0,22-01-2015,China,Hangzhou,E-commerce & direct-to-consumer,IDG Capital Partners,BEIBEI,2015-01-22,8
Lamabang,1.0,06-03-2015,China,Shenzhen,E-commerce & direct-to-consumer,5Y Capital,LAMABANG,2015-03-06,8
Lamabang,1.0,06-03-2015,China,Shenzhen,E-commerce & direct-to-consumer,Matrix Partners China,LAMABANG,2015-03-06,8
Lamabang,1.0,06-03-2015,China,Shenzhen,E-commerce & direct-to-consumer,K2VC,LAMABANG,2015-03-06,8
JimuBox,1.0,21-04-2015,China,Beijing,Fintech,Matrix Partners China,JIMUBOX,2015-04-21,8
JimuBox,1.0,21-04-2015,China,Beijing,Fintech,Ventech China,JIMUBOX,2015-04-21,8
JimuBox,1.0,21-04-2015,China,Beijing,Fintech,Shunwei Capital Partners,JIMUBOX,2015-04-21,8
FXiaoKe,1.0,02-07-2015,China,Beijing,Mobile & telecommunications,IDG Capital,FXIAOKE,2015-07-02,8
FXiaoKe,1.0,02-07-2015,China,Beijing,Mobile & telecommunications,Northern Light Venture Capital,FXIAOKE,2015-07-02,8
FXiaoKe,1.0,02-07-2015,China,Beijing,Mobile & telecommunications,DCM Ventures,FXIAOKE,2015-07-02,8
Mia.com,1.0,08-09-2015,China,Beijing,E-commerce & direct-to-consumer,Sequoia Capital China,MIA.COM,2015-09-08,8
Mia.com,1.0,08-09-2015,China,Beijing,E-commerce & direct-to-consumer,ZhenFund,MIA.COM,2015-09-08,8
Mia.com,1.0,08-09-2015,China,Beijing,E-commerce & direct-to-consumer,K2 Ventures,MIA.COM,2015-09-08,8
58 Daojia,1.0,12-10-2015,China,Beijing,Internet software & services,KKR,58 DAOJIA,2015-10-12,8
58 Daojia,1.0,12-10-2015,China,Beijing,Internet software & services,Alibaba Group,58 DAOJIA,2015-10-12,8
58 Daojia,1.0,12-10-2015,China,Beijing,Internet software & services,Ping An Insurance,58 DAOJIA,2015-10-12,8
Womai,1.0,12-10-2015,China,Beijing,E-commerce & direct-to-consumer,SAIF Partners China,WOMAI,2015-10-12,8
Womai,1.0,12-10-2015,China,Beijing,E-commerce & direct-to-consumer,Baidu,WOMAI,2015-10-12,8
Womai,1.0,12-10-2015,China,Beijing,E-commerce & direct-to-consumer,IDG Capital,WOMAI,2015-10-12,8
HuJiang,1.0,29-10-2015,China,Shanghai,Edtech,China Minsheng Investment,HUJIANG,2015-10-29,8
HuJiang,1.0,29-10-2015,China,Shanghai,Edtech,Baidu,HUJIANG,2015-10-29,8
HuJiang,1.0,29-10-2015,China,Shanghai,Edtech,Wanxin Media,HUJIANG,2015-10-29,8
iTutorGroup,1.0,18-11-2015,China,Shanghai,Edtech,QiMing Venture Partners,ITUTORGROUP,2015-11-18,8
iTutorGroup,1.0,18-11-2015,China,Shanghai,Edtech,Temasek Holdings,ITUTORGROUP,2015-11-18,8
iTutorGroup,1.0,18-11-2015,China,Shanghai,Edtech,Silverlink Capital,ITUTORGROUP,2015-11-18,8
MindMaze,1.0,28-01-2016,Switzerland,Lausanne,Health,Hinduja Group,MINDMAZE,2016-01-28,7
iCarbonX,1.0,12-04-2016,China,Shenzhen,Artificial intelligence,Tencent,ICARBONX,2016-04-12,7
iCarbonX,1.0,12-04-2016,China,Shenzhen,Artificial intelligence,Vcanbio,ICARBONX,2016-04-12,7
Kendra Scott,1.0,21-12-2016,United States,Austin,Consumer & retail,Berkshire Partners,KENDRA SCOTT,2016-12-21,7
Kendra Scott,1.0,21-12-2016,United States,Austin,Consumer & retail,Norwest Venture Partners,KENDRA SCOTT,2016-12-21,7
Mobvoi,1.0,06-04-2017,China,Beijing,Consumer & retail,Sequoia Capital China,MOBVOI,2017-04-06,6
Mobvoi,1.0,06-04-2017,China,Beijing,Consumer & retail,SIG Asia Investments,MOBVOI,2017-04-06,6
Mobvoi,1.0,06-04-2017,China,Beijing,Consumer & retail,ZhenFund,MOBVOI,2017-04-06,6
Zhuan Zhuan,1.0,18-04-2017,China,Beijing,E-commerce & direct-to-consumer,58.com,ZHUAN ZHUAN,2017-04-18,6
Zhuan Zhuan,1.0,18-04-2017,China,Beijing,E-commerce & direct-to-consumer,Tencent Holdings,ZHUAN ZHUAN,2017-04-18,6
Modernizing Medicine,1.0,10-05-2017,United States,Boca Raton,Health,Warburg Pincus,MODERNIZING MEDICINE,2017-05-10,6
Modernizing Medicine,1.0,10-05-2017,United States,Boca Raton,Health,Summit Partners,MODERNIZING MEDICINE,2017-05-10,6
Modernizing Medicine,1.0,10-05-2017,United States,Boca Raton,Health,Sands Capital,MODERNIZING MEDICINE,2017-05-10,6
Zhaogang,1.0,29-06-2017,China,Shanghai,E-commerce & direct-to-consumer,K2 Ventures,ZHAOGANG,2017-06-29,6
Zhaogang,1.0,29-06-2017,China,Shanghai,E-commerce & direct-to-consumer,Matrix Partners China,ZHAOGANG,2017-06-29,6
Zhaogang,1.0,29-06-2017,China,Shanghai,E-commerce & direct-to-consumer,IDG Capital,ZHAOGANG,2017-06-29,6
DianRong,1.0,02-08-2017,China,Shanghai,E-commerce & direct-to-consumer,Standard Chartered,DIANRONG,2017-08-02,6
DianRong,1.0,02-08-2017,China,Shanghai,E-commerce & direct-to-consumer,FinSight Ventures,DIANRONG,2017-08-02,6
DianRong,1.0,02-08-2017,China,Shanghai,E-commerce & direct-to-consumer,Affirma Capital,DIANRONG,2017-08-02,6
Cell C,1.0,07-08-2017,South Africa,Midrand,Mobile & telecommunications,Blue Label Telecoms,CELL C,2017-08-07,6
Cell C,1.0,07-08-2017,South Africa,Midrand,Mobile & telecommunications,Net1 UEPS Technologies,CELL C,2017-08-07,6
YH Global,1.0,21-09-2017,China,Shenzhen,"Supply chain, logistics, & delivery",Co-Energy Finance,YH GLOBAL,2017-09-21,6
YH Global,1.0,21-09-2017,China,Shenzhen,"Supply chain, logistics, & delivery",Grandland,YH GLOBAL,2017-09-21,6
Revolution Precrafted,1.0,23-10-2017,Philippines,Manila,Other,K2 Global,REVOLUTION PRECRAFTED,2017-10-23,6
Revolution Precrafted,1.0,23-10-2017,Philippines,Manila,Other,500 Startups,REVOLUTION PRECRAFTED,2017-10-23,6
WeLab,1.0,08-11-2017,Hong Kong,Unknown,Fintech,Sequoia Capital China,WELAB,2017-11-08,6
WeLab,1.0,08-11-2017,Hong Kong,Unknown,Fintech,ING,WELAB,2017-11-08,6
WeLab,1.0,08-11-2017,Hong Kong,Unknown,Fintech,Alibaba Entrepreneurs Fund,WELAB,2017-11-08,6
Maimai,1.0,15-11-2017,China,Beijing,Mobile & telecommunications,Morningside Venture Capital,MAIMAI,2017-11-15,6
Maimai,1.0,15-11-2017,China,Beijing,Mobile & telecommunications,IDG Capital,MAIMAI,2017-11-15,6
Maimai,1.0,15-11-2017,China,Beijing,Mobile & telecommunications,DCM Ventures,MAIMAI,2017-11-15,6
Dxy.cn,1.0,10-04-2018,China,Hangzhou,Health,Tencent Holdings,DXY.CN,2018-04-10,5
Dxy.cn,1.0,10-04-2018,China,Hangzhou,Health,DCM Ventures,DXY.CN,2018-04-10,5
HMD Global,1.0,21-05-2018,Finland,Espoo,Mobile & telecommunications,Ginko Ventures,HMD GLOBAL,2018-05-21,5
Huike Group,1.0,24-05-2018,China,Beijing,Edtech,Fosun RZ Capital,HUIKE GROUP,2018-05-24,5
Huike Group,1.0,24-05-2018,China,Beijing,Edtech,Oceanwide Holdings,HUIKE GROUP,2018-05-24,5
Huike Group,1.0,24-05-2018,China,Beijing,Edtech,Shenzhen Qianhe Capital Management Co.,HUIKE GROUP,2018-05-24,5
China Cloud,1.0,11-06-2018,China,Wuxi,Hardware,V Star Capital,CHINA CLOUD,2018-06-11,5
China Cloud,1.0,11-06-2018,China,Wuxi,Hardware,GF Xinde Investment Management Co.,CHINA CLOUD,2018-06-11,5
China Cloud,1.0,11-06-2018,China,Wuxi,Hardware,Haitong Leading Capital Management,CHINA CLOUD,2018-06-11,5
LinkDoc Technology,1.0,05-07-2018,China,Beijing,Health,China Investment Corporation,LINKDOC TECHNOLOGY,2018-07-05,5
LinkDoc Technology,1.0,05-07-2018,China,Beijing,Health,New Enterprise Associates,LINKDOC TECHNOLOGY,2018-07-05,5
MediaMath,1.0,10-07-2018,United States,New York,Internet software & services,Silicon Valley Bank,MEDIAMATH,2018-07-10,5
MediaMath,1.0,10-07-2018,United States,New York,Internet software & services,QED Investors,MEDIAMATH,2018-07-10,5
MediaMath,1.0,10-07-2018,United States,New York,Internet software & services,European Founders Fund,MEDIAMATH,2018-07-10,5
Movile,1.0,12-07-2018,Brazil,Sao Paulo,Mobile & telecommunications,Innova Capital - FIP,MOVILE,2018-07-12,5
Movile,1.0,12-07-2018,Brazil,Sao Paulo,Mobile & telecommunications,3G Capital Management,MOVILE,2018-07-12,5
Movile,1.0,12-07-2018,Brazil,Sao Paulo,Mobile & telecommunications,Prosus Ventures,MOVILE,2018-07-12,5
Pat McGrath Labs,1.0,16-07-2018,United States,New York,Consumer & retail,One Luxury Group,PAT MCGRATH LABS,2018-07-16,5
Pat McGrath Labs,1.0,16-07-2018,United States,New York,Consumer & retail,Eurazeo,PAT MCGRATH LABS,2018-07-16,5
Wacai,1.0,18-07-2018,China,Hangzhou,Mobile & telecommunications,Qiming Venture Partners,WACAI,2018-07-18,5
Wacai,1.0,18-07-2018,China,Hangzhou,Mobile & telecommunications,China Broadband Capital,WACAI,2018-07-18,5
Wacai,1.0,18-07-2018,China,Hangzhou,Mobile & telecommunications,CDH Investments,WACAI,2018-07-18,5
FlashEx,1.0,27-08-2018,China,Beijing,"Supply chain, logistics, & delivery",Prometheus Capital,FLASHEX,2018-08-27,5
FlashEx,1.0,27-08-2018,China,Beijing,"Supply chain, logistics, & delivery",Matrix Partners China,FLASHEX,2018-08-27,5
FlashEx,1.0,27-08-2018,China,Beijing,"Supply chain, logistics, & delivery",JD Capital Management,FLASHEX,2018-08-27,5
Banma Network Technologies,1.0,13-09-2018,China,Shanghai,Auto & transportation,Yunfeng Capital,BANMA NETWORK TECHNOLOGIES,2018-09-13,5
Banma Network Technologies,1.0,13-09-2018,China,Shanghai,Auto & transportation,SDIC Innovation Investment Management,BANMA NETWORK TECHNOLOGIES,2018-09-13,5
Banma Network Technologies,1.0,13-09-2018,China,Shanghai,Auto & transportation,Shang Qi Capital,BANMA NETWORK TECHNOLOGIES,2018-09-13,5
Tresata,1.0,10-10-2018,United States,Charlotte,Fintech,GCP Capital Partners,TRESATA,2018-10-10,5
Momenta,1.0,17-10-2018,China,Beijing,Artificial intelligence,Sinovation Ventures,MOMENTA,2018-10-17,5
Momenta,1.0,17-10-2018,China,Beijing,Artificial intelligence,Tencent Holdings,MOMENTA,2018-10-17,5
Momenta,1.0,17-10-2018,China,Beijing,Artificial intelligence,Sequoia Capital China,MOMENTA,2018-10-17,5
Hosjoy,1.0,18-10-2018,China,Nanjing,E-commerce & direct-to-consumer,U.S.-China Green Fund,HOSJOY,2018-10-18,5
Hosjoy,1.0,18-10-2018,China,Nanjing,E-commerce & direct-to-consumer,Founder H Fund,HOSJOY,2018-10-18,5
Hosjoy,1.0,18-10-2018,China,Nanjing,E-commerce & direct-to-consumer,Richland Equities,HOSJOY,2018-10-18,5
Omio,1.0,23-10-2018,Germany,Berlin,Travel,Lakestar,OMIO,2018-10-23,5
Omio,1.0,23-10-2018,Germany,Berlin,Travel,Battery Ventures,OMIO,2018-10-23,5
Omio,1.0,23-10-2018,Germany,Berlin,Travel,New Enterprise Associates,OMIO,2018-10-23,5
TERMINUS Technology,1.0,25-10-2018,China,Beijing,Hardware,China Everbright Limited,TERMINUS TECHNOLOGY,2018-10-25,5
TERMINUS Technology,1.0,25-10-2018,China,Beijing,Hardware,IDG Capital,TERMINUS TECHNOLOGY,2018-10-25,5
TERMINUS Technology,1.0,25-10-2018,China,Beijing,Hardware,iFLYTEK,TERMINUS TECHNOLOGY,2018-10-25,5
BitFury,1.0,06-11-2018,Netherlands,Amsterdam,Hardware,Georgian Co-Investment Fund,BITFURY,2018-11-06,5
BitFury,1.0,06-11-2018,Netherlands,Amsterdam,Hardware,iTech Capital,BITFURY,2018-11-06,5
BitFury,1.0,06-11-2018,Netherlands,Amsterdam,Hardware,Galaxy Digital,BITFURY,2018-11-06,5
REEF Technology,1.0,10-12-2018,United States,Miami,"Supply chain, logistics, & delivery",Target Global,REEF TECHNOLOGY,2018-12-10,5
REEF Technology,1.0,10-12-2018,United States,Miami,"Supply chain, logistics, & delivery",UBS Asset Management,REEF TECHNOLOGY,2018-12-10,5
REEF Technology,1.0,10-12-2018,United States,Miami,"Supply chain, logistics, & delivery",Mubadala Capital,REEF TECHNOLOGY,2018-12-10,5
Globality,1.0,22-01-2019,United States,Menlo Park,Artificial intelligence,SoftBank Group,GLOBALITY,2019-01-22,4
Ynsect,1.0,21-02-2019,France,Evry,Other,Astanor Ventures,YNSECT,2019-02-21,4
Ynsect,1.0,21-02-2019,France,Evry,Other,Upfront Ventures,YNSECT,2019-02-21,4
Ynsect,1.0,21-02-2019,France,Evry,Other,IDInvest Partners,YNSECT,2019-02-21,4
Intellifusion,1.0,22-03-2019,China,Shenzhen,Artificial intelligence,BOC International,INTELLIFUSION,2019-03-22,4
Intellifusion,1.0,22-03-2019,China,Shenzhen,Artificial intelligence,TopoScend Capital,INTELLIFUSION,2019-03-22,4
Intellifusion,1.0,22-03-2019,China,Shenzhen,Artificial intelligence,Hongxiu VC,INTELLIFUSION,2019-03-22,4
Poizon,1.0,29-04-2019,China,Shanghai,Mobile & telecommunications,DST Global,POIZON,2019-04-29,4
Poizon,1.0,29-04-2019,China,Shanghai,Mobile & telecommunications,Sequoia Capital China,POIZON,2019-04-29,4
Poizon,1.0,29-04-2019,China,Shanghai,Mobile & telecommunications,Gaorong Capital,POIZON,2019-04-29,4
SITECH DEV,1.0,16-05-2019,China,Guiyang,Other,China Prosperity Capital,SITECH DEV,2019-05-16,4
KnowBox,1.0,30-05-2019,China,Beijing,Edtech,TAL Education Group,KNOWBOX,2019-05-30,4
KnowBox,1.0,30-05-2019,China,Beijing,Edtech,Legend Star,KNOWBOX,2019-05-30,4
KnowBox,1.0,30-05-2019,China,Beijing,Edtech,Alibaba Group,KNOWBOX,2019-05-30,4
Yanolja,1.0,10-06-2019,South Korea,Seoul,Travel,SBI Investment Korea,YANOLJA,2019-06-10,4
Yanolja,1.0,10-06-2019,South Korea,Seoul,Travel,Partners Investment,YANOLJA,2019-06-10,4
Yanolja,1.0,10-06-2019,South Korea,Seoul,Travel,GIC,YANOLJA,2019-06-10,4
Meero,1.0,18-06-2019,France,Paris,Artificial intelligence,Aglae Ventures,MEERO,2019-06-18,4
Meero,1.0,18-06-2019,France,Paris,Artificial intelligence,Global Founders Capital,MEERO,2019-06-18,4
Meero,1.0,18-06-2019,France,Paris,Artificial intelligence,Alven Capital,MEERO,2019-06-18,4
Ibotta,1.0,06-08-2019,United States,Denver,Fintech,Koch Disruptive Technologies,IBOTTA,2019-08-06,4
Ibotta,1.0,06-08-2019,United States,Denver,Fintech,Teamworthy Ventures,IBOTTA,2019-08-06,4
Ibotta,1.0,06-08-2019,United States,Denver,Fintech,GGV Capital,IBOTTA,2019-08-06,4
C2FO,1.0,07-08-2019,United States,Leawood,Fintech,Union Square Ventures,C2FO,2019-08-07,4
C2FO,1.0,07-08-2019,United States,Leawood,Fintech,Summerhill Venture Partners,C2FO,2019-08-07,4
C2FO,1.0,07-08-2019,United States,Leawood,Fintech,Mithril Capital Management,C2FO,2019-08-07,4
Numbrs,1.0,22-08-2019,Switzerland,Zurich,Fintech,Investment Corporation of Dubai,NUMBRS,2019-08-22,4
Numbrs,1.0,22-08-2019,Switzerland,Zurich,Fintech,Centralway,NUMBRS,2019-08-22,4
EBANX,1.0,16-10-2019,Brazil,Curitiba,Fintech,FTV Capital,EBANX,2019-10-16,4
EBANX,1.0,16-10-2019,Brazil,Curitiba,Fintech,Endeavor,EBANX,2019-10-16,4
KK Group,1.0,23-10-2019,China,Dongguan,E-commerce & direct-to-consumer,Matrix Partners China,KK GROUP,2019-10-23,4
KK Group,1.0,23-10-2019,China,Dongguan,E-commerce & direct-to-consumer,Bright Venture Capita,KK GROUP,2019-10-23,4
KK Group,1.0,23-10-2019,China,Dongguan,E-commerce & direct-to-consumer,Shenzhen Capital Group,KK GROUP,2019-10-23,4
Alto Pharmacy,1.0,30-01-2020,United States,San Francisco,Health,Jackson Square Ventures,ALTO PHARMACY,2020-01-30,3
Alto Pharmacy,1.0,30-01-2020,United States,San Francisco,Health,Greenoaks Capital Management,ALTO PHARMACY,2020-01-30,3
Alto Pharmacy,1.0,30-01-2020,United States,San Francisco,Health,Softbank Group,ALTO PHARMACY,2020-01-30,3
Hotmart,1.0,17-03-2020,Netherlands,Amsterdam,E-commerce & direct-to-consumer,Technology Crossover Ventures,HOTMART,2020-03-17,3
Hotmart,1.0,17-03-2020,Netherlands,Amsterdam,E-commerce & direct-to-consumer,Alkeon Capital Management,HOTMART,2020-03-17,3
Hotmart,1.0,17-03-2020,Netherlands,Amsterdam,E-commerce & direct-to-consumer,General Atlantic,HOTMART,2020-03-17,3
Emerging Markets Property Group,1.0,28-04-2020,United Arab Emirates,Dubai,Other,OLX Group,EMERGING MARKETS PROPERTY GROUP,2020-04-28,3
Emerging Markets Property Group,1.0,28-04-2020,United Arab Emirates,Dubai,Other,KCK Group,EMERGING MARKETS PROPERTY GROUP,2020-04-28,3
Emerging Markets Property Group,1.0,28-04-2020,United Arab Emirates,Dubai,Other,EXOR Seeds,EMERGING MARKETS PROPERTY GROUP,2020-04-28,3
Quizlet,1.0,13-05-2020,United States,San Francisco,Edtech,Union Square Ventures,QUIZLET,2020-05-13,3
Quizlet,1.0,13-05-2020,United States,San Francisco,Edtech,Altos Ventures,QUIZLET,2020-05-13,3
Quizlet,1.0,13-05-2020,United States,San Francisco,Edtech,Costanoa Ventures,QUIZLET,2020-05-13,3
Orca Bio,1.0,17-06-2020,United States,Menlo Park,Health,Lightspeed Venture Partners,ORCA BIO,2020-06-17,3
Orca Bio,1.0,17-06-2020,United States,Menlo Park,Health,Data Collective,ORCA BIO,2020-06-17,3
Orca Bio,1.0,17-06-2020,United States,Menlo Park,Health,8VC,ORCA BIO,2020-06-17,3
Infobip,1.0,30-07-2020,Croatia,Vodnjan,Mobile & telecommunications,One Equity Partners,INFOBIP,2020-07-30,3
Zwift,1.0,16-09-2020,United States,Long Beach,E-commerce & direct-to-consumer,Novator Partners,ZWIFT,2020-09-16,3
Zwift,1.0,16-09-2020,United States,Long Beach,E-commerce & direct-to-consumer,True,ZWIFT,2020-09-16,3
Zwift,1.0,16-09-2020,United States,Long Beach,E-commerce & direct-to-consumer,Causeway Media Partners,ZWIFT,2020-09-16,3
Playco,1.0,21-09-2020,Japan,Tokyo,Other,Sozo Ventures,PLAYCO,2020-09-21,3
Playco,1.0,21-09-2020,Japan,Tokyo,Other,Caffeinated Capital,PLAYCO,2020-09-21,3
Playco,1.0,21-09-2020,Japan,Tokyo,Other,Sequoia Capital,PLAYCO,2020-09-21,3
Gousto,1.0,03-11-2020,United Kingdom,London,"Supply chain, logistics, & delivery",MMC Ventures,GOUSTO,2020-11-03,3
Gousto,1.0,03-11-2020,United Kingdom,London,"Supply chain, logistics, & delivery",BGF Ventures,GOUSTO,2020-11-03,3
Gousto,1.0,03-11-2020,United Kingdom,London,"Supply chain, logistics, & delivery",Unilever Ventures,GOUSTO,2020-11-03,3
Alation,1.0,03-06-2021,United States,Redwood City,Internet software & services,Costanoa Ventures,ALATION,2021-06-03,2
Alation,1.0,03-06-2021,United States,Redwood City,Internet software & services,Data Collective,ALATION,2021-06-03,2
Alation,1.0,03-06-2021,United States,Redwood City,Internet software & services,Salesforce Ventures,ALATION,2021-06-03,2
Boom Supersonic,1.0,16-12-2020,United States,Englewood,Other,WRVI Capital,BOOM SUPERSONIC,2020-12-16,3
Boom Supersonic,1.0,16-12-2020,United States,Englewood,Other,Caffeinated Capital,BOOM SUPERSONIC,2020-12-16,3
Boom Supersonic,1.0,16-12-2020,United States,Englewood,Other,Y Combinator,BOOM SUPERSONIC,2020-12-16,3
Quantum Metric,1.0,07-01-2021,United States,Colorado Springs,Data management & analytics,Insight Partners,QUANTUM METRIC,2021-01-07,2
Quantum Metric,1.0,07-01-2021,United States,Colorado Springs,Data management & analytics,Bain Capital Ventures,QUANTUM METRIC,2021-01-07,2
News Break,1.0,07-01-2021,United States,Mountain View,Internet software & services,IDG Capital,NEWS BREAK,2021-01-07,2
News Break,1.0,07-01-2021,United States,Mountain View,Internet software & services,Francisco Partners,NEWS BREAK,2021-01-07,2
News Break,1.0,07-01-2021,United States,Mountain View,Internet software & services,ZhenFund,NEWS BREAK,2021-01-07,2
MadeiraMadeira,1.0,07-01-2021,Brazil,Parana,E-commerce & direct-to-consumer,Flybridge Capital Partners,MADEIRAMADEIRA,2021-01-07,2
MadeiraMadeira,1.0,07-01-2021,Brazil,Parana,E-commerce & direct-to-consumer,SoftBank Group,MADEIRAMADEIRA,2021-01-07,2
MadeiraMadeira,1.0,07-01-2021,Brazil,Parana,E-commerce & direct-to-consumer,Monashees+,MADEIRAMADEIRA,2021-01-07,2
PPRO,1.0,19-01-2021,United Kingdom,London,Fintech,Wellington Management,PPRO,2021-01-19,2
PPRO,1.0,19-01-2021,United Kingdom,London,Fintech,Eurazeo,PPRO,2021-01-19,2
PPRO,1.0,19-01-2021,United Kingdom,London,Fintech,Citi Ventures,PPRO,2021-01-19,2
Splashtop,1.0,27-01-2021,United States,San Jose,Internet software & services,Storm Ventures,SPLASHTOP,2021-01-27,2
Splashtop,1.0,27-01-2021,United States,San Jose,Internet software & services,DFJ DragonFund,SPLASHTOP,2021-01-27,2
Splashtop,1.0,27-01-2021,United States,San Jose,Internet software & services,New Enterprise Associates,SPLASHTOP,2021-01-27,2
Flash Express,1.0,01-02-2021,Thailand,Bangkok,"Supply chain, logistics, & delivery",SCB 10X,FLASH EXPRESS,2021-02-01,2
Flash Express,1.0,01-02-2021,Thailand,Bangkok,"Supply chain, logistics, & delivery",Krungsri Finnovate,FLASH EXPRESS,2021-02-01,2
Flash Express,1.0,01-02-2021,Thailand,Bangkok,"Supply chain, logistics, & delivery",eWTP Capital,FLASH EXPRESS,2021-02-01,2
Axiom Space,1.0,16-02-2021,United States,Houston,Other,C5 Capital,AXIOM SPACE,2021-02-16,2
Axiom Space,1.0,16-02-2021,United States,Houston,Other,Hemisphere Ventures,AXIOM SPACE,2021-02-16,2
Axiom Space,1.0,16-02-2021,United States,Houston,Other,The Venture Collective,AXIOM SPACE,2021-02-16,2
Locus Robotics,1.0,17-02-2021,United States,Wilmington,Hardware,Scale Venture Partners,LOCUS ROBOTICS,2021-02-17,2
Locus Robotics,1.0,17-02-2021,United States,Wilmington,Hardware,Bond,LOCUS ROBOTICS,2021-02-17,2
Locus Robotics,1.0,17-02-2021,United States,Wilmington,Hardware,Tiger Global Management,LOCUS ROBOTICS,2021-02-17,2
Standard AI,1.0,17-02-2021,United States,San Francisco,Artificial intelligence,CRV,STANDARD AI,2021-02-17,2
Standard AI,1.0,17-02-2021,United States,San Francisco,Artificial intelligence,Y Combinator,STANDARD AI,2021-02-17,2
Standard AI,1.0,17-02-2021,United States,San Francisco,Artificial intelligence,Initialized Capital,STANDARD AI,2021-02-17,2
WeBull,1.0,18-02-2021,China,Changsha,Fintech,Bojiang Capital,WEBULL,2021-02-18,2
WeBull,1.0,18-02-2021,China,Changsha,Fintech,Hongdao Capital,WEBULL,2021-02-18,2
WeBull,1.0,18-02-2021,China,Changsha,Fintech,Mobai Capital,WEBULL,2021-02-18,2
Newsela,1.0,25-02-2021,United States,New York,Edtech,Owl Ventures,NEWSELA,2021-02-25,2
Newsela,1.0,25-02-2021,United States,New York,Edtech,Technology Crossover Ventures,NEWSELA,2021-02-25,2
Newsela,1.0,25-02-2021,United States,New York,Edtech,Tao Capital Partners,NEWSELA,2021-02-25,2
Aqua Security,1.0,10-03-2021,Israel,Ramat Gan,Cybersecurity,TLV Partners,AQUA SECURITY,2021-03-10,2
Aqua Security,1.0,10-03-2021,Israel,Ramat Gan,Cybersecurity,Lightspeed Venture Partners,AQUA SECURITY,2021-03-10,2
Aqua Security,1.0,10-03-2021,Israel,Ramat Gan,Cybersecurity,M12,AQUA SECURITY,2021-03-10,2
PatSnap,1.0,16-03-2021,Singapore,Unknown,Internet software & services,Sequoia Capital China,PATSNAP,2021-03-16,2
PatSnap,1.0,16-03-2021,Singapore,Unknown,Internet software & services,Shunwei Capital Partners,PATSNAP,2021-03-16,2
PatSnap,1.0,16-03-2021,Singapore,Unknown,Internet software & services,Qualgro,PATSNAP,2021-03-16,2
Evidation,1.0,22-03-2021,United States,San Mateo,Health,B Capital Group,EVIDATION,2021-03-22,2
Evidation,1.0,22-03-2021,United States,San Mateo,Health,,EVIDATION,2021-03-22,2
Evidation,1.0,22-03-2021,United States,San Mateo,Health,GE Ventures,EVIDATION,2021-03-22,2
Evidation,1.0,22-03-2021,United States,San Mateo,Health,McKesson Ventures,EVIDATION,2021-03-22,2
Sidecar Health,1.0,26-01-2021,United States,El Segundo,Fintech,GreatPoint Ventures,SIDECAR HEALTH,2021-01-26,2
Sidecar Health,1.0,26-01-2021,United States,El Segundo,Fintech,Tiger Global Management,SIDECAR HEALTH,2021-01-26,2
Sidecar Health,1.0,26-01-2021,United States,El Segundo,Fintech,Menlo Ventures,SIDECAR HEALTH,2021-01-26,2
Feedzai,1.0,24-03-2021,United States,San Mateo,Artificial intelligence,Global Founders Capital,FEEDZAI,2021-03-24,2
Feedzai,1.0,24-03-2021,United States,San Mateo,Artificial intelligence,Shea Ventures,FEEDZAI,2021-03-24,2
Feedzai,1.0,24-03-2021,United States,San Mateo,Artificial intelligence,Greycroft,FEEDZAI,2021-03-24,2
Yunxuetang,1.0,29-03-2021,China,Suzhou,Edtech,Matrix Partners China,YUNXUETANG,2021-03-29,2
Yunxuetang,1.0,29-03-2021,China,Suzhou,Edtech,Sequoia Capital China,YUNXUETANG,2021-03-29,2
Yunxuetang,1.0,29-03-2021,China,Suzhou,Edtech,Hundreds Capital,YUNXUETANG,2021-03-29,2
Cameo,1.0,30-03-2021,United States,Chicago,Internet software & services,Lightspeed Venture Partners,CAMEO,2021-03-30,2
Cameo,1.0,30-03-2021,United States,Chicago,Internet software & services,Kleiner Perkins Caufield & Byers,CAMEO,2021-03-30,2
Cameo,1.0,30-03-2021,United States,Chicago,Internet software & services,Origin Ventures,CAMEO,2021-03-30,2
Hyperchain,1.0,11-04-2021,China,Hangzhou,Fintech,Yinhong Equity Investment Fund,HYPERCHAIN,2021-04-11,2
Hyperchain,1.0,11-04-2021,China,Hangzhou,Fintech,E Fund,HYPERCHAIN,2021-04-11,2
Hyperchain,1.0,11-04-2021,China,Hangzhou,Fintech,Ideal International,HYPERCHAIN,2021-04-11,2
The Zebra,1.0,12-04-2021,United States,Austin,E-commerce & direct-to-consumer,Silverton Partners,THE ZEBRA,2021-04-12,2
The Zebra,1.0,12-04-2021,United States,Austin,E-commerce & direct-to-consumer,Accel,THE ZEBRA,2021-04-12,2
The Zebra,1.0,12-04-2021,United States,Austin,E-commerce & direct-to-consumer,Ballast Point Ventures,THE ZEBRA,2021-04-12,2
Clearcover,1.0,13-04-2021,United States,Chicago,Fintech,American Family Ventures,CLEARCOVER,2021-04-13,2
Clearcover,1.0,13-04-2021,United States,Chicago,Fintech,Cox Enterprises,CLEARCOVER,2021-04-13,2
Clearcover,1.0,13-04-2021,United States,Chicago,Fintech,OMERS Ventures,CLEARCOVER,2021-04-13,2
Groq,1.0,14-04-2021,United States,Mountain View,Artificial intelligence,TDK Ventures,GROQ,2021-04-14,2
Groq,1.0,14-04-2021,United States,Mountain View,Artificial intelligence,Social Capital,GROQ,2021-04-14,2
Groq,1.0,14-04-2021,United States,Mountain View,Artificial intelligence,D1 Capital Partners,GROQ,2021-04-14,2
Fiture,1.0,14-04-2021,China,Chengdu,Health,Bertelsmann Asia Investments,FITURE,2021-04-14,2
Fiture,1.0,14-04-2021,China,Chengdu,Health,Sequoia Capital China,FITURE,2021-04-14,2
Fiture,1.0,14-04-2021,China,Chengdu,Health,NIO Capital,FITURE,2021-04-14,2
Injective Protocol,1.0,20-04-2021,United States,New York,Fintech,Pantera Capital,INJECTIVE PROTOCOL,2021-04-20,2
Injective Protocol,1.0,20-04-2021,United States,New York,Fintech,Cadenza Ventures,INJECTIVE PROTOCOL,2021-04-20,2
Injective Protocol,1.0,20-04-2021,United States,New York,Fintech,BlockTower Capital,INJECTIVE PROTOCOL,2021-04-20,2
Sift,1.0,22-04-2021,United States,San Francisco,Artificial intelligence,Union Square Ventures,SIFT,2021-04-22,2
Sift,1.0,22-04-2021,United States,San Francisco,Artificial intelligence,Insight Partners,SIFT,2021-04-22,2
Sift,1.0,22-04-2021,United States,San Francisco,Artificial intelligence,Spark Capital,SIFT,2021-04-22,2
SaltPay,1.0,09-04-2021,United Kingdom,London,Fintech,Tiger Global Management,SALTPAY,2021-04-09,2
SaltPay,1.0,09-04-2021,United Kingdom,London,Fintech,Hedosophia,SALTPAY,2021-04-09,2
Capsule,1.0,28-04-2021,United States,New York,Health,Thrive Capital,CAPSULE,2021-04-28,2
Capsule,1.0,28-04-2021,United States,New York,Health,Durable Capital Partners,CAPSULE,2021-04-28,2
Capsule,1.0,28-04-2021,United States,New York,Health,G Squared,CAPSULE,2021-04-28,2
MOLOCO,1.0,29-04-2021,United States,Redwood City,Artificial intelligence,Smilegate Investment,MOLOCO,2021-04-29,2
MOLOCO,1.0,29-04-2021,United States,Redwood City,Artificial intelligence,DSC Investments,MOLOCO,2021-04-29,2
MOLOCO,1.0,29-04-2021,United States,Redwood City,Artificial intelligence,KTB Ventures,MOLOCO,2021-04-29,2
Inari,1.0,12-05-2021,United States,Cambridge,Other,Flagship Pioneering,INARI,2021-05-12,2
Inari,1.0,12-05-2021,United States,Cambridge,Other,Alexandria Venture Investments,INARI,2021-05-12,2
Inari,1.0,12-05-2021,United States,Cambridge,Other,Investment Corporation of Dubai,INARI,2021-05-12,2
Mux,1.0,30-04-2021,United States,San Francisco,Internet software & services,Accel,MUX,2021-04-30,2
Mux,1.0,30-04-2021,United States,San Francisco,Internet software & services,Cobalt Capital,MUX,2021-04-30,2
Mux,1.0,30-04-2021,United States,San Francisco,Internet software & services,Andreessen Horowitz,MUX,2021-04-30,2
XForcePlus,1.0,01-06-2021,China,Shanghai,Internet software & services,Eastern Bell Capital,XFORCEPLUS,2021-06-01,2
XForcePlus,1.0,01-06-2021,China,Shanghai,Internet software & services,Danhua Capital,XFORCEPLUS,2021-06-01,2
XForcePlus,1.0,01-06-2021,China,Shanghai,Internet software & services,MSA Capital,XFORCEPLUS,2021-06-01,2
Augustinus Bader,1.0,09-11-2022,London,United Kingdom,Consumer & retail,General Atlantic,AUGUSTINUS BADER,2022-11-09,1
Shift Technology,1.0,06-05-2021,France,Paris,Artificial intelligence,Griffin Gaming Partners,SHIFT TECHNOLOGY,2021-05-06,2
Shift Technology,1.0,06-05-2021,France,Paris,Artificial intelligence,Andreessen Horowitz,SHIFT TECHNOLOGY,2021-05-06,2
Shift Technology,1.0,06-05-2021,France,Paris,Artificial intelligence,Battery Ventures,SHIFT TECHNOLOGY,2021-05-06,2
TensTorrent,1.0,05-05-2021,Canada,Toronto,Artificial intelligence,Eclipse Ventures,TENSTORRENT,2021-05-05,2
TensTorrent,1.0,05-05-2021,Canada,Toronto,Artificial intelligence,Fidelity Investments,TENSTORRENT,2021-05-05,2
TensTorrent,1.0,05-05-2021,Canada,Toronto,Artificial intelligence,Moore Capital Management,TENSTORRENT,2021-05-05,2
Zihaiguo,1.0,06-05-2021,China,Chongqing,Consumer & retail,Xingwang Investment Management,ZIHAIGUO,2021-05-06,2
Zihaiguo,1.0,06-05-2021,China,Chongqing,Consumer & retail,China Capital Investment Group,ZIHAIGUO,2021-05-06,2
Zihaiguo,1.0,06-05-2021,China,Chongqing,Consumer & retail,Matrix Partners China,ZIHAIGUO,2021-05-06,2
Forte Labs,1.0,12-05-2021,United States,San Francisco,Fintech,Iris Capital,FORTE LABS,2021-05-12,2
Forte Labs,1.0,12-05-2021,United States,San Francisco,Fintech,Accel,FORTE LABS,2021-05-12,2
Forte Labs,1.0,12-05-2021,United States,San Francisco,Fintech,Elaia Partners,FORTE LABS,2021-05-12,2
Axtria,1.0,13-05-2021,United States,Berkeley Heights,Data management & analytics,Helion Venture Partners,AXTRIA,2021-05-13,2
Axtria,1.0,13-05-2021,United States,Berkeley Heights,Data management & analytics,Bain Capital Tech Opportunities,AXTRIA,2021-05-13,2
Axtria,1.0,13-05-2021,United States,Berkeley Heights,Data management & analytics,Sequoia Capital India,AXTRIA,2021-05-13,2
Amount,1.0,17-05-2021,United States,Chicago,Fintech,Invus Group,AMOUNT,2021-05-17,2
Amount,1.0,17-05-2021,United States,Chicago,Fintech,Hanaco Venture Capital,AMOUNT,2021-05-17,2
Amount,1.0,17-05-2021,United States,Chicago,Fintech,WestCap Group,AMOUNT,2021-05-17,2
Vise,1.0,18-05-2021,United States,New York,Fintech,Sequoia Capital,VISE,2021-05-18,2
Vise,1.0,18-05-2021,United States,New York,Fintech,Founders Fund,VISE,2021-05-18,2
Vise,1.0,18-05-2021,United States,New York,Fintech,Bling Capital,VISE,2021-05-18,2
Printful,1.0,24-05-2021,United States,Charlotte,Other,Bregal Sagemount,PRINTFUL,2021-05-24,2
Matrixport,1.0,01-06-2021,Singapore,Unknown,Fintech,Dragonfly Captial,MATRIXPORT,2021-06-01,2
Matrixport,1.0,01-06-2021,Singapore,Unknown,Fintech,Qiming Venture Partners,MATRIXPORT,2021-06-01,2
Matrixport,1.0,01-06-2021,Singapore,Unknown,Fintech,DST Global,MATRIXPORT,2021-06-01,2
Shippo,1.0,02-06-2021,United States,San Francisco,"Supply chain, logistics, & delivery",Version One Ventures,SHIPPO,2021-06-02,2
Shippo,1.0,02-06-2021,United States,San Francisco,"Supply chain, logistics, & delivery",Uncork Capital,SHIPPO,2021-06-02,2
Shippo,1.0,02-06-2021,United States,San Francisco,"Supply chain, logistics, & delivery",Bessemer Venture Partners,SHIPPO,2021-06-02,2
Thirty Madison,,02-06-2021,United States,New York,Health,Northzone Ventures,THIRTY MADISON,2021-06-02,2
Thirty Madison,,02-06-2021,United States,New York,Health,Maveron,THIRTY MADISON,2021-06-02,2
Thirty Madison,,02-06-2021,United States,New York,Health,Johnson & Johnson Innovation,THIRTY MADISON,2021-06-02,2
LetsGetChecked,,07-06-2021,Ireland,Dublin,Health,Optum Ventures,LETSGETCHECKED,2021-06-07,2
LetsGetChecked,,07-06-2021,Ireland,Dublin,Health,Qiming Venture Partners,LETSGETCHECKED,2021-06-07,2
LetsGetChecked,,07-06-2021,Ireland,Dublin,Health,Transformation Capital,LETSGETCHECKED,2021-06-07,2
EcoFlow,,10-06-2021,China,Shenzhen,Hardware,Delian Capital,ECOFLOW,2021-06-10,2
EcoFlow,,10-06-2021,China,Shenzhen,Hardware,China International Capital Corporation,ECOFLOW,2021-06-10,2
EcoFlow,,10-06-2021,China,Shenzhen,Hardware,Sequoia Capital China,ECOFLOW,2021-06-10,2
Carro,,14-06-2021,Singapore,Unknown,E-commerce & direct-to-consumer,SingTel Innov8,CARRO,2021-06-14,2
Carro,,14-06-2021,Singapore,Unknown,E-commerce & direct-to-consumer,Alpha JWC Ventures,CARRO,2021-06-14,2
Carro,,14-06-2021,Singapore,Unknown,E-commerce & direct-to-consumer,Golden Gate Ventures,CARRO,2021-06-14,2
Tractable,,16-06-2021,United Kingdom,London,Artificial intelligence,Insight Partners,TRACTABLE,2021-06-16,2
Tractable,,16-06-2021,United Kingdom,London,Artificial intelligence,Ignition Partners,TRACTABLE,2021-06-16,2
Tractable,,16-06-2021,United Kingdom,London,Artificial intelligence,Georgian Partners,TRACTABLE,2021-06-16,2
Xiaoe Tech,,15-06-2021,China,Shenzhen,Internet software & services,GGV Capital,XIAOE TECH,2021-06-15,2
Xiaoe Tech,,15-06-2021,China,Shenzhen,Internet software & services,Hillhouse Capital Management,XIAOE TECH,2021-06-15,2
Xiaoe Tech,,15-06-2021,China,Shenzhen,Internet software & services,IDG Capital,XIAOE TECH,2021-06-15,2
Bringg,,16-06-2021,Israel,Tel Aviv,"Supply chain, logistics, & delivery",Salesforce Ventures,BRINGG,2021-06-16,2
Bringg,,16-06-2021,Israel,Tel Aviv,"Supply chain, logistics, & delivery",next47,BRINGG,2021-06-16,2
Bringg,,16-06-2021,Israel,Tel Aviv,"Supply chain, logistics, & delivery",Pereg Ventures,BRINGG,2021-06-16,2
Claroty,,17-06-2021,United States,New York,Cybersecurity,Bessemer Venture Partners,CLAROTY,2021-06-17,2
Claroty,,17-06-2021,United States,New York,Cybersecurity,MoreVC,CLAROTY,2021-06-17,2
Claroty,,17-06-2021,United States,New York,Cybersecurity,Team8,CLAROTY,2021-06-17,2
Simply,,21-06-2021,Israel,Tel Aviv,Edtech,Genesis Partners,SIMPLY,2021-06-21,2
Simply,,21-06-2021,Israel,Tel Aviv,Edtech,Aleph,SIMPLY,2021-06-21,2
Simply,,21-06-2021,Israel,Tel Aviv,Edtech,Insight Partners,SIMPLY,2021-06-21,2
Aircall,,23-06-2021,United States,New York,Internet software & services,Balderton Capital,AIRCALL,2021-06-23,2
Aircall,,23-06-2021,United States,New York,Internet software & services,Next World Capital,AIRCALL,2021-06-23,2
Aircall,,23-06-2021,United States,New York,Internet software & services,Draper Esprit,AIRCALL,2021-06-23,2
Worldcoin,,29-06-2021,United States,San Francisco,Fintech,Day One Ventures,WORLDCOIN,2021-06-29,2
Worldcoin,,29-06-2021,United States,San Francisco,Fintech,Coinbase Ventures,WORLDCOIN,2021-06-29,2
Worldcoin,,29-06-2021,United States,San Francisco,Fintech,Andreessen Horowitz,WORLDCOIN,2021-06-29,2
SmartAsset,,24-06-2021,United States,New York,Fintech,Javelin Venture Partners,SMARTASSET,2021-06-24,2
SmartAsset,,24-06-2021,United States,New York,Fintech,TTV Capital,SMARTASSET,2021-06-24,2
SmartAsset,,24-06-2021,United States,New York,Fintech,Peterson Ventures,SMARTASSET,2021-06-24,2
Morning Consult,,08-06-2021,United States,Washington DC,Internet software & services,Advance Venture Partners,MORNING CONSULT,2021-06-08,2
Morning Consult,,08-06-2021,United States,Washington DC,Internet software & services,Susquehanna Growth Equity,MORNING CONSULT,2021-06-08,2
Morning Consult,,08-06-2021,United States,Washington DC,Internet software & services,Lupa Systems,MORNING CONSULT,2021-06-08,2
Visier,,29-06-2021,Canada,Vancouver,Internet software & services,Foundation Capital,VISIER,2021-06-29,2
Visier,,29-06-2021,Canada,Vancouver,Internet software & services,Summit Partners,VISIER,2021-06-29,2
Visier,,29-06-2021,Canada,Vancouver,Internet software & services,Adams Street Partners,VISIER,2021-06-29,2
ShipBob,,29-06-2021,United States,Chicago,"Supply chain, logistics, & delivery",Hyde Park Venture Partners,SHIPBOB,2021-06-29,2
ShipBob,,29-06-2021,United States,Chicago,"Supply chain, logistics, & delivery",FundersClub. Bain Capital Ventures,SHIPBOB,2021-06-29,2
MobileCoin,,07-07-2021,United States,San Francisco,Fintech,General Catalyst,MOBILECOIN,2021-07-07,2
MobileCoin,,07-07-2021,United States,San Francisco,Fintech,Future Ventures,MOBILECOIN,2021-07-07,2
MobileCoin,,07-07-2021,United States,San Francisco,Fintech,AU21,MOBILECOIN,2021-07-07,2
Amperity,,13-07-2021,United States,Seattle,Artificial intelligence,Madrona Venture Group,AMPERITY,2021-07-13,2
Amperity,,13-07-2021,United States,Seattle,Artificial intelligence,Tiger Global Management,AMPERITY,2021-07-13,2
Amperity,,13-07-2021,United States,Seattle,Artificial intelligence,Madera Technology Partners,AMPERITY,2021-07-13,2
Pantheon Systems,,13-07-2021,United States,San Francisco,Internet software & services,Foundry Group,PANTHEON SYSTEMS,2021-07-13,2
Pantheon Systems,,13-07-2021,United States,San Francisco,Internet software & services,Scale Venture Partners,PANTHEON SYSTEMS,2021-07-13,2
Pantheon Systems,,13-07-2021,United States,San Francisco,Internet software & services,SoftBank Group,PANTHEON SYSTEMS,2021-07-13,2
Xiaoice,,12-07-2021,China,Beijing,Fintech,NetEase Capital,XIAOICE,2021-07-12,2
Xiaoice,,12-07-2021,China,Beijing,Fintech,Northern Light Venture Capital,XIAOICE,2021-07-12,2
Xiaoice,,12-07-2021,China,Beijing,Fintech,Microsoft,XIAOICE,2021-07-12,2
dMed Biopharmaceutical,,12-07-2021,China,Shanghai,Health,Qiming Venture Partners,DMED BIOPHARMACEUTICAL,2021-07-12,2
dMed Biopharmaceutical,,12-07-2021,China,Shanghai,Health,Vivo Capital,DMED BIOPHARMACEUTICAL,2021-07-12,2
dMed Biopharmaceutical,,12-07-2021,China,Shanghai,Health,Sequoia Capital China,DMED BIOPHARMACEUTICAL,2021-07-12,2
Carson Group,,14-07-2021,United States,Lincoln,Fintech,Bain Capital,CARSON GROUP,2021-07-14,2
Interos,,22-07-2021,United States,Arlington,"Supply chain, logistics, & delivery",Kleiner Perkins Caufield & Byers,INTEROS,2021-07-22,2
Interos,,22-07-2021,United States,Arlington,"Supply chain, logistics, & delivery",NightDragon Security,INTEROS,2021-07-22,2
Interos,,22-07-2021,United States,Arlington,"Supply chain, logistics, & delivery",Venrock,INTEROS,2021-07-22,2
NIUM,,13-07-2021,Singapore,Unknown,Fintech,Vertex Ventures SE Asia,NIUM,2021-07-13,2
NIUM,,13-07-2021,Singapore,Unknown,Fintech,Global Founders Capital,NIUM,2021-07-13,2
NIUM,,13-07-2021,Singapore,Unknown,Fintech,Visa Ventures,NIUM,2021-07-13,2
Human Interest,,04-08-2021,United States,San Francisco,Fintech,Wing Venture Capital,HUMAN INTEREST,2021-08-04,2
Human Interest,,04-08-2021,United States,San Francisco,Fintech,Slow Ventures,HUMAN INTEREST,2021-08-04,2
Human Interest,,04-08-2021,United States,San Francisco,Fintech,Uncork Capital,HUMAN INTEREST,2021-08-04,2
Bluecore,,05-08-2021,United States,New York,Artificial intelligence,FirstMark Capital,BLUECORE,2021-08-05,2
Bluecore,,05-08-2021,United States,New York,Artificial intelligence,Georgian Partners,BLUECORE,2021-08-05,2
Bluecore,,05-08-2021,United States,New York,Artificial intelligence,Norwest Venture Partners,BLUECORE,2021-08-05,2
Freshbooks,,10-08-2021,Canada,Toronto,Fintech,Accomplice,FRESHBOOKS,2021-08-10,2
Freshbooks,,10-08-2021,Canada,Toronto,Fintech,Oak Investment Partners,FRESHBOOKS,2021-08-10,2
Freshbooks,,10-08-2021,Canada,Toronto,Fintech,Georgian Partners,FRESHBOOKS,2021-08-10,2
Snorkel AI,,09-08-2021,United States,Palo Alto,Artificial intelligence,Greylock Partners,SNORKEL AI,2021-08-09,2
Snorkel AI,,09-08-2021,United States,Palo Alto,Artificial intelligence,Google Ventures,SNORKEL AI,2021-08-09,2
Snorkel AI,,09-08-2021,United States,Palo Alto,Artificial intelligence,BlackRock,SNORKEL AI,2021-08-09,2
Gelato,,16-08-2021,Norway,Oslo,E-commerce & direct-to-consumer,Greylock Partners,GELATO,2021-08-16,2
Gelato,,16-08-2021,Norway,Oslo,E-commerce & direct-to-consumer,Google Ventures,GELATO,2021-08-16,2
Gelato,,16-08-2021,Norway,Oslo,E-commerce & direct-to-consumer,BlackRock,GELATO,2021-08-16,2
Maven Clinic,,17-08-2021,United States,New York,Health,Female Founders Fund,MAVEN CLINIC,2021-08-17,2
Maven Clinic,,17-08-2021,United States,New York,Health,Oak HC/FT Partners,MAVEN CLINIC,2021-08-17,2
Maven Clinic,,17-08-2021,United States,New York,Health,Sequoia Capital,MAVEN CLINIC,2021-08-17,2
PicsArt,,26-08-2021,United States,San Francisco,Mobile & telecommunications,Sequoia Capital,PICSART,2021-08-26,2
PicsArt,,26-08-2021,United States,San Francisco,Mobile & telecommunications,DCM Ventures,PICSART,2021-08-26,2
PicsArt,,26-08-2021,United States,San Francisco,Mobile & telecommunications,Insight Partners,PICSART,2021-08-26,2
1KMXC,,30-08-2021,China,Hangzhou,Hardware,Goldman Sachs Asset Management,1KMXC,2021-08-30,2
1KMXC,,30-08-2021,China,Hangzhou,Hardware,SDP Investment,1KMXC,2021-08-30,2
1KMXC,,30-08-2021,China,Hangzhou,Hardware,Alibaba Group,1KMXC,2021-08-30,2
Cider,,02-09-2021,Hong Kong,Unknown,E-commerce & direct-to-consumer,Andreessen Horowitz,CIDER,2021-09-02,2
Cider,,02-09-2021,Hong Kong,Unknown,E-commerce & direct-to-consumer,DST Global,CIDER,2021-09-02,2
Cider,,02-09-2021,Hong Kong,Unknown,E-commerce & direct-to-consumer,IDG Capital,CIDER,2021-09-02,2
Berlin Brands Group,,01-09-2021,Germany,Berlin,E-commerce & direct-to-consumer,Ardian,BERLIN BRANDS GROUP,2021-09-01,2
Berlin Brands Group,,01-09-2021,Germany,Berlin,E-commerce & direct-to-consumer,Bain Capital,BERLIN BRANDS GROUP,2021-09-01,2
Agile Robots,,09-09-2021,Germany,Munich,Hardware,Hillhouse Capital Management,AGILE ROBOTS,2021-09-09,2
Agile Robots,,09-09-2021,Germany,Munich,Hardware,Sequoia Capital China,AGILE ROBOTS,2021-09-09,2
Agile Robots,,09-09-2021,Germany,Munich,Hardware,Linear Venture,AGILE ROBOTS,2021-09-09,2
Mammoth Biosciences,,09-09-2021,United States,Brisbane,Health,NFX,MAMMOTH BIOSCIENCES,2021-09-09,2
Mammoth Biosciences,,09-09-2021,United States,Brisbane,Health,Plum Alley,MAMMOTH BIOSCIENCES,2021-09-09,2
Mammoth Biosciences,,09-09-2021,United States,Brisbane,Health,Mayfield,MAMMOTH BIOSCIENCES,2021-09-09,2
Orchard,,09-09-2021,United States,New York,Fintech,Accomplice,ORCHARD,2021-09-09,2
Orchard,,09-09-2021,United States,New York,Fintech,Juxtapose,ORCHARD,2021-09-09,2
Orchard,,09-09-2021,United States,New York,Fintech,FirstMark Capital,ORCHARD,2021-09-09,2
Xendit,,14-09-2021,Indonesia,Jakarta,Fintech,Accel,XENDIT,2021-09-14,2
Xendit,,14-09-2021,Indonesia,Jakarta,Fintech,Y Combinator,XENDIT,2021-09-14,2
Xendit,,14-09-2021,Indonesia,Jakarta,Fintech,Amasia,XENDIT,2021-09-14,2
TrueLayer,,21-09-2021,United Kingdom,London,Fintech,Anthemis,TRUELAYER,2021-09-21,2
TrueLayer,,21-09-2021,United Kingdom,London,Fintech,Connect Ventures,TRUELAYER,2021-09-21,2
TrueLayer,,21-09-2021,United Kingdom,London,Fintech,Northzone Ventures,TRUELAYER,2021-09-21,2
Assembly,,21-09-2021,United States,Culver City,Internet software & services,Advent International,ASSEMBLY,2021-09-21,2
Assembly,,21-09-2021,United States,Culver City,Internet software & services,PSG,ASSEMBLY,2021-09-21,2
Assembly,,21-09-2021,United States,Culver City,Internet software & services,Providence Equity Partners,ASSEMBLY,2021-09-21,2
PandaDoc,,22-09-2021,United States,San Francisco,Internet software & services,Rembrandt Venture Partners,PANDADOC,2021-09-22,2
PandaDoc,,22-09-2021,United States,San Francisco,Internet software & services,M12,PANDADOC,2021-09-22,2
PandaDoc,,22-09-2021,United States,San Francisco,Internet software & services,Altos Ventures,PANDADOC,2021-09-22,2
Keenon Robotics,,15-09-2021,China,Shanghai,"Supply chain, logistics, & delivery",Yunqi Partners,KEENON ROBOTICS,2021-09-15,2
Keenon Robotics,,15-09-2021,China,Shanghai,"Supply chain, logistics, & delivery",SoftBank Group,KEENON ROBOTICS,2021-09-15,2
Keenon Robotics,,15-09-2021,China,Shanghai,"Supply chain, logistics, & delivery",iVision Ventures,KEENON ROBOTICS,2021-09-15,2
HAYDON,,24-09-2021,China,Shanghai,Consumer & retail,Tencent Holdings,HAYDON,2021-09-24,2
HAYDON,,24-09-2021,China,Shanghai,Consumer & retail,Hillhouse Capital Management,HAYDON,2021-09-24,2
Ninja Van,,27-09-2021,Singapore,Unknown,"Supply chain, logistics, & delivery",B Capital Group,NINJA VAN,2021-09-27,2
Ninja Van,,27-09-2021,Singapore,Unknown,"Supply chain, logistics, & delivery",Monk's Hill Ventures,NINJA VAN,2021-09-27,2
Ninja Van,,27-09-2021,Singapore,Unknown,"Supply chain, logistics, & delivery",Dynamic Parcel Distribution,NINJA VAN,2021-09-27,2
Vedantu,,29-09-2021,India,Bengaluru,Edtech,Accel,VEDANTU,2021-09-29,2
Vedantu,,29-09-2021,India,Bengaluru,Edtech,Tiger Global Management,VEDANTU,2021-09-29,2
Vedantu,,29-09-2021,India,Bengaluru,Edtech,Omidyar Network,VEDANTU,2021-09-29,2
TrialSpark,,30-09-2021,United States,New York,Health,Sequoia Capital,TRIALSPARK,2021-09-30,2
TrialSpark,,30-09-2021,United States,New York,Health,Thrive Capital,TRIALSPARK,2021-09-30,2
TrialSpark,,30-09-2021,United States,New York,Health,Sound Ventures,TRIALSPARK,2021-09-30,2
Ajaib,,04-10-2021,Indonesia,Jakarta,Fintech,Softbank Ventures Asia,AJAIB,2021-10-04,2
Ajaib,,04-10-2021,Indonesia,Jakarta,Fintech,Alpha JWC Ventures,AJAIB,2021-10-04,2
Ajaib,,04-10-2021,Indonesia,Jakarta,Fintech,Insignia Ventures Partners,AJAIB,2021-10-04,2
Licious,,05-10-2021,India,Bengaluru,E-commerce & direct-to-consumer,3one4 Capital Partners,LICIOUS,2021-10-05,2
Licious,,05-10-2021,India,Bengaluru,E-commerce & direct-to-consumer,Bertelsmann India Investments,LICIOUS,2021-10-05,2
Licious,,05-10-2021,India,Bengaluru,E-commerce & direct-to-consumer,Vertex Ventures SE Asia,LICIOUS,2021-10-05,2
Masterworks,,05-10-2021,United States,New York,Fintech,Left Lane Capital,MASTERWORKS,2021-10-05,2
Masterworks,,05-10-2021,United States,New York,Fintech,Galaxy Interactive,MASTERWORKS,2021-10-05,2
Masterworks,,05-10-2021,United States,New York,Fintech,Tru Arrow Partners,MASTERWORKS,2021-10-05,2
Chronosphere,,07-10-2021,United States,New York,Data management & analytics,Greylock Partners,CHRONOSPHERE,2021-10-07,2
Chronosphere,,07-10-2021,United States,New York,Data management & analytics,Lux Capital,CHRONOSPHERE,2021-10-07,2
Chronosphere,,07-10-2021,United States,New York,Data management & analytics,General Atlantic,CHRONOSPHERE,2021-10-07,2
Solo.io,,07-10-2021,United States,Cambridge,Internet software & services,True Ventures,SOLO.IO,2021-10-07,2
Solo.io,,07-10-2021,United States,Cambridge,Internet software & services,Altimeter Capital,SOLO.IO,2021-10-07,2
Solo.io,,07-10-2021,United States,Cambridge,Internet software & services,Redpoint Ventures,SOLO.IO,2021-10-07,2
Savage X Fenty,,10-02-2021,United States,El Segundo,E-commerce & direct-to-consumer,Speedinvest,SAVAGE X FENTY,2021-02-10,2
Savage X Fenty,,10-02-2021,United States,El Segundo,E-commerce & direct-to-consumer,Valar Ventures,SAVAGE X FENTY,2021-02-10,2
Savage X Fenty,,10-02-2021,United States,El Segundo,E-commerce & direct-to-consumer,Uniqa Ventures,SAVAGE X FENTY,2021-02-10,2
Swile,,11-10-2021,France,Montpellier,Fintech,Index Ventures,SWILE,2021-10-11,2
Swile,,11-10-2021,France,Montpellier,Fintech,IDInvest Partners,SWILE,2021-10-11,2
Swile,,11-10-2021,France,Montpellier,Fintech,Daphni,SWILE,2021-10-11,2
MobiKwik,,13-10-2021,India,Gurugram,Fintech,Sequoia Capital India,MOBIKWIK,2021-10-13,2
MobiKwik,,13-10-2021,India,Gurugram,Fintech,The Times Group,MOBIKWIK,2021-10-13,2
MobiKwik,,13-10-2021,India,Gurugram,Fintech,GMO VenturePartners,MOBIKWIK,2021-10-13,2
Weights & Biases,,13-10-2021,United States,San Francisco,Artificial intelligence,Coatue Management,WEIGHTS & BIASES,2021-10-13,2
Weights & Biases,,13-10-2021,United States,San Francisco,Artificial intelligence,Insight Partners,WEIGHTS & BIASES,2021-10-13,2
Weights & Biases,,13-10-2021,United States,San Francisco,Artificial intelligence,Trinity Ventures,WEIGHTS & BIASES,2021-10-13,2
Zopa,,19-10-2021,United Kingdom,London,Fintech,IAG Capital Partners,ZOPA,2021-10-19,2
Zopa,,19-10-2021,United Kingdom,London,Fintech,Augmentum Fintech,ZOPA,2021-10-19,2
Zopa,,19-10-2021,United Kingdom,London,Fintech,Northzone Ventures,ZOPA,2021-10-19,2
Dental Monitoring,,21-10-2021,France,Paris,Health,Vitruvian Partners,DENTAL MONITORING,2021-10-21,2
Dental Monitoring,,21-10-2021,France,Paris,Health,Merieux Equity Partners,DENTAL MONITORING,2021-10-21,2
Dental Monitoring,,21-10-2021,France,Paris,Health,Straumann,DENTAL MONITORING,2021-10-21,2
CargoX,,21-10-2021,Brazil,Sao Paulo,"Supply chain, logistics, & delivery",Valor Capital Group,CARGOX,2021-10-21,2
CargoX,,21-10-2021,Brazil,Sao Paulo,"Supply chain, logistics, & delivery",Lightrock,CARGOX,2021-10-21,2
CargoX,,21-10-2021,Brazil,Sao Paulo,"Supply chain, logistics, & delivery",Softbank Group,CARGOX,2021-10-21,2
Fabric,,26-10-2021,United States,New York,"Supply chain, logistics, & delivery",Innovation Endeavors,FABRIC NEW YORK,2021-10-26,2
Fabric,,26-10-2021,United States,New York,"Supply chain, logistics, & delivery",Aleph,FABRIC NEW YORK,2021-10-26,2
Fabric,,26-10-2021,United States,New York,"Supply chain, logistics, & delivery",Temasek,FABRIC NEW YORK,2021-10-26,2
Augury,,26-10-2021,United States,New York,Artificial intelligence,Lerer Hippeau,AUGURY,2021-10-26,2
Augury,,26-10-2021,United States,New York,Artificial intelligence,Munich Re Ventures,AUGURY,2021-10-26,2
Augury,,26-10-2021,United States,New York,Artificial intelligence,Eclipse Ventures,AUGURY,2021-10-26,2
Moka,,02-11-2021,China,Beijing,Internet software & services,GGV Capital,MOKA,2021-11-02,2
Moka,,02-11-2021,China,Beijing,Internet software & services,GSR Ventures,MOKA,2021-11-02,2
Moka,,02-11-2021,China,Beijing,Internet software & services,FreesFund,MOKA,2021-11-02,2
Tezign,,02-11-2021,China,Shanghai,Internet software & services,Sequoia Capital China,TEZIGN,2021-11-02,2
Tezign,,02-11-2021,China,Shanghai,Internet software & services,Linear Venture,TEZIGN,2021-11-02,2
Tezign,,02-11-2021,China,Shanghai,Internet software & services,Hearst Ventures,TEZIGN,2021-11-02,2
Vagaro,,03-11-2021,United States,Dublin,Internet software & services,FTV Capital,VAGARO,2021-11-03,2
Razor,,08-11-2021,Germany,Berlin,Consumer & retail,Global Founders Capital,RAZOR,2021-11-08,2
Razor,,08-11-2021,Germany,Berlin,Consumer & retail,468 Capital,RAZOR,2021-11-08,2
Razor,,08-11-2021,Germany,Berlin,Consumer & retail,Redalpine Venture Partners,RAZOR,2021-11-08,2
IGAWorks,,08-11-2021,South Korea,Seoul,Internet software & services,Korea Investment Private Equity,IGAWORKS,2021-11-08,2
IGAWorks,,08-11-2021,South Korea,Seoul,Internet software & services,Atinum Investment,IGAWORKS,2021-11-08,2
IGAWorks,,08-11-2021,South Korea,Seoul,Internet software & services,Korea Investment Partners,IGAWORKS,2021-11-08,2
Contrast Security,,09-11-2021,United States,Los Altos,Cybersecurity,Acero Capital,CONTRAST SECURITY,2021-11-09,2
Contrast Security,,09-11-2021,United States,Los Altos,Cybersecurity,General Catalyst,CONTRAST SECURITY,2021-11-09,2
Contrast Security,,09-11-2021,United States,Los Altos,Cybersecurity,M12,CONTRAST SECURITY,2021-11-09,2
Wrapbook,,10-11-2021,United States,New York,Fintech,Equal Ventures,WRAPBOOK,2021-11-10,2
Wrapbook,,10-11-2021,United States,New York,Fintech,Uncork Capital,WRAPBOOK,2021-11-10,2
Wrapbook,,10-11-2021,United States,New York,Fintech,Andreessen Horowitz,WRAPBOOK,2021-11-10,2
Gaussian Robotics,,10-11-2021,China,Shanghai,Hardware,BlueRun Ventures,GAUSSIAN ROBOTICS,2021-11-10,2
Gaussian Robotics,,10-11-2021,China,Shanghai,Hardware,Grand Flight Investment,GAUSSIAN ROBOTICS,2021-11-10,2
Gaussian Robotics,,10-11-2021,China,Shanghai,Hardware,Meituan Dianping,GAUSSIAN ROBOTICS,2021-11-10,2
Mensa Brands,,16-11-2021,India,Bengaluru,Other,Accel,MENSA BRANDS,2021-11-16,2
Mensa Brands,,16-11-2021,India,Bengaluru,Other,Falcon Edge Capital,MENSA BRANDS,2021-11-16,2
Mensa Brands,,16-11-2021,India,Bengaluru,Other,Norwest Venture Partners,MENSA BRANDS,2021-11-16,2
Heyday,,16-11-2021,United States,Chicago,E-commerce & direct-to-consumer,Khosla Ventures,HEYDAY,2021-11-16,2
Heyday,,16-11-2021,United States,Chicago,E-commerce & direct-to-consumer,General Catalyst,HEYDAY,2021-11-16,2
Heyday,,16-11-2021,United States,Chicago,E-commerce & direct-to-consumer,Victory Park Capital,HEYDAY,2021-11-16,2
PLACE,,17-11-2021,United States,Bellingham,Internet software & services,Goldman Sachs Asset Management,PLACE,2021-11-17,2
PLACE,,17-11-2021,United States,Bellingham,Internet software & services,3L,PLACE,2021-11-17,2
Stytch,,18-11-2021,United States,San Francisco,Cybersecurity,Index Ventures,STYTCH,2021-11-18,2
Stytch,,18-11-2021,United States,San Francisco,Cybersecurity,Benchmark,STYTCH,2021-11-18,2
Stytch,,18-11-2021,United States,San Francisco,Cybersecurity,Thrive Capital,STYTCH,2021-11-18,2
Owkin,,18-11-2021,United States,New York,Artificial Intelligence,Google Ventures,OWKIN,2021-11-18,2
Owkin,,18-11-2021,United States,New York,Artificial Intelligence,Cathay Innovation,OWKIN,2021-11-18,2
Owkin,,18-11-2021,United States,New York,Artificial Intelligence,NJF Capital,OWKIN,2021-11-18,2
Expel,,18-11-2021,United States,Herndon,Cybersecurity,Paladin Capital Group,EXPEL,2021-11-18,2
Expel,,18-11-2021,United States,Herndon,Cybersecurity,Greycroft,EXPEL,2021-11-18,2
Expel,,18-11-2021,United States,Herndon,Cybersecurity,Scale Venture Partners,EXPEL,2021-11-18,2
NoBroker,,23-11-2021,India,Bengaluru,Internet software & services,General Atlantic,NOBROKER,2021-11-23,2
NoBroker,,23-11-2021,India,Bengaluru,Internet software & services,Elevation Capital,NOBROKER,2021-11-23,2
NoBroker,,23-11-2021,India,Bengaluru,Internet software & services,BEENEXT,NOBROKER,2021-11-23,2
Lessen,,30-11-2021,United States,Scottsdale,Internet software & services,Khosla Ventures,LESSEN,2021-11-30,2
Lessen,,30-11-2021,United States,Scottsdale,Internet software & services,General Catalyst,LESSEN,2021-11-30,2
Lessen,,30-11-2021,United States,Scottsdale,Internet software & services,Navitas Capital,LESSEN,2021-11-30,2
Clara,,06-12-2021,Mexico,Mexico City,Fintech,DST Global,CLARA,2021-12-06,2
Clara,,06-12-2021,Mexico,Mexico City,Fintech,General Catalyst,CLARA,2021-12-06,2
Clara,,06-12-2021,Mexico,Mexico City,Fintech,Monashees+,CLARA,2021-12-06,2
YipitData,,06-12-2021,United States,New York,Internet software & services,RRE Ventures+,YIPITDATA,2021-12-06,2
YipitData,,06-12-2021,United States,New York,Internet software & services,Highland Capital Partners,YIPITDATA,2021-12-06,2
YipitData,,06-12-2021,United States,New York,Internet software & services,The Carlyle Group,YIPITDATA,2021-12-06,2
Anyscale,,07-12-2021,United States,Berkeley,Artificial Intelligence,Andreessen Horowitz,ANYSCALE,2021-12-07,2
Anyscale,,07-12-2021,United States,Berkeley,Artificial Intelligence,Intel Capital,ANYSCALE,2021-12-07,2
Anyscale,,07-12-2021,United States,Berkeley,Artificial Intelligence,Foundation Capital,ANYSCALE,2021-12-07,2
Iodine Software,,01-12-2021,United States,Austin,Data management & analytics,Advent International,IODINE SOFTWARE,2021-12-01,2
Iodine Software,,01-12-2021,United States,Austin,Data management & analytics,Bain Capital Ventures,IODINE SOFTWARE,2021-12-01,2
Iodine Software,,01-12-2021,United States,Austin,Data management & analytics,Silversmith Capital Partners,IODINE SOFTWARE,2021-12-01,2
ReliaQuest,,01-12-2021,United States,Tampa,Cybersecurity,KKR,RELIAQUEST,2021-12-01,2
ReliaQuest,,01-12-2021,United States,Tampa,Cybersecurity,FTV Capital,RELIAQUEST,2021-12-01,2
ReliaQuest,,01-12-2021,United States,Tampa,Cybersecurity,Ten Eleven Ventures,RELIAQUEST,2021-12-01,2
Pet Circle,,06-12-2021,Australia,Alexandria,E-commerce & direct-to-consumer,Prysm Capital,PET CIRCLE,2021-12-06,2
Pet Circle,,06-12-2021,Australia,Alexandria,E-commerce & direct-to-consumer,Baillie Gifford & Co.,PET CIRCLE,2021-12-06,2
Pet Circle,,06-12-2021,Australia,Alexandria,E-commerce & direct-to-consumer,TDM Growth Partners,PET CIRCLE,2021-12-06,2
Nature's Fynd,,19-07-2021,United States,Chicago,Consumer & retail,Danone Manifesto Ventures,NATURE'S FYND,2021-07-19,2
Nature's Fynd,,19-07-2021,United States,Chicago,Consumer & retail,1955 Capital,NATURE'S FYND,2021-07-19,2
Nature's Fynd,,19-07-2021,United States,Chicago,Consumer & retail,Breakthrough Energy Ventures,NATURE'S FYND,2021-07-19,2
Lydia,,08-12-2021,France,Paris,Fintech,NewAlpha,LYDIA,2021-12-08,2
Lydia,,08-12-2021,France,Paris,Fintech,XAnge Private Equity,LYDIA,2021-12-08,2
Lydia,,08-12-2021,France,Paris,Fintech,Tencent Holdings,LYDIA,2021-12-08,2
SellerX,,09-12-2021,Germany,Berlin,E-commerce & direct-to-consumer,Cherry Ventures,SELLERX,2021-12-09,2
SellerX,,09-12-2021,Germany,Berlin,E-commerce & direct-to-consumer,Felix Capital,SELLERX,2021-12-09,2
SellerX,,09-12-2021,Germany,Berlin,E-commerce & direct-to-consumer,83North,SELLERX,2021-12-09,2
SnapLogic,,13-12-2021,United States,San Mateo,Internet software & services,Andreessen Horowitz,SNAPLOGIC,2021-12-13,2
SnapLogic,,13-12-2021,United States,San Mateo,Internet software & services,Triangle Peak Partners,SNAPLOGIC,2021-12-13,2
SnapLogic,,13-12-2021,United States,San Mateo,Internet software & services,Ignition Partners,SNAPLOGIC,2021-12-13,2
Cadence,,14-12-2021,United States,New York,Health,Thrive Capital,CADENCE,2021-12-14,2
Cadence,,14-12-2021,United States,New York,Health,General Catalyst,CADENCE,2021-12-14,2
Cadence,,14-12-2021,United States,New York,Health,Coatue Management,CADENCE,2021-12-14,2
Noname Security,,15-12-2021,United States,Palo Alto,Cybersecurity,Insight Partners,NONAME SECURITY,2021-12-15,2
Noname Security,,15-12-2021,United States,Palo Alto,Cybersecurity,Lightspeed Venture Partners,NONAME SECURITY,2021-12-15,2
Noname Security,,15-12-2021,United States,Palo Alto,Cybersecurity,CyberStarts,NONAME SECURITY,2021-12-15,2
Rothy's,,21-12-2021,United States,San Francisco,Consumer & retail,Alpargatas,ROTHY'S,2021-12-21,2
Rothy's,,21-12-2021,United States,San Francisco,Consumer & retail,GS Growth,ROTHY'S,2021-12-21,2
Rothy's,,21-12-2021,United States,San Francisco,Consumer & retail,Lightspeed Venture Partners,ROTHY'S,2021-12-21,2
VOI,,21-12-2021,Sweden,Stockholm,Travel,Vostok New Ventures,VOI,2021-12-21,2
VOI,,21-12-2021,Sweden,Stockholm,Travel,The Raine Group,VOI,2021-12-21,2
VOI,,21-12-2021,Sweden,Stockholm,Travel,Balderton Capital,VOI,2021-12-21,2
Haomao.AI,,22-12-2021,China,Beijing,Artificial Intelligence,Qualcomm Ventures,HAOMAO.AI,2021-12-22,2
Haomao.AI,,22-12-2021,China,Beijing,Artificial Intelligence,Nine Intelligence Capital,HAOMAO.AI,2021-12-22,2
Haomao.AI,,22-12-2021,China,Beijing,Artificial Intelligence,Hillhouse Capital Management,HAOMAO.AI,2021-12-22,2
Kopi Kenangan,,27-12-2021,Indonesia,Jakarta,Consumer & retail,Horizons Ventures,KOPI KENANGAN,2021-12-27,2
Kopi Kenangan,,27-12-2021,Indonesia,Jakarta,Consumer & retail,Sequoia Capital India,KOPI KENANGAN,2021-12-27,2
Kopi Kenangan,,27-12-2021,Indonesia,Jakarta,Consumer & retail,Alpha JWC Ventures,KOPI KENANGAN,2021-12-27,2
InFarm,,16-12-2021,Germany,Berlin,Other,Atomico,INFARM,2021-12-16,2
InFarm,,16-12-2021,Germany,Berlin,Other,Hanaco Venture Capital,INFARM,2021-12-16,2
InFarm,,16-12-2021,Germany,Berlin,Other,TriplePoint Capital,INFARM,2021-12-16,2
ONE,,08-12-2021,Singapore,Unknown,Internet software & services,Temasek,ONE,2021-12-08,2
ONE,,08-12-2021,Singapore,Unknown,Internet software & services,Guggenheim Investments,ONE,2021-12-08,2
ONE,,08-12-2021,Singapore,Unknown,Internet software & services,Qatar Investment Authority,ONE,2021-12-08,2
Fractal Analytics,,05-01-2022,India,Mumbai,Data management & analytics,TPG Capital,FRACTAL ANALYTICS,2022-01-05,1
Fractal Analytics,,05-01-2022,India,Mumbai,Data management & analytics,Apax Partners,FRACTAL ANALYTICS,2022-01-05,1
Fractal Analytics,,05-01-2022,India,Mumbai,Data management & analytics,TA Associates,FRACTAL ANALYTICS,2022-01-05,1
Assent,,06-01-2022,Canada,Ottawa,"Supply chain, logistics, & delivery",Vista Equity Partners,ASSENT,2022-01-06,1
Assent,,06-01-2022,Canada,Ottawa,"Supply chain, logistics, & delivery",Warburg Pincus,ASSENT,2022-01-06,1
Assent,,06-01-2022,Canada,Ottawa,"Supply chain, logistics, & delivery",First Ascent Ventures,ASSENT,2022-01-06,1
Placer.ai,,12-01-2022,United States,Los Altos,Artificial intelligence,Fifth Wall Ventures,PLACER.AI,2022-01-12,1
Placer.ai,,12-01-2022,United States,Los Altos,Artificial intelligence,JBV Capital,PLACER.AI,2022-01-12,1
Placer.ai,,12-01-2022,United States,Los Altos,Artificial intelligence,Array Ventures,PLACER.AI,2022-01-12,1
Pentera,,11-01-2022,Israel,Petah Tikva,Cybersecurity,AWZ Ventures,PENTERA,2022-01-11,1
Pentera,,11-01-2022,Israel,Petah Tikva,Cybersecurity,Blackstone,PENTERA,2022-01-11,1
Pentera,,11-01-2022,Israel,Petah Tikva,Cybersecurity,Insight Partners,PENTERA,2022-01-11,1
Darwinbox,,25-01-2022,India,Hyderabad,Internet software & services,Lightspeed India Partners,DARWINBOX,2022-01-25,1
Darwinbox,,25-01-2022,India,Hyderabad,Internet software & services,Sequoia Capital India,DARWINBOX,2022-01-25,1
Darwinbox,,25-01-2022,India,Hyderabad,Internet software & services,Endiya Partners,DARWINBOX,2022-01-25,1
Minio,,26-01-2022,United States,Palo Alto,Data management & analytics,General Catalyst,MINIO,2022-01-26,1
Minio,,26-01-2022,United States,Palo Alto,Data management & analytics,Nexus Venture Partners,MINIO,2022-01-26,1
Minio,,26-01-2022,United States,Palo Alto,Data management & analytics,Dell Technologies Capital,MINIO,2022-01-26,1
Esusu,,27-01-2022,United States,New York,Fintech,Next Play Ventures,ESUSU,2022-01-27,1
Esusu,,27-01-2022,United States,New York,Fintech,Zeal Capital Partners,ESUSU,2022-01-27,1
Esusu,,27-01-2022,United States,New York,Fintech,SoftBank Group,ESUSU,2022-01-27,1
Betterfly,,01-02-2022,Chile,Santiago,Artificial intelligence,QED Investors,BETTERFLY,2022-02-01,1
Betterfly,,01-02-2022,Chile,Santiago,Artificial intelligence,DST Global,BETTERFLY,2022-02-01,1
Betterfly,,01-02-2022,Chile,Santiago,Artificial intelligence,Endeavor,BETTERFLY,2022-02-01,1
Dune Analytics,,02-02-2022,Norway,Oslo,Data management & analytics,Multicoin Capital,DUNE ANALYTICS,2022-02-02,1
Dune Analytics,,02-02-2022,Norway,Oslo,Data management & analytics,Coatue Management,DUNE ANALYTICS,2022-02-02,1
Dune Analytics,,02-02-2022,Norway,Oslo,Data management & analytics,Dragonfly Capital Partners,DUNE ANALYTICS,2022-02-02,1
Scandit,,09-02-2022,Switzerland,Zurich,"Supply chain, logistics, & delivery",Atomico,SCANDIT,2022-02-09,1
Scandit,,09-02-2022,Switzerland,Zurich,"Supply chain, logistics, & delivery",NGP Capital,SCANDIT,2022-02-09,1
Scandit,,09-02-2022,Switzerland,Zurich,"Supply chain, logistics, & delivery",Google Ventures,SCANDIT,2022-02-09,1
Payhawk,,14-02-2022,United Kingdom,London,Fintech,Earlybird Venture Capital,PAYHAWK,2022-02-14,1
Payhawk,,14-02-2022,United Kingdom,London,Fintech,Eleven Ventures,PAYHAWK,2022-02-14,1
Payhawk,,14-02-2022,United Kingdom,London,Fintech,QED Investors,PAYHAWK,2022-02-14,1
Watershed,,08-02-2022,United States,San Francisco,Internet software & services,Kleiner Perkins Caufield & Byers,WATERSHED,2022-02-08,1
Watershed,,08-02-2022,United States,San Francisco,Internet software & services,Sequoia Capital,WATERSHED,2022-02-08,1
Axelar,,15-02-2022,Canada,Waterloo,Internet software & services,Lemniscap VC,AXELAR,2022-02-15,1
Axelar,,15-02-2022,Canada,Waterloo,Internet software & services,North Island Ventures,AXELAR,2022-02-15,1
Axelar,,15-02-2022,Canada,Waterloo,Internet software & services,Polychain Capital,AXELAR,2022-02-15,1
CHEQ,,22-02-2022,United States,New York,Cybersecurity,Battery Ventures,CHEQ,2022-02-22,1
CHEQ,,22-02-2022,United States,New York,Cybersecurity,Tiger Global Management,CHEQ,2022-02-22,1
CHEQ,,22-02-2022,United States,New York,Cybersecurity,Hanaco Ventures,CHEQ,2022-02-22,1
Hasura,,22-02-2022,India,Bengaluru,Internet software & services,Nexus Venture Partners,HASURA,2022-02-22,1
Hasura,,22-02-2022,India,Bengaluru,Internet software & services,Vertex Ventures,HASURA,2022-02-22,1
Hasura,,22-02-2022,India,Bengaluru,Internet software & services,STRIVE,HASURA,2022-02-22,1
Timescale,,22-02-2022,United States,New York,Internet software & services,New Enterprise Associates,TIMESCALE,2022-02-22,1
Timescale,,22-02-2022,United States,New York,Internet software & services,Benchmark,TIMESCALE,2022-02-22,1
Timescale,,22-02-2022,United States,New York,Internet software & services,Two Sigma Ventures,TIMESCALE,2022-02-22,1
Scalapay,,23-02-2022,Italy,Milan,Fintech,Fasanara Capital,SCALAPAY,2022-02-23,1
Scalapay,,23-02-2022,Italy,Milan,Fintech,Tiger Global Management,SCALAPAY,2022-02-23,1
Scalapay,,23-02-2022,Italy,Milan,Fintech,Baleen Capital,SCALAPAY,2022-02-23,1
Omada Health,,23-02-2022,United States,San Francisco,Health,U.S. Venture Partners,OMADA HEALTH,2022-02-23,1
Omada Health,,23-02-2022,United States,San Francisco,Health,dRx Capital,OMADA HEALTH,2022-02-23,1
Omada Health,,23-02-2022,United States,San Francisco,Health,Andreessen Horowitz,OMADA HEALTH,2022-02-23,1
BlueVoyant,,23-02-2022,United States,New York,Cybersecurity,8VC,BLUEVOYANT,2022-02-23,1
BlueVoyant,,23-02-2022,United States,New York,Cybersecurity,Liberty Strategic Capital,BLUEVOYANT,2022-02-23,1
BlueVoyant,,23-02-2022,United States,New York,Cybersecurity,Eden Global Partners,BLUEVOYANT,2022-02-23,1
Veev,,24-02-2022,United States,San Mateo,Internet software & services,Zeev Ventures,VEEV,2022-02-24,1
Veev,,24-02-2022,United States,San Mateo,Internet software & services,Bond,VEEV,2022-02-24,1
Veev,,24-02-2022,United States,San Mateo,Internet software & services,Fifth Wall Ventures,VEEV,2022-02-24,1
Vendr,,24-02-2022,United States,Boston,Fintech,Craft Ventures,VENDR,2022-02-24,1
Vendr,,24-02-2022,United States,Boston,Fintech,F-Prime Capital,VENDR,2022-02-24,1
Vendr,,24-02-2022,United States,Boston,Fintech,Sound Ventures,VENDR,2022-02-24,1
Gauntlet Networks,,07-03-2022,United States,New York,Fintech,Polychain Capital,GAUNTLET NETWORKS,2022-03-07,1
Gauntlet Networks,,07-03-2022,United States,New York,Fintech,Paradigm,GAUNTLET NETWORKS,2022-03-07,1
Gauntlet Networks,,07-03-2022,United States,New York,Fintech,Ribbit Capital,GAUNTLET NETWORKS,2022-03-07,1
Aptos,,15-03-2022,United States,Palo Alto,Internet software & services,Andreessen Horowitz,APTOS,2022-03-15,1
Aptos,,15-03-2022,United States,Palo Alto,Internet software & services,Coinbase Ventures,APTOS,2022-03-15,1
Aptos,,15-03-2022,United States,Palo Alto,Internet software & services,Tiger Global Management,APTOS,2022-03-15,1
Glia,,21-03-2022,United States,New York,Fintech,Wildcat Capital Management,GLIA,2022-03-21,1
Glia,,21-03-2022,United States,New York,Fintech,Insight Partners,GLIA,2022-03-21,1
Glia,,21-03-2022,United States,New York,Fintech,Tola Capital,GLIA,2022-03-21,1
CommerceIQ,,21-03-2022,United States,Palo Alto,Artificial Intelligence,Trinity Ventures,COMMERCEIQ,2022-03-21,1
CommerceIQ,,21-03-2022,United States,Palo Alto,Artificial Intelligence,Madrona Venture Group,COMMERCEIQ,2022-03-21,1
CommerceIQ,,21-03-2022,United States,Palo Alto,Artificial Intelligence,Shasta Ventures,COMMERCEIQ,2022-03-21,1
RapidAPI,,23-03-2022,United States,San Francisco,Internet software & services,Green Bay Ventures,RAPIDAPI,2022-03-23,1
RapidAPI,,23-03-2022,United States,San Francisco,Internet software & services,M12,RAPIDAPI,2022-03-23,1
RapidAPI,,23-03-2022,United States,San Francisco,Internet software & services,Andreessen Horowitz,RAPIDAPI,2022-03-23,1
Tarana Wireless,,23-03-2022,United States,Milpitas,Mobile & telecommunications,Prime Movers Lab,TARANA WIRELESS,2022-03-23,1
Tarana Wireless,,23-03-2022,United States,Milpitas,Mobile & telecommunications,Khosla Ventures,TARANA WIRELESS,2022-03-23,1
Tarana Wireless,,23-03-2022,United States,Milpitas,Mobile & telecommunications,I Squared Capital,TARANA WIRELESS,2022-03-23,1
FLASH,,16-03-2022,United States,Austin,Fintech,L Catterton,FLASH,2022-03-16,1
FLASH,,16-03-2022,United States,Austin,Fintech,Trellis Partners,FLASH,2022-03-16,1
FLASH,,16-03-2022,United States,Austin,Fintech,Vista Equity Partners,FLASH,2022-03-16,1
Electric,,29-03-2022,United States,New York,Cybersecurity,Primary Venture Partners,ELECTRIC,2022-03-29,1
Electric,,29-03-2022,United States,New York,Cybersecurity,Bessemer Venture Partners,ELECTRIC,2022-03-29,1
Electric,,29-03-2022,United States,New York,Cybersecurity,Harmonic Growth Partners,ELECTRIC,2022-03-29,1
LayerZero Labs,,30-03-2022,United States,New York,Internet software & services,Andreessen Horowitz,LAYERZERO LABS,2022-03-30,1
LayerZero Labs,,30-03-2022,United States,New York,Internet software & services,FTX Ventures,LAYERZERO LABS,2022-03-30,1
LayerZero Labs,,30-03-2022,United States,New York,Internet software & services,Tiger Global Management,LAYERZERO LABS,2022-03-30,1
BostonGene,,06-04-2022,United States,Waltham,Health,Japan Industrial Partners,BOSTONGENE,2022-04-06,1
BostonGene,,06-04-2022,United States,Waltham,Health,Impact Investment Capital,BOSTONGENE,2022-04-06,1
BostonGene,,06-04-2022,United States,Waltham,Health,NEC,BOSTONGENE,2022-04-06,1
Grover,,07-04-2022,Germany,Berlin,E-commerce & direct-to-consumer,Varengold Bank,GROVER,2022-04-07,1
Grover,,07-04-2022,Germany,Berlin,E-commerce & direct-to-consumer,Circularity Capital,GROVER,2022-04-07,1
Grover,,07-04-2022,Germany,Berlin,E-commerce & direct-to-consumer,Coparion,GROVER,2022-04-07,1
Genies,,12-04-2022,United States,Venice,Internet software & services,New Enterprise Associates,GENIES,2022-04-12,1
Genies,,12-04-2022,United States,Venice,Internet software & services,Tull Investment Group,GENIES,2022-04-12,1
Genies,,12-04-2022,United States,Venice,Internet software & services,Silver Lake,GENIES,2022-04-12,1
Oyster,,20-04-2022,United States,Wilmington,Fintech,Emergence Capital,OYSTER,2022-04-20,1
Oyster,,20-04-2022,United States,Wilmington,Fintech,Slack Fund,OYSTER,2022-04-20,1
Oyster,,20-04-2022,United States,Wilmington,Fintech,PayPal Ventures,OYSTER,2022-04-20,1
NexHealth,,21-04-2022,United States,San Francisco,Health,iSeed Ventures,NEXHEALTH,2022-04-21,1
NexHealth,,21-04-2022,United States,San Francisco,Health,Point Nine Capital,NEXHEALTH,2022-04-21,1
NexHealth,,21-04-2022,United States,San Francisco,Health,Buckley Ventures,NEXHEALTH,2022-04-21,1
UPSIDE Foods,,21-04-2022,United States,Berkeley,Other,Battery Ventures,UPSIDE FOODS,2022-04-21,1
UPSIDE Foods,,21-04-2022,United States,Berkeley,Other,Adams Street Partners,UPSIDE FOODS,2022-04-21,1
UPSIDE Foods,,21-04-2022,United States,Berkeley,Other,Coatue Management,UPSIDE FOODS,2022-04-21,1
Factorial,,11-10-2022,Spain,Barcelona,Internet software & services,K Fund,FACTORIAL,2022-10-11,1
Factorial,,11-10-2022,Spain,Barcelona,Internet software & services,Creandum,FACTORIAL,2022-10-11,1
Factorial,,11-10-2022,Spain,Barcelona,Internet software & services,CRV,FACTORIAL,2022-10-11,1
Divergent 3D,,25-04-2022,United States,Torrance,Auto & transportation,Hedosophia,DIVERGENT 3D,2022-04-25,1
Divergent 3D,,25-04-2022,United States,Torrance,Auto & transportation,Horizons Ventures,DIVERGENT 3D,2022-04-25,1
Divergent 3D,,25-04-2022,United States,Torrance,Auto & transportation,Alumni Ventures Group,DIVERGENT 3D,2022-04-25,1
Taxfix,,28-04-2022,Germany,Berlin,Fintech,Valar Ventures,TAXFIX,2022-04-28,1
Taxfix,,28-04-2022,Germany,Berlin,Fintech,Index Ventures,TAXFIX,2022-04-28,1
Taxfix,,28-04-2022,Germany,Berlin,Fintech,Creandum,TAXFIX,2022-04-28,1
Open,,02-05-2022,India,Bengaluru,Fintech,3one4 Capital Partners,OPEN,2022-05-02,1
Open,,02-05-2022,India,Bengaluru,Fintech,Tiger Global Management,OPEN,2022-05-02,1
Open,,02-05-2022,India,Bengaluru,Fintech,Temasek,OPEN,2022-05-02,1
Polarium,,03-05-2022,Sweden,Kista,Other,AMF Pensionsforsakring,POLARIUM,2022-05-03,1
Opn,,09-05-2022,Japan,Tokyo,Fintech,Sinar Mas Digital Ventures,OPN,2022-05-09,1
Opn,,09-05-2022,Japan,Tokyo,Fintech,JIC Venture Growth Investments,OPN,2022-05-09,1
Opn,,09-05-2022,Japan,Tokyo,Fintech,Golden Gate Ventures,OPN,2022-05-09,1
Remarkable,,10-05-2022,Norway,Oslo,Internet software & services,Spark Capital,REMARKABLE,2022-05-10,1
Habi,,11-05-2022,Colombia,Bogota,Fintech,Homebrew,HABI,2022-05-11,1
Habi,,11-05-2022,Colombia,Bogota,Fintech,Inspired Capital,HABI,2022-05-11,1
Habi,,11-05-2022,Colombia,Bogota,Fintech,Tiger Global Management,HABI,2022-05-11,1
Glean,,18-05-2022,United States,Palo Alto,Internet software & services,General Catalyst,GLEAN,2022-05-18,1
Glean,,18-05-2022,United States,Palo Alto,Internet software & services,Kleiner Perkins Caufield & Byers,GLEAN,2022-05-18,1
Glean,,18-05-2022,United States,Palo Alto,Internet software & services,Lightspeed Venture Partners,GLEAN,2022-05-18,1
CareBridge,,08-06-2022,United States,Nashville,Health,Bain Capital Ventures,CAREBRIDGE,2022-06-08,1
CareBridge,,08-06-2022,United States,Nashville,Health,Splunk Ventures,CAREBRIDGE,2022-06-08,1
CareBridge,,08-06-2022,United States,Nashville,Health,Cisco Investments,CAREBRIDGE,2022-06-08,1
Immuta,,08-06-2022,United States,Boston,Data management & analytics,DFJ Growth Fund,IMMUTA,2022-06-08,1
Immuta,,08-06-2022,United States,Boston,Data management & analytics,Dell Technologies Capital,IMMUTA,2022-06-08,1
Immuta,,08-06-2022,United States,Boston,Data management & analytics,Ten Eleven Ventures,IMMUTA,2022-06-08,1
JupiterOne,,02-06-2022,United States,Morrisville,Cybersecurity,Bain Capital Ventures,JUPITERONE,2022-06-02,1
JupiterOne,,02-06-2022,United States,Morrisville,Cybersecurity,Splunk Ventures,JUPITERONE,2022-06-02,1
JupiterOne,,02-06-2022,United States,Morrisville,Cybersecurity,Cisco Investments,JUPITERONE,2022-06-02,1
Vayyar,,06-06-2022,Israel,Yehud,Hardware,Battery Ventures,VAYYAR,2022-06-06,1
Vayyar,,06-06-2022,Israel,Yehud,Hardware,Bessemer Venture Partners,VAYYAR,2022-06-06,1
Vayyar,,06-06-2022,Israel,Yehud,Hardware,MoreVC,VAYYAR,2022-06-06,1
LeadSquared,,21-06-2022,India,Bengaluru,Internet software & services,Gaja Capital Partners,LEADSQUARED,2022-06-21,1
LeadSquared,,21-06-2022,India,Bengaluru,Internet software & services,Stakeboat Capital,LEADSQUARED,2022-06-21,1
LeadSquared,,21-06-2022,India,Bengaluru,Internet software & services,WestBridge Capital,LEADSQUARED,2022-06-21,1
FourKites,,21-06-2022,United States,Chicago,"Supply chain, logistics, & delivery",Hyde Park Venture Partners,FOURKITES,2022-06-21,1
FourKites,,21-06-2022,United States,Chicago,"Supply chain, logistics, & delivery",Bain Capital Ventures,FOURKITES,2022-06-21,1
FourKites,,21-06-2022,United States,Chicago,"Supply chain, logistics, & delivery",Hyde Park Angels,FOURKITES,2022-06-21,1
VulcanForms,,05-07-2022,United States,Burlington,"Supply chain, logistics, & delivery",Eclipse Ventures,VULCANFORMS,2022-07-05,1
VulcanForms,,05-07-2022,United States,Burlington,"Supply chain, logistics, & delivery",D1 Capital Partners,VULCANFORMS,2022-07-05,1
VulcanForms,,05-07-2022,United States,Burlington,"Supply chain, logistics, & delivery",Industry Ventures,VULCANFORMS,2022-07-05,1
SingleStore,,12-07-2022,United States,San Francisco,Data management & analytics,Google Ventures,SINGLESTORE,2022-07-12,1
SingleStore,,12-07-2022,United States,San Francisco,Data management & analytics,Accel,SINGLESTORE,2022-07-12,1
SingleStore,,12-07-2022,United States,San Francisco,Data management & analytics,Data Collective,SINGLESTORE,2022-07-12,1
Unstoppable Domains,,27-07-2022,United States,Las Vegas,Internet software & services,Boost VC,UNSTOPPABLE DOMAINS,2022-07-27,1
Unstoppable Domains,,27-07-2022,United States,Las Vegas,Internet software & services,Draper Associates,UNSTOPPABLE DOMAINS,2022-07-27,1
Unstoppable Domains,,27-07-2022,United States,Las Vegas,Internet software & services,Gaingels,UNSTOPPABLE DOMAINS,2022-07-27,1
